comment_id,parent_comment_id,video_id,is_reply,author,published_at,updated_at,like_count,text,inferred_parent_id,depth,newspaper,author_anon
UgwQR5Ly3HGx16QeWVh4AaABAg,,2ZpnJ2x5goI,False,author_3349,2026-05-25T17:36:16Z,2026-05-25T17:36:16Z,2,Ma che😂,,0,corriere_della_sera,author_3349
UgxPDugByDz4YHzEsux4AaABAg,,2ZpnJ2x5goI,False,author_3350,2026-05-25T17:41:01Z,2026-05-25T17:41:01Z,4,"Avete dimenticato il simbolo degli imbecilli, non mi sento rappresentato 😂",,0,corriere_della_sera,author_3350
UgwOmEyWE4WJMd4p6bB4AaABAg,,2ZpnJ2x5goI,False,author_2111,2026-05-25T17:44:27Z,2026-05-25T17:44:27Z,0,Però sono tutti bianchi....razzisti! 😂,,0,corriere_della_sera,author_2111
UgyaEiB4AJ_cfcSFP2p4AaABAg,,2ZpnJ2x5goI,False,author_3351,2026-05-25T18:08:16Z,2026-05-25T18:08:16Z,5,Ridicoli,,0,corriere_della_sera,author_3351
UgxX9BCwIJK7P2TKx_x4AaABAg,,2ZpnJ2x5goI,False,author_133,2026-05-25T18:10:28Z,2026-05-25T18:10:28Z,3,😂😂😂😂😂😂😂 Ridicoli,,0,corriere_della_sera,author_133
UgzS0PqP7yTAlz7H-cl4AaABAg,,2ZpnJ2x5goI,False,author_3294,2026-05-25T18:11:24Z,2026-05-25T18:11:24Z,5,"Ho un solo testicolo,mi tocca so bagno?",,0,corriere_della_sera,author_3294
UgzUzrav4QJpijowAGB4AaABAg,,2ZpnJ2x5goI,False,author_709,2026-05-25T18:11:34Z,2026-05-25T18:11:34Z,2,Bello urinare sulle ciambelle 😂😂😂,,0,corriere_della_sera,author_709
UgxPDugByDz4YHzEsux4AaABAg.AXEoKanD6OlAXEruqcWLry,UgxPDugByDz4YHzEsux4AaABAg,2ZpnJ2x5goI,True,author_3352,2026-05-25T18:12:19Z,2026-05-25T18:12:19Z,1,Puoi adoperare quello degli alieni!🎉😂😂😂😂😂😂,UgxPDugByDz4YHzEsux4AaABAg,1,corriere_della_sera,author_3352
Ugx7tDGw5TLIzk7r4b54AaABAg,,2ZpnJ2x5goI,False,author_3353,2026-05-25T18:42:56Z,2026-05-25T18:42:56Z,4,Fate ridere,,0,corriere_della_sera,author_3353
UgxkCoRkCYLZWEqKhKp4AaABAg,,2ZpnJ2x5goI,False,author_41,2026-05-25T19:04:09Z,2026-05-25T19:04:09Z,3,"Sono un albero, non siete inclusivi...",,0,corriere_della_sera,author_41
UgxRvaidAW8Et7zDxHF4AaABAg,,2ZpnJ2x5goI,False,author_3354,2026-05-25T19:29:33Z,2026-05-25T19:29:33Z,2,pajassi🎉,,0,corriere_della_sera,author_3354
UgytPX1serwiK2YThYt4AaABAg,,2ZpnJ2x5goI,False,author_3355,2026-05-25T19:37:36Z,2026-05-25T19:37:36Z,6,Poveri noi chi è sto fenomeno?,,0,corriere_della_sera,author_3355
UgwMIU6eZX9wQGzlxq94AaABAg,,2ZpnJ2x5goI,False,author_142,2026-05-25T19:44:31Z,2026-05-25T19:44:54Z,0,Gender in che senso? ... con il pisello e le tette o con la patata senza tette e con i peli sul torace ? .... no perche per fare le cose fatte bene bisogna essere precisi! ... e chi controlla se ogni genere usa il bagno giusto????,,0,corriere_della_sera,author_142
UgxhK4SKuQyZ58qDvwJ4AaABAg,,2ZpnJ2x5goI,False,author_3356,2026-05-25T20:16:50Z,2026-05-25T20:16:50Z,5,E sticazzi non c'è lo mettiamo?,,0,corriere_della_sera,author_3356
UgwUJKbCG3ezXzX1Z094AaABAg,,2ZpnJ2x5goI,False,author_3357,2026-05-25T20:36:07Z,2026-05-25T20:36:07Z,0,Fantastico! Il 🔝,,0,corriere_della_sera,author_3357
UgwgzbtC5JfzhXagJKR4AaABAg,,2ZpnJ2x5goI,False,author_3358,2026-05-25T21:22:05Z,2026-05-25T21:22:05Z,5,Ormai la follia dilaga ovunque,,0,corriere_della_sera,author_3358
Ugy5V-6Q-xqmlSN1uW94AaABAg,,2ZpnJ2x5goI,False,author_3359,2026-05-25T21:22:51Z,2026-05-25T21:22:51Z,6,Stiamo andando fuori di cabessa.,,0,corriere_della_sera,author_3359
Ugzw6vJPAzGgTxyY3JV4AaABAg,,2ZpnJ2x5goI,False,author_3360,2026-05-25T23:34:49Z,2026-05-25T23:34:49Z,4,MA NON VI FATE SCHIFO.....NEANCHE UN PO'!!!!!😂😂😂😂😂😂,,0,corriere_della_sera,author_3360
UgwBTqKl9139vgXCYAx4AaABAg,,2ZpnJ2x5goI,False,author_3361,2026-05-26T03:15:28Z,2026-05-26T03:15:28Z,2,Bello schifo,,0,corriere_della_sera,author_3361
Ugy7paTbfWRbIJyw6n94AaABAg,,2ZpnJ2x5goI,False,author_3362,2026-05-26T03:27:22Z,2026-05-26T03:27:22Z,8,C'è un limite all'idiozia che è stato superato abbondantemente,,0,corriere_della_sera,author_3362
UgyVvKoOHaiL43-VYjB4AaABAg,,2ZpnJ2x5goI,False,author_3363,2026-05-26T03:51:09Z,2026-05-26T03:51:09Z,2,Fatevi vedere da uno bravo....,,0,corriere_della_sera,author_3363
UgxmiMUE4Zwt6Fp2qwF4AaABAg,,2ZpnJ2x5goI,False,author_3364,2026-05-26T04:42:13Z,2026-05-26T04:42:13Z,2,Che dementi,,0,corriere_della_sera,author_3364
UgwGlyAE4li01IOh0Jl4AaABAg,,2ZpnJ2x5goI,False,author_2641,2026-05-26T04:56:35Z,2026-05-26T04:58:14Z,0,"Guardate la foto, per questa idiozia ne vanno anche fieri (e casomai pure pagati con soldi pubblici) La natura ha fatto maschi e femmine il resto sono seghe mentali dell'era moderna!",,0,corriere_della_sera,author_2641
UgyK8M0PDVWjFHgGezJ4AaABAg,,2ZpnJ2x5goI,False,author_3365,2026-05-26T05:35:57Z,2026-05-26T05:35:57Z,1,"A me viene da ridere,ma non c'e' nulla da ridere.",,0,corriere_della_sera,author_3365
Ugwd9lBQNUqZhAwk86d4AaABAg,,2ZpnJ2x5goI,False,author_3366,2026-05-26T06:20:02Z,2026-05-26T06:20:02Z,4,Che conquistaaaaaaaa!!! Abbiamo risolto tutti i problemi ora!!!! E sono pure contenti,,0,corriere_della_sera,author_3366
UgwvFCj_39QsZf7TQ014AaABAg,,2ZpnJ2x5goI,False,author_437,2026-05-26T06:20:52Z,2026-05-26T06:20:52Z,0,"questi sono fuori di testa,fra tanti problemi che ci sono loro cosa fanno?creano i gabinetti per quelli che non sono né maschi e né femmine!!!",,0,corriere_della_sera,author_437
Ugy7wurAmbh3zZA44u14AaABAg,,2ZpnJ2x5goI,False,author_671,2026-05-26T06:38:01Z,2026-05-26T06:38:01Z,1,"I simboli sulla porta sono senz'altro comici, l'importante é che il bagno ci sia e che venga tenuto pulito.",,0,corriere_della_sera,author_671
UgzS0PqP7yTAlz7H-cl4AaABAg.AXEro7MQ8mJAXGDIxFvAiO,UgzS0PqP7yTAlz7H-cl4AaABAg,2ZpnJ2x5goI,True,author_671,2026-05-26T06:47:13Z,2026-05-26T06:47:13Z,0,Sí e se non ce la fai hai diritto all'assistente che ti aiuta nello svolgimento delle attivitá connesse.,UgzS0PqP7yTAlz7H-cl4AaABAg,1,corriere_della_sera,author_671
UgzS0PqP7yTAlz7H-cl4AaABAg.AXEro7MQ8mJAXGJ2Aakem6,UgzS0PqP7yTAlz7H-cl4AaABAg.AXEro7MQ8mJAXGDIxFvAiO,2ZpnJ2x5goI,True,author_3294,2026-05-26T07:37:21Z,2026-05-26T07:37:21Z,0,"@user che era una battuta,spero l'abbia capito",UgzS0PqP7yTAlz7H-cl4AaABAg.AXEro7MQ8mJAXGDIxFvAiO,2,corriere_della_sera,author_3294
UgyvUjZhDaVk8NmeZXt4AaABAg,,2ZpnJ2x5goI,False,author_3367,2026-05-26T07:37:22Z,2026-05-26T07:41:16Z,2,Secondo loro questo sarebbe per la libertà sessuale..😢..non si fa prima a fare un unico bagno per tutti? così ognuno va dove gli pare adottando comportamenti rispettosi verso gli altri..sembra che invece si dia per scontato che le latrine siano i luoghi naturali di approccio ed adescamento ...,,0,corriere_della_sera,author_3367
UgzS0PqP7yTAlz7H-cl4AaABAg.AXEro7MQ8mJAXGKNyTVwEO,UgzS0PqP7yTAlz7H-cl4AaABAg.AXEro7MQ8mJAXGJ2Aakem6,2ZpnJ2x5goI,True,author_671,2026-05-26T07:49:04Z,2026-05-26T07:49:04Z,0,@user anche la mia é chiaramente una battuta.,UgzS0PqP7yTAlz7H-cl4AaABAg.AXEro7MQ8mJAXGJ2Aakem6,3,corriere_della_sera,author_671
UgyUnQEa2--JjO1VrVp4AaABAg,,2ZpnJ2x5goI,False,author_3368,2026-05-26T08:25:19Z,2026-05-26T08:25:19Z,2,"C'è stata la fuga di cervelli, co sti qua non stiamo messi bene, povera Italia 🤦♂️",,0,corriere_della_sera,author_3368
UgzS0PqP7yTAlz7H-cl4AaABAg.AXEro7MQ8mJAXGYRHqoQ4O,UgzS0PqP7yTAlz7H-cl4AaABAg.AXEro7MQ8mJAXGJ2Aakem6,2ZpnJ2x5goI,True,author_3294,2026-05-26T09:51:51Z,2026-05-26T09:51:51Z,0,@user saluto,UgzS0PqP7yTAlz7H-cl4AaABAg.AXEro7MQ8mJAXGKNyTVwEO,4,corriere_della_sera,author_3294
UgwmbA8vUiG5-iYtlRR4AaABAg,,2ZpnJ2x5goI,False,author_3369,2026-05-26T14:05:25Z,2026-05-26T14:05:25Z,0,"Ma non vi vergognate per niente!!!! Solo voi di sinistra riuscite a fare queste cose fate schifo!!! Siete sempre malati di mente!!!! Ma la colpa non è vostra ma di chi vi vota ancora, loro sono ancora peggio!!",,0,corriere_della_sera,author_3369
Ugy7wurAmbh3zZA44u14AaABAg.AXGCFZyFWy9AXH-cBSGyJi,Ugy7wurAmbh3zZA44u14AaABAg,2ZpnJ2x5goI,True,author_3369,2026-05-26T14:06:53Z,2026-05-26T14:06:53Z,0,Ti preoccupi se siamo puliti !!! Non pensi che sono fuori di testa ????!!!??,Ugy7wurAmbh3zZA44u14AaABAg,1,corriere_della_sera,author_3369
Ugy7wurAmbh3zZA44u14AaABAg.AXGCFZyFWy9AXH3QYGBh2y,Ugy7wurAmbh3zZA44u14AaABAg,2ZpnJ2x5goI,True,author_671,2026-05-26T14:40:07Z,2026-05-26T14:42:29Z,0,"@user veritá questo tipo di bagni ci sono sempre stati perché non in tutti i posti ce ne sono due, potevano anche metterci la sola scritta WC e giá significava che era per tutti, ma lo scopo di quella gente era di fare propaganda degli LBGTXYZ, fra un pó non troveremo neanche piú i vestiti unisex, troveremo invece solo quelli LGBTetc. che sono esattamente uguali ma con il nome diverso perché per certa gente ogni occasione é buona per farsi pubblicitá.",Ugy7wurAmbh3zZA44u14AaABAg.AXGCFZyFWy9AXH-cBSGyJi,2,corriere_della_sera,author_671
UgyvUjZhDaVk8NmeZXt4AaABAg.AXGJ2BY0KRnAXH56KbrA7c,UgyvUjZhDaVk8NmeZXt4AaABAg,2ZpnJ2x5goI,True,author_671,2026-05-26T14:54:50Z,2026-05-26T14:54:50Z,1,"Forse vogliono associarli a luoghi adatti alle pratiche sessuali perverse pioggia dorata e coprofilia, per questo i WC.",UgyvUjZhDaVk8NmeZXt4AaABAg,1,corriere_della_sera,author_671
UgzeGCCpkfGgxNVLYId4AaABAg,,2ZpnJ2x5goI,False,author_3370,2026-05-26T15:47:50Z,2026-05-26T15:47:50Z,0,"E per fare ciò hanno studiato anni, speso soldi all’università, corsi concorsi , speso soldi ( pubblici) , architetti geometri, operai , istanze comunali........che imbecillità......solo scarsa intelligenza e ideologia “sinistra”",,0,corriere_della_sera,author_3370
