comment_id,parent_comment_id,video_id,is_reply,author,published_at,updated_at,like_count,text,inferred_parent_id,depth,newspaper,author_anon
Ugx9FWtqrn3-JzWpsJN4AaABAg,,oRkHtyD7r98,False,author_3648,2026-05-21T14:58:39Z,2026-05-21T14:58:39Z,0,"Signor Presidente, è ora di concludere con sanzioni dovute e meritate, prima che non sia troppo tardi. Contro Putin siete stati unanimamente d' accordo per le misure ed invii di armi per difendere il governo FASCISTA ucraino. Per il vostro AMICO BIBI cosa aspettate ??",,0,corriere_della_sera,author_3648
UgxLlmFIb4TQ_Ulz7a54AaABAg,,oRkHtyD7r98,False,author_3649,2026-05-21T14:59:19Z,2026-05-21T14:59:19Z,1,"Forse la flottilla non ha ancora capito che quelle acque sono zona di guerra e non devono essere superate.Questo lo capisce anche un dodicenne.Inoltre su queste imbarcazioni non è stato trovato nemmeno un pacco di aiuti umanitari.Ma come non si è ancora capito che questa gente va in crociera a divertirsi? Eh già ... perché hanno trovato su altre imbarcazioni della flottilla ,droga,cocaina ed è emerso che facevano festini,sesso e quant'altro.Guardate che la milizia israeliana non scherza.Ora si divertiranno in carcere in Israele...",,0,corriere_della_sera,author_3649
UgxwjciVJJ6s7i6O1114AaABAg.AX49NiBqUyGAX4DkX_KZiD,UgxwjciVJJ6s7i6O1114AaABAg,oRkHtyD7r98,True,author_3644,2026-05-21T15:00:14Z,2026-05-21T15:00:14Z,0,"Ma i malviventi da parrocchia della Magliana, delle crociate in Medio Oriente ed in Africa, hanno precedenti penali gravi anche per tali malvessità! Il criminale al Quirinale ha anche ammesso pratiche fasciste-mafiose di cui all'articolo 31 del fake-DDL 85 del 2025, arrecante danni alla sicurezza per le vie... Va condannato!",UgxwjciVJJ6s7i6O1114AaABAg,1,corriere_della_sera,author_3644
UgwnYnT7UT6uqnGGSMd4AaABAg,,oRkHtyD7r98,False,author_3650,2026-05-21T15:03:06Z,2026-05-21T15:03:06Z,1,"X questi che non dovrebbe andare dove è proibito Mattarella li difende ,e quando offendono la Meloni non dice niente",,0,corriere_della_sera,author_3650
Ugxwa_z_FWdWrMxBM0R4AaABAg,,oRkHtyD7r98,False,author_3651,2026-05-21T15:07:22Z,2026-05-21T15:07:22Z,0,😡,,0,corriere_della_sera,author_3651
Ugwjfd00T-HwIDuIaqp4AaABAg.AX48YQA4v1tAX4FYDhmDTk,Ugwjfd00T-HwIDuIaqp4AaABAg,oRkHtyD7r98,True,author_3652,2026-05-21T15:15:54Z,2026-05-21T15:15:54Z,0,"E sì , perché secondo te Pertini che avrebbe fatto al posto di Mattarella ? Fermava Israele dai casini attuali? Fate pace co sta capoccia!!",Ugwjfd00T-HwIDuIaqp4AaABAg,1,corriere_della_sera,author_3652
UgwiAeEvwqjqsW9LD2l4AaABAg,,oRkHtyD7r98,False,author_3653,2026-05-21T15:24:10Z,2026-05-21T15:24:10Z,0,"ora c'è il rischio sempre più alto che aumenti l'odio verso gli ebrei,nn solo dai mussulmani ma anche dagli occidentali. la cronaca ne sarà testimone purtroppo!",,0,corriere_della_sera,author_3653
Ugwjfd00T-HwIDuIaqp4AaABAg.AX48YQA4v1tAX4GWYwA5hB,Ugwjfd00T-HwIDuIaqp4AaABAg.AX48YQA4v1tAX4FYDhmDTk,oRkHtyD7r98,True,author_3576,2026-05-21T15:24:24Z,2026-05-21T15:24:24Z,0,@author_3652 non avrebbe sicuramente. Vietato di. Lavorare perché. Sarei antiscenza. E no. Vax. !!!! E. Non avrebbe detto. Non si invochi la libertà per. Vaccinarmi. !!!!! Un. Essere umano in questo paese e diventato un disturbo. E. Di troppo secondo lui. Saremo persone pericolose. !!!!! Secondo lui. .se io ho dei dubbi non ne ho diritto. !!!! Devi obbedire. Alle autorità. Zitto e muto !! No. . inaccettabile. !!!!,Ugwjfd00T-HwIDuIaqp4AaABAg.AX48YQA4v1tAX4FYDhmDTk,2,corriere_della_sera,author_3576
UgzqpFflS16Di0hGdlt4AaABAg,,oRkHtyD7r98,False,author_3654,2026-05-21T15:34:08Z,2026-05-21T15:34:08Z,1,Adesso si che cambieranno le cose ...,,0,corriere_della_sera,author_3654
Ugzp3bu2h4inWVDc32R4AaABAg,,oRkHtyD7r98,False,author_471,2026-05-21T15:38:39Z,2026-05-21T15:38:39Z,0,"😂Che afflato, che empatia, che gesto d'amore che sgorga sinceramente dal cuore 😂😂😂un ghiacciolo Sammontana 😂😂😂",,0,corriere_della_sera,author_471
UgxOB6n3mQJaCT-KnWh4AaABAg,,oRkHtyD7r98,False,author_3655,2026-05-21T15:38:46Z,2026-05-21T15:38:46Z,0,E quindi? ora fate i fatti e nn solo parole.,,0,corriere_della_sera,author_3655
UgxtBCOYWrzc9NGVY0Z4AaABAg.AX46TH7jZ--AX4IIOOjnWm,UgxtBCOYWrzc9NGVY0Z4AaABAg,oRkHtyD7r98,True,author_471,2026-05-21T15:39:57Z,2026-05-21T15:39:57Z,1,Con un ghiacciolo in mano 😂😂,UgxtBCOYWrzc9NGVY0Z4AaABAg,1,corriere_della_sera,author_471
Ugzp0RNLyyqZCmeMzcl4AaABAg,,oRkHtyD7r98,False,author_471,2026-05-21T15:41:42Z,2026-05-21T15:41:42Z,0,Oppebbacco nostra SUA MAESTÀ SERGIO si è svegliato con un ghiacciolo pieno di afflato e sincero sdegno 😂😂😂,,0,corriere_della_sera,author_471
Ugw0gGt6PrBEkSmWiDh4AaABAg,,oRkHtyD7r98,False,author_53,2026-05-21T15:47:11Z,2026-05-21T15:47:11Z,0,Che credibilità può avere uno che si circonda di consiglieri che argomentano pubblicamente la necessità di scossoni al governo?,,0,corriere_della_sera,author_53
UgzILlPEKZ5QwjdG0614AaABAg,,oRkHtyD7r98,False,author_3656,2026-05-21T16:00:12Z,2026-05-21T16:00:12Z,0,"Ma scusi Signor Presidente realizza adesso il comportamento incivile di Ben-Gvir e company. Tajani Meloni..superato la linea rossa. .hanno superato tante crudeltà hanni fa"" e comtinueranno .. Povera Italia..da chi siamo governati..senza prendere posizioni più decisive.. Troppo deboli.",,0,corriere_della_sera,author_3656
Ugz_EbT9eipVSEuvreZ4AaABAg.AX48MdkEKNEAX4LHxPeHv9,Ugz_EbT9eipVSEuvreZ4AaABAg,oRkHtyD7r98,True,author_448,2026-05-21T16:06:06Z,2026-05-21T16:06:06Z,1,Si vede che del mondo hai capito meno di Calenda... e fidati non c’è insulto peggiore,Ugz_EbT9eipVSEuvreZ4AaABAg,1,corriere_della_sera,author_448
Ugwjfd00T-HwIDuIaqp4AaABAg.AX48YQA4v1tAX4Oi3GjNsS,Ugwjfd00T-HwIDuIaqp4AaABAg.AX48YQA4v1tAX4FYDhmDTk,oRkHtyD7r98,True,author_3576,2026-05-21T16:36:01Z,2026-05-21T16:36:01Z,0,@user Ti sei. Ammutolito. ??? Sei. Senza. Discorso ??? Vedi. Che ho ragione ?? Visto ?? Un presidente che crea disuguaglianze e discriminazioni al popolo non e un presidente della Repubblica. E un pagliaccio. !!!!!!!!!!!!!!!!!! Deve. Dimettersi. !! Punto. !!!!! Mummia. !!!! 😂😂😂😂😂. Che vergogna. !!!!!,Ugwjfd00T-HwIDuIaqp4AaABAg.AX48YQA4v1tAX4FYDhmDTk,2,corriere_della_sera,author_3576
UgwCwZ0w9jF2yP5S48V4AaABAg,,oRkHtyD7r98,False,author_1383,2026-05-21T16:52:44Z,2026-05-21T16:52:44Z,0,Tanto rispetto per il Presidente. A volte per accontentare i sinistri esce dal seminato.,,0,corriere_della_sera,author_1383
Ugz_EbT9eipVSEuvreZ4AaABAg.AX48MdkEKNEAX4R5v8V-tg,Ugz_EbT9eipVSEuvreZ4AaABAg,oRkHtyD7r98,True,author_3623,2026-05-21T16:56:53Z,2026-05-21T16:58:22Z,0,"@user da chi non ne ha azzeccata una in tutta la sua vita è comico, prima avete brigato x decenni x portare il comunismo in Italia (ben pagati tra l’altro dai rubli sovietici), poi dopo la palata sul grugno presa nel 1989, vi siete rincipriati, imbarcato qualche zecca della dc (questo losco figuro e prodi x esempio), avete cambiato nome e via a rovinare nuovamente la vita degli italiani. Prima con il globalismo (i lavoratori italiani vi ringrazieranno x decenni), poi con l’austerity (anche Draghi ormai vi ha sconfessato), per passare all’immigrazione senza se e senza ma, Italia ridotta a campo profughi con arrivo di delinquenti da mezzo mondo, x passare poi al green, grande genialata proibire dí produrre in Europa x andare a produrre ed inquinare nei paesi emergenti. Pensi quanto siete imxecilli",Ugz_EbT9eipVSEuvreZ4AaABAg.AX48MdkEKNEAX4LHxPeHv9,2,corriere_della_sera,author_3623
Ugwjfd00T-HwIDuIaqp4AaABAg.AX48YQA4v1tAX4RkMMQf2I,Ugwjfd00T-HwIDuIaqp4AaABAg.AX48YQA4v1tAX4Oi3GjNsS,oRkHtyD7r98,True,author_3652,2026-05-21T17:02:33Z,2026-05-21T17:02:33Z,0,"@author_3576 A sii? Deve dimettersi? E chi ci metti al suo posto?Te che sei così saggio e risolvi tutti i problemi che ci sono? Ripeto, fate pace co ste capocce!!!",Ugwjfd00T-HwIDuIaqp4AaABAg.AX48YQA4v1tAX4Oi3GjNsS,3,corriere_della_sera,author_3652
Ugwjfd00T-HwIDuIaqp4AaABAg.AX48YQA4v1tAX4SG6jBJ8n,Ugwjfd00T-HwIDuIaqp4AaABAg.AX48YQA4v1tAX4Oi3GjNsS,oRkHtyD7r98,True,author_3576,2026-05-21T17:07:01Z,2026-05-21T17:07:01Z,0,@author_3652 ci. Metterei. Un. Vecchio. Partigiano. !!!!! Con 90. Anni alle spalle e una vita da. Soldato per aver difeso la. Nostra costituzione italiana e libertà. !!! Anche se breve presenza !!!!!!!!!!!!!!!!!!!!,Ugwjfd00T-HwIDuIaqp4AaABAg.AX48YQA4v1tAX4RkMMQf2I,4,corriere_della_sera,author_3576
UgztzSEDo63im-0F4rV4AaABAg,,oRkHtyD7r98,False,author_3657,2026-05-21T17:09:59Z,2026-05-21T17:09:59Z,1,"Attivista politico innocente va bene, un sostenitore finanziato da Hamas no.. C'è un enorme differenza .... 😌🤙",,0,corriere_della_sera,author_3657
Ugz9SvJcTaugSDQhFnt4AaABAg.AX47fy9j5lQAX4ScyOT66q,Ugz9SvJcTaugSDQhFnt4AaABAg,oRkHtyD7r98,True,author_3576,2026-05-21T17:10:16Z,2026-05-21T17:10:16Z,1,Giustissimo. Questo. Viscido essere. Non ha capito che gli italiani sono il suo popolo e non deve dimenticare che siamo sivrani e non servi di nessuno. !!!!!!!!!!!!!!!,Ugz9SvJcTaugSDQhFnt4AaABAg,1,corriere_della_sera,author_3576
UgwThQ4ez5K-kQmxKCN4AaABAg,,oRkHtyD7r98,False,author_3657,2026-05-21T17:21:49Z,2026-05-21T17:21:49Z,1,Questo è il vero sdegno... la più piccola aveva solo 17 anni mentre si divertiva spensierata.. trucidata dopo essere stata stuprata... e senza motivo procurato..🫣😔🙏 https://m.youtube.com/watch?v=4iEq2hUZMMQ,,0,corriere_della_sera,author_3657
Ugymd8HZs-nG1rH9G5h4AaABAg.AX45QayLL9YAX4_N_OFPUX,Ugymd8HZs-nG1rH9G5h4AaABAg.AX45QayLL9YAX4BReptzLX,oRkHtyD7r98,True,author_3561,2026-05-21T18:17:56Z,2026-05-21T18:17:56Z,0,@author_526 Non uso la play ma il pc,Ugymd8HZs-nG1rH9G5h4AaABAg.AX45QayLL9YAX4BReptzLX,2,corriere_della_sera,author_3561
UgwwLHYQ52Lf2_uRVGl4AaABAg.AX48h-jdwUZAX4a6NEcMl4,UgwwLHYQ52Lf2_uRVGl4AaABAg.AX48h-jdwUZAX4CbJtE0Mg,oRkHtyD7r98,True,author_3625,2026-05-21T18:24:20Z,2026-05-21T18:24:20Z,0,@user un po' più di noi,UgwwLHYQ52Lf2_uRVGl4AaABAg.AX48h-jdwUZAX4CbJtE0Mg,2,corriere_della_sera,author_3625
UgwwLHYQ52Lf2_uRVGl4AaABAg.AX48h-jdwUZAX4aTSuOcGR,UgwwLHYQ52Lf2_uRVGl4AaABAg.AX48h-jdwUZAX4a6NEcMl4,oRkHtyD7r98,True,author_3646,2026-05-21T18:27:29Z,2026-05-21T18:27:29Z,0,@user risposta è? Boh,UgwwLHYQ52Lf2_uRVGl4AaABAg.AX48h-jdwUZAX4a6NEcMl4,3,corriere_della_sera,author_3646
Ugz7wx0Edth_wgysIzx4AaABAg.AX491QLpvNBAX4aVG5O_1z,Ugz7wx0Edth_wgysIzx4AaABAg,oRkHtyD7r98,True,author_3625,2026-05-21T18:27:44Z,2026-05-21T18:27:44Z,0,Convinto? Non li Facevano manco atterrare,Ugz7wx0Edth_wgysIzx4AaABAg,1,corriere_della_sera,author_3625
UgzqpFflS16Di0hGdlt4AaABAg.AX4HckF3HnbAX4hQgB2uFw,UgzqpFflS16Di0hGdlt4AaABAg,oRkHtyD7r98,True,author_3658,2026-05-21T19:28:16Z,2026-05-21T19:28:16Z,0,😂😂😂,UgzqpFflS16Di0hGdlt4AaABAg,1,corriere_della_sera,author_3658
UgwjlGNcl16mSqTz8wR4AaABAg.AX44zQgfjIkAX4hmMrXgHt,UgwjlGNcl16mSqTz8wR4AaABAg,oRkHtyD7r98,True,author_3658,2026-05-21T19:31:22Z,2026-05-21T19:31:22Z,1,Il TUO presidente,UgwjlGNcl16mSqTz8wR4AaABAg,1,corriere_della_sera,author_3658
UgyxAdQbOyTTDizRic14AaABAg,,oRkHtyD7r98,False,author_1085,2026-05-22T07:07:47Z,2026-05-22T07:07:47Z,0,Leggendo i commenti posso solo dire povera italia....siamo fritti se non si capisce nemmeno da che parte stare Ormai sono talmente lobotomizzati che se parl bene di mattarella sei buonista comunista o grillino o del pd (e non si capisce il motivo) Per me a livello umano e democratico mattarella è un gigante Certo avrebbe potuto farsi sentire di più anche su altre vicende Ma è un buon presidente della repubblica Vorrò vedere il prossimo sono proprio curioso Ci aspetta solo un futuro di imbecilli,,0,corriere_della_sera,author_1085
UgxSFK7OdFStuhcCotZ4AaABAg,,oRkHtyD7r98,False,author_3659,2026-05-22T07:35:29Z,2026-05-22T07:35:29Z,0,Uno stato in guerra può fermare se lo ritiene necessario in acque internazionali chi ritiene che li minaccia! Ma poi proprio lui parla che ha graziato lo scafista responsabile della morte di non so' quante persone!!!!!,,0,corriere_della_sera,author_3659
UgzhKWMr3mnQ-KKElqN4AaABAg.AX43waw9jq3AX67BoPnFRq,UgzhKWMr3mnQ-KKElqN4AaABAg,oRkHtyD7r98,True,author_3660,2026-05-22T08:41:25Z,2026-05-22T08:41:25Z,1,Ricordiamoci che il parruccone stringeva le mani di Herzog ( sinistra israeliana) che firmava le bombe da gettare su Gaza,UgzhKWMr3mnQ-KKElqN4AaABAg,1,corriere_della_sera,author_3660
UgwDjyL2aLswMgOP0rF4AaABAg.AX44M0eGhsjAX67E9eyehd,UgwDjyL2aLswMgOP0rF4AaABAg,oRkHtyD7r98,True,author_3660,2026-05-22T08:41:44Z,2026-05-22T08:41:44Z,0,Ricordiamoci che il parruccone stringeva le mani di Herzog ( sinistra israeliana) che firmava le bombe da gettare su Gaza,UgwDjyL2aLswMgOP0rF4AaABAg,1,corriere_della_sera,author_3660
UgxLlmFIb4TQ_Ulz7a54AaABAg.AX4Ddog7cuPAX67fDH6Vaj,UgxLlmFIb4TQ_Ulz7a54AaABAg,oRkHtyD7r98,True,author_3660,2026-05-22T08:45:34Z,2026-05-22T08:45:34Z,0,"Quindi questa estate niente mare, perché tutto il Mediterraneo è di Israele? Mi fai ridere",UgxLlmFIb4TQ_Ulz7a54AaABAg,1,corriere_della_sera,author_3660
UgzMQitsMNtMY1FO4Lh4AaABAg,,oRkHtyD7r98,False,author_3661,2026-05-22T10:01:53Z,2026-05-22T10:01:53Z,0,Quindi ammette che quello alla Flotilla è Stato un trattamento Incivile e quello che è Accaduto a Modena non è un Attentato alla Cristianita!....Pero!😏,,0,corriere_della_sera,author_3661
UgxZZfNQpxuTq2cF30l4AaABAg,,oRkHtyD7r98,False,author_3662,2026-05-22T15:50:56Z,2026-05-22T15:50:56Z,1,"e l'Italia è civile con la ""famiglia nel bosco"" ? Lei non ha proferito, Signor Presidente, nemmeno una parola e sono 6 mesi che quei bambini strappati ai genitori da aguzzini sono segregati nel lager della casa protetta.",,0,corriere_della_sera,author_3662
Ugx0vGNdXJdrfsRA65F4AaABAg,,oRkHtyD7r98,False,author_3663,2026-05-22T18:39:15Z,2026-05-22T18:39:15Z,0,A te interessano qs fregnacce pensa all italia,,0,corriere_della_sera,author_3663
UgxG14NNS59JEcSAoZ14AaABAg,,oRkHtyD7r98,False,author_3664,2026-05-22T18:56:39Z,2026-05-22T18:56:39Z,0,Era ora c'è ne hai messo di tempo,,0,corriere_della_sera,author_3664
UgwGeRGO_TDtDwJLyiJ4AaABAg,,oRkHtyD7r98,False,author_3665,2026-05-22T21:38:39Z,2026-05-22T21:38:39Z,0,Non si va in casa d'altri a fare gll scemi,,0,corriere_della_sera,author_3665
Ugwjfd00T-HwIDuIaqp4AaABAg.AX48YQA4v1tAX4Yhvxxj92,Ugwjfd00T-HwIDuIaqp4AaABAg.AX48YQA4v1tAX4Oi3GjNsS,oRkHtyD7r98,True,author_3652,2026-05-23T00:00:00+00:00,,0,"@author_3576 Un vecchio partigiano con le nuove generazioni e la politica di oggi? Non durerebbe neanche un'ora!!! Qui ci vogliono politiche veramente rigide che eliminano il marcio che che sta seminando l'altra sponda : vedi Modena tanto per capirci e tutti quelli che vanno dietro a quel mostro ... Bisogna veramente ricominciare a vivere sereni come negli gli anni""70... cose che l'altra sponda non vuole fare ma prima o poi ci riusciremo!!!",Ugwjfd00T-HwIDuIaqp4AaABAg.AX48YQA4v1tAX4SG6jBJ8n,5,corriere_della_sera,author_3652
Ugwjfd00T-HwIDuIaqp4AaABAg.AX48YQA4v1tAX4_8N7x3UB,Ugwjfd00T-HwIDuIaqp4AaABAg.AX48YQA4v1tAX4Oi3GjNsS,oRkHtyD7r98,True,author_3576,2026-05-23T00:00:00+00:00,,0,"@author_3652 scusami. Ma tu. Non hai capito , allora. Un presidente della Repubblica in primis deve rispettare la costituzione italiana. E. .il popolo deve rispettare la loro volontà di essere un popolo sovrano e non. Pecora !!! Un presidente della Repubblica. Deve essere come un giudice imparziale e edigere e. Mettere al primo posto i bisogni dei cittadini e. Le politiche economiche del paese e non politica dei parlamentari e le leggi a personam. !!!!!! Deve rispettare i dovere della costituzione italiana. Che sono scritti e redatti dal giugno del 1946. !!!! Un presidente della Repubblica italiana. Deve dare voce sempre al popolo e non ai politici !!!! .i referendum in questi anni sono stati e saranno sempre un flop. Perché i politici non rispettano il volere del popolo ma gli interessi loro !!! Dovrebbe essere lui e banchettare i politici e emanare decreti legge a favore. Sempre del popolo e non gli interessi dei potenti !!!!! Quelle parole vergognose. , come non si invochi la libertà per evitare la vaccinazione sono state parole. Da un dittatore monaca e non da un presidente della Repubblica. !!! E invece ha fatto il contrario di tutto !!!!! Ecco perché credo che un veterano di guerra anziano capisce il vero senso democratico e civile di un paese. Come l'Italia. !!!!! Deve dare le dimissioni subito !!!!!!",Ugwjfd00T-HwIDuIaqp4AaABAg.AX48YQA4v1tAX4RkMMQf2I,4,corriere_della_sera,author_3576
Ugwjfd00T-HwIDuIaqp4AaABAg.AX48YQA4v1tAX4cLYjQ714,Ugwjfd00T-HwIDuIaqp4AaABAg.AX48YQA4v1tAX4Oi3GjNsS,oRkHtyD7r98,True,author_3652,2026-05-23T00:00:00+00:00,,0,"@author_3576 Io sono del ""58 , e da che ricordo tutti i presidenti eletti nei vari anni fino ad adesso ,dimmi qual'e il presidente che si è opposto alle decisioni dei vari partiti nel corso degli anni che sono stati rappresentati dal popolo !!",Ugwjfd00T-HwIDuIaqp4AaABAg.AX48YQA4v1tAX4SG6jBJ8n,5,corriere_della_sera,author_3652
Ugwjfd00T-HwIDuIaqp4AaABAg.AX48YQA4v1tAX4d2Ql1TjR,Ugwjfd00T-HwIDuIaqp4AaABAg.AX48YQA4v1tAX4Oi3GjNsS,oRkHtyD7r98,True,author_3576,2026-05-23T00:00:00+00:00,,0,@author_3652 questa e una domanda sensata !!! Giusto !!!! Da. Che io sono nato nel. 1971. Credo che sicuramente il presidente della Repubblica. Pertini e Cossiga. Si siano opposti. Ad alcuni emendamenti. Politici. Quali. ??? Te lo dirò fra un istante !! Aspetta fra qualche minuto !!!,Ugwjfd00T-HwIDuIaqp4AaABAg.AX48YQA4v1tAX4RkMMQf2I,4,corriere_della_sera,author_3576
Ugwjfd00T-HwIDuIaqp4AaABAg.AX48YQA4v1tAX4elcL_Fek,Ugwjfd00T-HwIDuIaqp4AaABAg.AX48YQA4v1tAX4Oi3GjNsS,oRkHtyD7r98,True,author_3576,2026-05-23T00:00:00+00:00,,0,@author_3652 be. Comunque un presidente della Repubblica italiana. Ha il dovere di non firmare una legge se viola la costituzione italiana !!! .in questo caso proprio Mattarella ha firmato tutti i DPCM incostituzionali. !!!!! Ci. Ha tolto il lavoro con il ricatto di stato. !! O ti vaccini o niente lavoro e questo e reato penale. Art. 610. Codice penale. !!!! Estorsione. !!!! Doveva non firmare !! Se non firmava il parlamento lo metteva in stato di accusa !!! Ma era stato meglio !! Se lo avesse fatto. Sarebbe stato un uomo che non. Avrebbe tradito il popolo italiano. !!! .invece ci ha tradito e umiliato !!!!,Ugwjfd00T-HwIDuIaqp4AaABAg.AX48YQA4v1tAX4RkMMQf2I,4,corriere_della_sera,author_3576
Ugwjfd00T-HwIDuIaqp4AaABAg.AX48YQA4v1tAX4ddf_f0cu,Ugwjfd00T-HwIDuIaqp4AaABAg.AX48YQA4v1tAX4Oi3GjNsS,oRkHtyD7r98,True,author_3576,2026-05-23T00:00:00+00:00,,0,"@author_3652 eccomi. .il presidente della Repubblica italiana Pertini. In passato ha rifiutato la legge. Che diceva , l'aumento dei. Salari. Ai politici. Nel. 8. Luglio del 1978 vai a vedere. E una legge della valle d'Aosta. Che ha rimandato. !!!!!",Ugwjfd00T-HwIDuIaqp4AaABAg.AX48YQA4v1tAX4RkMMQf2I,4,corriere_della_sera,author_3576
Ugy_RPXFPl7-SbTSSVt4AaABAg,,oRkHtyD7r98,False,author_3666,2026-05-23T04:11:20Z,2026-05-23T04:11:20Z,0,"E chi lo dice che erano in acque intenazionali??? Questi sono zecche rosse che vogliono provocare ,,,pagati da Hamas ,quindi complici dei terroristi.",,0,corriere_della_sera,author_3666
Ugy2wVA19exnwS0HZA54AaABAg,,oRkHtyD7r98,False,author_879,2026-05-23T05:00:57Z,2026-05-23T05:00:57Z,0,Hallo ! Buongiorno ! ...,,0,corriere_della_sera,author_879
UgzftPXnFe2Sg4qvM2d4AaABAg,,oRkHtyD7r98,False,author_2538,2026-05-23T15:57:24Z,2026-05-23T15:57:24Z,0,"""Non si invochi la libertà per non vaccinarsi"" ""ora e sempre resistenza"". Ogni considerazione è superlfua.",,0,corriere_della_sera,author_2538
Ugx2mHFlwHE-V_fOiTJ4AaABAg,,oRkHtyD7r98,False,author_3426,2026-05-23T19:58:53Z,2026-05-23T20:01:02Z,0,2 morti al giorno sul lavoro in Italia Senza contare gli infuruni più o meno gravi Sarebbe ora di pensare un po di piu a chi ti paga lo stipendio,,0,corriere_della_sera,author_3426
UgzsLVVmf76sODyvaNZ4AaABAg.AX45utD0-HcAX9v6-l_nt7,UgzsLVVmf76sODyvaNZ4AaABAg,oRkHtyD7r98,True,author_3426,2026-05-23T20:03:59Z,2026-05-23T20:03:59Z,1,No all'epoca quando era ministro scherzava con gli attacchi 😂😂😂😂😂,UgzsLVVmf76sODyvaNZ4AaABAg,1,corriere_della_sera,author_3426
Ugymd8HZs-nG1rH9G5h4AaABAg.AX45QayLL9YAX9vG63Z3n6,Ugymd8HZs-nG1rH9G5h4AaABAg,oRkHtyD7r98,True,author_3426,2026-05-23T20:05:22Z,2026-05-23T20:05:22Z,0,È solo il Presidente della Repubblica Italiana Dettagli non preoccuparti 😂😂,Ugymd8HZs-nG1rH9G5h4AaABAg,1,corriere_della_sera,author_3426
UgwUNJEjDYH0te7gr2R4AaABAg,,oRkHtyD7r98,False,author_3667,2026-05-23T20:13:48Z,2026-05-23T20:13:48Z,0,"E sì, sono civili i tuoi attivisti provocatori con la bandiera palestinese che assaltano le tue forze dell'ordine e distruggono tutto. Ci vuole una bella faccia tosta per affermare una cosa del genere.",,0,corriere_della_sera,author_3667
Ugxq3P8ikN1-tiNhldx4AaABAg,,oRkHtyD7r98,False,author_3668,2026-05-24T10:09:25Z,2026-05-24T10:09:25Z,0,È arrivata l’ora che i Riservisti Ebrei che hanno il doppio passaporto non possano più rientrare in Italia 🇮🇹 Dopo aver prestato servizio in Israele,,0,corriere_della_sera,author_3668
Ugy_IBLRODMl6t6bjA94AaABAg,,oRkHtyD7r98,False,author_3669,2026-05-24T19:22:12Z,2026-05-24T19:22:12Z,0,"La civetta sa solo blaterare,,presidente inutile.",,0,corriere_della_sera,author_3669
Ugw3UcZ_oEEqqccWl5x4AaABAg,,oRkHtyD7r98,False,author_3011,2026-05-26T07:43:06Z,2026-05-26T07:43:06Z,0,"Il governo di Israele che dice al ministro di fermare imbarcazioni civili in acque internazionali e di trattarli peggio delle bestie. Ricordiamo il nostro ministro Tajani che dice ""il diritto vale fino ad un certo punto"". Dovrebbe andare in galera quel ministro israeliano invece...",,0,corriere_della_sera,author_3011
UgzQFAjlAs2Sc7ImOZN4AaABAg,,oRkHtyD7r98,False,author_3344,2026-05-26T11:02:59Z,2026-05-26T11:02:59Z,0,"Io ho trovato ottima la soluzione ""scherzosa"" di Ben-Gvir. Visto che patteggiano per i musulmani li ha fatti mettere inginocchiati verso La Mecca, ad ascoltare, al posto del Muezzin, un filmato con le urla del 7 ottobre! Bravissimo!!!!!",,0,corriere_della_sera,author_3344
UgwWzOWUPqYN3--8iAZ4AaABAg,,oRkHtyD7r98,False,author_83,2026-05-27T08:32:28Z,2026-05-27T08:32:28Z,0,L’essere più comico della storia della repubblica. Nemmeno napolitano si era reso così ridicolo,,0,corriere_della_sera,author_83
