comment_id,parent_comment_id,video_id,is_reply,author,published_at,updated_at,like_count,text,inferred_parent_id,depth,newspaper,author_anon
UgwITezdLOqhZxyxRoh4AaABAg,,UgLBNnyTQog,False,author_105,2026-05-27T14:58:20Z,2026-05-27T14:58:20Z,3,"Brutti pazzi! Che sono 50k italiani sicuro covidioti pieni di odio e intolleranza verso chi fuma solo perchè loro non fumano! E tutti i soldi che quotidianamente i fumatori danno allo Stato e quindi alla sanità?! Ma perchè i covidioti non vivono e lasciano vivere?! Questa malattia mentale di voler regolare la vita altrui... Chi vuol perdere le elezioni... si faccia avanti! 😂 Allora tutto bisogna vietare, ogni cosa fa male. Faremo i monaci.",,0,corriere_della_sera,author_105
UgyaUrhaDQAPPRIqoQV4AaABAg,,UgLBNnyTQog,False,author_292,2026-05-27T16:23:18Z,2026-05-27T16:23:18Z,0,Certo tutto fa male.,,0,corriere_della_sera,author_292
UgzEQPUzS09MVK95q_V4AaABAg,,UgLBNnyTQog,False,author_3258,2026-05-27T16:37:52Z,2026-05-27T16:37:52Z,0,Tanto fumiamo lo stesso😜,,0,corriere_della_sera,author_3258
UgwXd92lxriWc1z1zFF4AaABAg,,UgLBNnyTQog,False,author_471,2026-05-27T17:15:34Z,2026-05-27T17:15:34Z,0,Ma che bella ladrata 😂Zelensky ha bisogno soldi 😡,,0,corriere_della_sera,author_471
UgxkdeT1F7T0VxHvmkl4AaABAg,,UgLBNnyTQog,False,author_471,2026-05-27T17:16:36Z,2026-05-27T17:16:36Z,0,50 mila Italiani hanno anche firmato per abolire il REDDITO DI GIORNALANZA 😁😁,,0,corriere_della_sera,author_471
Ugx12uCKE_hElRgHId14AaABAg,,UgLBNnyTQog,False,author_3259,2026-05-27T21:07:54Z,2026-05-27T21:07:54Z,0,Perché non abbassare lo stipendio dei parlamentari di diecimila euro? Forse è meglio.,,0,corriere_della_sera,author_3259
UgxKjlUEPJi4r1lrf-R4AaABAg,,UgLBNnyTQog,False,author_3260,2026-05-28T11:23:32Z,2026-05-28T11:23:32Z,0,"Le solite vigliaccherie dello stato che per la salute pubblica bisogna smettere di fumare perciò i5 euro sarebbero giustificati non per far cassa ma per la salute, ma lo sappiamo benissimo che per un incallito fumatore non sono i5 euro ma per far cassa è come una scusa buona, ma la gente non è proprio stupida da non capire 🤡",,0,corriere_della_sera,author_3260
