comment_id,parent_comment_id,video_id,is_reply,author,published_at,updated_at,like_count,text,inferred_parent_id,depth,newspaper,author_anon
UgzT0GZIJoXbgOsCPat4AaABAg,,emdmIgaFKjw,False,author_3352,2026-05-26T08:23:33Z,2026-05-26T08:23:33Z,20,Basta con questa nullità assoluta!🎉,,0,ilmessaggero,author_3352
UgzAOhbmg34yGFL_UdF4AaABAg,,emdmIgaFKjw,False,author_5208,2026-05-26T08:29:54Z,2026-05-26T08:29:54Z,4,Cacarella...forse...😅🎉😂,,0,ilmessaggero,author_5208
Ugx9yjKB9U9X2ITt6R54AaABAg,,emdmIgaFKjw,False,author_636,2026-05-26T08:32:54Z,2026-05-26T08:32:54Z,1,Mi dispiace tantissimo 😢😢😢,,0,ilmessaggero,author_636
UgzAOhbmg34yGFL_UdF4AaABAg.AXGP2zRoOFRAXGPQQzald9,UgzAOhbmg34yGFL_UdF4AaABAg,emdmIgaFKjw,True,author_636,2026-05-26T08:33:06Z,2026-05-26T08:33:06Z,2,😂😂😂,UgzAOhbmg34yGFL_UdF4AaABAg,1,ilmessaggero,author_636
Ugw9yZtxYwniTLg0CRR4AaABAg,,emdmIgaFKjw,False,author_5209,2026-05-26T08:33:13Z,2026-05-26T08:33:13Z,12,È vittimista di se stessa ...per fare notizie!!,,0,ilmessaggero,author_5209
UgzQDmvLRN-HW2_Paid4AaABAg,,emdmIgaFKjw,False,author_4993,2026-05-26T08:33:52Z,2026-05-26T08:33:52Z,1,Rimandatela in Venezuela😂😂😂,,0,ilmessaggero,author_4993
Ugxa6AZxz34wTiINgrB4AaABAg,,emdmIgaFKjw,False,author_5210,2026-05-26T08:38:23Z,2026-05-26T08:38:23Z,4,"Ma a questi vip non manca nulla ,hanno tutto ma alla fine la salute è ciò che conta",,0,ilmessaggero,author_5210
UgygJfin0INB9HGgurl4AaABAg,,emdmIgaFKjw,False,author_129,2026-05-26T08:39:25Z,2026-05-26T08:39:25Z,2,"Oddio, che notizia... Auguri e sticazzi",,0,ilmessaggero,author_129
UgydlpCOy-pRwRVsPnJ4AaABAg,,emdmIgaFKjw,False,author_362,2026-05-26T08:40:48Z,2026-05-26T08:40:48Z,17,"Ma chi se ne frega??? Anche la mia vicina oggi si è sentita male, ma non ho letto nessuna notizia sui media....e credetemi, la mia vicina è una casalinga e vale molto più di questa nullità 😂😂😂",,0,ilmessaggero,author_362
Ugw3V4upEV5tTwsBTxd4AaABAg,,emdmIgaFKjw,False,author_2001,2026-05-26T08:41:38Z,2026-05-26T08:41:38Z,20,Aaaaaa la bamba,,0,ilmessaggero,author_2001
Ugz5RIg-b2uNAGOmy-R4AaABAg,,emdmIgaFKjw,False,author_1618,2026-05-26T08:45:53Z,2026-05-26T08:45:53Z,7,"Ma chi se ne fregaaaa!!!! Io ho malessere tutta l'estate, dovrei essere in prima pagina !! Questa non sa più come farsi notare, la sorella le ha rubato la scena 😂😂😂",,0,ilmessaggero,author_1618
Ugzoul6K9tvTpJnzW1F4AaABAg,,emdmIgaFKjw,False,author_5211,2026-05-26T09:00:33Z,2026-05-26T09:00:33Z,14,Questi sono i giornalai italiani...una testata giornalistica come il messaggero che da queste minchiate di notizie🤮,,0,ilmessaggero,author_5211
Ugxvdefr9vt5fzKi3Ph4AaABAg,,emdmIgaFKjw,False,author_5212,2026-05-26T09:04:03Z,2026-05-26T09:04:03Z,0,Avrà fatto indigestione di 🍌 ??? 🤔🤔🤔🤔,,0,ilmessaggero,author_5212
UgxZEpTXlfUWt6tBGpJ4AaABAg,,emdmIgaFKjw,False,author_5213,2026-05-26T09:12:48Z,2026-05-26T09:12:48Z,1,Droga,,0,ilmessaggero,author_5213
Ugw9yZtxYwniTLg0CRR4AaABAg.AXGPRHUR90_AXGU0im_y-E,Ugw9yZtxYwniTLg0CRR4AaABAg,emdmIgaFKjw,True,author_5213,2026-05-26T09:13:17Z,2026-05-26T09:13:17Z,3,La droga ucide,Ugw9yZtxYwniTLg0CRR4AaABAg,1,ilmessaggero,author_5213
UgxPhvHUtiTCpGTeV914AaABAg,,emdmIgaFKjw,False,author_5214,2026-05-26T09:31:36Z,2026-05-26T09:31:36Z,4,"Vuole la scena tutta su di se , e se le inventa tutte , non ha ancora capito che invecchia e passa di moda anche lei",,0,ilmessaggero,author_5214
UgzAOhbmg34yGFL_UdF4AaABAg.AXGP2zRoOFRAXGWFYgOFHR,UgzAOhbmg34yGFL_UdF4AaABAg,emdmIgaFKjw,True,author_5214,2026-05-26T09:32:47Z,2026-05-26T09:32:47Z,0,"Anche la cacarella pur di far notizia diventa ""malore"" per far parlare i no vax o i gomblottisti😊😊😊",UgzAOhbmg34yGFL_UdF4AaABAg,1,ilmessaggero,author_5214
Ugxtd7BEb9WTyKO8aK14AaABAg,,emdmIgaFKjw,False,author_5215,2026-05-26T09:39:15Z,2026-05-26T09:39:15Z,0,Il figlio stava a scuola mi spiace capitato anche a me,,0,ilmessaggero,author_5215
UgwKfHeaJm7klDwqwNp4AaABAg,,emdmIgaFKjw,False,author_3743,2026-05-26T09:47:31Z,2026-05-26T09:47:31Z,0,"Mi dispiace moltissimo, è capitato anche a me, fortunatamente mio marito rientrò prima dal lavoro, sennò non so cosa avrei fatto.",,0,ilmessaggero,author_3743
UgzT0GZIJoXbgOsCPat4AaABAg.AXGOKTdDj2oAXGY4qQirwj,UgzT0GZIJoXbgOsCPat4AaABAg,emdmIgaFKjw,True,author_1100,2026-05-26T09:48:48Z,2026-05-26T09:48:48Z,5,Allora che stai a fare qua con i tuoi commenti inutili?,UgzT0GZIJoXbgOsCPat4AaABAg,1,ilmessaggero,author_1100
UgzT0GZIJoXbgOsCPat4AaABAg.AXGOKTdDj2oAXGYOir_ewz,UgzT0GZIJoXbgOsCPat4AaABAg,emdmIgaFKjw,True,author_3352,2026-05-26T09:51:31Z,2026-05-26T09:51:31Z,0,@user è il tuo commento brutto cafone!,UgzT0GZIJoXbgOsCPat4AaABAg.AXGOKTdDj2oAXGY4qQirwj,2,ilmessaggero,author_3352
Ugw9yZtxYwniTLg0CRR4AaABAg.AXGPRHUR90_AXGZVS2-DeR,Ugw9yZtxYwniTLg0CRR4AaABAg,emdmIgaFKjw,True,author_5216,2026-05-26T10:01:10Z,2026-05-26T10:01:10Z,1,Ma no poverina non cominciamo si sa che non sta bene,Ugw9yZtxYwniTLg0CRR4AaABAg,1,ilmessaggero,author_5216
UgydlpCOy-pRwRVsPnJ4AaABAg.AXGQIrYQN8bAXGZ_Cl1LvP,UgydlpCOy-pRwRVsPnJ4AaABAg,emdmIgaFKjw,True,author_5217,2026-05-26T10:01:49Z,2026-05-26T10:01:49Z,0,"Min@user ,quanti acido ti sei bevuta 😅😅😅😅😅😅",UgydlpCOy-pRwRVsPnJ4AaABAg,1,ilmessaggero,author_5217
UgzT0GZIJoXbgOsCPat4AaABAg.AXGOKTdDj2oAXGaiR8LeT-,UgzT0GZIJoXbgOsCPat4AaABAg,emdmIgaFKjw,True,author_5218,2026-05-26T10:20:33Z,2026-05-26T10:20:33Z,0,@author_1100 commentare questi esseri Inutili e' sempre cosa buona e giusta!!!!!!! Svegliati!!!!!!,UgzT0GZIJoXbgOsCPat4AaABAg.AXGOKTdDj2oAXGY4qQirwj,2,ilmessaggero,author_5218
Ugzl0c4--lws5t5UAo94AaABAg,,emdmIgaFKjw,False,author_5219,2026-05-26T10:39:23Z,2026-05-26T10:39:23Z,8,Destino di Nina Moric?,,0,ilmessaggero,author_5219
Ugyc5lWtfkiQDxHI40F4AaABAg,,emdmIgaFKjw,False,author_5220,2026-05-26T10:40:14Z,2026-05-26T10:40:14Z,0,La coca,,0,ilmessaggero,author_5220
UgyPqVtNyfy4ejW9H9h4AaABAg,,emdmIgaFKjw,False,author_5221,2026-05-26T10:43:43Z,2026-05-26T10:43:43Z,1,Non so se è vero...... Ignazio Moser stai vicino a Belen,,0,ilmessaggero,author_5221
UgydlpCOy-pRwRVsPnJ4AaABAg.AXGQIrYQN8bAXGkp4FBLeG,UgydlpCOy-pRwRVsPnJ4AaABAg,emdmIgaFKjw,True,author_5222,2026-05-26T11:48:50Z,2026-05-26T11:48:50Z,1,Con i fotografi al pronto soccorso.,UgydlpCOy-pRwRVsPnJ4AaABAg,1,ilmessaggero,author_5222
UgxVw9IK6AI-NmnU7HN4AaABAg,,emdmIgaFKjw,False,author_5223,2026-05-26T12:24:11Z,2026-05-26T12:24:11Z,0,Basta cocaina.... Fatti una canna piuttosto ... Così ti rovini😂😂😂😂,,0,ilmessaggero,author_5223
UgyYvVOBYrUSt_E9zEJ4AaABAg,,emdmIgaFKjw,False,author_1646,2026-05-26T12:26:00Z,2026-05-26T12:26:00Z,2,Tutelare i suoi figli,,0,ilmessaggero,author_1646
UgxyFPnWXa9JbnZFS-p4AaABAg,,emdmIgaFKjw,False,author_1651,2026-05-26T13:20:37Z,2026-05-26T13:20:37Z,1,eccesso di neve peruviana,,0,ilmessaggero,author_1651
UgyY72uuny5qs7IqCLN4AaABAg,,emdmIgaFKjw,False,author_5082,2026-05-26T13:28:37Z,2026-05-26T13:28:37Z,3,"Anch'io soffro di questa maledetta ansia da anni,per violenze psicologiche e problem vari.Prendo le medicine per poter condurre una vita normale. Purtroppo sono grassa,se non le prendo non mangio, vomito, divento anoressica,per la troppa ansia, e non riesco ad uscire di casa. Non me ne frega del grasso altrimenti non potrei fare neppure la spesa, quindi per quel poco che esco lo voglio fare serenamente. Mi sono dovuta adeguare ad avere più di 20 kg ,anche se non è facile accettarsi, non mi piaccio, la soluzione è che non mi guardo allo specchio. Con le medicine, non avvilisco gli altri con gli attacchi di panico per farmi accompagnare dappertutto.Amo essere libera, questa non ha prezzo..",,0,ilmessaggero,author_5082
UgyAxxhHG0AzwZ6eFu14AaABAg,,emdmIgaFKjw,False,author_5082,2026-05-26T13:32:02Z,2026-05-26T13:32:02Z,0,Mi dispiace tanto per lei. Il marito l'ha sempre tradita e lei lo ha sempre perdonato. Secondo me lei lo ama ancora tanto.,,0,ilmessaggero,author_5082
Ugx7I5ZWFmK4s_Ohygt4AaABAg,,emdmIgaFKjw,False,author_5224,2026-05-26T13:46:04Z,2026-05-26T13:46:04Z,5,"Personalmente non voglio infierire su nessuno , ma questi personaggi cosidetti famosi , anche loro anno y loro problemi essendo fatto di carne ed ossa pure loro , ma non mi scorderò mai quando la signora Belén Rodriguez se la rideva di gusto , quando Ni a Moric dopo aver passato le pene dell'inferno con il suo ex Fabrizio Corona tra litigi e tradimenti e con un unico figlio messo contro dal suo ex come se lui fosse stato un sant'uomo , e mi ricordo che la Belén Rodriguez dopo avergli rubato il marito , da notare che tutti lavoravano nella stessa agenzia di Lele Mora , ecc ecc c'è ne sarebbero troppe da scrivere",,0,ilmessaggero,author_5224
UgywWi_Gjh2vOVA4CcJ4AaABAg,,emdmIgaFKjw,False,author_56,2026-05-26T14:01:20Z,2026-05-26T14:01:20Z,1,Chi se ne frega ...,,0,ilmessaggero,author_56
Ugzl0c4--lws5t5UAo94AaABAg.AXGcsM47VWRAXHAyEEW0y_,Ugzl0c4--lws5t5UAo94AaABAg,emdmIgaFKjw,True,author_1960,2026-05-26T15:46:01Z,2026-05-26T15:46:01Z,3,Ho pensato la stessa identica cosa,Ugzl0c4--lws5t5UAo94AaABAg,1,ilmessaggero,author_1960
UgwKfHeaJm7klDwqwNp4AaABAg.AXGXwW5n511AXHFqhaReLn,UgwKfHeaJm7klDwqwNp4AaABAg,emdmIgaFKjw,True,author_4335,2026-05-26T16:28:41Z,2026-05-26T16:28:41Z,3,"Ma a questa qui succede un poʻ troppo spesso di imbottirsi di psicofarmaci e chissa che altro, ha due figli e si mette alla guida del suo macchinone facendo danni. Ma che roba è? Si faccia curare e figli devono stare al sicuro dai loro padri. Ma siamo pazzi?",UgwKfHeaJm7klDwqwNp4AaABAg,1,ilmessaggero,author_4335
UgyMQZvdXR8YIUn5psR4AaABAg,,emdmIgaFKjw,False,author_5225,2026-05-26T16:45:19Z,2026-05-26T16:45:19Z,1,auguri Belen..spero non sia grave 🥺♥️♥️♥️♥️,,0,ilmessaggero,author_5225
Ugxtd7BEb9WTyKO8aK14AaABAg.AXGWzyB4_a5AXHJ3Y2sxC3,Ugxtd7BEb9WTyKO8aK14AaABAg,emdmIgaFKjw,True,author_5226,2026-05-26T16:56:47Z,2026-05-26T16:56:47Z,0,Alle 7 ?,Ugxtd7BEb9WTyKO8aK14AaABAg,1,ilmessaggero,author_5226
Ugxa6AZxz34wTiINgrB4AaABAg.AXGQ17SoHLkAXHJyriMHW9,Ugxa6AZxz34wTiINgrB4AaABAg,emdmIgaFKjw,True,author_5227,2026-05-26T17:04:45Z,2026-05-26T17:04:45Z,0,"Forse perché hanno avuto e hanno troppo....lei ha a avuto tutto fama, denaro, uomini, questo lo chiamo il ""malessere di vivere"" di chi ha avuto troppo perché prima non era nessuno!",Ugxa6AZxz34wTiINgrB4AaABAg,1,ilmessaggero,author_5227
Ugydn7uUlFBaKb0OBXN4AaABAg,,emdmIgaFKjw,False,author_5228,2026-05-26T17:13:52Z,2026-05-26T17:13:52Z,0,Epstein,,0,ilmessaggero,author_5228
UgwfJG3XEGNV_uoQsb94AaABAg,,emdmIgaFKjw,False,author_5005,2026-05-26T18:36:05Z,2026-05-26T18:36:05Z,1,"Io sono due giorni che scorreggio come un cavallo, mi conviene chiamate l'ambulanza?",,0,ilmessaggero,author_5005
UgwfJG3XEGNV_uoQsb94AaABAg.AXHUQmVI-4SAXHWgnCGrxX,UgwfJG3XEGNV_uoQsb94AaABAg,emdmIgaFKjw,True,author_5229,2026-05-26T18:55:53Z,2026-05-26T18:55:53Z,2,Quesito interessante!,UgwfJG3XEGNV_uoQsb94AaABAg,1,ilmessaggero,author_5229
Ugw3V4upEV5tTwsBTxd4AaABAg.AXGQOx_EOCDAXHZa2KKaFH,Ugw3V4upEV5tTwsBTxd4AaABAg,emdmIgaFKjw,True,author_5005,2026-05-26T19:21:11Z,2026-05-26T19:21:11Z,1,Vamos a bailar la bamba 🎼🎶🎶🎶🎼🎼,Ugw3V4upEV5tTwsBTxd4AaABAg,1,ilmessaggero,author_5005
UgwASdDsK-Qc4R0aIaR4AaABAg,,emdmIgaFKjw,False,author_5230,2026-05-26T19:28:20Z,2026-05-26T19:28:20Z,0,In bocca al lupo belen,,0,ilmessaggero,author_5230
UgwEnGe1ChIi3ISkjoB4AaABAg,,emdmIgaFKjw,False,author_5231,2026-05-26T20:28:52Z,2026-05-26T20:28:52Z,11,Quando una persona sta poco bene non è mai bello. Però io ricordo i video di quando ancheggiava con lo sguardo come a dire: ce l' ho solo io. E quando era in vacanza che ha insultato il benzinaio solo perché le ha detto di non passare perché c'era il tombino aperto? Dai per favore...vai a lavorare come tutti,,0,ilmessaggero,author_5231
Ugzoul6K9tvTpJnzW1F4AaABAg.AXGSZVV2C6qAXHhZf7LsQ1,Ugzoul6K9tvTpJnzW1F4AaABAg,emdmIgaFKjw,True,author_5232,2026-05-26T20:39:37Z,2026-05-26T20:39:37Z,1,Come le migliori riviste da parrucchiera,Ugzoul6K9tvTpJnzW1F4AaABAg,1,ilmessaggero,author_5232
UgyY72uuny5qs7IqCLN4AaABAg.AXGwEqBTFBNAXHntvgAVoJ,UgyY72uuny5qs7IqCLN4AaABAg,emdmIgaFKjw,True,author_5233,2026-05-26T21:34:57Z,2026-05-26T21:34:57Z,1,😘,UgyY72uuny5qs7IqCLN4AaABAg,1,ilmessaggero,author_5233
Ugw9yZtxYwniTLg0CRR4AaABAg.AXGPRHUR90_AXHnyj7q2LX,Ugw9yZtxYwniTLg0CRR4AaABAg,emdmIgaFKjw,True,author_1720,2026-05-26T21:35:37Z,2026-05-26T21:35:37Z,1,@user è che da anni ha una dipendenza da cocaina e benzodiazepine forse come tanti non ne sapevi nulla,Ugw9yZtxYwniTLg0CRR4AaABAg.AXGPRHUR90_AXGZVS2-DeR,2,ilmessaggero,author_1720
UgwKfHeaJm7klDwqwNp4AaABAg.AXGXwW5n511AXHo9qo6yJO,UgwKfHeaJm7klDwqwNp4AaABAg,emdmIgaFKjw,True,author_1720,2026-05-26T21:37:16Z,2026-05-26T21:37:16Z,0,@user un commento sensato cocaina e benzodiazepine,UgwKfHeaJm7klDwqwNp4AaABAg.AXGXwW5n511AXHFqhaReLn,2,ilmessaggero,author_1720
UgyLwsT9AR_53yLS8914AaABAg,,emdmIgaFKjw,False,author_4964,2026-05-27T02:30:54Z,2026-05-27T02:30:54Z,0,Droga Alcool Preservativi Gonfiabili di C2 Una donna misteriosa.,,0,ilmessaggero,author_4964
Ugw3V4upEV5tTwsBTxd4AaABAg.AXGQOx_EOCDAXIKsi0hl_1,Ugw3V4upEV5tTwsBTxd4AaABAg.AXGQOx_EOCDAXHZa2KKaFH,emdmIgaFKjw,True,author_4964,2026-05-27T02:31:53Z,2026-05-27T02:31:53Z,0,@author_5005 6 anche Tu un Drogato 😂?,Ugw3V4upEV5tTwsBTxd4AaABAg.AXGQOx_EOCDAXHZa2KKaFH,2,ilmessaggero,author_4964
UgyY72uuny5qs7IqCLN4AaABAg.AXGwEqBTFBNAXIctrQTK9t,UgyY72uuny5qs7IqCLN4AaABAg,emdmIgaFKjw,True,author_5234,2026-05-27T05:18:04Z,2026-05-27T05:18:04Z,0,Hai perfettamente ragione ..brava ❤,UgyY72uuny5qs7IqCLN4AaABAg,1,ilmessaggero,author_5234
UgzKPK2RhVznGwJn1qx4AaABAg,,emdmIgaFKjw,False,author_5235,2026-05-27T05:31:16Z,2026-05-27T05:46:45Z,1,"Dopo i 40 anni se non hai talento per andate avanti la chirurgia plastica non e' sufficiente. Da oltre 20 anni in Italia balbetta, pronuncia la V al posto della B, aVViamo, doVViamo, non si capisce quel che dice.Se poi ci aggiungi qualche sostanza e la chiamano depressione. Immigrati che vivono in strada dopo 6 mesi parlano benissimo. I soccorsi hanno impiegato 3 ore per convincerla ad aprire la porta, solo dopo che la stavano forzando ha aperto!",,0,ilmessaggero,author_5235
UgyYiXFcBrkndT5qDaV4AaABAg,,emdmIgaFKjw,False,author_4361,2026-05-27T06:13:25Z,2026-05-27T06:13:25Z,0,Ho tanti caxxi miei non posso pensare ai caxxi degli altri,,0,ilmessaggero,author_4361
UgwsMq7KiHR4yatEtQp4AaABAg,,emdmIgaFKjw,False,author_5236,2026-05-27T10:52:14Z,2026-05-27T10:52:14Z,0,Probabile bamba,,0,ilmessaggero,author_5236
Ugy7UlabOmW_8U2FraN4AaABAg,,emdmIgaFKjw,False,author_5237,2026-05-27T10:53:10Z,2026-05-27T10:53:10Z,0,Hai fatto il tuo tempo bastaaaa,,0,ilmessaggero,author_5237
UgxqCEIjFkOffi_v6914AaABAg,,emdmIgaFKjw,False,author_5238,2026-05-27T11:01:08Z,2026-05-27T11:01:08Z,1,Se ne fa troppa,,0,ilmessaggero,author_5238
Ugwp9ha9SH2Up_LuDoh4AaABAg,,emdmIgaFKjw,False,author_4360,2026-05-27T12:47:38Z,2026-05-27T12:47:38Z,0,Malore???😂😂😂😂😂.... Crack crack crack 😂,,0,ilmessaggero,author_4360
Ugx7HDrCp_orfA0K1rB4AaABAg,,emdmIgaFKjw,False,author_5239,2026-05-27T14:05:54Z,2026-05-27T14:05:54Z,0,Povera drogata😂😂😂😂,,0,ilmessaggero,author_5239
Ugw4jUDUgQhmm2LeCBB4AaABAg,,emdmIgaFKjw,False,author_5240,2026-05-27T16:30:45Z,2026-05-27T16:30:45Z,2,Poverina soffre di depressione perché ormai non se la caga più nessuno e lei questo non lo sopporta di essere stata .messa da parte... Vi dovete rassegnare la popolarità non dura per sempre,,0,ilmessaggero,author_5240
UgwEnGe1ChIi3ISkjoB4AaABAg.AXHgKpPRV1gAXJq1hvPpZm,UgwEnGe1ChIi3ISkjoB4AaABAg,emdmIgaFKjw,True,author_5240,2026-05-27T16:32:07Z,2026-05-27T16:32:07Z,1,"D'accordo, lei era abituata ad essere sempre la migliore e al centro dell'attenzione, il suo momento è finito come succede a tanti, molti non si rassegnano.",UgwEnGe1ChIi3ISkjoB4AaABAg,1,ilmessaggero,author_5240
UgzmBzpauscLF1DtSEt4AaABAg,,emdmIgaFKjw,False,author_5240,2026-05-27T16:36:07Z,2026-05-27T16:36:07Z,2,È dura non essere più al centro dell'attenzione e diventare vecchie,,0,ilmessaggero,author_5240
Ugzoul6K9tvTpJnzW1F4AaABAg.AXGSZVV2C6qAXJr4A0G3Ii,Ugzoul6K9tvTpJnzW1F4AaABAg,emdmIgaFKjw,True,author_5231,2026-05-27T16:41:11Z,2026-05-27T16:41:11Z,0,Infatti in Italia va tutto a rotoli e il problema è Belen che si è chiusa nel cesso per 3 ore,Ugzoul6K9tvTpJnzW1F4AaABAg,1,ilmessaggero,author_5231
Ugz1Ho7_EalDNvXW0Gh4AaABAg,,emdmIgaFKjw,False,author_5227,2026-05-27T17:17:47Z,2026-05-27T17:17:47Z,0,Alle 4 del mattino andare avanti indietro dal balcone all'appartamento mettere sottoquadro la casa e il bagno dove si e rintanata e non voleva uscire ma solo dopo 40 minuti i pompieri sono riusciti a farla uscire. Se stai così male butti le braccia al collo alla prima persona che ti tende la mano ma se fai abuso di coca o sostanze stupefacenti il tuo stato psicofisico e alterato all'ennesima potenza.,,0,ilmessaggero,author_5227
UgwEnGe1ChIi3ISkjoB4AaABAg.AXHgKpPRV1gAXK-HueqQhg,UgwEnGe1ChIi3ISkjoB4AaABAg,emdmIgaFKjw,True,author_5241,2026-05-27T18:01:42Z,2026-05-27T18:01:42Z,0,Bravoooooo,UgwEnGe1ChIi3ISkjoB4AaABAg,1,ilmessaggero,author_5241
UgydlpCOy-pRwRVsPnJ4AaABAg.AXGQIrYQN8bAXK-WoKR0iq,UgydlpCOy-pRwRVsPnJ4AaABAg,emdmIgaFKjw,True,author_5241,2026-05-27T18:03:44Z,2026-05-27T18:03:44Z,0,Giustissimo,UgydlpCOy-pRwRVsPnJ4AaABAg,1,ilmessaggero,author_5241
Ugw4jUDUgQhmm2LeCBB4AaABAg.AXJpsmEaHgpAXK-m_ni5FU,Ugw4jUDUgQhmm2LeCBB4AaABAg,emdmIgaFKjw,True,author_5241,2026-05-27T18:06:02Z,2026-05-27T18:06:02Z,0,E presto verranno sostituiti tutti questi VIP dall'intelligenza Artificiale!,Ugw4jUDUgQhmm2LeCBB4AaABAg,1,ilmessaggero,author_5241
UgzT0GZIJoXbgOsCPat4AaABAg.AXGOKTdDj2oAXK01mA9RRB,UgzT0GZIJoXbgOsCPat4AaABAg,emdmIgaFKjw,True,author_3352,2026-05-27T18:08:15Z,2026-05-27T18:08:15Z,0,@user se ti riferisci a me brava dal momento che sono donna e molto più di quella sciacquina!🎉,UgzT0GZIJoXbgOsCPat4AaABAg,1,ilmessaggero,author_3352
UgwnlUk-Q0PgWyZHZdt4AaABAg,,emdmIgaFKjw,False,author_5241,2026-05-27T18:09:49Z,2026-05-27T18:09:49Z,0,FESTEGGIERO' QUANDO TUTTI QUESTI COSIDETTI VIP VERRANNO SOSTITUITI DALL'INTELLIGENZA ARTIFICIALE,,0,ilmessaggero,author_5241
UgzrA3sBvfSjmtlLd0l4AaABAg,,emdmIgaFKjw,False,author_498,2026-05-27T19:15:14Z,2026-05-27T19:15:14Z,0,Narcisista piena di bamba !!!!!,,0,ilmessaggero,author_498
UgxLHvyzPFpAuppXE_V4AaABAg,,emdmIgaFKjw,False,author_5242,2026-05-27T22:00:00Z,2026-05-27T22:00:00Z,1,Non bisogna infierire e una donna e mamma fragile io ti auguro che tornerai più forte di prima i tuoi figli anno bisogno di te forza avanti tuttia❤❤❤❤❤,,0,ilmessaggero,author_5242
Ugy7UlabOmW_8U2FraN4AaABAg.AXJEFEZXphvAXKYPs7z5kn,Ugy7UlabOmW_8U2FraN4AaABAg,emdmIgaFKjw,True,author_5243,2026-05-27T23:08:38Z,2026-05-27T23:08:38Z,0,Come sei umana!!,Ugy7UlabOmW_8U2FraN4AaABAg,1,ilmessaggero,author_5243
UgyKPiSSXDhgN9J9S-Z4AaABAg,,emdmIgaFKjw,False,author_5244,2026-05-28T05:10:22Z,2026-05-28T05:10:22Z,0,Perché non va a lavorare,,0,ilmessaggero,author_5244
Ugxq8jT7czBFua3IOVl4AaABAg,,emdmIgaFKjw,False,author_5244,2026-05-28T05:10:49Z,2026-05-28T05:10:49Z,0,L'anno ricoverata dove lavoro io in ospedale,,0,ilmessaggero,author_5244
UgwcjcHHXblZsSfioFZ4AaABAg,,emdmIgaFKjw,False,author_5245,2026-05-28T08:32:09Z,2026-05-28T08:32:09Z,0,Forza Belen sei stata sempre forte pensa i tuoi figli adorabili ❤❤❤❤❤,,0,ilmessaggero,author_5245
UgyxQ7oji-s1tva8Zix4AaABAg,,emdmIgaFKjw,False,author_5246,2026-05-28T15:15:36Z,2026-05-28T15:15:36Z,0,Ma perché Belen è vecchia come si fanno a dire certe cose i momenti di fragilità possono capitare a tutti ma ormai non c'è ne compassione ne umanità mi dispiace premetto che non sono né fan né altro solo mi dispiace leggere certe cose ❤,,0,ilmessaggero,author_5246
