comment_id,parent_comment_id,video_id,is_reply,author,published_at,updated_at,like_count,text,inferred_parent_id,depth,newspaper,author_anon
UgyHlO2Hd2LrkhViuGR4AaABAg,,i-h4udtvxQU,False,author_5154,2026-05-26T15:54:59Z,2026-05-26T15:54:59Z,1,"Hai fatto bene a prepararti la valigetta, manca poco poco",,0,ilmessaggero,author_5154
UgyHlO2Hd2LrkhViuGR4AaABAg.AXHBzqYIrV4AXHDG5SsX6k,UgyHlO2Hd2LrkhViuGR4AaABAg,i-h4udtvxQU,True,author_3886,2026-05-26T16:06:04Z,2026-05-26T16:06:04Z,2,"Sente il fiato sul collo, come la canzone ,la verità mi fa' male lo so.",UgyHlO2Hd2LrkhViuGR4AaABAg,1,ilmessaggero,author_3886
UgwWXsLKaPPEQr1Ik2F4AaABAg,,i-h4udtvxQU,False,author_5155,2026-05-26T16:47:33Z,2026-05-26T16:47:33Z,2,Questo mostro.... è convinto di fare quello che vuole....e di prendere in giro.... l' intelligenza umana......che fine ha fatto il mondo,,0,ilmessaggero,author_5155
UgxgimiB4wpI4uRAI2N4AaABAg,,i-h4udtvxQU,False,author_5156,2026-05-26T17:17:13Z,2026-05-26T17:17:13Z,0,E cosa proverebbe?,,0,ilmessaggero,author_5156
UgzwsGNVz7RMDkJRdnp4AaABAg,,i-h4udtvxQU,False,author_5157,2026-05-26T17:26:23Z,2026-05-26T17:26:52Z,2,Solitamente la pelle sotto le unghie è sinonimo di difesa. Che sia come ho scritto moltissimo tempo fa che tra S. e M. ci fosse una relazione e non solo un'amicizia?,,0,ilmessaggero,author_5157
UgxgimiB4wpI4uRAI2N4AaABAg.AXHLPBcBt2qAXHMdkAdW93,UgxgimiB4wpI4uRAI2N4AaABAg,i-h4udtvxQU,True,author_5157,2026-05-26T17:28:05Z,2026-05-26T17:28:05Z,0,Una difesa da parte di Chiara ma penso che si dovesse difendere anche dal fratello....,UgxgimiB4wpI4uRAI2N4AaABAg,1,ilmessaggero,author_5157
Ugyj0LA2DbisUOxY9gl4AaABAg,,i-h4udtvxQU,False,author_5158,2026-05-26T17:32:09Z,2026-05-26T17:32:09Z,0,continuo a pensare che su questo povero diavolo stiano costruendo le prove e le accuse. Per me l'assassino resta Stasi con la complicità della cugina. Chiara aveva scoperto che avevano una relazione.,,0,ilmessaggero,author_5158
Ugyj0LA2DbisUOxY9gl4AaABAg.AXHN6ZHQOszAXHV66ZeT5B,Ugyj0LA2DbisUOxY9gl4AaABAg,i-h4udtvxQU,True,author_5159,2026-05-26T18:42:00Z,2026-05-26T18:42:00Z,1,"👍Gra💤ia Longo!! Sempio,il SADICO!! Dott.Stasi libero! Hai ragione!! Brava !! 👏👏👏👏💯💯",Ugyj0LA2DbisUOxY9gl4AaABAg,1,ilmessaggero,author_5159
UgyHlO2Hd2LrkhViuGR4AaABAg.AXHBzqYIrV4AXI89vbi0EB,UgyHlO2Hd2LrkhViuGR4AaABAg,i-h4udtvxQU,True,author_1729,2026-05-27T00:40:47Z,2026-05-27T00:40:47Z,0,Purtroppo non manca poco ho sentito il telegiornale oggi e i suoi avvocati anno ribaltato tutto che la procura di Pavia sta sbagliando tutto e sempio è innocente e intanto c'è un innocente in galera che delusione sempio se la caverà sempre è protetto da per tutto sono tutti corrotti 😡,UgyHlO2Hd2LrkhViuGR4AaABAg,1,ilmessaggero,author_1729
UgxH2MF0LnXmzumOQk54AaABAg,,i-h4udtvxQU,False,author_4964,2026-05-27T02:26:12Z,2026-05-27T02:26:12Z,1,"La legge italiana è fallita da sempre. Ormai ne fa parte del mondo mafioso, come lo sono la più parte dei politici italiani.",,0,ilmessaggero,author_4964
UgwWXsLKaPPEQr1Ik2F4AaABAg.AXHI-r92cc6AXIKNYmbBjy,UgwWXsLKaPPEQr1Ik2F4AaABAg,i-h4udtvxQU,True,author_4964,2026-05-27T02:27:30Z,2026-05-27T02:27:30Z,1,"Il mondo è andato allo sfascio, con la favola del Gesù di Nazareth 😂!",UgwWXsLKaPPEQr1Ik2F4AaABAg,1,ilmessaggero,author_4964
UgyHlO2Hd2LrkhViuGR4AaABAg.AXHBzqYIrV4AXIk0DGgr4N,UgyHlO2Hd2LrkhViuGR4AaABAg.AXHBzqYIrV4AXI89vbi0EB,i-h4udtvxQU,True,author_5154,2026-05-27T06:20:14Z,2026-05-27T06:20:14Z,1,"@user Teresa un giorno la bugia andò dalla verità e le disse ridendo: tanto arrivo sempre prima io di te, la verità con la sua massima calma e senza sorriso rispose: lo so, ma tu sottovaluti una cosa importante, quale rispose la bugia, io ti raggiungerò sempre ribadì la verità. È solo questione di tempo vedrai.",UgyHlO2Hd2LrkhViuGR4AaABAg.AXHBzqYIrV4AXI89vbi0EB,2,ilmessaggero,author_5154
Ugwjs3CDlQ95zF8uUbB4AaABAg,,i-h4udtvxQU,False,author_5160,2026-05-27T06:44:21Z,2026-05-27T06:44:21Z,0,DNA non mente. Che ci faceva il DNA di Sempio su Chiara Poggi?,,0,ilmessaggero,author_5160
UgyHlO2Hd2LrkhViuGR4AaABAg.AXHBzqYIrV4AXJ5K5wU-O_,UgyHlO2Hd2LrkhViuGR4AaABAg.AXHBzqYIrV4AXIk0DGgr4N,i-h4udtvxQU,True,author_1729,2026-05-27T09:35:12Z,2026-05-27T09:35:12Z,0,@user ragione mi è piaciuto molto quello che ha scritto con gentilezza e tranquillità parole sante 😊,UgyHlO2Hd2LrkhViuGR4AaABAg.AXHBzqYIrV4AXIk0DGgr4N,3,ilmessaggero,author_1729
UgxCXw-DvyAMByqkLkt4AaABAg,,i-h4udtvxQU,False,author_5161,2026-05-27T11:45:07Z,2026-05-27T11:45:07Z,0,Udizze marocco yogurt marocco mecdonas gelato mattina marocco mecdonas addonata sushi nonna gatti lecce nonna selena selena donna selena e un uomo che ha un matrimonio Sadrokan sadrokan Pessagita amici squalo carted bregorotto appetorie don hotel cane lupo macchina Rosà di zucca sadrokan di Pessagita e dintorni e di non aver trovato un matrimonio senza selena mollocone selena selena di un addonata di acqua selena e di un addonata nonna lecca selena buiotto e 😅,,0,ilmessaggero,author_5161
Ugz5m8E8Tvvie21KNet4AaABAg,,i-h4udtvxQU,False,author_5162,2026-05-27T16:51:28Z,2026-05-27T16:51:28Z,0,Con quella faccia da cretino che si ritrova prende in giro tutti .,,0,ilmessaggero,author_5162
UgyzlXi6VPUdXs_qoV14AaABAg,,i-h4udtvxQU,False,author_5145,2026-05-27T17:37:22Z,2026-05-27T17:37:22Z,0,Andatelo a dire a Bossetti,,0,ilmessaggero,author_5145
Ugz74j1aFPIvwax1dYJ4AaABAg,,i-h4udtvxQU,False,author_534,2026-05-27T21:12:36Z,2026-05-27T21:12:36Z,0,"Se dicessero che si è suicidata,farebbero più bella figura",,0,ilmessaggero,author_534
Ugyox8VvYEkcQ0Zg7Z14AaABAg,,i-h4udtvxQU,False,author_5163,2026-05-28T06:45:35Z,2026-05-28T06:45:35Z,0,La difesa sa che può chiedere solo il rito abbreviato... se glielo concederanno...,,0,ilmessaggero,author_5163
