comment_id,parent_comment_id,video_id,is_reply,author,published_at,updated_at,like_count,text,inferred_parent_id,depth,newspaper,author_anon
UgzpkNxDB69ygrvuJUN4AaABAg,,i-pHOBt0BAU,False,author_5064,2026-05-27T10:59:15Z,2026-05-27T10:59:15Z,2,Bravo estefano,,0,ilmessaggero,author_5064
UgzpkNxDB69ygrvuJUN4AaABAg.AXJEwkOlQaSAXJFboOPcl6,UgzpkNxDB69ygrvuJUN4AaABAg,i-pHOBt0BAU,True,author_208,2026-05-27T11:05:08Z,2026-05-27T11:05:08Z,0,"Meraviglioso!!!vuoi vedere che è cresciuto e ha capito il ruolo di genitore???io ho qualche dubbio, ai posteri l ardua....",UgzpkNxDB69ygrvuJUN4AaABAg,1,ilmessaggero,author_208
UgzpkNxDB69ygrvuJUN4AaABAg.AXJEwkOlQaSAXJFrPi95El,UgzpkNxDB69ygrvuJUN4AaABAg,i-pHOBt0BAU,True,author_2334,2026-05-27T11:07:16Z,2026-05-27T11:07:16Z,1,"@author_208 magari sa fare il padre, o ci tenta. Il marito, certamente no",UgzpkNxDB69ygrvuJUN4AaABAg,1,ilmessaggero,author_2334
UgyA50TiYXkckQzhvQV4AaABAg,,i-pHOBt0BAU,False,author_5065,2026-05-27T11:23:32Z,2026-05-27T11:23:32Z,0,Belen e falsa fa finta non lavora e cerca attenzioni dappertutto 😂,,0,ilmessaggero,author_5065
UgzpkNxDB69ygrvuJUN4AaABAg.AXJEwkOlQaSAXJHlwzMzs2,UgzpkNxDB69ygrvuJUN4AaABAg,i-pHOBt0BAU,True,author_5065,2026-05-27T11:23:59Z,2026-05-27T11:23:59Z,2,Bravo Stefano,UgzpkNxDB69ygrvuJUN4AaABAg,1,ilmessaggero,author_5065
UgzpkNxDB69ygrvuJUN4AaABAg.AXJEwkOlQaSAXJKM4-S9SK,UgzpkNxDB69ygrvuJUN4AaABAg,i-pHOBt0BAU,True,author_5066,2026-05-27T11:46:32Z,2026-05-27T11:46:32Z,0,Bravissimo Stefano....grande uomo👍👍🌻🌻🌻🌻🌻❣️,UgzpkNxDB69ygrvuJUN4AaABAg,1,ilmessaggero,author_5066
UgyVnhKGYWW00p5XziJ4AaABAg,,i-pHOBt0BAU,False,author_5067,2026-05-27T12:02:59Z,2026-05-27T12:02:59Z,0,Caaaaaa..........zi SUOI,,0,ilmessaggero,author_5067
UgzpkNxDB69ygrvuJUN4AaABAg.AXJEwkOlQaSAXJMLwdaFSg,UgzpkNxDB69ygrvuJUN4AaABAg,i-pHOBt0BAU,True,author_5068,2026-05-27T12:04:00Z,2026-05-27T12:04:00Z,3,Ha fatto esattamente il suo dovere di padre 👏👏👏🔝❤️,UgzpkNxDB69ygrvuJUN4AaABAg,1,ilmessaggero,author_5068
UgzpUSxMWnR3uY0Pkqt4AaABAg,,i-pHOBt0BAU,False,author_5069,2026-05-27T12:18:43Z,2026-05-27T12:18:43Z,7,Chi se ne frega 😎,,0,ilmessaggero,author_5069
UgzY5vLglJT2n91W7at4AaABAg,,i-pHOBt0BAU,False,author_5070,2026-05-27T12:35:38Z,2026-05-27T12:35:38Z,4,Bravo ragazzo ❤,,0,ilmessaggero,author_5070
Ugz5LkEuFgSPNRHJRmJ4AaABAg,,i-pHOBt0BAU,False,author_5071,2026-05-27T12:36:47Z,2026-05-27T12:36:47Z,9,Non solo sei bello fuori ma anche dentro bravissimo Stefano,,0,ilmessaggero,author_5071
UgzR5cjdZAjJRZuwLOt4AaABAg,,i-pHOBt0BAU,False,author_479,2026-05-27T12:37:15Z,2026-05-27T12:37:15Z,6,Belen riprenditi 😢😢😢😢,,0,ilmessaggero,author_479
UgwIy1e-E1FCgN6Gd-Z4AaABAg,,i-pHOBt0BAU,False,author_1673,2026-05-27T12:43:57Z,2026-05-27T12:43:57Z,3,E. Con questo?????,,0,ilmessaggero,author_1673
UgzpUSxMWnR3uY0Pkqt4AaABAg.AXJO1kFXIzeAXJVaAfHZZN,UgzpUSxMWnR3uY0Pkqt4AaABAg,i-pHOBt0BAU,True,author_4765,2026-05-27T13:24:43Z,2026-05-27T13:24:43Z,2,Figurati a me delle risposte che dai,UgzpUSxMWnR3uY0Pkqt4AaABAg,1,ilmessaggero,author_4765
UgyteNQAINJ2X2iuex94AaABAg,,i-pHOBt0BAU,False,author_5072,2026-05-27T13:32:20Z,2026-05-27T13:32:20Z,7,Cara Belen sei una donna bellissima stai passando un periodo di fragilità ti auguro tutto il meglio della vita forza e coraggio ❤❤❤,,0,ilmessaggero,author_5072
UgyQOuNN2b08TynVtc94AaABAg,,i-pHOBt0BAU,False,author_5017,2026-05-27T13:52:27Z,2026-05-27T13:52:27Z,0,"Belin, Belen",,0,ilmessaggero,author_5017
UgzfTmV-MhSs-BsAG3l4AaABAg,,i-pHOBt0BAU,False,author_5073,2026-05-27T14:08:07Z,2026-05-27T14:08:07Z,0,Belen ❤,,0,ilmessaggero,author_5073
Ugz8ELStmh_DDLwmomF4AaABAg,,i-pHOBt0BAU,False,author_4365,2026-05-27T14:35:16Z,2026-05-27T14:35:16Z,18,Chissa ‘ quante volte capita ogni giorno alla povera gente e di sicuro non se ne parla. Meditate gente meditate!!!!,,0,ilmessaggero,author_4365
Ugy_Wq0qY0uqFZ68ezB4AaABAg,,i-pHOBt0BAU,False,author_498,2026-05-27T14:45:25Z,2026-05-27T14:45:25Z,0,Ha ottenuto ciò che voleva!!!!!!! Quanto sono stupidi gli uomini!,,0,ilmessaggero,author_498
Ugxg7AlBQPEF_9ji-sV4AaABAg,,i-pHOBt0BAU,False,author_5074,2026-05-27T15:27:24Z,2026-05-27T15:27:24Z,3,Forza Belen❤,,0,ilmessaggero,author_5074
UgyyXqAi2j3tjDU3-B94AaABAg,,i-pHOBt0BAU,False,author_5075,2026-05-27T16:17:54Z,2026-05-27T16:17:54Z,5,Miracolo prima stava morendo adesso dimessa 😅,,0,ilmessaggero,author_5075
UgzPpheXBIe39JEH_Yt4AaABAg,,i-pHOBt0BAU,False,author_5076,2026-05-27T16:29:30Z,2026-05-27T16:29:30Z,0,"Tutte scene per essere al centro dell attenzione tutto il contrario di Cecilia lei una ragazza d oro ,questa cessa è viziata e antipatica",,0,ilmessaggero,author_5076
Ugya23cHcEc69naFdgJ4AaABAg,,i-pHOBt0BAU,False,author_5077,2026-05-27T16:29:31Z,2026-05-27T16:29:31Z,9,La tv non la chiama più e lei si inventa qualcosa per attrarre i riflettori su di lei 😅,,0,ilmessaggero,author_5077
UgwTbquDbYvops8mekl4AaABAg,,i-pHOBt0BAU,False,author_5078,2026-05-27T16:36:40Z,2026-05-27T16:36:40Z,1,Che bella coppia bravo Stefano e tu belen meriti il meglio nessuno e migliore di te tu sei belen,,0,ilmessaggero,author_5078
UgwNpRCkeeMEu2L2urJ4AaABAg,,i-pHOBt0BAU,False,author_5079,2026-05-27T16:38:22Z,2026-05-27T16:38:22Z,0,Ma che cavolo ce ne può frega state a rompe li coioni co sta belen,,0,ilmessaggero,author_5079
UgzZx6Qc9aJISzihZV94AaABAg,,i-pHOBt0BAU,False,author_5080,2026-05-27T16:52:34Z,2026-05-27T16:52:34Z,0,Bravo 👏👏👏👏👏👏👏👏👏 Stefano bello dentro e fuori ❤❤❤❤❤,,0,ilmessaggero,author_5080
UgxxtbeQy84ED08ka7R4AaABAg,,i-pHOBt0BAU,False,author_4368,2026-05-27T17:03:10Z,2026-05-27T17:03:10Z,0,Fai apposto crizeee😂😂😂,,0,ilmessaggero,author_4368
UgxHyjFQheq-rFHwGvx4AaABAg,,i-pHOBt0BAU,False,author_5081,2026-05-27T17:07:31Z,2026-05-27T17:07:31Z,0,Eh sti gran cazzi nun ce lo metti??,,0,ilmessaggero,author_5081
Ugz5LkEuFgSPNRHJRmJ4AaABAg.AXJQ62pQBWDAXJvoO7U7B1,Ugz5LkEuFgSPNRHJRmJ4AaABAg,i-pHOBt0BAU,True,author_5082,2026-05-27T17:22:35Z,2026-05-27T17:22:35Z,1,"Lui le ha messo tante di quelle corna,povera donna,da doverlo lasciare. Lei lo ha amato immensamente,lui no. Persino con la Marcuzzi e all'epoca stavano ancora insieme. Ecco perché si è rotto tutto. Essendo bello tutte si concedono. Dopo la scoperta della Marcuzzi ha saputo che è stato con una marea di donne. Ecco perché sta male, è innamorata ma come si può stare con uno così? Oramai tutto è finito, peccato, pensavo che sarebbe stato per sempre. Sarà bello ma buono non credo, tipico uomo che non ragiona con il cervello ma con altro. Se fosse stato bravo avrebbe pensato che avevano un figlio. Un uomo così accanto non lo vorrei.Io non vedo neppure affari tuoi, mi ha deluso. Inoltre preferisco la ruota della fortuna, dove si vince sempre ed è molto più allegra. Rai uno in mortorio.",Ugz5LkEuFgSPNRHJRmJ4AaABAg,1,ilmessaggero,author_5082
UgwTbquDbYvops8mekl4AaABAg.AXJqYuLxs-sAXJvueB03Gm,UgwTbquDbYvops8mekl4AaABAg,i-pHOBt0BAU,True,author_5082,2026-05-27T17:23:26Z,2026-05-27T17:23:26Z,0,Lui l'ha sempre tradita. Lei lo ama lui no.,UgwTbquDbYvops8mekl4AaABAg,1,ilmessaggero,author_5082
Ugya23cHcEc69naFdgJ4AaABAg.AXJpjchgYIuAXJy_j8KX28,Ugya23cHcEc69naFdgJ4AaABAg,i-pHOBt0BAU,True,author_5083,2026-05-27T17:46:48Z,2026-05-27T17:46:48Z,2,Ma perché ti inventi cose che non esistono?,Ugya23cHcEc69naFdgJ4AaABAg,1,ilmessaggero,author_5083
Ugyk-Ug3z4Igt5D7mpp4AaABAg,,i-pHOBt0BAU,False,author_5084,2026-05-27T17:51:29Z,2026-05-27T17:51:29Z,1,Stefano sei proprio un bravo ragazzo,,0,ilmessaggero,author_5084
Ugya23cHcEc69naFdgJ4AaABAg.AXJpjchgYIuAXK451x42IC,Ugya23cHcEc69naFdgJ4AaABAg,i-pHOBt0BAU,True,author_5077,2026-05-27T18:43:38Z,2026-05-27T18:43:38Z,0,@author_5083 Io invento? Sarà ...😂 Di sicuro è che Belen è una persona arrogante incivile maleducata presuntuosa che si crede sto cax Non sa fare niente È il nulla assoluto Ed ha fatto pure troppi soldi per quello che vale 😂😂,Ugya23cHcEc69naFdgJ4AaABAg.AXJpjchgYIuAXJy_j8KX28,2,ilmessaggero,author_5077
Ugy7xw499rKsTdYwe7J4AaABAg,,i-pHOBt0BAU,False,author_5085,2026-05-27T18:55:08Z,2026-05-27T18:55:08Z,0,Pronta guarigione un caro abbraccio ❤,,0,ilmessaggero,author_5085
UgyIwlhQPmbK3g2wsz14AaABAg,,i-pHOBt0BAU,False,author_1684,2026-05-27T19:04:17Z,2026-05-27T19:04:17Z,2,Che notizia... Mah,,0,ilmessaggero,author_1684
Ugz2-Fa94-LjRA55N1B4AaABAg,,i-pHOBt0BAU,False,author_5005,2026-05-27T19:38:01Z,2026-05-27T19:38:01Z,16,"Ieri hanno dimesso pure mia zia che cia 89 anni e anche io ho dovuto saltare gli affari miei per andare a prenderla, non so se l'avete letto sui giornali......",,0,ilmessaggero,author_5005
UgyteNQAINJ2X2iuex94AaABAg.AXJWSvQHcU5AXKAR9wYlE8,UgyteNQAINJ2X2iuex94AaABAg,i-pHOBt0BAU,True,author_5005,2026-05-27T19:39:05Z,2026-05-27T19:39:05Z,0,Vorrai dire forse eri bellissima.......il tempo passa e voi donne appassite più rapidamente di noi uomini.....,UgyteNQAINJ2X2iuex94AaABAg,1,ilmessaggero,author_5005
Ugz3fQPnh2TTsa4YiEJ4AaABAg,,i-pHOBt0BAU,False,author_5086,2026-05-27T19:58:43Z,2026-05-27T19:58:43Z,2,Belen fa' uso di sostanze tossiche. Devo curarsi.,,0,ilmessaggero,author_5086
UgyqBAZa8sjlqyaNArZ4AaABAg,,i-pHOBt0BAU,False,author_5087,2026-05-27T20:04:34Z,2026-05-27T20:04:34Z,1,Belen le auguro di guarire e di avere una buona vita,,0,ilmessaggero,author_5087
UgwUnXjtJ2s1AvyOmvh4AaABAg,,i-pHOBt0BAU,False,author_5088,2026-05-27T20:26:55Z,2026-05-27T20:26:55Z,4,ogni occasione è buona x far pubblicità gratuita,,0,ilmessaggero,author_5088
Ugz2-Fa94-LjRA55N1B4AaABAg.AXKAJKidmoqAXKG7We1pDg,Ugz2-Fa94-LjRA55N1B4AaABAg,i-pHOBt0BAU,True,author_5089,2026-05-27T20:28:50Z,2026-05-27T20:28:50Z,2,😂😂,Ugz2-Fa94-LjRA55N1B4AaABAg,1,ilmessaggero,author_5089
Ugz8ELStmh_DDLwmomF4AaABAg.AXJcetJVq-iAXKIgrKDH5W,Ugz8ELStmh_DDLwmomF4AaABAg,i-pHOBt0BAU,True,author_5005,2026-05-27T20:51:16Z,2026-05-27T20:51:16Z,0,ma io mica vado a raccontà li cazzi mei a tutto er mondo....,Ugz8ELStmh_DDLwmomF4AaABAg,1,ilmessaggero,author_5005
Ugz2-Fa94-LjRA55N1B4AaABAg.AXKAJKidmoqAXKK-zKk-AW,Ugz2-Fa94-LjRA55N1B4AaABAg,i-pHOBt0BAU,True,author_2243,2026-05-27T21:02:46Z,2026-05-27T21:03:41Z,1,"Con tutto il rispetto "" tu non sei una vip""... bando alle ciance se la gente smettesse di voler sapere o vivere la vita altrui ...i giornali parlerebbe d altro! In Italia il gossip sfama vip e le persone hanno di cui parlare aimé! Un abbraccio alla zia ❤",Ugz2-Fa94-LjRA55N1B4AaABAg,1,ilmessaggero,author_2243
UgwTbquDbYvops8mekl4AaABAg.AXJqYuLxs-sAXKKLvDIDX5,UgwTbquDbYvops8mekl4AaABAg.AXJqYuLxs-sAXJvueB03Gm,i-pHOBt0BAU,True,author_2243,2026-05-27T21:05:45Z,2026-05-27T21:05:45Z,0,"@author_5082 la depressione ha spesso un motivo più scatenante di un tradimento, se poi si prendono certe medicine a volte l anima si paca ma non si cura",UgwTbquDbYvops8mekl4AaABAg.AXJqYuLxs-sAXJvueB03Gm,2,ilmessaggero,author_2243
Ugya23cHcEc69naFdgJ4AaABAg.AXJpjchgYIuAXKKaUCtdmD,Ugya23cHcEc69naFdgJ4AaABAg,i-pHOBt0BAU,True,author_2243,2026-05-27T21:07:53Z,2026-05-27T21:07:53Z,1,"Tutto può essere, ma meglio non credere che si giochi sulla salute é la cosa più preziosa che abbiamo. Per attirare l attenzione basterebbe far intravedere il tatoo farfalla a lei!",Ugya23cHcEc69naFdgJ4AaABAg,1,ilmessaggero,author_2243
UgwUnXjtJ2s1AvyOmvh4AaABAg.AXKFuPfFD42AXKPA8-b03u,UgwUnXjtJ2s1AvyOmvh4AaABAg,i-pHOBt0BAU,True,author_5090,2026-05-27T21:47:50Z,2026-05-27T21:47:50Z,0,"E quale sarebbe questa""pubblicita'progresso""di cui parli? Sulle proprie disgrazie?? Non credo ne abbiano entrambi bisogno!! ..Ma vai va'stordito",UgwUnXjtJ2s1AvyOmvh4AaABAg,1,ilmessaggero,author_5090
UgyyXqAi2j3tjDU3-B94AaABAg.AXJoPZzTjbrAXKPd9kYSQe,UgyyXqAi2j3tjDU3-B94AaABAg,i-pHOBt0BAU,True,author_5090,2026-05-27T21:51:56Z,2026-05-27T21:51:56Z,0,"Non stava morendo,piccola sciacalla che scrivi ste cagate!! Ma ai mediocri invidiosi come te piace sapere che chi ha successo ed e'migliore di noi ""comuni mortali""sta male e soffre,vero???👎👎👎",UgyyXqAi2j3tjDU3-B94AaABAg,1,ilmessaggero,author_5090
Ugya23cHcEc69naFdgJ4AaABAg.AXJpjchgYIuAXKPvOK8fFK,Ugya23cHcEc69naFdgJ4AaABAg,i-pHOBt0BAU,True,author_5090,2026-05-27T21:54:25Z,2026-05-27T21:54:25Z,0,@user invece 6 tanto buona e cara vero??,Ugya23cHcEc69naFdgJ4AaABAg.AXJpjchgYIuAXK451x42IC,3,ilmessaggero,author_5090
UgzPpheXBIe39JEH_Yt4AaABAg.AXJpjYFCxxvAXKQ4l-6BD7,UgzPpheXBIe39JEH_Yt4AaABAg,i-pHOBt0BAU,True,author_5090,2026-05-27T21:55:50Z,2026-05-27T21:55:50Z,0,"Questa cessa come la chiami tu,e'una delle donne piu belle della televisione.Ripigliati.",UgzPpheXBIe39JEH_Yt4AaABAg,1,ilmessaggero,author_5090
Ugy_Wq0qY0uqFZ68ezB4AaABAg.AXJdpBgdgg6AXKQHTeMTTf,Ugy_Wq0qY0uqFZ68ezB4AaABAg,i-pHOBt0BAU,True,author_5090,2026-05-27T21:57:34Z,2026-05-27T21:57:34Z,0,..mi sa che ragioni cosi perche una come te infatti attrae solo uomini stupidi...,Ugy_Wq0qY0uqFZ68ezB4AaABAg,1,ilmessaggero,author_5090
UgyteNQAINJ2X2iuex94AaABAg.AXJWSvQHcU5AXKQPcK7Pg4,UgyteNQAINJ2X2iuex94AaABAg,i-pHOBt0BAU,True,author_5090,2026-05-27T21:58:41Z,2026-05-27T21:58:41Z,0,@author_5005...pero'trombiamo lo stesso alla faccia tua😂😂😂,UgyteNQAINJ2X2iuex94AaABAg.AXJWSvQHcU5AXKAR9wYlE8,2,ilmessaggero,author_5090
Ugz2-Fa94-LjRA55N1B4AaABAg.AXKAJKidmoqAXKRaW4BKJz,Ugz2-Fa94-LjRA55N1B4AaABAg,i-pHOBt0BAU,True,author_5005,2026-05-27T22:09:03Z,2026-05-27T22:09:03Z,0,"@author_2243 A me personalmente della vita altrui non me ne frega nulla, ho smesso di guardare la TV, i giornali non li leggo, unica cosa mi guardo qualche video porno su internet, tutto li....",Ugz2-Fa94-LjRA55N1B4AaABAg.AXKAJKidmoqAXKK-zKk-AW,2,ilmessaggero,author_5005
UgzpkNxDB69ygrvuJUN4AaABAg.AXJEwkOlQaSAXJPf3Rr5LK,UgzpkNxDB69ygrvuJUN4AaABAg.AXJEwkOlQaSAXJKM4-S9SK,i-pHOBt0BAU,True,author_2334,2026-05-28T00:00:00+00:00,,1,"@author_5066 perché, cosa ha fatto di ""così grande""??",UgzpkNxDB69ygrvuJUN4AaABAg.AXJEwkOlQaSAXJKM4-S9SK,2,ilmessaggero,author_2334
Ugzcw3SAbC2z0WE35i14AaABAg,,i-pHOBt0BAU,False,author_5091,2026-05-28T03:36:18Z,2026-05-28T03:36:18Z,0,Noi comuni mortali non ci ricoverano manco se abbiamo una trave conficcata in testa. Sta vacca ricoverata solo per fare notizia,,0,ilmessaggero,author_5091
UgxPpFJEYgkpQkSIy114AaABAg,,i-pHOBt0BAU,False,author_5092,2026-05-28T04:12:02Z,2026-05-28T04:12:02Z,2,Lo proporremo come prossimo beato....santo non ancora aspettiamo il prossimo miracolo!,,0,ilmessaggero,author_5092
UgwTbquDbYvops8mekl4AaABAg.AXJqYuLxs-sAXLApvfknII,UgwTbquDbYvops8mekl4AaABAg,i-pHOBt0BAU,True,author_5093,2026-05-28T05:01:51Z,2026-05-28T05:01:51Z,0,😂,UgwTbquDbYvops8mekl4AaABAg,1,ilmessaggero,author_5093
UgyteNQAINJ2X2iuex94AaABAg.AXJWSvQHcU5AXLC_bJs3dM,UgyteNQAINJ2X2iuex94AaABAg,i-pHOBt0BAU,True,author_5094,2026-05-28T05:17:06Z,2026-05-28T05:17:06Z,0,Evviva l ecstasy e gli anni 90 ❤ sta coca sta rovinando tutto e tutti,UgyteNQAINJ2X2iuex94AaABAg,1,ilmessaggero,author_5094
Ugx08ybM3TYd9KP2kA54AaABAg,,i-pHOBt0BAU,False,author_5095,2026-05-28T06:21:18Z,2026-05-28T06:21:18Z,0,Mo,,0,ilmessaggero,author_5095
Ugz2-Fa94-LjRA55N1B4AaABAg.AXKAJKidmoqAXLT52LB_TU,Ugz2-Fa94-LjRA55N1B4AaABAg,i-pHOBt0BAU,True,author_247,2026-05-28T07:41:20Z,2026-05-28T07:41:20Z,0,"No no , su Sky Tg non l ho visto 😂😂😂😂😂😂😂",Ugz2-Fa94-LjRA55N1B4AaABAg,1,ilmessaggero,author_247
UgzpUSxMWnR3uY0Pkqt4AaABAg.AXJO1kFXIzeAXLowJ5zJFg,UgzpUSxMWnR3uY0Pkqt4AaABAg,i-pHOBt0BAU,True,author_5096,2026-05-28T11:00:59Z,2026-05-28T11:00:59Z,0,Frega a chi non ha niente da fare nelle vita....,UgzpUSxMWnR3uY0Pkqt4AaABAg,1,ilmessaggero,author_5096
UgzCqLoTfvN9M3kv6ot4AaABAg,,i-pHOBt0BAU,False,author_2524,2026-05-28T11:45:13Z,2026-05-28T11:45:13Z,2,"Ogni tanto bisognerebbe scendere e vivere come le persone normali...ricordo Claudia Koll,fu travolta dalla popolarità improvvisa andò in crisi e decise di cambiare vita",,0,ilmessaggero,author_2524
Ugz2-Fa94-LjRA55N1B4AaABAg.AXKAJKidmoqAXLwTfmuxZP,Ugz2-Fa94-LjRA55N1B4AaABAg,i-pHOBt0BAU,True,author_5097,2026-05-28T12:06:50Z,2026-05-28T12:06:50Z,1,Evviva le buone azioni 💗💗👏👏👏 un abbraccio grande a te e zia 💗,Ugz2-Fa94-LjRA55N1B4AaABAg,1,ilmessaggero,author_5097
UgyteNQAINJ2X2iuex94AaABAg.AXJWSvQHcU5AXLyktynp4e,UgyteNQAINJ2X2iuex94AaABAg.AXJWSvQHcU5AXLC_bJs3dM,i-pHOBt0BAU,True,author_5090,2026-05-28T12:26:48Z,2026-05-28T12:26:48Z,0,"@user parla per te,visto che te la fumi anche con la bottiglia e l'ammoniaca 😂😂😂",UgyteNQAINJ2X2iuex94AaABAg.AXJWSvQHcU5AXLC_bJs3dM,2,ilmessaggero,author_5090
UgyteNQAINJ2X2iuex94AaABAg.AXJWSvQHcU5AXLz96XrKxD,UgyteNQAINJ2X2iuex94AaABAg.AXJWSvQHcU5AXLyktynp4e,i-pHOBt0BAU,True,author_5094,2026-05-28T12:30:15Z,2026-05-28T12:30:15Z,0,@user fumato in vita mia,UgyteNQAINJ2X2iuex94AaABAg.AXJWSvQHcU5AXLyktynp4e,3,ilmessaggero,author_5094
UgyteNQAINJ2X2iuex94AaABAg.AXJWSvQHcU5AXLz_JiyJSP,UgyteNQAINJ2X2iuex94AaABAg.AXJWSvQHcU5AXLyktynp4e,i-pHOBt0BAU,True,author_5090,2026-05-28T13:00:00+00:00,,0,@author_5094 E pero le minchiate le spari come Morgan Milani il cantante😂😂😂.. quello si che ci e'andato sotto...,UgyteNQAINJ2X2iuex94AaABAg.AXJWSvQHcU5AXLz96XrKxD,4,ilmessaggero,author_5090
UgyteNQAINJ2X2iuex94AaABAg.AXJWSvQHcU5AXM-13IjAUg,UgyteNQAINJ2X2iuex94AaABAg.AXJWSvQHcU5AXLyktynp4e,i-pHOBt0BAU,True,author_5094,2026-05-28T13:00:00+00:00,,0,@user che minchiata avrei sparato?,UgyteNQAINJ2X2iuex94AaABAg.AXJWSvQHcU5AXLyktynp4e,3,ilmessaggero,author_5094
Ugz2-Fa94-LjRA55N1B4AaABAg.AXKAJKidmoqAXM3jcSVjvv,Ugz2-Fa94-LjRA55N1B4AaABAg.AXKAJKidmoqAXLwTfmuxZP,i-pHOBt0BAU,True,author_5005,2026-05-28T14:00:00+00:00,,0,@author_5097 Grazie,Ugz2-Fa94-LjRA55N1B4AaABAg.AXKAJKidmoqAXLwTfmuxZP,2,ilmessaggero,author_5005
UgztEek1x_e484Sx95l4AaABAg,,i-pHOBt0BAU,False,author_5098,2026-05-28T14:38:46Z,2026-05-28T14:39:06Z,0,COMUNQUE FACCIAMOLE GLI AUGURI INVECE DI CRITICARLA. .BELEN RIMETTITI SUBITO.❤❤❤❤❤❤❤❤❤,,0,ilmessaggero,author_5098
