comment_id,parent_comment_id,video_id,is_reply,author,published_at,updated_at,like_count,text,inferred_parent_id,depth,newspaper,author_anon
UgzIguhWlAynQtBiEAt4AaABAg.AX3jlVDyk6_AX5uYdLo2uB,UgzIguhWlAynQtBiEAt4AaABAg,VXp6qw86mSo,True,author_6085,2026-05-22T06:42:12Z,2026-05-22T06:42:12Z,0,@user rimasto all anziano del secolo scorso 😂,UgzIguhWlAynQtBiEAt4AaABAg.AX3jlVDyk6_AX5nQb_SYuX,2,ilmessaggero,author_6085
UgzIguhWlAynQtBiEAt4AaABAg.AX3jlVDyk6_AX5uao6M_Rk,UgzIguhWlAynQtBiEAt4AaABAg,VXp6qw86mSo,True,author_6085,2026-05-22T06:42:37Z,2026-05-22T06:42:37Z,0,Tu potresti tacere,UgzIguhWlAynQtBiEAt4AaABAg,1,ilmessaggero,author_6085
Ugz1QPYFFXqVObUMEW14AaABAg,,VXp6qw86mSo,False,author_6525,2026-05-22T06:42:42Z,2026-05-22T06:42:42Z,0,"Si leggono i soliti commenti di me..da ,🤮🤮🤮qui il tifo da calcio non c entra niente ...i voti ...il colore politico...se non ci arrivate con il cervello e' un problema vostro 🤔🤔🤔",,0,ilmessaggero,author_6525
Ugykx1T_mJvRwknxF1F4AaABAg.AX3kgAWR0RPAX5ueBtRO2A,Ugykx1T_mJvRwknxF1F4AaABAg.AX3kgAWR0RPAX5uDzTTETE,VXp6qw86mSo,True,author_6517,2026-05-22T06:43:05Z,2026-05-22T06:43:05Z,1,@user quanti ONOREVOLI ciao PUBLICITATE anche un mato a capito,Ugykx1T_mJvRwknxF1F4AaABAg.AX3kgAWR0RPAX5uDzTTETE,3,ilmessaggero,author_6517
UgxIsxYley4FLvxKk9l4AaABAg.AX3in1KEqgoAX5ugc2WRvz,UgxIsxYley4FLvxKk9l4AaABAg,VXp6qw86mSo,True,author_6525,2026-05-22T06:43:25Z,2026-05-22T06:43:25Z,0,Difendete sempre l indifendibile🤮🤮🤮🤮🤮🤮,UgxIsxYley4FLvxKk9l4AaABAg,1,ilmessaggero,author_6525
UgxBOEmMrfwNZg9t9Q94AaABAg.AX3ii_TPiksAX5ulyuqZH2,UgxBOEmMrfwNZg9t9Q94AaABAg,VXp6qw86mSo,True,author_6085,2026-05-22T06:44:09Z,2026-05-22T06:44:09Z,0,Genocidio in corso difesa ad oltranza siete della partita,UgxBOEmMrfwNZg9t9Q94AaABAg,1,ilmessaggero,author_6085
UgzxP-Krh5pEUR7Xp394AaABAg,,VXp6qw86mSo,False,author_6526,2026-05-22T07:12:59Z,2026-05-22T07:12:59Z,3,bevi meno fa' 😂,,0,ilmessaggero,author_6526
Ugyh79AwbfPfrKzpPYN4AaABAg,,VXp6qw86mSo,False,author_5951,2026-05-22T07:13:15Z,2026-05-22T07:13:15Z,3,Comunque a onore del vero uno che prende un pugno in maniera violenta in un occhio impiega almeno quindici giorni e anche più perché ne spariscano le ecchimosi...mha..,,0,ilmessaggero,author_5951
UgxAiRHtrY9LqT-QfbF4AaABAg,,VXp6qw86mSo,False,author_6527,2026-05-22T07:16:19Z,2026-05-22T07:16:19Z,2,Non ci credo... sei falso più di una banconota d’argento,,0,ilmessaggero,author_6527
UgzvhY4RXhKYwqzvROZ4AaABAg,,VXp6qw86mSo,False,author_3434,2026-05-22T07:16:29Z,2026-05-22T07:16:29Z,0,TROPPE POCHE PROVE...non bastano...lincontro di BOX troppo semplice.. FACCI VEDERE 4 DENTI A TERRA...di SOLITO NEI BAR UNO PERDE UN DENTE...,,0,ilmessaggero,author_3434
Ugx9GMJVZDyGMXRm7ih4AaABAg,,VXp6qw86mSo,False,author_6527,2026-05-22T07:19:11Z,2026-05-22T07:19:11Z,2,"Spettabile Giorgia Meloni, non deve perdere né tempo né la dignità per queste persone irresponsabili e irrispettose. Mi ascolti, per favore. Grazie",,0,ilmessaggero,author_6527
UgwxJ86zN6rEothN0PF4AaABAg,,VXp6qw86mSo,False,author_668,2026-05-22T08:00:35Z,2026-05-22T08:00:35Z,0,Buttate le chiavi a chi fa certi orrori,,0,ilmessaggero,author_668
UgzZbASj0nROE14Z4tx4AaABAg,,VXp6qw86mSo,False,author_6528,2026-05-22T08:08:03Z,2026-05-22T08:08:03Z,3,"Ti devono mettere in galera perché un parlamentare non può fare quello che vuole. Davi le dimissioni e poi potevi andare con la flottiglia. Ti hanno trattato troppo bene, in qualche altro paese del mondo saresti ancora lì.",,0,ilmessaggero,author_6528
UgwLy9WA4Bwr2AK5rsp4AaABAg,,VXp6qw86mSo,False,author_6498,2026-05-22T10:58:31Z,2026-05-22T10:58:31Z,0,a voi delle 5 stelle e flotilia o un grande grece di pecore anche tutta la sinistra se vuole venire a fare i pastori pecore e zecche non ho cani voi fate anche cuel ruolo viva I pastori,,0,ilmessaggero,author_6498
Ugz4UeduDbzQcJtLiCZ4AaABAg,,VXp6qw86mSo,False,author_1673,2026-05-22T14:34:25Z,2026-05-22T14:34:25Z,2,Tornatene presto,,0,ilmessaggero,author_1673
Ugwz0fvycYqhHuxdV7B4AaABAg,,VXp6qw86mSo,False,author_1745,2026-05-22T15:19:44Z,2026-05-22T15:19:44Z,1,Invece di piangere prima di correre da mammina potevi benissimo startene a casa senza andare in giro a rompere i coglioni per metterti in mostra !!!!!,,0,ilmessaggero,author_1745
UgzTAittGKhe169-G9V4AaABAg,,VXp6qw86mSo,False,author_4415,2026-05-22T15:36:48Z,2026-05-22T15:36:48Z,0,"La personificazione del maiale tale faccia tale panza . Se l avessero fatto a pezzetti avrebbe sfamato mezza Palestina , almeno sarebbe stato utile ! 😆",,0,ilmessaggero,author_4415
UgyJC3rYSJLOiu4bwj54AaABAg,,VXp6qw86mSo,False,author_6529,2026-05-22T15:43:53Z,2026-05-22T15:43:53Z,0,Pagliaccio demmerda,,0,ilmessaggero,author_6529
UgwoFGjiSdJh486KMul4AaABAg,,VXp6qw86mSo,False,author_3803,2026-05-22T16:56:32Z,2026-05-22T16:56:32Z,0,Dicci tutta la verità: ti hanno sodomizzato?,,0,ilmessaggero,author_3803
UgyEJBjT46VQRSIeJLJ4AaABAg,,VXp6qw86mSo,False,author_6530,2026-05-22T17:12:00Z,2026-05-22T17:12:00Z,1,"Mantenuto lo sa che un ebraico non può avere contatti intimi 5 giorni durante, 10 prima e 10 dopo? Che si sciacqui la bocca bugiarda.",,0,ilmessaggero,author_6530
Ugy3naUk1tyOGu0kskF4AaABAg,,VXp6qw86mSo,False,author_6531,2026-05-22T17:18:18Z,2026-05-22T17:18:18Z,0,Avete perso il referendum. Andate a casa con la coda tra le gambe invece di dire sciocchezze,,0,ilmessaggero,author_6531
UgxTp_nBAPwQlGK9let4AaABAg,,VXp6qw86mSo,False,author_6532,2026-05-22T17:51:21Z,2026-05-22T17:51:21Z,1,"Se uno scolaro, marina la scuola, hli danno la nota. Carotenuto ha marinato il Parlamento, come la mettiamo? A meno che gosse in missione per il partito dei 5stelline.",,0,ilmessaggero,author_6532
UgxD6d-tf1cwpQAUJ0F4AaABAg,,VXp6qw86mSo,False,author_5962,2026-05-22T18:15:51Z,2026-05-22T18:15:51Z,0,😂😂😂😂😂😂😂😂 ma smettila di bere che fate schifo,,0,ilmessaggero,author_5962
UgyZSu4G-VXrTvRDe1N4AaABAg,,VXp6qw86mSo,False,author_2551,2026-05-22T18:21:48Z,2026-05-22T18:21:48Z,0,"Violenza sessuale??? Cioè hanno inculato questo qui? E fateci raccontare se i maschi israeliani sono superdotati, se glielo hanno infilato sputando o con la vasellina....oppure a secco? E poi, quante volte siete venuti?😂😂😂😂😂",,0,ilmessaggero,author_2551
Ugx7fkfxsHXodHhwW854AaABAg,,VXp6qw86mSo,False,author_6533,2026-05-22T19:27:21Z,2026-05-22T19:27:21Z,0,Non se ne puo piu'😮,,0,ilmessaggero,author_6533
UgwgHGDc07a17rRwm654AaABAg.AX5q-ZLYzjUAX7SpbItqRO,UgwgHGDc07a17rRwm654AaABAg,VXp6qw86mSo,True,author_6517,2026-05-22T21:09:43Z,2026-05-22T21:09:43Z,0,Laverita,UgwgHGDc07a17rRwm654AaABAg,1,ilmessaggero,author_6517
UgzARu2p3zrL2H3w9ul4AaABAg.AX3mUTiYRfLAX7Sub1atkj,UgzARu2p3zrL2H3w9ul4AaABAg,VXp6qw86mSo,True,author_6517,2026-05-22T21:10:24Z,2026-05-22T21:10:24Z,0,Eroi da BUGIARDI,UgzARu2p3zrL2H3w9ul4AaABAg,1,ilmessaggero,author_6517
UgzZbASj0nROE14Z4tx4AaABAg.AX63NWgewGrAX7T2eP5BtU,UgzZbASj0nROE14Z4tx4AaABAg,VXp6qw86mSo,True,author_6517,2026-05-22T21:11:38Z,2026-05-22T21:11:38Z,0,Israele debole perché no gambe in culo BASTONATE,UgzZbASj0nROE14Z4tx4AaABAg,1,ilmessaggero,author_6517
Ugzp4Z2WvF9wOCUgP1h4AaABAg,,VXp6qw86mSo,False,author_277,2026-05-22T22:05:21Z,2026-05-22T22:05:21Z,0,"Sbaglierò , ma con questi viaggi mettete a repentaglio le vostre vite non concludendo nulla e tenendo in ansia i vostri cari e gravare situazioni politiche non facili. C’è una guerra e voi vi recate in un campo di battaglia a mani nude sperando di essere ascoltati da chi non ha orecchie. ❤",,0,ilmessaggero,author_277
UgwGaPw9nGI3GvD1klx4AaABAg,,VXp6qw86mSo,False,author_6534,2026-05-22T22:57:10Z,2026-05-22T22:57:10Z,3,Buongiorno statevi alle case vostre Senza fare gli eroi medaglie non le danno,,0,ilmessaggero,author_6534
Ugx53ZT50i7bvAMPCxV4AaABAg.AX3fIwZ8-_WAX6ptLjChUZ,Ugx53ZT50i7bvAMPCxV4AaABAg,VXp6qw86mSo,True,author_1745,2026-05-23T00:00:00+00:00,,0,Daccordissimo!!!!!!!!!!,Ugx53ZT50i7bvAMPCxV4AaABAg,1,ilmessaggero,author_1745
UgwsG5uQIqBwluYbaxR4AaABAg.AX3fJ1C7VJHAX4jVmvh0uB,UgwsG5uQIqBwluYbaxR4AaABAg,VXp6qw86mSo,True,author_6517,2026-05-23T00:00:00+00:00,,0,LAVERITA,UgwsG5uQIqBwluYbaxR4AaABAg,1,ilmessaggero,author_6517
UgyqFL9fxMtFNBOsR754AaABAg.AX3jk_D4ETIAX6TXdZVV_A,UgyqFL9fxMtFNBOsR754AaABAg.AX3jk_D4ETIAX6RQ3WZd0Y,VXp6qw86mSo,True,author_6085,2026-05-23T00:00:00+00:00,,0,@author_2382 dispiacere per quel che si è visto o per quello che si fa?,UgyqFL9fxMtFNBOsR754AaABAg.AX3jk_D4ETIAX6RQ3WZd0Y,2,ilmessaggero,author_6085
UgxLtMo7Ie7kplF6zLx4AaABAg.AX3fi497qA8AX5v8Oj3MBC,UgxLtMo7Ie7kplF6zLx4AaABAg.AX3fi497qA8AX3hxEw3OZX,VXp6qw86mSo,True,author_6525,2026-05-23T00:00:00+00:00,,0,@author_6467 quello che da 3 anni continua a confermare quella e anche a usarlo tutti gli amici degli amici e I parenti dei parenti ...pero' la colpa poi è degli altri ...che tristezza ...che schifo 🤮🤮🤮🤮🤮,UgxLtMo7Ie7kplF6zLx4AaABAg.AX3fi497qA8AX3hxEw3OZX,2,ilmessaggero,author_6525
UgyqFL9fxMtFNBOsR754AaABAg.AX3jk_D4ETIAX6RQ3WZd0Y,UgyqFL9fxMtFNBOsR754AaABAg,VXp6qw86mSo,True,author_2382,2026-05-23T00:00:00+00:00,,0,"Show mediatico riuscitissimo ,neanche nella piu ottimistica previsione credo che potessero pensare di ottenere tutto questo, ma tutto questo non sarebbe mai successo senza l'aiuto dei nostri amici , chi se lo sarebbe aspettato che avrebbero assecondato cosi la flottilia , che la marina ebrea , con i mefisto a cel are i volti che questa flottilia qua si sa si vendica senza pietà!! Quindi prese le dovute accortezze con un blitz studiato nei minimi particolari ,che relega sun tzu a un badoglio qualsiasi ! Israele decide di attaccare le barche in acque internazionali , sparare a gente disarmata è a mani alzate,dopo avergli proibito di entrare in acque israeliane decidono bene di arrestarli illegalmente è rapirli x portarli dove volevano arrivare , intanto che sono in custodia fanno volare qualche scarpata è qualche ceffone educativo ,x poi stendere il red carpet a un ciccione dalla non particolarmente sveglia che gira con una bandiera della lazio , voci incontrollate dicono che sia un pezzo grosso del governo israeliano in effetti grosso è grosso ! Ma a sorpresa sembra che i terroristi della flottilia abbiano trovato una falla nella sicurezza è introdotto una telecamera ....ci arriva una retifica si sono filmati loro🤷♂️ che dire chapeau , vi siete fatti piu danni voi in un giorno che abu nidal in una vita",UgyqFL9fxMtFNBOsR754AaABAg,1,ilmessaggero,author_2382
UgxDndZUN2W6OC1f76h4AaABAg.AX3mgziwblUAX5u9LuAN8P,UgxDndZUN2W6OC1f76h4AaABAg.AX3mgziwblUAX49bc6fGWI,VXp6qw86mSo,True,author_2382,2026-05-23T00:00:00+00:00,,1,"Sul assenteismo stenderei un velo pietoso bipartisan ma fino a un certo punto !!! Il gas è il petrolio russo non avrei propio smesso di comprarlo, sul pugno in faccia leggero credevo fosse abbastanza ovvio fosse una battuta , di pugni in faccia non ne ha mai presi ma non dico in israele dico propio in generale",UgxDndZUN2W6OC1f76h4AaABAg.AX3mgziwblUAX49bc6fGWI,3,ilmessaggero,author_2382
UgzDwKUsEKLgL2a7eup4AaABAg,,VXp6qw86mSo,False,author_4010,2026-05-23T09:31:32Z,2026-05-23T09:31:32Z,0,Qualcuno si è accorto che nei paesi normali non funziona come in Itaglia dove i clandestini afroislamici spadroneggiano impuniti. Prendere esempio da chi sa difendere il proprio paese e i comunisti li tratta come meritano,,0,ilmessaggero,author_4010
UgyzT6MBfIluct7wSwB4AaABAg,,VXp6qw86mSo,False,author_6535,2026-05-23T10:42:15Z,2026-05-23T10:42:15Z,0,Potevi stare a casa e non rompere i maroni,,0,ilmessaggero,author_6535
UgwB57YjkHzs3TPM8Gh4AaABAg,,VXp6qw86mSo,False,author_6535,2026-05-23T10:43:44Z,2026-05-23T10:43:44Z,0,Visto che alla fine paghiamo noi chiedete agli svizzeri quanto hanno pagato x farsi salvare,,0,ilmessaggero,author_6535
UgypIqCMkArTyicvdjV4AaABAg,,VXp6qw86mSo,False,author_4361,2026-05-23T14:23:46Z,2026-05-23T14:23:46Z,0,Chi è causa del suo male pianga se stesso buffoni,,0,ilmessaggero,author_4361
Ugw1iUbGb_fsaBmW4sh4AaABAg,,VXp6qw86mSo,False,author_3426,2026-05-23T19:31:52Z,2026-05-23T19:31:52Z,0,Ecco perché voto destra Perché chi rappresenta la sinistra viene messo a pecora Parole di Carotenuto fino a prova contraria,,0,ilmessaggero,author_3426
Ugwi9pQcQ8Cdm1mm04F4AaABAg,,VXp6qw86mSo,False,author_6536,2026-05-23T19:50:55Z,2026-05-23T19:50:55Z,0,Vai a menarlo ai coccodrilli,,0,ilmessaggero,author_6536
UgxyuWTThsTSmluFAr94AaABAg,,VXp6qw86mSo,False,author_6537,2026-05-23T19:57:41Z,2026-05-23T19:57:41Z,0,Ma chi glielo ha ordinato di andare... forse il.medico gli ha detto un po di iodio ti fa passare la tosse....,,0,ilmessaggero,author_6537
Ugw3LjNE3zAoN-c3csZ4AaABAg,,VXp6qw86mSo,False,author_6538,2026-05-23T20:37:34Z,2026-05-23T20:37:34Z,0,Leggete il manuale di Sanremo,,0,ilmessaggero,author_6538
UgzQZsiJwtVopLHIZrl4AaABAg,,VXp6qw86mSo,False,author_6539,2026-05-23T21:48:43Z,2026-05-23T21:48:43Z,0,"Prima di parlare di cose più grandi di voi, imparate l'italiano, perché questa sezione commenti è degna di una quinta elementare.",,0,ilmessaggero,author_6539
Ugykx1T_mJvRwknxF1F4AaABAg.AX3kgAWR0RPAX7OIL_OfgC,Ugykx1T_mJvRwknxF1F4AaABAg,VXp6qw86mSo,True,author_6085,2026-05-24T00:00:00+00:00,,0,Vero. Caritenuto mente e chi commette Genocidio È SINCERO DIMOSTRA LA PROPRIA ATTITUDINE SINCERAMENTE.,Ugykx1T_mJvRwknxF1F4AaABAg,1,ilmessaggero,author_6085
Ugykx1T_mJvRwknxF1F4AaABAg.AX3kgAWR0RPAX7COgQPMU3,Ugykx1T_mJvRwknxF1F4AaABAg,VXp6qw86mSo,True,author_5005,2026-05-24T00:00:00+00:00,,0,Chi sarìa stu onorevole? L'hai mai sentüne parlé,Ugykx1T_mJvRwknxF1F4AaABAg,1,ilmessaggero,author_5005
Ugykx1T_mJvRwknxF1F4AaABAg.AX3kgAWR0RPAX7DfiLMEqK,Ugykx1T_mJvRwknxF1F4AaABAg.AX3kgAWR0RPAX7COgQPMU3,VXp6qw86mSo,True,author_6517,2026-05-24T00:00:00+00:00,,0,@author_5005 NESSUNO,Ugykx1T_mJvRwknxF1F4AaABAg.AX3kgAWR0RPAX7COgQPMU3,2,ilmessaggero,author_6517
Ugykx1T_mJvRwknxF1F4AaABAg.AX3kgAWR0RPAX76B1x-2iV,Ugykx1T_mJvRwknxF1F4AaABAg.AX3kgAWR0RPAX5uDzTTETE,VXp6qw86mSo,True,author_6525,2026-05-24T00:00:00+00:00,,1,Difendete l indifendibile ...povera Italia,Ugykx1T_mJvRwknxF1F4AaABAg.AX3kgAWR0RPAX5uDzTTETE,3,ilmessaggero,author_6525
Ugykx1T_mJvRwknxF1F4AaABAg.AX3kgAWR0RPAX7HUON1AyC,Ugykx1T_mJvRwknxF1F4AaABAg.AX3kgAWR0RPAX7DfiLMEqK,VXp6qw86mSo,True,author_5005,2026-05-24T00:00:00+00:00,,0,@author_6517 Unurévul dle mie bale,Ugykx1T_mJvRwknxF1F4AaABAg.AX3kgAWR0RPAX7DfiLMEqK,3,ilmessaggero,author_5005
Ugykx1T_mJvRwknxF1F4AaABAg.AX3kgAWR0RPAX75Uop0XeM,Ugykx1T_mJvRwknxF1F4AaABAg,VXp6qw86mSo,True,author_6532,2026-05-24T00:00:00+00:00,,1,È la sensazione di.moltissimi.,Ugykx1T_mJvRwknxF1F4AaABAg,1,ilmessaggero,author_6532
Ugy0ASWQvOVmBqZzlFp4AaABAg.AX3fQv2M3eOAXBQxUv1ZNm,Ugy0ASWQvOVmBqZzlFp4AaABAg,VXp6qw86mSo,True,author_6085,2026-05-24T10:10:17Z,2026-05-24T10:10:17Z,0,Si é vero perché ci sono più diavoli,Ugy0ASWQvOVmBqZzlFp4AaABAg,1,ilmessaggero,author_6085
Ugx3hK_LHl3_bA8jqNh4AaABAg,,VXp6qw86mSo,False,author_6540,2026-05-24T10:11:26Z,2026-05-24T10:11:26Z,0,Dovevi stare a casa c. ....,,0,ilmessaggero,author_6540
UgydbWg-lV5aXEFg3wh4AaABAg,,VXp6qw86mSo,False,author_6541,2026-05-24T10:50:51Z,2026-05-24T10:50:51Z,0,"Per caso ti hanno anche inchiappettato, sai che goduria.🤣🤣🤣🤣🤣🤣",,0,ilmessaggero,author_6541
UgyqFL9fxMtFNBOsR754AaABAg.AX3jk_D4ETIAXA4zw8mEAn,UgyqFL9fxMtFNBOsR754AaABAg,VXp6qw86mSo,True,author_6539,2026-05-25T00:00:00+00:00,,1,"Ma davvero, in una democrazia, è accettabile trattare così i detenuti? 'Se la sono cercata' non è una giustificazione: con la stessa logica, potremmo dire che i volontari italiani che vanno in Ucraina ad aiutare la gente 'se la sono cercata' se vengono maltrattati. Classico commento da senza palle il tuo, di chi nella vita non ha spina dorsale",UgyqFL9fxMtFNBOsR754AaABAg,1,ilmessaggero,author_6539
UgyqFL9fxMtFNBOsR754AaABAg.AX3jk_D4ETIAXAJ1KSLUnA,UgyqFL9fxMtFNBOsR754AaABAg.AX3jk_D4ETIAXA4zw8mEAn,VXp6qw86mSo,True,author_6085,2026-05-25T00:00:00+00:00,,1,@author_6539 esattanente c'è troppa gente in giro che dovrebbe passare una notte con gli aguzzini che difendono.,UgyqFL9fxMtFNBOsR754AaABAg.AX3jk_D4ETIAXA4zw8mEAn,2,ilmessaggero,author_6085
UgxIsxYley4FLvxKk9l4AaABAg.AX3in1KEqgoAXA4Hn5Xfq_,UgxIsxYley4FLvxKk9l4AaABAg.AX3in1KEqgoAXA3vlEJBhH,VXp6qw86mSo,True,author_6473,2026-05-25T00:00:00+00:00,,0,@author_6539 già sarei uno dei pochi libero😂,UgxIsxYley4FLvxKk9l4AaABAg.AX3in1KEqgoAXA3vlEJBhH,2,ilmessaggero,author_6473
UgxIsxYley4FLvxKk9l4AaABAg.AX3in1KEqgoAXA5JTuslnE,UgxIsxYley4FLvxKk9l4AaABAg.AX3in1KEqgoAXA4Hn5Xfq_,VXp6qw86mSo,True,author_6539,2026-05-25T00:00:00+00:00,,0,Ma almeno l'italiano lo volete imparare?,UgxIsxYley4FLvxKk9l4AaABAg.AX3in1KEqgoAXA4Hn5Xfq_,3,ilmessaggero,author_6539
UgxIsxYley4FLvxKk9l4AaABAg.AX3in1KEqgoAXA3vlEJBhH,UgxIsxYley4FLvxKk9l4AaABAg,VXp6qw86mSo,True,author_6539,2026-05-25T00:00:00+00:00,,1,Fortunatamente per te l'ignoranza non è illegale,UgxIsxYley4FLvxKk9l4AaABAg,1,ilmessaggero,author_6539
UgyqFL9fxMtFNBOsR754AaABAg.AX3jk_D4ETIAXAfqj5AT6I,UgyqFL9fxMtFNBOsR754AaABAg.AX3jk_D4ETIAX6TXdZVV_A,VXp6qw86mSo,True,author_2382,2026-05-25T00:00:00+00:00,,0,@author_6085 scusami non ho capito,UgyqFL9fxMtFNBOsR754AaABAg.AX3jk_D4ETIAX6TXdZVV_A,3,ilmessaggero,author_2382
UgwwgLAMmM_3vVPO55p4AaABAg.AX3gt73qk_7AXAjdeuJhM8,UgwwgLAMmM_3vVPO55p4AaABAg.AX3gt73qk_7AXA3lsvaC81,VXp6qw86mSo,True,author_880,2026-05-25T00:00:00+00:00,,0,"@author_6539 Non è mancanza di rispetto, ma oggi in Occidente con la travisazione del politicamente corretto si è persa la realtà delle cose. C’è un Alzheimer galoppante di certa parte politica, anche UE.",UgwwgLAMmM_3vVPO55p4AaABAg.AX3gt73qk_7AXA3lsvaC81,2,ilmessaggero,author_880
UgwwgLAMmM_3vVPO55p4AaABAg.AX3gt73qk_7AXA3lsvaC81,UgwwgLAMmM_3vVPO55p4AaABAg,VXp6qw86mSo,True,author_6539,2026-05-25T00:00:00+00:00,,0,Una reale democrazia gestirebbe così la situazione? Hai paragonato un cane ad uno stato comunque,UgwwgLAMmM_3vVPO55p4AaABAg,1,ilmessaggero,author_6539
Ugykx1T_mJvRwknxF1F4AaABAg.AX3kgAWR0RPAXA0ayYsyL5,Ugykx1T_mJvRwknxF1F4AaABAg,VXp6qw86mSo,True,author_4519,2026-05-25T00:00:00+00:00,,0,Fa la attore 😂,Ugykx1T_mJvRwknxF1F4AaABAg,1,ilmessaggero,author_4519
UgyR4qIpKy1agTvY7s94AaABAg,,VXp6qw86mSo,False,author_2538,2026-05-25T05:48:23Z,2026-05-25T05:48:23Z,0,😂😂😂 ti crediamo fratello!😂😂😂,,0,ilmessaggero,author_2538
UgyRshysbex4aKHFUoN4AaABAg,,VXp6qw86mSo,False,author_6542,2026-05-25T18:23:46Z,2026-05-25T18:23:46Z,0,dovevano trattenervi un mesetto cosi vi passava la voglia di andare a propagandare e poi vanno a piangere dal governo che li riporti a casa,,0,ilmessaggero,author_6542
Ugy7S05VQWPQbbYBikx4AaABAg,,VXp6qw86mSo,False,author_3286,2026-05-25T19:47:15Z,2026-05-25T19:47:15Z,0,"Non ci sono parole x giudicarvi,siete proprio dei sinistrati.",,0,ilmessaggero,author_3286
Ugx-Hb1onKrQ0z-axot4AaABAg,,VXp6qw86mSo,False,author_6543,2026-05-25T20:21:05Z,2026-05-25T20:21:05Z,0,Poverino è pieno di lividi.😢,,0,ilmessaggero,author_6543
UgwwgLAMmM_3vVPO55p4AaABAg.AX3gt73qk_7AXC_zdpEffr,UgwwgLAMmM_3vVPO55p4AaABAg.AX3gt73qk_7AXAjdeuJhM8,VXp6qw86mSo,True,author_880,2026-05-26T00:00:00+00:00,,0,@author_6539 La realtà dei fatti è che Israele ha sempre tollerato Hamas e in tutti questi anni non ha mai attaccato Gaza né i territori della Autorità Nazionale Palestinese. Il resto è il suo politicamente corretto.,UgwwgLAMmM_3vVPO55p4AaABAg.AX3gt73qk_7AXAjdeuJhM8,3,ilmessaggero,author_880
UgwwgLAMmM_3vVPO55p4AaABAg.AX3gt73qk_7AXCLwvb60Bu,UgwwgLAMmM_3vVPO55p4AaABAg.AX3gt73qk_7AXAjdeuJhM8,VXp6qw86mSo,True,author_6539,2026-05-26T00:00:00+00:00,,0,"@author_880 Ridurre tutto al ""politicamente corretto"" non è un argomento, è un modo per evitare di affrontare la realtà dei fatti. La questione palestinese è enormemente complessa, ma alcune cose sono abbastanza chiare indipendentemente dalla propria parte politica: attaccare una flottiglia civile che porta aiuti umanitari in una zona dove la gente muore di fame non era accettabile cinquant'anni fa, e non lo è oggi. Non è una questione di sensibilità ideologica — è una questione di diritto internazionale e di umanità di base. Queste sono persone che stavano cercando di portare cibo e medicine, non combattenti. Chiamare tutto questo ""politicamente corretto"" mi sembra più un Alzheimer della realtà che il contrario.",UgwwgLAMmM_3vVPO55p4AaABAg.AX3gt73qk_7AXAjdeuJhM8,3,ilmessaggero,author_6539
Ugzl60OT-ER8GSNVu_V4AaABAg,,VXp6qw86mSo,False,author_4019,2026-05-26T12:53:22Z,2026-05-26T12:53:22Z,0,Piangi come la Carra' che fa odiens 😂😂😂😂😂,,0,ilmessaggero,author_4019
Ugxtd3_tUtUvAS6JxgZ4AaABAg,,VXp6qw86mSo,False,author_1502,2026-05-26T17:12:05Z,2026-05-26T17:12:48Z,0,"Ma vai a lavorare , e non aggiungo altro , è meglio.",,0,ilmessaggero,author_1502
UgzG8dRB4Oa6ghCKWhp4AaABAg,,VXp6qw86mSo,False,author_3470,2026-05-26T20:23:16Z,2026-05-26T20:23:16Z,0,CARO CAROCORNUTO SCRIVI UN LIBRO LE MIE PRIGIONI😁😁😁😁😁,,0,ilmessaggero,author_3470
UgwGWAo0uo93cZ2hHC54AaABAg,,VXp6qw86mSo,False,author_6544,2026-05-27T08:16:08Z,2026-05-27T08:16:08Z,0,"ma fammi il piacere ,non fare la vittima .",,0,ilmessaggero,author_6544
UgwEFfkJGScuSmD1Qch4AaABAg,,VXp6qw86mSo,False,author_1706,2026-05-27T15:26:46Z,2026-05-27T15:27:18Z,0,"È guerra, è guerra é guerra. Avete fatto di tutto per andarci.... Quando ci ritornate?? Col cavolo.. 😂",,0,ilmessaggero,author_1706
UgwDWoHsqRzHj8YsaUZ4AaABAg,,VXp6qw86mSo,False,author_3508,2026-05-27T19:50:01Z,2026-05-27T19:50:01Z,0,E chi sarebbero gli anziani?,,0,ilmessaggero,author_3508
