comment_id,parent_comment_id,video_id,is_reply,author,published_at,updated_at,like_count,text,inferred_parent_id,depth,newspaper,author_anon
UgziI7mNqfdCHosPbY94AaABAg,,3RgD1kTewSY,False,author_4413,2026-05-26T11:32:51Z,2026-05-26T11:32:51Z,2,Particolarissimo,,0,lastampa,author_4413
UgxoojfFx0ACuw68H0J4AaABAg,,3RgD1kTewSY,False,author_4414,2026-05-26T22:03:07Z,2026-05-26T22:03:07Z,6,"Grande Carlo Petrini , grande la sua intelligenza la sua Umanità il suo genio lascia una eredità immensa",,0,lastampa,author_4414
UgzrTr62WhTgOSDqRiV4AaABAg,,3RgD1kTewSY,False,author_325,2026-05-27T08:26:39Z,2026-05-27T08:27:03Z,3,"Un grande italiano, un uomo universale da innate capacità nel leggere il mondo che ci circonda. Grazie per averci onorato della tua esistenza.❤",,0,lastampa,author_325
Ugwap6klGZrfR9-4HMV4AaABAg,,3RgD1kTewSY,False,author_3337,2026-05-27T12:31:06Z,2026-05-27T12:31:06Z,2,Visionario per sempre grata❤🙏,,0,lastampa,author_3337
Ugy4Qs1m2tFfa7FuJfN4AaABAg,,3RgD1kTewSY,False,author_535,2026-05-27T15:58:11Z,2026-05-27T15:58:11Z,0,🌹❤️💐🌿🙏,,0,lastampa,author_535
