comment_id,parent_comment_id,video_id,is_reply,author,published_at,updated_at,like_count,text,inferred_parent_id,depth,newspaper,author_anon
UgyOfli4jQ6cmjIXFj54AaABAg,,L9I8Fg3ZIoc,False,author_899,2026-05-26T16:41:07Z,2026-05-26T16:41:07Z,8,"Io, da appassionato, non posso davvero accettare una cosa simile. In nessuna maniera. Noi siamo l'Italia e questa cosa ormai è stata non solo dimenticata, ma sepolta sotto 100 metri di vergogna. Eravamo il paese che ha insegnato al mondo come si fecevano le auto (da corsa e non), il paese che rappresenta al 100% le parole ""Design"" e ""Qualità"", un paese di storia, cultira, artigiani e carrozzerie senza pari, designer e progettisti inimitabili. Il mondo guardava a questo nostro patrimonio con ammirazione e paura. Non importava cosa fosse, se un'automobile, un vestito o un pezzo di arredamento, se sopra c'era scritto ""made in Italy"" era tutto dire e non vi potevano essere contestazioni. Siamo anche ricchi di sbagli, va detto, ma da essi abbiamo sempre imparato e abbiamo poi fatto il massimo possibile. Ma questa.... cosa... non può essere definita ""errore"". Perchè ormai abbiamo definitivamente buttato il nostro immenso ed inestimabile retaggio storico automobilistico dritto nel cesso. (O per meglio dire, regalato ai paesi esteri). 5 anni di studio e oltre mezzo miliardo di euro spesi per un progetto che sin dal benedetro principio doveva essere la svolta per voi di Maranello e questo.... è il risultato. E si, io non sono nessuno, nemmeno lontanamente un possibile acquirente perchè non mi potrei permettere nemmeno un bullone, ma sono Designer molto principiante anche se con molte idee, ho lavorato nel settore, lo seguo con il cuore, ogni tanto progetto qualche auto per conto mio e tutto questo è per me necessario dirlo. Non voglio sentire che sono ""linee a cui ci si deve abituare"" perchè non stiamo psrlando di una brand nato ieri, ma di uno che sa, o dovrebbe sapere, cosa il pubblico si aspetta e una cosa del genere è inammissibile, anche fosse stata a benzina pura. Persino Ford con la Mustang Mach-E ha fatto più successo, prima Mustang eletrrica e pure SUV, e quella macchina è bella solo se la ribalti in un fosso. Io sono deluso, sempre di più... perchè continuiamo a regalare al mondo motivi per non essere più presi sul serio perche tanto ormai... cosa ci è rimasto...nemmeno lo spirito è più italiano.. I costi che questo paese impone sono alti, ma prima o poi qualcuno salterà fuori, qualcuno che ci regalerà di nuovo le auto che fanno sognare, quella passione pura al 100% su 4 ruote con il design e la qualità e la storia che solo noi sappiamo fare. Prima o poi.",,0,repubblica,author_899
UgzPDCAlUE1Iv4wluLJ4AaABAg,,L9I8Fg3ZIoc,False,author_900,2026-05-26T16:47:16Z,2026-05-26T16:47:16Z,73,L'ha disegnata Homer,,0,repubblica,author_900
Ugz7W-PqlJKlqjErspZ4AaABAg,,L9I8Fg3ZIoc,False,author_901,2026-05-26T16:48:33Z,2026-05-26T16:48:33Z,1,Nasoni. Tutto quello che toccano lo distruggono.,,0,repubblica,author_901
Ugz2mhjNwYBO21irWg94AaABAg,,L9I8Fg3ZIoc,False,author_902,2026-05-26T16:48:34Z,2026-05-26T16:48:34Z,0,Un albero di natale,,0,repubblica,author_902
UgxzWs8Pv0RI2euWBKB4AaABAg,,L9I8Fg3ZIoc,False,author_903,2026-05-26T16:53:29Z,2026-05-26T16:53:29Z,1,L'ha disegnata uno che lavora alla Hunday?,,0,repubblica,author_903
Ugz9OkrIm8uKACZS8kN4AaABAg,,L9I8Fg3ZIoc,False,author_904,2026-05-26T16:58:40Z,2026-05-26T16:58:40Z,30,Questo Elkann è una vergogna senza fine.,,0,repubblica,author_904
UgzoTgdAwpa7uGfeZq94AaABAg,,L9I8Fg3ZIoc,False,author_905,2026-05-26T16:58:58Z,2026-05-26T17:01:51Z,13,"Perché Rolex ha smesso di produrre orologi al quarzo? Il quarzo fu una risposta affrettata alla crisi dell’orologeria svizzera degli anni ’70. Una volta superata la minaccia giapponese, Rolex è tornata a concentrarsi sui movimenti meccanici, più coerenti con la sua identità di marca, più desiderati dalla sua clientela di riferimento. Spero almeno che questo bidè serva a calare il sipario sull'idea ridicola delle Ferrari elettriche.",,0,repubblica,author_905
UgztYomMA8ZZWDXa1GB4AaABAg,,L9I8Fg3ZIoc,False,author_906,2026-05-26T17:03:22Z,2026-05-26T17:03:22Z,0,Oggi il titolo in borsa è crollato. Io non capisco come si possa solo pensare di fare un aborto del genere e metterci il cavallino sopra. Gli Elkann andrebbero rimpatriati su un altro pianeta ed espulsi dall' umanità intera.......passando prima per un centro tipo Libia.,,0,repubblica,author_906
UgxB7nalG7QTxAFgVzZ4AaABAg,,L9I8Fg3ZIoc,False,author_907,2026-05-26T17:03:32Z,2026-05-26T17:07:25Z,21,Il DRAKE si è rivoltato nella tomba!!! 😭,,0,repubblica,author_907
Ugwc4J1ScZCJN4pjf094AaABAg,,L9I8Fg3ZIoc,False,author_908,2026-05-26T17:12:44Z,2026-05-26T17:12:44Z,1,Ma fà schifo!,,0,repubblica,author_908
UgzPDCAlUE1Iv4wluLJ4AaABAg.AXHHysZU7U1AXHL8H07VHz,UgzPDCAlUE1Iv4wluLJ4AaABAg,L9I8Fg3ZIoc,True,author_473,2026-05-26T17:14:54Z,2026-05-26T17:14:54Z,1,😂😂,UgzPDCAlUE1Iv4wluLJ4AaABAg,1,repubblica,author_473
UgzBeTXIxvG0Zgj5w3B4AaABAg,,L9I8Fg3ZIoc,False,author_909,2026-05-26T17:15:32Z,2026-05-26T17:15:32Z,17,STA COSA CON LE PILE È PERFETTA PER MOZZARELLA 😂 TANTO NON SA NEMMENO COSA SIA,,0,repubblica,author_909
Ugzs6gAfA6IZGJqp4Kt4AaABAg,,L9I8Fg3ZIoc,False,author_910,2026-05-26T17:16:24Z,2026-05-26T17:16:24Z,2,Inguardabile,,0,repubblica,author_910
Ugw1kInp6NUI7Nc1LXt4AaABAg,,L9I8Fg3ZIoc,False,author_911,2026-05-26T17:16:45Z,2026-05-26T17:16:45Z,1,Nei panni di Mattarella avrei ordinato ai corazzieri di arrestarli.😢,,0,repubblica,author_911
UgwpAOt0rJvKJY83in14AaABAg,,L9I8Fg3ZIoc,False,author_912,2026-05-26T17:19:15Z,2026-05-26T17:19:15Z,0,Che schifo,,0,repubblica,author_912
Ugz3J9wXfYTqdCCveEd4AaABAg,,L9I8Fg3ZIoc,False,author_913,2026-05-26T17:22:37Z,2026-05-26T17:22:37Z,0,Anche il Presidente ci deve riflettere un pò,,0,repubblica,author_913
UgxFBRqlmAYxDGM51cN4AaABAg,,L9I8Fg3ZIoc,False,author_914,2026-05-26T17:26:38Z,2026-05-26T17:26:38Z,2,"È un cesso, che amarezza",,0,repubblica,author_914
UgxWxJ8C6GInoU2CHut4AaABAg,,L9I8Fg3ZIoc,False,author_915,2026-05-26T17:28:35Z,2026-05-26T17:28:35Z,0,che vergogna...cone disonorare ľItalia davanti al nostro Presidente,,0,repubblica,author_915
UgygeGzu5BzQgwO5e5l4AaABAg,,L9I8Fg3ZIoc,False,author_119,2026-05-26T17:30:02Z,2026-05-26T17:30:02Z,0,"Siamo passati dalla Maserati Quattroporte ""Calliope"" regalata a Pertini a... questa 🙄",,0,repubblica,author_119
Ugz3CB9H__9gqGYHBuB4AaABAg,,L9I8Fg3ZIoc,False,author_916,2026-05-26T17:30:47Z,2026-05-26T17:30:47Z,2,"Che schifo, che amarezza, che tristezza...",,0,repubblica,author_916
Ugww1TPdDECGEotJGMd4AaABAg,,L9I8Fg3ZIoc,False,author_917,2026-05-26T17:41:19Z,2026-05-26T17:41:19Z,0,Cesso clamoroso,,0,repubblica,author_917
Ugzrp-r4Y4K54wZS-Ex4AaABAg,,L9I8Fg3ZIoc,False,author_918,2026-05-26T17:44:37Z,2026-05-26T17:44:37Z,0,È una prius che costa 500000€,,0,repubblica,author_918
UgymxR1WuOayGogL2QZ4AaABAg,,L9I8Fg3ZIoc,False,author_919,2026-05-26T17:44:40Z,2026-05-26T17:44:40Z,0,E anche la Ferrari ce la semo giocata,,0,repubblica,author_919
Ugxetfm_UzA2mXX7I-F4AaABAg,,L9I8Fg3ZIoc,False,author_920,2026-05-26T17:49:22Z,2026-05-26T17:49:22Z,0,Stanno radento al suolo un Mito 😮 vergogna 😢,,0,repubblica,author_920
UgwfinJKOOwcUfUtZVt4AaABAg,,L9I8Fg3ZIoc,False,author_921,2026-05-26T17:50:48Z,2026-05-26T17:50:48Z,3,Datevi 🔥,,0,repubblica,author_921
UgwFFc7avPfW8EVSUQp4AaABAg,,L9I8Fg3ZIoc,False,author_922,2026-05-26T17:51:38Z,2026-05-26T17:51:38Z,1,....e pensare...che la Fiat di suo nonno l'abbiamo...mantenuta ..noi italiani...con le tasse....e questo e' il risultato.....l'annientamento ...del mito Ferrari.......,,0,repubblica,author_922
UgzNMCpwPB5hsMh3_gN4AaABAg,,L9I8Fg3ZIoc,False,author_923,2026-05-26T17:52:09Z,2026-05-26T17:52:09Z,0,Enzo torna in vita per ridare luce alla Ferrari!!,,0,repubblica,author_923
UgzyDWCz5Ny6zg7KiLx4AaABAg,,L9I8Fg3ZIoc,False,author_924,2026-05-26T17:54:24Z,2026-05-26T17:54:24Z,8,"Eravamo i maestri del design, del lusso e della bellezza siamo diventi dei fake cinesi",,0,repubblica,author_924
UgxGkshHKlNfjUWUwDh4AaABAg,,L9I8Fg3ZIoc,False,author_925,2026-05-26T17:59:29Z,2026-05-26T17:59:29Z,0,Hai rovinato la Ferrari e adesso anche la Juve Complimenti,,0,repubblica,author_925
UgzVHO-7aT3mVkxyD2h4AaABAg,,L9I8Fg3ZIoc,False,author_926,2026-05-26T17:59:40Z,2026-05-26T17:59:40Z,0,Elkann pezzo di merda...Ferrari R.I.P,,0,repubblica,author_926
UgyCokls7wh9YFGxSTx4AaABAg,,L9I8Fg3ZIoc,False,author_927,2026-05-26T17:59:41Z,2026-05-26T17:59:41Z,0,Non ci sono parole per descrivere tale obbrobrio! Un mito rovinato con un baraccone a pile!! Che schifo! Un insulto a tutti gli appassionati del cavallino!!,,0,repubblica,author_927
UgxyzKuMAByQIZJkR8R4AaABAg.AXGzGRFRGZ1AXHQLDqLP7L,UgxyzKuMAByQIZJkR8R4AaABAg,L9I8Fg3ZIoc,True,author_927,2026-05-26T18:00:22Z,2026-05-26T18:00:22Z,0,Anche poco!!,UgxyzKuMAByQIZJkR8R4AaABAg,1,repubblica,author_927
UgxzWs8Pv0RI2euWBKB4AaABAg.AXHIgMcsagYAXHQUfrfWr9,UgxzWs8Pv0RI2euWBKB4AaABAg,L9I8Fg3ZIoc,True,author_927,2026-05-26T18:01:39Z,2026-05-26T18:01:39Z,0,Un australiano e un inglese che fanno cellulari!!!! Imbarazzante!,UgxzWs8Pv0RI2euWBKB4AaABAg,1,repubblica,author_927
UgzORUjOIRXL_ZK7dgx4AaABAg,,L9I8Fg3ZIoc,False,author_928,2026-05-26T18:10:24Z,2026-05-26T18:10:24Z,0,Ma vergognatevi.,,0,repubblica,author_928
UgzPDCAlUE1Iv4wluLJ4AaABAg.AXHHysZU7U1AXHRcd1r46M,UgzPDCAlUE1Iv4wluLJ4AaABAg,L9I8Fg3ZIoc,True,author_929,2026-05-26T18:11:37Z,2026-05-26T18:11:37Z,1,😂😂😂,UgzPDCAlUE1Iv4wluLJ4AaABAg,1,repubblica,author_929
UgwtQv8FOUacdnckc3Z4AaABAg,,L9I8Fg3ZIoc,False,author_929,2026-05-26T18:12:01Z,2026-05-26T18:12:01Z,0,Cosa è quella merda?,,0,repubblica,author_929
UgwVz3oLZGbzzzZG6wp4AaABAg,,L9I8Fg3ZIoc,False,author_930,2026-05-26T18:15:13Z,2026-05-26T18:15:13Z,7,Giusto Mattarella ci poteva andare all innagurazione di quel rutto orribile,,0,repubblica,author_930
UgzpD5O-7kZuXavqXYB4AaABAg,,L9I8Fg3ZIoc,False,author_931,2026-05-26T18:15:38Z,2026-05-26T18:15:38Z,0,"Chissa' se il gobbo cattocomunista si sara' reso conto della idiozia, con i suoi pupilli magistrati no",,0,repubblica,author_931
UgwBHifwXXtHSDxgu_h4AaABAg,,L9I8Fg3ZIoc,False,author_932,2026-05-26T18:16:00Z,2026-05-26T18:16:00Z,157,"Mattarella: ""bella questa BYD, ma la Ferrari dove l'avete parcheggiata?""",,0,repubblica,author_932
UgzNHSL8HgLVcx3zHIZ4AaABAg,,L9I8Fg3ZIoc,False,author_933,2026-05-26T18:18:09Z,2026-05-26T18:18:09Z,1,🤮,,0,repubblica,author_933
Ugwlq7jg7irojNeed2x4AaABAg,,L9I8Fg3ZIoc,False,author_934,2026-05-26T18:18:26Z,2026-05-26T18:18:26Z,0,TORNATE A DARE QUEL CAZZO DI DODICI CILINDRI E FATELS FINITA QUESTA E’ UNA BARZELLETTA 😡😡😡😡😡😡😡😡,,0,repubblica,author_934
UgxVl5wvwESavQLTWA54AaABAg,,L9I8Fg3ZIoc,False,author_935,2026-05-26T18:25:41Z,2026-05-26T18:25:41Z,1,No comment,,0,repubblica,author_935
Ugx5P0O8wo6zAfmiRu54AaABAg,,L9I8Fg3ZIoc,False,author_936,2026-05-26T18:26:09Z,2026-05-26T18:26:09Z,0,Che vomito di uomo sta affossando tutto,,0,repubblica,author_936
UgwcJgdI7hAQMzRlipB4AaABAg,,L9I8Fg3ZIoc,False,author_937,2026-05-26T18:28:54Z,2026-05-26T18:28:54Z,0,Ferrari luce.....quella che non si vede più dal 2007,,0,repubblica,author_937
Ugz7q4PGgk0RQ-7h0ct4AaABAg,,L9I8Fg3ZIoc,False,author_938,2026-05-26T18:28:55Z,2026-05-26T18:28:55Z,0,La Ferrari più brutta della storia,,0,repubblica,author_938
UgwnKyX7q23QuwpDPDJ4AaABAg,,L9I8Fg3ZIoc,False,author_939,2026-05-26T18:31:53Z,2026-05-26T18:31:53Z,0,Che schifo!!!,,0,repubblica,author_939
Ugx1banOGSWuzhel5RB4AaABAg,,L9I8Fg3ZIoc,False,author_940,2026-05-26T18:32:05Z,2026-05-26T18:32:05Z,0,"Signore e signori, da Maranello con furore (elettrico) ecco a voi la Ferrari Luce: un prodigio della tecnica che ridefinisce il concetto di ""crimine contro il patrimonio motoristico"". Un aborto stilistico e concettuale che potevano partorire solo menti così geniali. Hanno preso il leggendario nome ""Testarossa"", lo hanno privato di un motore dodici cilindri degno di questo nome, e ci hanno appiccicato sopra una spina della corrente. Il risultato? Un elettrodomestico da 550.000 euro firmato dall'ex designer della Apple, ottimo per chi ha sempre sognato di guidare un costoso iPhone a quattro ruote con 1.050 cavalli, ma zero anima. Enzo Ferrari non si sta solo rivoltando nella tomba: sta probabilmente cercando il modo di staccare il contatore generale di Maranello.",,0,repubblica,author_940
UgyRSfYbE90PnXxDYeJ4AaABAg,,L9I8Fg3ZIoc,False,author_941,2026-05-26T18:32:06Z,2026-05-26T18:32:06Z,1,Ma daiiiiii 😂😂,,0,repubblica,author_941
UgwWscSMI2MTfqq59dd4AaABAg,,L9I8Fg3ZIoc,False,author_942,2026-05-26T18:34:53Z,2026-05-26T18:35:47Z,1,Immagina che difficoltà per Sergione sorridere e fare finta che quella macchina non gli faccia cagare davanti a quell'incapace di Elkann.,,0,repubblica,author_942
UgywIvQelBiLDfPP9U54AaABAg,,L9I8Fg3ZIoc,False,author_943,2026-05-26T18:35:37Z,2026-05-26T18:35:37Z,0,... e’ una cagata pazzesca!😂,,0,repubblica,author_943
Ugxo9MXjv4LR0xTLPyF4AaABAg,,L9I8Fg3ZIoc,False,author_565,2026-05-26T18:37:14Z,2026-05-26T18:38:17Z,7,Una vasca da bagno a pile con il logo del cavallino. E Mattarella guarda compiaciuto. Cos'è un film di Checco Zalone?,,0,repubblica,author_565
UgyohhKfdcbcmxHV0ol4AaABAg,,L9I8Fg3ZIoc,False,author_944,2026-05-26T18:39:12Z,2026-05-26T18:39:12Z,0,Fa schifo non è una Ferrari.non sarà mai una Ferrari.,,0,repubblica,author_944
UgyRaLNmIQ9buE2dz3p4AaABAg,,L9I8Fg3ZIoc,False,author_945,2026-05-26T18:46:48Z,2026-05-26T18:48:24Z,0,Riusciranno nell'impresa di demolire anche la Ferrari.,,0,repubblica,author_945
UgxVJG3sc9f0aewsG514AaABAg,,L9I8Fg3ZIoc,False,author_946,2026-05-26T18:46:53Z,2026-05-26T18:46:53Z,7,Ma il presidente d'Italia nn ha niente da Fare 😂😂,,0,repubblica,author_946
Ugz7dMMBixFZLb8KVIJ4AaABAg,,L9I8Fg3ZIoc,False,author_947,2026-05-26T18:49:05Z,2026-05-26T18:49:05Z,0,Va beh ma questa faceva cagare pure col 12 cilindri.,,0,repubblica,author_947
Ugxx_WQdc23B4KWhplt4AaABAg,,L9I8Fg3ZIoc,False,author_948,2026-05-26T18:53:30Z,2026-05-26T18:53:30Z,0,Un tostapane piú o meno,,0,repubblica,author_948
UgyEthyarYE7vGdx_Jt4AaABAg,,L9I8Fg3ZIoc,False,author_949,2026-05-26T18:54:55Z,2026-05-26T18:54:55Z,33,Non vedo l'ora che sia domani per poter leggere il comunicato in cui Ferrari dichiara che era solo uno scherzo!,,0,repubblica,author_949
UgyAhCoxV_rDRjBbRMR4AaABAg,,L9I8Fg3ZIoc,False,author_950,2026-05-26T19:02:46Z,2026-05-26T19:02:46Z,0,"Le prime parole di Mattarella: cos’è , una scatoletta di tonno???",,0,repubblica,author_950
Ugw8Yymg_x8wYEiCp_l4AaABAg,,L9I8Fg3ZIoc,False,author_951,2026-05-26T19:05:03Z,2026-05-26T19:05:03Z,0,Povero presidente morirà di infarto... ah no dimenticavo che è un ipocrita per elezione,,0,repubblica,author_951
UgxNXajZKOCyxJvwjt54AaABAg,,L9I8Fg3ZIoc,False,author_952,2026-05-26T19:05:51Z,2026-05-26T19:05:51Z,0,"ma che vergognosi, macchina squallida, come chi dopo aver rovinato tutto sta cercando di rovinare l'unico mito italiano.... strappategli dalle mani l'azienda, velocemente prima che sia troppo tardi. (vedi risultati Juve)",,0,repubblica,author_952
UgzJUmDlsorUJ7iPx9t4AaABAg,,L9I8Fg3ZIoc,False,author_952,2026-05-26T19:07:25Z,2026-05-26T19:07:25Z,1,"titolo in borsa crollato, perché?",,0,repubblica,author_952
UgxotRVawjphanAqn1V4AaABAg.AXH9jPzw2_DAXHY6elFzq3,UgxotRVawjphanAqn1V4AaABAg,L9I8Fg3ZIoc,True,author_953,2026-05-26T19:08:17Z,2026-05-26T19:08:17Z,0,"Il popolino bue non conta una ceppa,",UgxotRVawjphanAqn1V4AaABAg,1,repubblica,author_953
UgwOymNdiZrKXistdIh4AaABAg,,L9I8Fg3ZIoc,False,author_954,2026-05-26T19:09:56Z,2026-05-26T19:10:21Z,4,Ma il figlio del Drake non dice niente?,,0,repubblica,author_954
UgyYHHM-cSqY7rZ6rRx4AaABAg.AXH0nflvmyPAXHYOyJFGZd,UgyYHHM-cSqY7rZ6rRx4AaABAg,L9I8Fg3ZIoc,True,author_953,2026-05-26T19:10:47Z,2026-05-26T19:10:47Z,0,Datti 🔥,UgyYHHM-cSqY7rZ6rRx4AaABAg,1,repubblica,author_953
Ugy9lFohZg66PiXr35t4AaABAg,,L9I8Fg3ZIoc,False,author_955,2026-05-26T19:15:11Z,2026-05-26T19:15:11Z,0,Povero Enzo,,0,repubblica,author_955
UgwnJLAHB7KRbslQMJ54AaABAg,,L9I8Fg3ZIoc,False,author_955,2026-05-26T19:15:28Z,2026-05-26T19:15:28Z,1,Ma Piero che dice in merito?,,0,repubblica,author_955
UgwovdyYjwIfEKhMTDF4AaABAg.AXGzxwuVtkPAXHZ0fztyQn,UgwovdyYjwIfEKhMTDF4AaABAg,L9I8Fg3ZIoc,True,author_953,2026-05-26T19:16:12Z,2026-05-26T19:16:12Z,0,Non capite nulla di automobili,UgwovdyYjwIfEKhMTDF4AaABAg,1,repubblica,author_953
Ugx50n_3d4-v_SYCShl4AaABAg,,L9I8Fg3ZIoc,False,author_956,2026-05-26T19:20:13Z,2026-05-26T19:20:13Z,0,Fa veramente cagare...come quelli lì davanti,,0,repubblica,author_956
UgwU79JzUymgLotDfcZ4AaABAg,,L9I8Fg3ZIoc,False,author_957,2026-05-26T19:30:33Z,2026-05-26T19:30:33Z,2,Togliete il cavallino da quella cosa!,,0,repubblica,author_957
UgwxnvBH8PIxO25Rwed4AaABAg,,L9I8Fg3ZIoc,False,author_105,2026-05-26T19:31:40Z,2026-05-26T19:31:40Z,1,"Bella! Adesso tutti alla Scala e stasera cena di gala con calciatori, popstars e influencers. E domani... Domani uguale!",,0,repubblica,author_105
Ugy1YTMj7cMQFRSmboN4AaABAg,,L9I8Fg3ZIoc,False,author_958,2026-05-26T19:32:33Z,2026-05-26T19:32:56Z,3,Elettrica??? 😂😂😂😂la Ferrari vuole crollare in borsa? Quant'è brutta,,0,repubblica,author_958
Ugxd94105AJsvlVGNRZ4AaABAg,,L9I8Fg3ZIoc,False,author_959,2026-05-26T19:33:26Z,2026-05-26T19:33:26Z,1,Neanche regalata,,0,repubblica,author_959
UgzenTjbFvpxZxSNdk94AaABAg,,L9I8Fg3ZIoc,False,author_960,2026-05-26T19:36:29Z,2026-05-26T19:36:29Z,23,Mi piacerebbe immaginare Ferruccio Lamborghini che percula Enzo Ferrari in paradiso,,0,repubblica,author_960
UgytMVM39_NPcWgg_iF4AaABAg,,L9I8Fg3ZIoc,False,author_961,2026-05-26T19:36:41Z,2026-05-26T19:36:41Z,38,"Sembra una scena di ""scemo e più scemo""",,0,repubblica,author_961
Ugy6hjYg0eZE9JZPnc14AaABAg,,L9I8Fg3ZIoc,False,author_962,2026-05-26T19:36:41Z,2026-05-26T19:36:41Z,0,"Pensavo le umiliazioni da parte americana per noi italiani si fossero fermate a pizza con l ananas e spaghetti col ketchup... e invece... ancora questo, adesso loro ci impongono il loro design Mah!!",,0,repubblica,author_962
UgwgvRcBXSuLE_RCExR4AaABAg,,L9I8Fg3ZIoc,False,author_963,2026-05-26T19:36:44Z,2026-05-26T19:36:44Z,1,MALEDETTI VOGLIONO IL FALLIMENTO ANCHE DI FERRARI. VERGOGNA ELKANN,,0,repubblica,author_963
Ugyyh1g4VbJncytZBCl4AaABAg,,L9I8Fg3ZIoc,False,author_964,2026-05-26T19:39:13Z,2026-05-26T19:39:13Z,0,"Jonnn Erkan: Allora Matty, questo è il nostro nuovo cesso a quattro ruote, diciamo che rispecchia i nostri tempi. Mattarella: devo dire che ci avete veramente preso, buona l' idea....di m...a",,0,repubblica,author_964
UgwovdyYjwIfEKhMTDF4AaABAg.AXGzxwuVtkPAXHaeM9KJxh,UgwovdyYjwIfEKhMTDF4AaABAg.AXGzxwuVtkPAXHZ0fztyQn,L9I8Fg3ZIoc,True,author_824,2026-05-26T19:39:14Z,2026-05-26T19:39:14Z,1,Menomale che ce stai te 😂😂😂😂,UgwovdyYjwIfEKhMTDF4AaABAg.AXGzxwuVtkPAXHZ0fztyQn,2,repubblica,author_824
UgydI0S-TfeAEB8x-SF4AaABAg,,L9I8Fg3ZIoc,False,author_622,2026-05-26T19:39:15Z,2026-05-26T19:39:15Z,1,"Ma quell'uomo con i capelli bianchi, non dovrebbe preoccuparsi dei problemi degli Italiani? Anzichè a partecipare ad eventi che non gli riguardano? Tanto poi l'istruzione, il lavoro, la sanità, chi se ne frega. L'importante è vedere quella lavatrice elettrica..mah",,0,repubblica,author_622
UgyO3plea88YxPG7yyd4AaABAg,,L9I8Fg3ZIoc,False,author_965,2026-05-26T19:40:44Z,2026-05-26T19:40:44Z,0,Togliete lo stemma del cavallino rampante!!!!,,0,repubblica,author_965
UgxjARPjhfstBI8Yz1F4AaABAg.AXHA6k-_fLGAXHar-dWiwh,UgxjARPjhfstBI8Yz1F4AaABAg,L9I8Fg3ZIoc,True,author_966,2026-05-26T19:40:58Z,2026-05-26T19:40:58Z,7,Hai ragione da vendere,UgxjARPjhfstBI8Yz1F4AaABAg,1,repubblica,author_966
Ugxp8A3VsjWDRJKY6Cd4AaABAg,,L9I8Fg3ZIoc,False,author_967,2026-05-26T19:41:25Z,2026-05-26T19:41:25Z,0,"Nemmeno regalata, mi tengo la mia Stelvio diesel",,0,repubblica,author_967
Ugw6CvSQxiN_fei12M94AaABAg,,L9I8Fg3ZIoc,False,author_968,2026-05-26T19:44:09Z,2026-05-26T19:44:09Z,3,al posto dei sedili ci sono dei cessi così uno può cagarci direttamente dentro.,,0,repubblica,author_968
UgzoTgdAwpa7uGfeZq94AaABAg.AXHJJTdcbphAXHbIbs0nUy,UgzoTgdAwpa7uGfeZq94AaABAg,L9I8Fg3ZIoc,True,author_969,2026-05-26T19:44:52Z,2026-05-26T19:44:52Z,1,"esatto, è quello il nocciolo.. non possiamo competere con i cinesi che sono avanti decenni con la formazione, gli investimenti e hanno tecnologìe e materiali a km zero. significherebbe la fine dell'identità del nostro marchio corsaiolo e finirebbe dritto nelle loro mani. sarà mica un antipasto?",UgzoTgdAwpa7uGfeZq94AaABAg,1,repubblica,author_969
UgwVgxEmibhVRJYgkgd4AaABAg,,L9I8Fg3ZIoc,False,author_289,2026-05-26T19:46:24Z,2026-05-26T19:46:24Z,0,"Meglio se non commento, altrimenti mi vengono a prendere a casa",,0,repubblica,author_289
UgybJ-fg6twRuuDvFL54AaABAg,,L9I8Fg3ZIoc,False,author_970,2026-05-26T19:51:55Z,2026-05-26T19:51:55Z,1,"Per un attimo lasciamo perdere il design, forse a qualcuno piacerà, ma almeno avete letto le prestazioni?? Un Tesla Plaid S e superiore......",,0,repubblica,author_970
UgyOfli4jQ6cmjIXFj54AaABAg.AXHHGnoGvaRAXHcf_XrarB,UgyOfli4jQ6cmjIXFj54AaABAg,L9I8Fg3ZIoc,True,author_969,2026-05-26T19:56:53Z,2026-05-26T19:56:53Z,1,"esatto. avrei molto da dirti. l'artigianalità, la passione e il buongusto italiani nessuno ce li può togliere ma delocalizzare, svendere o accorpare le nostre industrie è un passo miope che ci tornerà contro. in questo caso si sono addentrati nel settore della mobilità elettrica ma i cinesi sono da decenni che puntano lì con formazione e know-how tecnologico, oltre ad avere microchip e materie prime lì a km zero. è una sfida persa in partenza. inoltre nello specifico di questa auto mi sembra sia stato impostato il progetto al computer su parametri con precendenza all'efficienza aerodinamica, il risparmio energetico, l'ecologìa per anticipare future normative vincolanti ratificate dall'europa e quel design minimalistico solo perchè di moda, dimenticando l'identità pistaiola, la storia e il disegno distintivo del marchio.",UgyOfli4jQ6cmjIXFj54AaABAg,1,repubblica,author_969
Ugzr-Fprn3_C3_RhBGd4AaABAg,,L9I8Fg3ZIoc,False,author_971,2026-05-26T19:59:30Z,2026-05-26T19:59:30Z,0,Paiaccio,,0,repubblica,author_971
UgzoTgdAwpa7uGfeZq94AaABAg.AXHJJTdcbphAXHdVqW1h4R,UgzoTgdAwpa7uGfeZq94AaABAg.AXHJJTdcbphAXHbIbs0nUy,L9I8Fg3ZIoc,True,author_905,2026-05-26T20:04:09Z,2026-05-26T20:04:09Z,0,"@user ci avevo pensato, ed ora però mi hai fatto venire l'ansia: non sono disposto a vedere la mia società mutilata dai cambiamenti, i cambiamenti vanno rallentati affinché scorrano paralleli alla vita, senza travolgerla, in equilibrio.",UgzoTgdAwpa7uGfeZq94AaABAg.AXHJJTdcbphAXHbIbs0nUy,2,repubblica,author_905
UgzCdvJgZaZcgqD4JKx4AaABAg,,L9I8Fg3ZIoc,False,author_972,2026-05-26T20:08:02Z,2026-05-26T20:08:02Z,27,"Elkann và esiliato su un isola con i draghi di Komodo, nudo e senza viveri",,0,repubblica,author_972
UgzoTgdAwpa7uGfeZq94AaABAg.AXHJJTdcbphAXHeJFAI01w,UgzoTgdAwpa7uGfeZq94AaABAg.AXHJJTdcbphAXHdVqW1h4R,L9I8Fg3ZIoc,True,author_969,2026-05-26T20:11:10Z,2026-05-26T20:11:10Z,2,"@author_905 purtroppo i venti degli equilibri nazionali erano in cambiamento da decenni, ora se ne vedono i frutti di chi ha pianificato con lungimiranza e chi è stato miope pensando a politiche di durata giornaliera. stai sicuro che la nostra passione, il nostro buon gusto artistico non ce lo porteranno via. ci ridurranno a dipendenza economica ma ora dobbiamo focalizzarci a non farci portare via il saper fare artigiano e l'ingegno... da lì possiamo partire a ricostruire tutto. se però non produciamo più in Italia perdiamo il saper fare.. capito? ti mando un abbraccio.",UgzoTgdAwpa7uGfeZq94AaABAg.AXHJJTdcbphAXHdVqW1h4R,3,repubblica,author_969
UgyfzPflfb6smU1bmIV4AaABAg,,L9I8Fg3ZIoc,False,author_973,2026-05-26T20:11:40Z,2026-05-26T20:11:40Z,0,Secondo me ci godo no a distruggere le cose,,0,repubblica,author_973
UgyaQqSYnhZW8fxbfIx4AaABAg,,L9I8Fg3ZIoc,False,author_974,2026-05-26T20:12:05Z,2026-05-26T20:12:05Z,0,Ennesima conferma dei soldi buttati del PNRR... e’ bene che si sappia che hanno beneficiato di miliardi di aiuti di Stato per fare questo cesso,,0,repubblica,author_974
UgwkDOZBn_5tvTXzSdZ4AaABAg,,L9I8Fg3ZIoc,False,author_975,2026-05-26T20:14:08Z,2026-05-26T20:14:08Z,0,Sbaglio o Mattarella sembra un po' in imbarazzo?,,0,repubblica,author_975
UgzoTgdAwpa7uGfeZq94AaABAg.AXHJJTdcbphAXHeom0Zmae,UgzoTgdAwpa7uGfeZq94AaABAg.AXHJJTdcbphAXHdVqW1h4R,L9I8Fg3ZIoc,True,author_969,2026-05-26T20:15:37Z,2026-05-26T20:15:37Z,2,non resta che far fare a Ferrari sempre auto con meccaniche endotermiche.. diventerà ancora più di nicchia ma è quello il punto per farla rimanere viva con la sua identità originale. il mercato è in movimento ma non possiamo pretendere di diventare montagne se siamo colline. dobbiamo rimanere delle belle colline.,UgzoTgdAwpa7uGfeZq94AaABAg.AXHJJTdcbphAXHdVqW1h4R,3,repubblica,author_969
UgyVKFZ0-LWnEcRoCPx4AaABAg,,L9I8Fg3ZIoc,False,author_976,2026-05-26T20:16:48Z,2026-05-26T20:17:34Z,5,praticamente è un elettrodomestico non ha nulla a che vedere con la storia della Ferrari.,,0,repubblica,author_976
