comment_id,parent_comment_id,video_id,is_reply,author,published_at,updated_at,like_count,text,inferred_parent_id,depth,newspaper,author_anon
Ugxn5zAiTK3PHDAeYlR4AaABAg,,L9I8Fg3ZIoc,False,author_652,2026-05-26T13:24:34Z,2026-05-26T13:24:34Z,67,"Che amarezza .... Questo succede quando la passione la storia muore, Enzo perdonali tutti se puoi .....",,0,repubblica,author_652
UgwD1NuCDyyXQlcJaz54AaABAg,,L9I8Fg3ZIoc,False,author_801,2026-05-26T13:24:49Z,2026-05-26T13:24:49Z,36,Che vergogna come si può,,0,repubblica,author_801
Ugz8QX20B5BmV1UQu7V4AaABAg,,L9I8Fg3ZIoc,False,author_802,2026-05-26T13:26:40Z,2026-05-26T13:26:40Z,7,Tutti ingegneri fenomeni vedo 🤣🤡,,0,repubblica,author_802
UgxxAw7N8cJpfTHNpdJ4AaABAg,,L9I8Fg3ZIoc,False,author_803,2026-05-26T13:28:43Z,2026-05-26T13:28:43Z,23,Che tristezza,,0,repubblica,author_803
UgwYsCLVELGz6jiZBnx4AaABAg,,L9I8Fg3ZIoc,False,author_804,2026-05-26T13:30:52Z,2026-05-26T13:30:52Z,0,Pagliacci,,0,repubblica,author_804
Ugyo6e1XsAmp0ICB2bF4AaABAg,,L9I8Fg3ZIoc,False,author_805,2026-05-26T13:31:04Z,2026-05-26T13:31:04Z,0,Chi ha firmato il design?,,0,repubblica,author_805
UgwMLhQLdyckWQr5--p4AaABAg,,L9I8Fg3ZIoc,False,author_806,2026-05-26T13:32:09Z,2026-05-26T13:32:09Z,0,Elkan vendi la juve e togliti dalle palle. SEI SCARSO,,0,repubblica,author_806
UgzFPZ1Mi2iYBMRk9Lh4AaABAg,,L9I8Fg3ZIoc,False,author_807,2026-05-26T13:35:11Z,2026-05-26T13:35:11Z,0,🤮🤮,,0,repubblica,author_807
UgxvTlbzWWpmtyEW3AN4AaABAg,,L9I8Fg3ZIoc,False,author_808,2026-05-26T13:35:13Z,2026-05-26T13:35:30Z,0,Elkan sei un disastro !!! Sparisci finto ITALIANO!!! Te e tuo fratello siete una vergogna assoluta,,0,repubblica,author_808
UgxtlFBXOVR1fHvaG594AaABAg,,L9I8Fg3ZIoc,False,author_809,2026-05-26T13:37:18Z,2026-05-26T13:37:18Z,1,Che vergogna.,,0,repubblica,author_809
UgyfyYWJZtq7SH9kEEN4AaABAg,,L9I8Fg3ZIoc,False,author_810,2026-05-26T13:38:08Z,2026-05-26T13:38:08Z,0,Che schifo,,0,repubblica,author_810
UgxKkwo3TFhNxtmLULR4AaABAg,,L9I8Fg3ZIoc,False,author_811,2026-05-26T13:38:45Z,2026-05-26T13:38:45Z,16,Si stava trattenendo sergiuzzo,,0,repubblica,author_811
UgygCg1TJ2YYZ-42jXF4AaABAg,,L9I8Fg3ZIoc,False,author_812,2026-05-26T13:40:00Z,2026-05-26T13:40:00Z,0,"Mattarell sembra che pensi, la lavatroce non la so usare, perchè me ne fanno vedere una ...",,0,repubblica,author_812
UgzMiEfPAg812TS5zrJ4AaABAg,,L9I8Fg3ZIoc,False,author_758,2026-05-26T13:44:16Z,2026-05-26T13:44:16Z,0,Che macchina di merda preferisco una ape piaggio,,0,repubblica,author_758
UgxdXC7H_sI4mLgJRYh4AaABAg,,L9I8Fg3ZIoc,False,author_813,2026-05-26T13:44:44Z,2026-05-26T13:44:44Z,1,Enzo si sta rivoltando nella tomba! ORRORE!,,0,repubblica,author_813
Ugyo6e1XsAmp0ICB2bF4AaABAg.AXGwWpSZrikAXGyHaouSOj,Ugyo6e1XsAmp0ICB2bF4AaABAg,L9I8Fg3ZIoc,True,author_756,2026-05-26T13:46:28Z,2026-05-26T13:46:28Z,0,Un tossico sicuro amico degli Helkan,Ugyo6e1XsAmp0ICB2bF4AaABAg,1,repubblica,author_756
UgxNwgaV1QAX6MQkeDF4AaABAg,,L9I8Fg3ZIoc,False,author_814,2026-05-26T13:48:02Z,2026-05-26T13:48:02Z,0,Non ho capito tutto questo show ma per cosa ?,,0,repubblica,author_814
Ugw0iype06Tt-JlOlYJ4AaABAg,,L9I8Fg3ZIoc,False,author_815,2026-05-26T13:48:27Z,2026-05-26T13:48:27Z,1,"Ma è proprio sbagliato il concetto, non puoi preparare un piatto di pasta con pancetta, zucchine, uova e chiamarlo carbonara. Il marchio Ferrari è qualcosa di oltre. È qualcosa che anche un non vedente riesce a riconsocere in modo inconfondibile. Anche un bambino di 5 anni se sente il suono di quel motore ti dice ch'è passata una Ferrari. Questa è un abominio, levale quel marchio e chiamala come ti pare ma non Ferrari, per favore.",,0,repubblica,author_815
UgwkRpA_8IhPBqaLu-p4AaABAg,,L9I8Fg3ZIoc,False,author_816,2026-05-26T13:48:56Z,2026-05-26T13:48:56Z,0,😂😂😂😂😭😭😭,,0,repubblica,author_816
UgzkZp9sP_5sodylKQN4AaABAg,,L9I8Fg3ZIoc,False,author_817,2026-05-26T13:49:57Z,2026-05-26T13:49:57Z,1,Vergogna,,0,repubblica,author_817
UgzY82YE5Zb1yDKPNYh4AaABAg,,L9I8Fg3ZIoc,False,author_818,2026-05-26T13:52:39Z,2026-05-26T13:52:39Z,0,Fa cagare,,0,repubblica,author_818
Ugyo6e1XsAmp0ICB2bF4AaABAg.AXGwWpSZrikAXGz731xx1b,Ugyo6e1XsAmp0ICB2bF4AaABAg,L9I8Fg3ZIoc,True,author_818,2026-05-26T13:53:46Z,2026-05-26T13:53:46Z,3,"Il tizio che disegna l iPhone,vorrei scriverti il nome,ma non voglio sprecare bite di memoria per ricordare una roba del genere,perdonami 🙏",Ugyo6e1XsAmp0ICB2bF4AaABAg,1,repubblica,author_818
UgxRqb6Lh4hlZcZyAWZ4AaABAg,,L9I8Fg3ZIoc,False,author_819,2026-05-26T13:53:50Z,2026-05-26T13:53:50Z,1,Enzo se fosse ancora vivo si sarebbe buttato giù da un ponte,,0,repubblica,author_819
UgxyzKuMAByQIZJkR8R4AaABAg,,L9I8Fg3ZIoc,False,author_820,2026-05-26T13:55:03Z,2026-05-26T13:55:03Z,32,"""Ferrari perde circa il 6-7% in Borsa""",,0,repubblica,author_820
Ugwl2Zhj7MX-NIhBrWN4AaABAg,,L9I8Fg3ZIoc,False,author_821,2026-05-26T13:56:06Z,2026-05-26T13:56:06Z,28,È finita un'era,,0,repubblica,author_821
UgzSx_XxDxbG0D4eH3t4AaABAg,,L9I8Fg3ZIoc,False,author_822,2026-05-26T13:58:55Z,2026-05-26T13:58:55Z,0,Squallida,,0,repubblica,author_822
Ugw0D0C-rkVas-1EMlR4AaABAg,,L9I8Fg3ZIoc,False,author_823,2026-05-26T14:00:45Z,2026-05-26T14:00:45Z,0,"bella, la compro",,0,repubblica,author_823
UgwovdyYjwIfEKhMTDF4AaABAg,,L9I8Fg3ZIoc,False,author_824,2026-05-26T14:01:07Z,2026-05-26T14:01:07Z,2,Certo non é la nostra ferrari ma il mondo va avanti ( purtroppo) bisogna accettarlo,,0,repubblica,author_824
Ugz-ocySCbXRm4UThph4AaABAg,,L9I8Fg3ZIoc,False,author_825,2026-05-26T14:09:17Z,2026-05-26T14:09:17Z,0,AD ESSERE VOLGARI CI STA BENE UN : MA STI CAZZI ! CO TANTI PROBLEMI CHE CI SONO IN ITALIA TRA FAME E MALASANITÀ IL PRESIDENTE DELLA REPUBBLICA FA QUESTA PUPAZZATA PER POCHI ELETTI !,,0,repubblica,author_825
UgwxZxzQDW9EsJkn0Q54AaABAg,,L9I8Fg3ZIoc,False,author_826,2026-05-26T14:09:43Z,2026-05-26T14:09:43Z,0,Ste facce di mmerda e noi non arriviamo a fine mese VERGOGNA,,0,repubblica,author_826
UgzH0uHJPkVHNyflyzN4AaABAg,,L9I8Fg3ZIoc,False,author_520,2026-05-26T14:12:18Z,2026-05-26T14:12:18Z,5,Mattarella avrebbe voluto esclamare le parole di Fantozzi sull armata potiomkim,,0,repubblica,author_520
Ugw6MeRulKKsVTe3Bk94AaABAg,,L9I8Fg3ZIoc,False,author_827,2026-05-26T14:14:43Z,2026-05-26T14:14:43Z,0,Esteticamente fa molto cagare. Ma chi ha i soldi la compra la stesso perché ha uno status da mantenere. E poi diranno andranno in giro a dire che è bella 😂,,0,repubblica,author_827
UgxG20oNPNOAX64-6yV4AaABAg,,L9I8Fg3ZIoc,False,author_828,2026-05-26T14:15:14Z,2026-05-26T14:15:14Z,130,Enzo perdonali...non sanno quello che fanno😢,,0,repubblica,author_828
UgxEbVz4Wev_g6TpJr14AaABAg,,L9I8Fg3ZIoc,False,author_829,2026-05-26T14:16:49Z,2026-05-26T14:16:49Z,0,Almeno potevate farla rossa...,,0,repubblica,author_829
UgxaACCSi5U2gb_nzdV4AaABAg,,L9I8Fg3ZIoc,False,author_830,2026-05-26T14:16:54Z,2026-05-26T14:16:54Z,1,Che merda!! Se questa é una ferrari io sono Superman!!,,0,repubblica,author_830
UgyYHHM-cSqY7rZ6rRx4AaABAg,,L9I8Fg3ZIoc,False,author_831,2026-05-26T14:17:12Z,2026-05-26T14:17:12Z,2,"Che vergogna, quanto è costato Mattarella per essere lì, in più a cosa fare?",,0,repubblica,author_831
UgzpxkDMVVDwmLpwNoN4AaABAg,,L9I8Fg3ZIoc,False,author_832,2026-05-26T14:18:00Z,2026-05-26T14:18:00Z,0,Fa cagare,,0,repubblica,author_832
Ugz88ZiEyzkMtoDvqa54AaABAg,,L9I8Fg3ZIoc,False,author_833,2026-05-26T14:18:03Z,2026-05-26T14:18:03Z,0,Terribile. Scusaci enzo,,0,repubblica,author_833
UgzFimV-uBkBvtfLhXx4AaABAg,,L9I8Fg3ZIoc,False,author_834,2026-05-26T14:18:35Z,2026-05-26T14:18:35Z,0,"Ma il Mattarello, avra' capito di cosa si tratta? Ne dubito! Gia il tagliaerba elettrico fa' cagare, figurati una macchina nata per fare sensazione. Se arrivi a questo punto, non chiamarla più ""Ferrari"", chiamala Edison o Volta e lascia la storia che rimanga passato....",,0,repubblica,author_834
Ugzlu8ZP0sBQbxgW6st4AaABAg,,L9I8Fg3ZIoc,False,author_835,2026-05-26T14:22:34Z,2026-05-26T14:22:34Z,0,Che tristezza,,0,repubblica,author_835
Ugy2k3_58FJgtDjYQGZ4AaABAg,,L9I8Fg3ZIoc,False,author_836,2026-05-26T14:22:50Z,2026-05-26T14:22:50Z,6,Vai. Dopo Fiat e Juventus ammazza anche la Ferrari e scappa coi soldi all'estero,,0,repubblica,author_836
UgzI5CUDwoMeA8YGJ9t4AaABAg,,L9I8Fg3ZIoc,False,author_837,2026-05-26T14:23:06Z,2026-05-26T14:23:06Z,0,Che schifo,,0,repubblica,author_837
Ugy09SwNnh5b4CKcma14AaABAg,,L9I8Fg3ZIoc,False,author_838,2026-05-26T14:23:47Z,2026-05-26T14:23:47Z,1,Ma chi caxxo la compra?,,0,repubblica,author_838
UgzLSOAQfu34dxjejqh4AaABAg,,L9I8Fg3ZIoc,False,author_180,2026-05-26T14:24:59Z,2026-05-26T14:24:59Z,0,Immondizia 😂,,0,repubblica,author_180
Ugy_gr5pzD6OJGoh3zB4AaABAg,,L9I8Fg3ZIoc,False,author_839,2026-05-26T14:25:29Z,2026-05-26T14:25:29Z,1,Per me è una cagata pazzesca,,0,repubblica,author_839
Ugwph8Jf9-tKJclvVdV4AaABAg,,L9I8Fg3ZIoc,False,author_840,2026-05-26T14:25:29Z,2026-05-26T14:25:29Z,0,"Mah!secondo me sarà un flop,anche se a me dà fastidio a dare gloria alla Ferrari è stato il rombo ,parere personale",,0,repubblica,author_840
UgzMuyUnztLAwcK5Akp4AaABAg,,L9I8Fg3ZIoc,False,author_841,2026-05-26T14:26:53Z,2026-05-26T14:26:53Z,0,🤦🏻♂️il mondo è finito,,0,repubblica,author_841
Ugw0D0C-rkVas-1EMlR4AaABAg.AXGzvHWgH3zAXH1vynoHDO,Ugw0D0C-rkVas-1EMlR4AaABAg,L9I8Fg3ZIoc,True,author_842,2026-05-26T14:27:04Z,2026-05-26T14:27:04Z,0,😂,Ugw0D0C-rkVas-1EMlR4AaABAg,1,repubblica,author_842
Ugyoig9q29-San89tD94AaABAg,,L9I8Fg3ZIoc,False,author_843,2026-05-26T14:27:33Z,2026-05-26T14:27:33Z,2,Enzo perdonali 🙏,,0,repubblica,author_843
UgwCgTOk_DrU0ojObWN4AaABAg,,L9I8Fg3ZIoc,False,author_844,2026-05-26T14:29:35Z,2026-05-26T14:29:35Z,1,"Il problema non è l'elettrico, il Grosso Problema è l'estetica, esterna e interna, il gusto è sparito, la classe non parliamone! Come si può assoldare un designer di telefoni (Apple) per fare una macchina del genere? In Italia mancano persone che hanno gusto e che avrebbero rispettato maggiormente la tradizione estetica della casa?",,0,repubblica,author_844
UgzdEV5ytel0A7zte6l4AaABAg,,L9I8Fg3ZIoc,False,author_845,2026-05-26T14:30:04Z,2026-05-26T14:30:04Z,2,Le auto elettriche sono la rovina delle case automobilistiche 😥,,0,repubblica,author_845
UgwZohM3ZGZLkFr5QqJ4AaABAg,,L9I8Fg3ZIoc,False,author_846,2026-05-26T14:30:58Z,2026-05-26T14:30:58Z,15,Ricoprite quel tombino. Imbarazzante per l Italia intera,,0,repubblica,author_846
UgxRqb6Lh4hlZcZyAWZ4AaABAg.AXGz7XVi5mEAXH2cbIbZXU,UgxRqb6Lh4hlZcZyAWZ4AaABAg,L9I8Fg3ZIoc,True,author_847,2026-05-26T14:33:10Z,2026-05-26T14:33:10Z,0,"Ma Enzo è morto da 40 anni porca merda nemmeno il computer come lo conosciamo noi c’era, il mondo va avanti, anche perché non te la potevi comprare 50 anni fa é nemmeno adesso quindi che non commentare cose che non capisci.",UgxRqb6Lh4hlZcZyAWZ4AaABAg,1,repubblica,author_847
UgyuoFQuPAbD7cw78-Z4AaABAg,,L9I8Fg3ZIoc,False,author_170,2026-05-26T14:34:19Z,2026-05-26T14:34:19Z,0,Bravi avete rovinato un mito,,0,repubblica,author_170
UgwovdyYjwIfEKhMTDF4AaABAg.AXGzxwuVtkPAXH35kavv8M,UgwovdyYjwIfEKhMTDF4AaABAg,L9I8Fg3ZIoc,True,author_20,2026-05-26T14:37:17Z,2026-05-26T14:37:17Z,1,Non per forza il progresso significa migliore,UgwovdyYjwIfEKhMTDF4AaABAg,1,repubblica,author_20
UgzuLBRziIhenVSK6QB4AaABAg,,L9I8Fg3ZIoc,False,author_848,2026-05-26T14:37:56Z,2026-05-26T14:37:56Z,1,Ho shortato ferrari in leva 10×,,0,repubblica,author_848
UgwCgTOk_DrU0ojObWN4AaABAg.AXH2DTKyncYAXH3C9a9DBO,UgwCgTOk_DrU0ojObWN4AaABAg,L9I8Fg3ZIoc,True,author_20,2026-05-26T14:38:09Z,2026-05-26T14:38:09Z,0,Il design della Apple e morto nel 2005. Nei anni 70 aveva più fascino,UgwCgTOk_DrU0ojObWN4AaABAg,1,repubblica,author_20
Ugyo6e1XsAmp0ICB2bF4AaABAg.AXGwWpSZrikAXH3Z39mX-3,Ugyo6e1XsAmp0ICB2bF4AaABAg,L9I8Fg3ZIoc,True,author_846,2026-05-26T14:41:17Z,2026-05-26T14:41:27Z,0,Bombolo zzzz,Ugyo6e1XsAmp0ICB2bF4AaABAg,1,repubblica,author_846
UgyyTnp19X9KcM2ZcSh4AaABAg,,L9I8Fg3ZIoc,False,author_176,2026-05-26T14:41:58Z,2026-05-26T14:41:58Z,3,Design? Con 30 mila lire il mio falegname la fa meglio,,0,repubblica,author_176
UgzQAntKHhL2M_ADMe54AaABAg,,L9I8Fg3ZIoc,False,author_849,2026-05-26T14:44:24Z,2026-05-26T14:44:24Z,1,"Che mondo di merda...si costruisce una vettura da 500 mila euro e il presidente della repubblica la benedice...al contrRio non si preoccupa che gli edifici delle scuole cadono a pezzi in tutta Italia,che non si costruiscono a prezzi bassi le case per le giovane coppie, un paese allo sbando.",,0,repubblica,author_849
UgzqOp0uwCYSJ1RDznZ4AaABAg,,L9I8Fg3ZIoc,False,author_850,2026-05-26T14:45:05Z,2026-05-26T14:45:05Z,0,Che scempio....,,0,repubblica,author_850
UgxBOhK1kphVvWXsx1N4AaABAg,,L9I8Fg3ZIoc,False,author_851,2026-05-26T14:45:23Z,2026-05-26T14:45:23Z,0,io non salirei mai in questa macchina...,,0,repubblica,author_851
Ugyo6e1XsAmp0ICB2bF4AaABAg.AXGwWpSZrikAXH42H08w6T,Ugyo6e1XsAmp0ICB2bF4AaABAg.AXGwWpSZrikAXGz731xx1b,L9I8Fg3ZIoc,True,author_852,2026-05-26T14:45:32Z,2026-05-26T14:45:32Z,0,"@author_818 Ha disegnato alcuni iPhone nel corso della sua carriera come designer, ma non è stato l’unico disegnatore della Luce. Per favore informati prima di scrivere.",Ugyo6e1XsAmp0ICB2bF4AaABAg.AXGwWpSZrikAXGz731xx1b,2,repubblica,author_852
Ugx0jpIxWSU0nHDvTKt4AaABAg,,L9I8Fg3ZIoc,False,author_851,2026-05-26T14:46:00Z,2026-05-26T14:46:00Z,0,macchina elettrica... no... no... no... no.,,0,repubblica,author_851
UgxxiHqxQQJtd1MSeCN4AaABAg,,L9I8Fg3ZIoc,False,author_853,2026-05-26T14:48:23Z,2026-05-26T14:48:23Z,1,Che cagata,,0,repubblica,author_853
UgyAN3mrAAblOJcFtJB4AaABAg,,L9I8Fg3ZIoc,False,author_854,2026-05-26T14:48:58Z,2026-05-26T14:48:58Z,4,Hanno rovinato un marchio.,,0,repubblica,author_854
UgwmGsBY2eI_GETuTIt4AaABAg,,L9I8Fg3ZIoc,False,author_855,2026-05-26T14:50:41Z,2026-05-26T14:50:41Z,0,"È da cretini lamentarsi di un’auto elettrica, il problema è che è orrenda!!!!",,0,repubblica,author_855
UgymiGozJiY08I0nak14AaABAg,,L9I8Fg3ZIoc,False,author_856,2026-05-26T14:52:28Z,2026-05-26T14:52:28Z,0,Però non l'hanno accesa per far sentire il rombo a Mattarella,,0,repubblica,author_856
UgxLNeeSad_ElkIsPnR4AaABAg,,L9I8Fg3ZIoc,False,author_857,2026-05-26T14:52:42Z,2026-05-26T14:52:42Z,0,Obrio,,0,repubblica,author_857
Ugyh17FwJSSMSGlLawl4AaABAg,,L9I8Fg3ZIoc,False,author_858,2026-05-26T14:53:55Z,2026-05-26T14:53:55Z,2,Nel gruppo Fiat le auto ultimamente le concepisce Topo Gigio. 😢,,0,repubblica,author_858
Ugz1E4m8Rlh4s1yTYZt4AaABAg,,L9I8Fg3ZIoc,False,author_858,2026-05-26T14:56:36Z,2026-05-26T14:56:36Z,0,A Roma se direbbe...li moxxxcci vostra. Non solo Enzo Ferrari ma anche il nonno ( con tutti i difetti) di questi decerebrati si rivolta nella tomba.,,0,repubblica,author_858
Ugz5j_9MxI8Vz_-C9VR4AaABAg,,L9I8Fg3ZIoc,False,author_859,2026-05-26T14:56:53Z,2026-05-26T14:56:53Z,4,"Dopo la F1, La Juve (compresa Juventus femminile), credo che anche questo sarà un flop....grazie Elkann...",,0,repubblica,author_859
UgzBofAK6XuQXSt5wDl4AaABAg,,L9I8Fg3ZIoc,False,author_860,2026-05-26T14:59:05Z,2026-05-26T14:59:05Z,16,Vedo che la borsa ha apprezzato questa nuova opera d'arte su 4 ruote 😂,,0,repubblica,author_860
UgwpxIdR8q1YQQMDKBp4AaABAg,,L9I8Fg3ZIoc,False,author_858,2026-05-26T15:00:04Z,2026-05-26T15:00:04Z,0,Sto pennellone sta facendo più danni di Carlo in Francia. Quello che tocca diventa merda. Un re Mida al contrario. Liberatevene.,,0,repubblica,author_858
UgwovdyYjwIfEKhMTDF4AaABAg.AXGzxwuVtkPAXH5pCLVWGN,UgwovdyYjwIfEKhMTDF4AaABAg.AXGzxwuVtkPAXH35kavv8M,L9I8Fg3ZIoc,True,author_824,2026-05-26T15:01:06Z,2026-05-26T15:01:06Z,1,@user d'accordo,UgwovdyYjwIfEKhMTDF4AaABAg.AXGzxwuVtkPAXH35kavv8M,2,repubblica,author_824
Ugz8xf4TGETnzkeHSKF4AaABAg,,L9I8Fg3ZIoc,False,author_861,2026-05-26T15:01:32Z,2026-05-26T15:01:32Z,20,Si rischia la distruzione di un mito - È una macchina che almeno i cinesi non ci copieranno (cit. Luca Cordero di Montezemolo),,0,repubblica,author_861
Ugw_u_WOiZGBfFHfqfV4AaABAg,,L9I8Fg3ZIoc,False,author_862,2026-05-26T15:04:29Z,2026-05-26T15:04:29Z,2,el can....te si proprio en can .... prrrrrrrr,,0,repubblica,author_862
Ugzpkslk77i5e9EYxgx4AaABAg,,L9I8Fg3ZIoc,False,author_863,2026-05-26T15:06:20Z,2026-05-26T15:06:20Z,0,e intanto la gente fa la fame...,,0,repubblica,author_863
UgxToxs4Uooe4G70xhB4AaABAg,,L9I8Fg3ZIoc,False,author_864,2026-05-26T15:07:26Z,2026-05-26T15:07:26Z,0,Ma che assoluta merda,,0,repubblica,author_864
UgzjtFnXReRGL6QUWN14AaABAg,,L9I8Fg3ZIoc,False,author_865,2026-05-26T15:08:51Z,2026-05-26T15:08:51Z,2,Il drake starà facendo i tuffi nella tomba Elkann sei stato lo sfascio della Ferrari e della iuventus .,,0,repubblica,author_865
UgyQt1sCPVlFMR-DDJV4AaABAg,,L9I8Fg3ZIoc,False,author_866,2026-05-26T15:13:07Z,2026-05-26T15:13:07Z,0,Levate il cavallino.,,0,repubblica,author_866
UgxUkYgEVbs7RBWv_kZ4AaABAg,,L9I8Fg3ZIoc,False,author_867,2026-05-26T15:13:17Z,2026-05-26T15:13:17Z,0,Orrenda,,0,repubblica,author_867
Ugyo6e1XsAmp0ICB2bF4AaABAg.AXGwWpSZrikAXH7G2Yi0-Q,Ugyo6e1XsAmp0ICB2bF4AaABAg,L9I8Fg3ZIoc,True,author_866,2026-05-26T15:13:38Z,2026-05-26T15:13:38Z,0,Uno che disegna lavatrici,Ugyo6e1XsAmp0ICB2bF4AaABAg,1,repubblica,author_866
UgyiFHrXKHRhjIYJfsN4AaABAg,,L9I8Fg3ZIoc,False,author_868,2026-05-26T15:13:52Z,2026-05-26T15:13:52Z,0,Cazzo tutto quello che tocca jonny marcisce...,,0,repubblica,author_868
UgxXiP2STJU5us4UC6N4AaABAg,,L9I8Fg3ZIoc,False,author_869,2026-05-26T15:15:15Z,2026-05-26T15:15:15Z,9,Pare che sia già un flop il titolo ferrari è crollato in borsa,,0,repubblica,author_869
UgxnVslWEeth2K6YQYB4AaABAg,,L9I8Fg3ZIoc,False,author_870,2026-05-26T15:16:01Z,2026-05-26T15:16:01Z,0,"Brutta, brutta, brutta. Progetto, a dir poco, fallimentare.",,0,repubblica,author_870
Ugxn5zAiTK3PHDAeYlR4AaABAg.AXGvm9pFpwaAXH7_rHYqX-,Ugxn5zAiTK3PHDAeYlR4AaABAg,L9I8Fg3ZIoc,True,author_871,2026-05-26T15:16:29Z,2026-05-26T15:16:29Z,3,Adesso piango😢😂,Ugxn5zAiTK3PHDAeYlR4AaABAg,1,repubblica,author_871
Ugx86tkWFoBgE5FJrvF4AaABAg,,L9I8Fg3ZIoc,False,author_871,2026-05-26T15:16:40Z,2026-05-26T15:16:40Z,0,È solo una cazzo di macchina,,0,repubblica,author_871
UgxddzPDL7MU6axjHF94AaABAg,,L9I8Fg3ZIoc,False,author_872,2026-05-26T15:17:42Z,2026-05-26T15:17:42Z,6,Mattarella ha evitato di far parcheggiare la Flaminia Presidenziale convertibile Pininfarina accanto a questo oggetto indefinibile altrimenti in mondovisione tutti avrebbero compreso quanto indietro siamo andati ...... consiglio a elkann : auto come questa si presentano a gardaland o al mcdonald non nei giardini del Quirinale .......,,0,repubblica,author_872
UgymiGozJiY08I0nak14AaABAg.AXH4q-jWt_9AXH7zIQd2Ir,UgymiGozJiY08I0nak14AaABAg,L9I8Fg3ZIoc,True,author_873,2026-05-26T15:19:57Z,2026-05-26T15:19:57Z,1,Si romba di tuono! Come quelle che si fanno dopo aver mangiato fagioli!!!,UgymiGozJiY08I0nak14AaABAg,1,repubblica,author_873
UgxK-vArIULsvpw6zjx4AaABAg,,L9I8Fg3ZIoc,False,author_874,2026-05-26T15:23:19Z,2026-05-26T15:23:19Z,1,Brutta eh,,0,repubblica,author_874
UgyJCggH-T3TbI-gBcF4AaABAg,,L9I8Fg3ZIoc,False,author_602,2026-05-26T15:23:50Z,2026-05-26T15:23:50Z,0,Fine...,,0,repubblica,author_602
UgxEQdUncqkh6Zy-xIR4AaABAg,,L9I8Fg3ZIoc,False,author_875,2026-05-26T15:24:25Z,2026-05-26T15:24:25Z,1,Tutto finisce,,0,repubblica,author_875
Ugz5ItzE_HaKRPYaXHZ4AaABAg,,L9I8Fg3ZIoc,False,author_876,2026-05-26T15:24:33Z,2026-05-26T15:24:33Z,1,"Non mi intendo assolutamente di auto,ma quella e' una Ferrari? Ma davvero?",,0,repubblica,author_876
Ugw-D0XgIjaUi7x3pEZ4AaABAg,,L9I8Fg3ZIoc,False,author_186,2026-05-26T15:25:07Z,2026-05-26T15:25:07Z,3,Era meglio chiudere L baracca che darsi all’elettrico 😢,,0,repubblica,author_186
UgxmLDljcPepo4GWw6t4AaABAg,,L9I8Fg3ZIoc,False,author_877,2026-05-26T15:25:30Z,2026-05-26T15:25:30Z,2,Questo evento è considerabile un attentato al Presidente della Repubblica. Mai come in questo momento Mattarella ha rimpianto il giorno in cui è stato rieletto a tradimento contro la sua volontà.,,0,repubblica,author_877
Ugzux9ISpkVEj_hBNHF4AaABAg,,L9I8Fg3ZIoc,False,author_878,2026-05-26T15:26:22Z,2026-05-26T15:26:22Z,1,Non ho sentito il rombo del motore,,0,repubblica,author_878
UgxJs-fR8ENLt2rVdz94AaABAg,,L9I8Fg3ZIoc,False,author_879,2026-05-26T15:27:03Z,2026-05-26T15:27:03Z,3,Non un auto ma In pratica un ELETTRODOMESTICO..,,0,repubblica,author_879
UgwovdyYjwIfEKhMTDF4AaABAg.AXGzxwuVtkPAXH8qhFxc_Y,UgwovdyYjwIfEKhMTDF4AaABAg.AXGzxwuVtkPAXH5pCLVWGN,L9I8Fg3ZIoc,True,author_20,2026-05-26T15:27:31Z,2026-05-26T15:27:31Z,1,"@author_824 Prima o poi torneremo indietro, perché una volta arrivato in cima alla montagna, puoi solo che scendere",UgwovdyYjwIfEKhMTDF4AaABAg.AXGzxwuVtkPAXH5pCLVWGN,3,repubblica,author_20
UgwjCTCmuEmtmx7BiiR4AaABAg,,L9I8Fg3ZIoc,False,author_880,2026-05-26T15:28:08Z,2026-05-26T15:28:08Z,2,"Elkann è andato. Ogni famiglia sale, ogni famiglia scende. La ruota gira.",,0,repubblica,author_880
Ugzj0zuWeW6jLuLP2at4AaABAg,,L9I8Fg3ZIoc,False,author_880,2026-05-26T15:28:37Z,2026-05-26T15:28:37Z,10,Togliete i soldi agli incapaci.,,0,repubblica,author_880
Ugzrk-QQUgvAnPWXkYp4AaABAg,,L9I8Fg3ZIoc,False,author_881,2026-05-26T15:28:55Z,2026-05-26T15:28:55Z,1,Ma Encület !!,,0,repubblica,author_881
UgwsLyYYyiZEsYGUDrZ4AaABAg,,L9I8Fg3ZIoc,False,author_880,2026-05-26T15:28:57Z,2026-05-26T15:28:57Z,2,Avere il cognome non basta.,,0,repubblica,author_880
UgxotRVawjphanAqn1V4AaABAg,,L9I8Fg3ZIoc,False,author_882,2026-05-26T15:35:15Z,2026-05-26T15:35:15Z,0,La prima carica dello stato non eletta dal popolo non è stata di grande aiuto,,0,repubblica,author_882
UgxRgR3uMKBFyKBtBlB4AaABAg,,L9I8Fg3ZIoc,False,author_883,2026-05-26T15:35:33Z,2026-05-26T15:35:33Z,5,"Finché ci sarà Elkann, questi sono i risultati. Alfa Romeo Lancia e Maserati stanno morendo grazie a lui 🤮🤮🤮🤮",,0,repubblica,author_883
Ugyv4gs8jJzOchtFKDB4AaABAg,,L9I8Fg3ZIoc,False,author_884,2026-05-26T15:37:54Z,2026-05-26T15:37:54Z,0,"Chi ve muort e chi ve stramuort avete ucciso la ferrari, avete profanato il suo stile idioti di stocazzo",,0,repubblica,author_884
UgxjARPjhfstBI8Yz1F4AaABAg,,L9I8Fg3ZIoc,False,author_885,2026-05-26T15:38:35Z,2026-05-26T15:38:35Z,195,Dove ci sono gli elkann c'è distruzione,,0,repubblica,author_885
Ugwwom6Hn6CvkCPcNPd4AaABAg,,L9I8Fg3ZIoc,False,author_773,2026-05-26T15:38:44Z,2026-05-26T15:38:44Z,4,Fine del mito.,,0,repubblica,author_773
UgyX8Y8dCqnxoxbpAe14AaABAg,,L9I8Fg3ZIoc,False,author_134,2026-05-26T15:40:42Z,2026-05-26T15:40:42Z,0,Fa proprio cagare,,0,repubblica,author_134
UgzR8uauBzNP38-Ia6N4AaABAg,,L9I8Fg3ZIoc,False,author_886,2026-05-26T15:42:05Z,2026-05-26T15:42:05Z,0,Mai visto una macchina più brutta di questa....sto rivalutando la nuova lancia Ypsilon e la fiat duna..,,0,repubblica,author_886
UgzcvNuyelnSoPZ9T1h4AaABAg,,L9I8Fg3ZIoc,False,author_887,2026-05-26T15:42:07Z,2026-05-26T15:42:07Z,0,Bellissima come la Juventus😂😂😂😂,,0,repubblica,author_887
UgyuaiAkNFw14lqLzPZ4AaABAg,,L9I8Fg3ZIoc,False,author_888,2026-05-26T15:42:39Z,2026-05-26T15:42:39Z,0,Una Ferrari elettrica!!! Si è proprio girato il mondo.... Ee si gira nella tomba anche il sig ferrari,,0,repubblica,author_888
Ugyx6YReEYX8aECbFHV4AaABAg,,L9I8Fg3ZIoc,False,author_889,2026-05-26T15:51:25Z,2026-05-26T15:51:25Z,77,Almeno abbiate la Decenza di togliere lo stemma Ferrari...,,0,repubblica,author_889
UgxBdEqu4l_REg0J6X94AaABAg,,L9I8Fg3ZIoc,False,author_890,2026-05-26T15:53:24Z,2026-05-26T15:53:24Z,0,"Inguardabile,non degna di montare lo stemma del Cavallino",,0,repubblica,author_890
UgxEMnWUk8fhCLeBUZV4AaABAg,,L9I8Fg3ZIoc,False,author_889,2026-05-26T15:55:16Z,2026-05-26T15:55:16Z,0,Luca Cordero di Montezemolo nell' intervista si è vergognato che questo cess... di macchina abbia il marchio Ferrari...,,0,repubblica,author_889
Ugy-Sd0AenKvo-5GnlN4AaABAg,,L9I8Fg3ZIoc,False,author_775,2026-05-26T15:57:36Z,2026-05-26T15:57:36Z,1,E' un po' un coloraccio da vecchio pensionato.... potevano fare un colore alternativo....e che cazz... già elettrica non si può sentire...🤷🏻♀️🤦🏻♀️,,0,repubblica,author_775
UgxyzKuMAByQIZJkR8R4AaABAg.AXGzGRFRGZ1AXHCYy4E5qY,UgxyzKuMAByQIZJkR8R4AaABAg,L9I8Fg3ZIoc,True,author_891,2026-05-26T15:59:55Z,2026-05-26T15:59:55Z,8,meriterebbe di perdere il 90 %,UgxyzKuMAByQIZJkR8R4AaABAg,1,repubblica,author_891
UgzxlPeAueKGJyS7gwR4AaABAg,,L9I8Fg3ZIoc,False,author_889,2026-05-26T16:07:00Z,2026-05-26T16:07:00Z,0,"Sapete quanto costa questo tombino marchiato Ferrari? 550.000 mila euri !!!! Vergognati Elkan!!!! Riporta in Italia tutti i soldi che ti sei portato in Olanda, e qui in Italia hai venduto tutto!!!",,0,repubblica,author_889
UgxNl2YKDEM5fRRkdR14AaABAg,,L9I8Fg3ZIoc,False,author_892,2026-05-26T16:08:29Z,2026-05-26T16:08:29Z,0,Che vomito.,,0,repubblica,author_892
UgwM6AOHQCrLe8dyxkh4AaABAg,,L9I8Fg3ZIoc,False,author_893,2026-05-26T16:18:28Z,2026-05-26T16:18:28Z,6,"Mattarella: ""bella merda""",,0,repubblica,author_893
Ugzw4MqwYmoQHFRO0AN4AaABAg,,L9I8Fg3ZIoc,False,author_894,2026-05-26T16:26:42Z,2026-05-26T16:26:42Z,0,"Che cesso , maledetto Elkan e chi la disegnata",,0,repubblica,author_894
Ugx2ejetsZpZ4I4WtXt4AaABAg,,L9I8Fg3ZIoc,False,author_895,2026-05-26T16:28:39Z,2026-05-26T16:28:39Z,1,Che dolore dittemi che non è vero,,0,repubblica,author_895
UgxO4klCXbX5B075m4h4AaABAg,,L9I8Fg3ZIoc,False,author_896,2026-05-26T16:33:41Z,2026-05-26T16:33:41Z,0,"Sta famiglia di ladri sfruttatori, indegni.",,0,repubblica,author_896
UgyWqXlNz9EIUlAdSJd4AaABAg,,L9I8Fg3ZIoc,False,author_897,2026-05-26T16:33:58Z,2026-05-26T16:33:58Z,152,Qui viene scritto il periodo più basso e nero per la Ferrari e l'Italia 🇮🇹,,0,repubblica,author_897
Ugy1_Pgp6G6tK4KDt_Z4AaABAg,,L9I8Fg3ZIoc,False,author_898,2026-05-26T16:39:15Z,2026-05-26T16:39:15Z,8,Italia a rotoli,,0,repubblica,author_898
