comment_id,parent_comment_id,video_id,is_reply,author,published_at,updated_at,like_count,text,inferred_parent_id,depth,newspaper,author_anon
UgzHEyaCfUuvZTw3LzF4AaABAg.AXEVLNT9VnFAXGRmKG53cl,UgzHEyaCfUuvZTw3LzF4AaABAg,yyooDzr0s8I,True,author_2214,2026-05-26T08:53:42Z,2026-05-26T08:53:42Z,0,E perchè gli italiani chi elegge 😂😂?,UgzHEyaCfUuvZTw3LzF4AaABAg,1,repubblica,author_2214
UgyT7LshxxEcUuvLhC54AaABAg,,yyooDzr0s8I,False,author_145,2026-05-26T09:43:41Z,2026-05-26T09:43:41Z,0,"La sinistra prende i voti degli islamici. Così vi mettono una busta di piscio in testa (come già avviene in città europee). Adesso ridete, teste di cazzo 😂😂😂",,0,repubblica,author_145
Ugzjiso4miDcG8xYio14AaABAg,,yyooDzr0s8I,False,author_2215,2026-05-26T10:30:06Z,2026-05-26T10:30:06Z,0,l'Arabia Saudita vi può aiutare...,,0,repubblica,author_2215
UgzrApejk29GTKC6Qch4AaABAg,,yyooDzr0s8I,False,author_2216,2026-05-26T10:46:51Z,2026-05-26T10:46:51Z,0,Il problema è che Israele è marcio ed è diventato uno stato superterrorista,,0,repubblica,author_2216
UgxCKo5xbi7LaBnLMk54AaABAg,,yyooDzr0s8I,False,author_2217,2026-05-26T11:23:06Z,2026-05-26T11:23:06Z,0,Israele é un avanposto colonial. non dovrebbe essere li,,0,repubblica,author_2217
Ugz39cNi1zy3A9cuW594AaABAg.AXFfBtrIqMaAXGoLiicwSb,Ugz39cNi1zy3A9cuW594AaABAg.AXFfBtrIqMaAXGGiOXIRBR,yyooDzr0s8I,True,author_24,2026-05-26T12:19:39Z,2026-05-26T12:19:39Z,0,"@user islamici seguono la Sharia non li puoi integrare, loro la donna deve essere sottomessa, e magari anche chi ha il culto religioso diverso. Io la vedo così può darsi pure che mi sbaglo",Ugz39cNi1zy3A9cuW594AaABAg.AXFfBtrIqMaAXGGiOXIRBR,2,repubblica,author_24
Ugz39cNi1zy3A9cuW594AaABAg.AXFfBtrIqMaAXGtzOwJja6,Ugz39cNi1zy3A9cuW594AaABAg.AXFfBtrIqMaAXGoLiicwSb,yyooDzr0s8I,True,author_2208,2026-05-26T13:08:53Z,2026-05-26T13:08:53Z,1,"@author_24 i miei figli sono andati a scuola con ragazzi musulmani che vivendo nel nostro paese hanno acquisito la nostra cultura sottraendosi del tutto o in parte ad alcune idee dei genitori, mentre noi conoscendoli abbiamo capito che anche con le loro idee non erano affatto dei mostri.",Ugz39cNi1zy3A9cuW594AaABAg.AXFfBtrIqMaAXGoLiicwSb,3,repubblica,author_2208
UgwSZf3fFzuYNwlWXOJ4AaABAg,,yyooDzr0s8I,False,author_2218,2026-05-26T13:17:58Z,2026-05-26T13:17:58Z,0,Io non ho mai visto in Italia centinaia e neppure decine di italo/istraeliani marciare contro la politica di Israele anzi mi pare che le comunità’ soprattutto quella di Roma siano molto allineate al progetto sionista,,0,repubblica,author_2218
UgzaTooFaF6M97qSKNB4AaABAg,,yyooDzr0s8I,False,author_1570,2026-05-26T14:24:01Z,2026-05-26T14:24:01Z,1,"Quando ero piccolo,parlo di 75 anni fa,spesso mi capitava di sentire ,quando due persone litigavano per problemi di soldi,uno diceva all' altro, una frase che mi è rimasta impressa nella mente:""Si pegg' d n'ebrej""Sei peggio di un ebreo. All' inizio del novecento nella città antica di Taranto c'erano delle famiglie ebrei che,forse non trovandosi a loro agio ,presto smammarono,per nostra fortuna.E'un popolo che non stanno bene con nessuno.Sono delle sette molto aggressive e violente.Dal1948 ad oggi hanno solo pensato ad armarsi e addestrarsi con l' intento di eliminare popoli pacifici e impossessarsi delle loro terre ed averi.Non li stiamo fermando,anzi li amiamo e appoggiamo le loro azioni.Facciamo proprio schifo.😮😮",,0,repubblica,author_1570
UgxsyK5aOgcE8mFZG-J4AaABAg,,yyooDzr0s8I,False,author_2219,2026-05-26T14:26:46Z,2026-05-26T14:26:46Z,0,80 % degli Israeliani sono per Natanyahu. Circondato di terroristi che devono fare ? Invitarli per il caffè,,0,repubblica,author_2219
UgxXjFX_QRkHXWIsKz94AaABAg,,yyooDzr0s8I,False,author_2220,2026-05-26T14:51:55Z,2026-05-26T14:51:55Z,0,Purtroppo....Il 90 % dei sionisti israeliani sono Ben Gvir. Alla luce dei fatti odierni e passati e’ la triste e paurosa Verità.,,0,repubblica,author_2220
UgyIQG3otst5LzMJjf14AaABAg.AXDzSHESksKAXHP7219-XM,UgyIQG3otst5LzMJjf14AaABAg.AXDzSHESksKAXGHNCz7nQS,yyooDzr0s8I,True,author_2186,2026-05-26T17:49:41Z,2026-05-26T17:49:41Z,0,@author_2208 In questo caso non si tratta di stare dalla parte del più forte. Si tratta di stare dalla parte della civiltà.,UgyIQG3otst5LzMJjf14AaABAg.AXDzSHESksKAXGHNCz7nQS,3,repubblica,author_2186
UgylpA8R4iDT_j2QY9N4AaABAg,,yyooDzr0s8I,False,author_2221,2026-05-26T17:49:53Z,2026-05-26T17:49:53Z,0,Disgrazia nazionale sono trasmissioni come questa. Sono 2000 anni che ci rompete le palle antisemiti della malora,,0,repubblica,author_2221
UgxHlOimnJwoiqIYK2B4AaABAg,,yyooDzr0s8I,False,author_2221,2026-05-26T17:51:41Z,2026-05-26T17:51:41Z,0,Infami bugiardi,,0,repubblica,author_2221
Ugy8ANjEVoQ17mLAZxN4AaABAg,,yyooDzr0s8I,False,author_2222,2026-05-26T17:57:46Z,2026-05-26T17:57:46Z,0,Il 90% degli israeliani appoggiano questo governo d nazisti,,0,repubblica,author_2222
UgyIQG3otst5LzMJjf14AaABAg.AXDzSHESksKAXHX_F9Odm7,UgyIQG3otst5LzMJjf14AaABAg.AXDzSHESksKAXGHNCz7nQS,yyooDzr0s8I,True,author_2208,2026-05-26T19:03:36Z,2026-05-26T19:03:36Z,0,"@author_2186 su questo concordo, non sono d'accordo sul tuo concetto di civiltà",UgyIQG3otst5LzMJjf14AaABAg.AXDzSHESksKAXHP7219-XM,4,repubblica,author_2208
Ugz39cNi1zy3A9cuW594AaABAg.AXFfBtrIqMaAXHeiuUKlBv,Ugz39cNi1zy3A9cuW594AaABAg,yyooDzr0s8I,True,author_2212,2026-05-26T20:14:48Z,2026-05-26T20:14:48Z,0,"@user non è affatto esattamente così... Riguardo il musulmano (molto meno esasperato con il passare del tempo)non si può dire che la donna sia sottomessa perché, ad esempio, per la gestione della casa e dei soldi ha il potere quasi totale sull'uomo.. Non è che una donna musulmana sta' là a prendere calci in culo dalla mattina alla sera ma svolge un ruolo che può essere paragonabile a quello che avevano le nostre nonne... Tuttavia l'uomo è obbligato al mantenimento.. In mancanza di questo, il divorzio è immediato... Anche per il non adempimento del dovere coniugale (se non la scopa, insomma), c'è il divorzio immediato... E per ""immediato"" si intende proprio subito.. Non come da noi che devi aspettare il periodo di riconciliazione e comunque non ci si può più risposare in chiesa.. No... là decade con decorrenza immediata e la donna si può anche risposare subito... La convivenza come la concepiamo noi è proibita ma si può vivere con una donna senza essere sposati a patto che, in caso di controllo, si possa dimostrare di vivere in camere separate(poi di notte fai come ti pare, ovviamente)... Prima del matrimonio, l'uomo ha l'obbligo di dimostrare di poter mantenere economicamente la moglie, altrimenti non se ne fa' niente... E potrei stare fino a domattina a spiegare cose (sono stato sposato con una musulmana e qualcosa so')ma la percezione di sopraffazione che da noi si ha sulla donna musulmana è totalmente sbagliato.. Poi è chiaro che trovi il matto che accoppa una donna...come anche da noi... Ma ti becchi l'ergastolo ed il alcuni paesi anche la pena di morte, cosa che da noi invece non avviene...",Ugz39cNi1zy3A9cuW594AaABAg,1,repubblica,author_2212
UgxNvKLKARqFXGH0qcF4AaABAg,,yyooDzr0s8I,False,author_2223,2026-05-26T21:52:37Z,2026-05-26T21:52:37Z,0,israele è un'entità genocidaria terrorista che pratica apartheid.,,0,repubblica,author_2223
UgzJ1xt8VI8MT6ptd6V4AaABAg,,yyooDzr0s8I,False,author_2224,2026-05-26T22:42:04Z,2026-05-26T22:42:04Z,0,Ma state scherzando vero?? Ma chi volete persuadere o far credere. Cerchiamo di nn essere ipocriti e accettiamo che ci sono assassini e genocidiari come è Israele ed il governo...,,0,repubblica,author_2224
UgxPyt1BB1wjOtjJUJ14AaABAg.AXDsJMll1yeAXEmjgwPRP9,UgxPyt1BB1wjOtjJUJ14AaABAg.AXDsJMll1yeAXEWmIqp71J,yyooDzr0s8I,True,author_2186,2026-05-27T00:00:00+00:00,,1,@author_2150 Si. Il terrorismo palestinese e il terrorismo islamico sono ripugnanti.,UgxPyt1BB1wjOtjJUJ14AaABAg.AXDsJMll1yeAXEWmIqp71J,3,repubblica,author_2186
UgxZR4n4-_ju9bSFB9B4AaABAg.AXDqdBeXB8fAXG91e4xXGI,UgxZR4n4-_ju9bSFB9B4AaABAg.AXDqdBeXB8fAXEKrx7WbKK,yyooDzr0s8I,True,author_2225,2026-05-27T00:00:00+00:00,,1,"@author_2186 lo sappiamo, non è difficile capire il perché.",UgxZR4n4-_ju9bSFB9B4AaABAg.AXDqdBeXB8fAXEKrx7WbKK,2,repubblica,author_2225
UgzFXexVlAmw-8BkyuB4AaABAg.AXDvLReX2EGAXGFcdHWAIY,UgzFXexVlAmw-8BkyuB4AaABAg.AXDvLReX2EGAXE8b615p82,yyooDzr0s8I,True,author_2208,2026-05-27T00:00:00+00:00,,0,"@author_2179 siamo comunque parte dell'UE, non ci possiamo certo aspettare che se cambia il governo mandiamo i nostri 4 militari a fare la guerra a Israele, però voglio sperare che qualcuno almeno prenderebbe una posizione netta e provvedimenti economici",UgzFXexVlAmw-8BkyuB4AaABAg.AXDvLReX2EGAXE8b615p82,3,repubblica,author_2208
UgxPyt1BB1wjOtjJUJ14AaABAg.AXDsJMll1yeAXF45-PuCuj,UgxPyt1BB1wjOtjJUJ14AaABAg.AXDsJMll1yeAXE19n47mUl,yyooDzr0s8I,True,author_584,2026-05-27T00:00:00+00:00,,0,"Non dire sciocchezze, non c'è paragone!",UgxPyt1BB1wjOtjJUJ14AaABAg.AXDsJMll1yeAXE19n47mUl,2,repubblica,author_584
UgzFXexVlAmw-8BkyuB4AaABAg.AXDvLReX2EGAXEws9revA6,UgzFXexVlAmw-8BkyuB4AaABAg,yyooDzr0s8I,True,author_2196,2026-05-27T00:00:00+00:00,,2,"Non si capisce niente, sei contro la Meloni, contro la Schlein, contro Grossmann, contro tutti???",UgzFXexVlAmw-8BkyuB4AaABAg,1,repubblica,author_2196
UgxPyt1BB1wjOtjJUJ14AaABAg.AXDsJMll1yeAXGC8XHrAcw,UgxPyt1BB1wjOtjJUJ14AaABAg.AXDsJMll1yeAXE6lnRDlzA,yyooDzr0s8I,True,author_2208,2026-05-27T00:00:00+00:00,,0,"@author_2150 lei ha ragione, ma è comunque una cosa terribile che non sarebbe dovuta avvenire. Ne gli ucraini ne i palestinesi meritano tutto ciò. Mi spingo oltre: nemmeno gli ebrei meritano di essere manipolati dalla propaganda dell'odio con cui vengono indottrinati ogni giorno. Sono grata a chi di loro coraggiosamente dice basta.",UgxPyt1BB1wjOtjJUJ14AaABAg.AXDsJMll1yeAXE6lnRDlzA,3,repubblica,author_2208
UgxPyt1BB1wjOtjJUJ14AaABAg.AXDsJMll1yeAXGCL0rAoA2,UgxPyt1BB1wjOtjJUJ14AaABAg.AXDsJMll1yeAXEL8efgVUo,yyooDzr0s8I,True,author_2208,2026-05-27T00:00:00+00:00,,0,"@author_2186 dio ce ne scampi, come fai a essere così sciocco?",UgxPyt1BB1wjOtjJUJ14AaABAg.AXDsJMll1yeAXEL8efgVUo,2,repubblica,author_2208
UgxPyt1BB1wjOtjJUJ14AaABAg.AXDsJMll1yeAXF0Fzofw9A,UgxPyt1BB1wjOtjJUJ14AaABAg.AXDsJMll1yeAXEWmIqp71J,yyooDzr0s8I,True,author_2150,2026-05-27T00:00:00+00:00,,3,"@author_2186 Netanyahu ha assoldato gruppi Isis in funzione antihamas lo scorso anno, esattamente come in passato aveva assoldato, in contrapposizione all'Olp, proprio Hamas! Molti ministri israeliani e perfino lo stesso Netanyahu hanno sì un glorioso passato da terroristi. Ripugnanti terroristi che non si nascondono neanche oggi nel pieno di un genocidio in mondovisione!",UgxPyt1BB1wjOtjJUJ14AaABAg.AXDsJMll1yeAXEWmIqp71J,3,repubblica,author_2150
UgxPyt1BB1wjOtjJUJ14AaABAg.AXDsJMll1yeAXG9F2rg7Pd,UgxPyt1BB1wjOtjJUJ14AaABAg.AXDsJMll1yeAXE19n47mUl,yyooDzr0s8I,True,author_2225,2026-05-27T00:00:00+00:00,,0,@user non ha capito del fatto che si può essere contro tutte le violenze?,UgxPyt1BB1wjOtjJUJ14AaABAg.AXDsJMll1yeAXE19n47mUl,2,repubblica,author_2225
Ugwv-CRsYXXK7USBcwV4AaABAg,,yyooDzr0s8I,False,author_2226,2026-05-27T05:33:51Z,2026-05-27T05:33:51Z,0,Siete tutti cosi` israele deve sparire dalla faccia della Terra!,,0,repubblica,author_2226
UgwwA0roJzEMqUjFrfp4AaABAg,,yyooDzr0s8I,False,author_2227,2026-05-27T06:16:24Z,2026-05-27T06:16:24Z,0,Il problema non è Ben Gvir tutti ebrei sono peggio di lui,,0,repubblica,author_2227
UgxLqc1Wmq9oKTLIK_J4AaABAg.AXGPAhrQRF0AXJOn6OrD88,UgxLqc1Wmq9oKTLIK_J4AaABAg,yyooDzr0s8I,True,author_54,2026-05-27T12:25:19Z,2026-05-27T12:25:19Z,0,"Ma falla finita tu, ridicolo!",UgxLqc1Wmq9oKTLIK_J4AaABAg,1,repubblica,author_54
UgxaEd2RAy9Zc1WhEc14AaABAg,,yyooDzr0s8I,False,author_54,2026-05-27T12:27:55Z,2026-05-27T12:27:55Z,0,Ma smettetela di puntare il ditino! Specchiatevi a questo intellettuale israeliano che ha il coraggio di parlare contro la politica del suo paese e lo fa da sempre! Vergognatevi,,0,repubblica,author_54
UgyG202o2ORE579cW9d4AaABAg.AXFLJdkrS6nAXJnCFy6VnM,UgyG202o2ORE579cW9d4AaABAg,yyooDzr0s8I,True,author_2228,2026-05-27T16:07:20Z,2026-05-27T16:07:20Z,0,"Che significa ""meglio nulla da cena""?",UgyG202o2ORE579cW9d4AaABAg,1,repubblica,author_2228
UgzaKskYxkLm9rqS_OZ4AaABAg,,yyooDzr0s8I,False,author_2229,2026-05-27T16:08:34Z,2026-05-27T16:08:34Z,0,Il vostro presidente firmava le bombe.,,0,repubblica,author_2229
UgyG202o2ORE579cW9d4AaABAg.AXFLJdkrS6nAXJvQcEy3yL,UgyG202o2ORE579cW9d4AaABAg.AXFLJdkrS6nAXJnCFy6VnM,yyooDzr0s8I,True,author_2203,2026-05-27T17:19:12Z,2026-05-27T17:19:12Z,0,@author_2228 significa che ..dovendo scegliere ..è preferibile non avere niente da mangiare ..prima di avere a che fare con loro. ..meglio nulla da cena.,UgyG202o2ORE579cW9d4AaABAg.AXFLJdkrS6nAXJnCFy6VnM,2,repubblica,author_2203
UgyxYO3DtT4eX9YjO-x4AaABAg,,yyooDzr0s8I,False,author_2230,2026-05-27T18:05:04Z,2026-05-27T18:05:04Z,0,Dove sono questi fiumi di gente che ogni sabato si oppone a Netanyahu?,,0,repubblica,author_2230
UgyG202o2ORE579cW9d4AaABAg.AXFLJdkrS6nAXK2ehVFFUg,UgyG202o2ORE579cW9d4AaABAg,yyooDzr0s8I,True,author_2231,2026-05-27T18:31:10Z,2026-05-27T18:31:10Z,0,Si ma non fanno un cazzo per fermarli.,UgyG202o2ORE579cW9d4AaABAg,1,repubblica,author_2231
UgyhfA-rvODydFrj2614AaABAg.AXDstpN72qdAXHQQci8yhp,UgyhfA-rvODydFrj2614AaABAg.AXDstpN72qdAXGEXiOwWdJ,yyooDzr0s8I,True,author_2186,2026-05-28T00:00:00+00:00,,0,@author_2208 Tutti chi? 😂 L'estrema destra è in crescita ovunque. In uk e Germania vengono assaltate le moschee e si scende in piazza contro l'immigrazione e i sostenitori dei palestinesi. Quindi questi TUTTI voi indignati chi sareste? I 4 gatti che scendono in piazza? O qualche indignato sui social?,UgyhfA-rvODydFrj2614AaABAg.AXDstpN72qdAXGEXiOwWdJ,3,repubblica,author_2186
UgxPyt1BB1wjOtjJUJ14AaABAg.AXDsJMll1yeAXHPcJwXs1-,UgxPyt1BB1wjOtjJUJ14AaABAg.AXDsJMll1yeAXHHlOLXSyO,yyooDzr0s8I,True,author_2186,2026-05-28T00:00:00+00:00,,0,"@author_2232 Nasce perché esiste una cultura assassina e mediovale basata su un'ideologia totalmente agli antipodi rispetto ai diritti umani, all'illuminismo e ad ogni forma di secolarizzazione.",UgxPyt1BB1wjOtjJUJ14AaABAg.AXDsJMll1yeAXHHlOLXSyO,3,repubblica,author_2186
UgxPyt1BB1wjOtjJUJ14AaABAg.AXDsJMll1yeAXHHlOLXSyO,UgxPyt1BB1wjOtjJUJ14AaABAg.AXDsJMll1yeAXEL8efgVUo,yyooDzr0s8I,True,author_2232,2026-05-28T00:00:00+00:00,,0,@author_2186 sai cosa è il terrorismo e perché tale fenomeno nasce?,UgxPyt1BB1wjOtjJUJ14AaABAg.AXDsJMll1yeAXEL8efgVUo,2,repubblica,author_2232
UgxPyt1BB1wjOtjJUJ14AaABAg.AXDsJMll1yeAXHOq4_HCtT,UgxPyt1BB1wjOtjJUJ14AaABAg.AXDsJMll1yeAXEWmIqp71J,yyooDzr0s8I,True,author_2186,2026-05-28T00:00:00+00:00,,0,@author_2150 Quale genocidio? Quello che esiste solo nelle vostre teste? 😂,UgxPyt1BB1wjOtjJUJ14AaABAg.AXDsJMll1yeAXF0Fzofw9A,4,repubblica,author_2186
UgxPyt1BB1wjOtjJUJ14AaABAg.AXDsJMll1yeAXHQ-jD_gm8,UgxPyt1BB1wjOtjJUJ14AaABAg.AXDsJMll1yeAXETMdYVbIu,yyooDzr0s8I,True,author_2186,2026-05-28T00:00:00+00:00,,0,"@author_2190 Si. La differenza tra combattere per abbattere un sistema totalitario e una dittatura, e uccidere a caso per imporre un regime totalitario basato sul fondamentalismo religioso. Ecco la differenza. Combattere per la libertà e la democrazia rende partigiani. Il terrorismo palestinese uccide in nome del martirio, per sterminare gli ebrei e imporre un sistema nazistoide, totalitario in antitesi con la libertà e la laicità.",UgxPyt1BB1wjOtjJUJ14AaABAg.AXDsJMll1yeAXETMdYVbIu,3,repubblica,author_2186
UgxZR4n4-_ju9bSFB9B4AaABAg.AXDqdBeXB8fAXIsX1fdcu7,UgxZR4n4-_ju9bSFB9B4AaABAg.AXDqdBeXB8fAXG91e4xXGI,yyooDzr0s8I,True,author_2233,2026-05-28T00:00:00+00:00,,0,"@author_2186 ignoranza a mille. L'occidente colonialista ha invaso e attaccato e non è il contrario, ti lamenti perché poi la gente si incazza e ti viene a cercare ?",UgxZR4n4-_ju9bSFB9B4AaABAg.AXDqdBeXB8fAXG91e4xXGI,3,repubblica,author_2233
UgxZR4n4-_ju9bSFB9B4AaABAg.AXDqdBeXB8fAXHPEwlz0Wz,UgxZR4n4-_ju9bSFB9B4AaABAg.AXDqdBeXB8fAXG91e4xXGI,yyooDzr0s8I,True,author_2186,2026-05-28T00:00:00+00:00,,0,@author_2225 Perché l'islam uccide e insanguina l'europa da secoli e ancora di più da decenni con stragi e attentati. Ecco perché.,UgxZR4n4-_ju9bSFB9B4AaABAg.AXDqdBeXB8fAXG91e4xXGI,3,repubblica,author_2186
UgyhfA-rvODydFrj2614AaABAg.AXDstpN72qdAXHXNAvxlpk,UgyhfA-rvODydFrj2614AaABAg.AXDstpN72qdAXGEXiOwWdJ,yyooDzr0s8I,True,author_2208,2026-05-28T00:00:00+00:00,,0,@author_2186 intanto delle cose che hai descritto non c'è da andare per niente fieri. Poi comunque le hai viste le manifestazioni? Altro che 4 gatti,UgyhfA-rvODydFrj2614AaABAg.AXDstpN72qdAXGEXiOwWdJ,3,repubblica,author_2208
UgxZR4n4-_ju9bSFB9B4AaABAg.AXDqdBeXB8fAXJoCkGWDwJ,UgxZR4n4-_ju9bSFB9B4AaABAg.AXDqdBeXB8fAXE-lXinCwh,yyooDzr0s8I,True,author_2228,2026-05-28T00:00:00+00:00,,0,@user Italia malgrado e nonostante le criminalità organizzate che si sono infilate nei palazzi di potere rappresentate dagli stessi politici in ruoli istituzionali con sta maggioranza felicemente sotto gli stivali degli isramericani ha una popolazione che quando si tratta di genocidio sulle popolazioni civili di mezzo medio oriente e non solo pulizia etnica territori occupati per la maggioranza lo sa da che parte stare!!!,UgxZR4n4-_ju9bSFB9B4AaABAg.AXDqdBeXB8fAXE-lXinCwh,2,repubblica,author_2228
