comment_id,parent_comment_id,video_id,is_reply,author,published_at,updated_at,like_count,text,inferred_parent_id,depth,newspaper,author_anon
Ugz5GWus8rHwSyFtTqR4AaABAg.AXDz1xAeI3dAXELmDnNT9S,Ugz5GWus8rHwSyFtTqR4AaABAg,yyooDzr0s8I,True,author_2186,2026-05-25T13:22:47Z,2026-05-25T13:22:47Z,1,😂😂😂,Ugz5GWus8rHwSyFtTqR4AaABAg,1,repubblica,author_2186
Ugz5GWus8rHwSyFtTqR4AaABAg.AXDz1xAeI3dAXELp8QKbKz,Ugz5GWus8rHwSyFtTqR4AaABAg,yyooDzr0s8I,True,author_2186,2026-05-25T13:23:10Z,2026-05-25T13:23:46Z,1,Quale mondo? Il tuo? O quello dei propal? 😂 Una buona parte del mondo è dalla parte di israele. Dovete farvene una ragione.,Ugz5GWus8rHwSyFtTqR4AaABAg,1,repubblica,author_2186
Ugxypd2veSZ6GnAjqBR4AaABAg.AXE-ofWRk8rAXELw4RXH_P,Ugxypd2veSZ6GnAjqBR4AaABAg,yyooDzr0s8I,True,author_2186,2026-05-25T13:24:07Z,2026-05-25T13:24:07Z,0,😂😂😂,Ugxypd2veSZ6GnAjqBR4AaABAg,1,repubblica,author_2186
UgyIQG3otst5LzMJjf14AaABAg.AXDzSHESksKAXEM1zDcxLN,UgyIQG3otst5LzMJjf14AaABAg,yyooDzr0s8I,True,author_2186,2026-05-25T13:25:04Z,2026-05-25T13:25:04Z,2,E hanno continuato a stare con i palestinesi. Come il regime fascista e gli alleati nazisti,UgyIQG3otst5LzMJjf14AaABAg,1,repubblica,author_2186
UgybN8UYT0M8olPrnpZ4AaABAg.AXDyq28-V6AAXEMBOoYeqx,UgybN8UYT0M8olPrnpZ4AaABAg,yyooDzr0s8I,True,author_2186,2026-05-25T13:26:21Z,2026-05-25T13:26:21Z,0,La normalità ci sarà quando i palestinesi Smetteranno di uccidere invocando allah.,UgybN8UYT0M8olPrnpZ4AaABAg,1,repubblica,author_2186
Ugyws1Q3ONJyapzIYjt4AaABAg.AXDxH3pc7TaAXEMzivfYPO,Ugyws1Q3ONJyapzIYjt4AaABAg,yyooDzr0s8I,True,author_2186,2026-05-25T13:33:21Z,2026-05-25T13:33:21Z,0,Perché sono circondati da popoli islamici 😂,Ugyws1Q3ONJyapzIYjt4AaABAg,1,repubblica,author_2186
UgyUMo7cABLtoOVvomJ4AaABAg,,yyooDzr0s8I,False,author_2187,2026-05-25T13:57:40Z,2026-05-25T13:57:40Z,1,Non si sente il piangente violoncello Il genocidio non è una calamità naturale,,0,repubblica,author_2187
Ugz-0iB1b1sqALZUInx4AaABAg,,yyooDzr0s8I,False,author_2188,2026-05-25T14:02:33Z,2026-05-25T14:02:33Z,17,Intanto a morire sono solo i palestinesi,,0,repubblica,author_2188
UgxG1-lzMy8d6KC7y6F4AaABAg,,yyooDzr0s8I,False,author_2189,2026-05-25T14:24:15Z,2026-05-25T14:24:15Z,0,Stop avete finito Justo sarà la sparizione dei EB REY,,0,repubblica,author_2189
Ugzv15C2ju1Fs9YCk5J4AaABAg,,yyooDzr0s8I,False,author_2190,2026-05-25T14:28:09Z,2026-05-25T14:28:09Z,0,"Ma per cortesia, è una democrazia sì o no ? Sono tutti d'accordo....",,0,repubblica,author_2190
UgxPyt1BB1wjOtjJUJ14AaABAg.AXDsJMll1yeAXETMdYVbIu,UgxPyt1BB1wjOtjJUJ14AaABAg.AXDsJMll1yeAXEL8efgVUo,yyooDzr0s8I,True,author_2190,2026-05-25T14:29:03Z,2026-05-25T14:29:03Z,4,@user la differenza tra resistenza e terrorismo ?,UgxPyt1BB1wjOtjJUJ14AaABAg.AXDsJMll1yeAXEL8efgVUo,2,repubblica,author_2190
UgzHEyaCfUuvZTw3LzF4AaABAg,,yyooDzr0s8I,False,author_2191,2026-05-25T14:46:22Z,2026-05-25T14:46:22Z,5,Gli Israeliani sono una democrazia che elegge delinquenti .,,0,repubblica,author_2191
Ugzv15C2ju1Fs9YCk5J4AaABAg.AXETG3ITu4sAXEVYeHu_Xa,Ugzv15C2ju1Fs9YCk5J4AaABAg,yyooDzr0s8I,True,author_2191,2026-05-25T14:48:10Z,2026-05-25T14:48:10Z,0,Nessuno ha imposto loro il governo che hanno,Ugzv15C2ju1Fs9YCk5J4AaABAg,1,repubblica,author_2191
Ugxvg9KCRZ9zFOrJMHp4AaABAg,,yyooDzr0s8I,False,author_591,2026-05-25T15:01:53Z,2026-05-25T15:01:53Z,0,"Non ci crede nemmeno lui! La maggioranza degli israeliani sono peggiori dei NAZISTI. Le comunità ebraiche hanno fatto finta di non sapere e non vedere e questo la dice lunga, molto lunga.",,0,repubblica,author_591
UgzaOwDrgIoLFLaoy8R4AaABAg,,yyooDzr0s8I,False,author_2192,2026-05-25T15:04:31Z,2026-05-25T15:04:31Z,0,Uomo saggio,,0,repubblica,author_2192
UgyxmD9QKRhRmLVrsgJ4AaABAg.AXDqeg7GcytAXEfJiy3uLb,UgyxmD9QKRhRmLVrsgJ4AaABAg.AXDqeg7GcytAXDt4mD5E2e,yyooDzr0s8I,True,author_2146,2026-05-25T16:22:15Z,2026-05-25T16:22:57Z,0,@user non sono tutti amici o clienti di Israele....?!?!,UgyxmD9QKRhRmLVrsgJ4AaABAg.AXDqeg7GcytAXDt4mD5E2e,2,repubblica,author_2146
UgylnyltgQg27ikd6ul4AaABAg.AXDupi_QM_8AXEiYTMJuSO,UgylnyltgQg27ikd6ul4AaABAg,yyooDzr0s8I,True,author_2193,2026-05-25T16:50:29Z,2026-05-25T16:50:29Z,2,Non era Spagna ma Paesi Baschi che sono una regione autonoma !,UgylnyltgQg27ikd6ul4AaABAg,1,repubblica,author_2193
UgxZR4n4-_ju9bSFB9B4AaABAg.AXDqdBeXB8fAXEkotClrMR,UgxZR4n4-_ju9bSFB9B4AaABAg,yyooDzr0s8I,True,author_227,2026-05-25T17:10:20Z,2026-05-25T17:10:20Z,6,"Purtroppo la maggior parte del popolo è violento fanatico e razzista e questo porterà poco lontano.Tutto il mondo va così purtroppo manca il dialogo, la diplomazia fra i popoli è sparita e questo genererà guerre",UgxZR4n4-_ju9bSFB9B4AaABAg,1,repubblica,author_227
UgxZR4n4-_ju9bSFB9B4AaABAg.AXDqdBeXB8fAXEm4aEakNe,UgxZR4n4-_ju9bSFB9B4AaABAg.AXDqdBeXB8fAXE-lXinCwh,yyooDzr0s8I,True,author_2145,2026-05-25T17:21:21Z,2026-05-25T17:21:21Z,7,"@user la dimostrazione di come vanno le cose in Italia, un paese alla deriva 😅😅😅 fortunatamente esiste una parte umana che riconosce il genocidio dei palestinesi",UgxZR4n4-_ju9bSFB9B4AaABAg.AXDqdBeXB8fAXE-lXinCwh,2,repubblica,author_2145
UgylnyltgQg27ikd6ul4AaABAg.AXDupi_QM_8AXEofzhN_4T,UgylnyltgQg27ikd6ul4AaABAg.AXDupi_QM_8AXEiYTMJuSO,yyooDzr0s8I,True,author_2159,2026-05-25T17:44:04Z,2026-05-25T17:44:04Z,0,@user allora??,UgylnyltgQg27ikd6ul4AaABAg.AXDupi_QM_8AXEiYTMJuSO,2,repubblica,author_2159
UgzFJqn7LhhYuW36T3l4AaABAg,,yyooDzr0s8I,False,author_2194,2026-05-25T18:26:08Z,2026-05-25T18:26:08Z,5,Ben Gvir capro espiatorio per salvare Bibi .,,0,repubblica,author_2194
UgytsQeqJg1uUy-xvc14AaABAg,,yyooDzr0s8I,False,author_2195,2026-05-25T18:51:00Z,2026-05-25T18:51:00Z,0,Schifo meda diavole assassini genocidi guerra lobbi = Israele e tutti israeliani,,0,repubblica,author_2195
UgybN8UYT0M8olPrnpZ4AaABAg.AXDyq28-V6AAXExG4JMUoe,UgybN8UYT0M8olPrnpZ4AaABAg,yyooDzr0s8I,True,author_2196,2026-05-25T18:59:02Z,2026-05-25T18:59:02Z,0,"Guarda che i vari Ben-Gvir sono stati ""creati"" da Hamas, se non ci fossero i terroristi non ci sarebbe nemmeno il governo di destra, pensaci!",UgybN8UYT0M8olPrnpZ4AaABAg,1,repubblica,author_2196
UgxCsmZVKgkvmBAfcy14AaABAg,,yyooDzr0s8I,False,author_2197,2026-05-25T19:28:35Z,2026-05-25T19:28:35Z,0,Moltissimi israeliani sono delle belve assetate di sangue,,0,repubblica,author_2197
UgwClKwqrKZQCOiBgdF4AaABAg,,yyooDzr0s8I,False,author_2198,2026-05-25T19:58:58Z,2026-05-25T19:58:58Z,1,"Ma tu sei Ebreo dovresti saperlo: nel quinto libro del Pentateuco, l'Apocalisse per gli Ebrei c'è la fine, ma la loro però nell'Armageddon.",,0,repubblica,author_2198
Ugwe4O-LFaxX-wNEDGx4AaABAg,,yyooDzr0s8I,False,author_584,2026-05-25T20:05:18Z,2026-05-25T20:05:18Z,0,Gli israeliani hanno votato Netanyahu per 30 anni. Le statistiche dicono che il 75% degli Israeliani sono per la pulizia etnica dei palestinesi.,,0,repubblica,author_584
Ugxmz6fG_r2nuObF3594AaABAg,,yyooDzr0s8I,False,author_2199,2026-05-25T20:26:50Z,2026-05-25T20:26:50Z,1,non è ben gvir una disgrazia per israele caro grossman... è tutto il paese che è oggi una DISGRAZIA PER IL MONDO perchè è dal 1948 almeno che ISRAELE PONE SOLO PROBLEMI AL MONDO e oggi purtroppo la gran parte della società di Israele è così ben gvir o non ben gvir perchè la singola persona è persino ininfluente per il destino di un paese di 8/9 mln di abitanti. Ci sono poche speranze anche x il futuro anche se netaniahu finisse prima condannato. Con un governo laburista cambierebbero i toni certamente ma non la sostanza. ISRAELE si è scavata lafossa da sola e PAGHERA' A CARO PREZZO NEI DECENNI TUTTI I SUOI CRIMINI,,0,repubblica,author_2199
UgwsDU82dSIX3rSsqxh4AaABAg,,yyooDzr0s8I,False,author_1513,2026-05-25T20:34:11Z,2026-05-25T20:34:11Z,1,Belle Parole😊,,0,repubblica,author_1513
Ugwn0S2Ghxx0pYDw_2l4AaABAg,,yyooDzr0s8I,False,author_2200,2026-05-25T20:43:15Z,2026-05-25T20:43:15Z,0,"Fazio è un figlio del sistema, tutti gli ebrei sono responsabili delle nefandezze che il loro Stato commette e questi tentativi di colpevolizzare solo qualche capre espiatorio rende tutto ancora più vomitevole come quella melma umana di Fazio 😢",,0,repubblica,author_2200
UgwsDU82dSIX3rSsqxh4AaABAg.AXF78x4cQE4AXF8JAlt-n2,UgwsDU82dSIX3rSsqxh4AaABAg,yyooDzr0s8I,True,author_2200,2026-05-25T20:44:20Z,2026-05-25T20:44:20Z,1,Pochi fatti,UgwsDU82dSIX3rSsqxh4AaABAg,1,repubblica,author_2200
UgyWELriAhtgVdbEnQB4AaABAg,,yyooDzr0s8I,False,author_2201,2026-05-25T21:19:57Z,2026-05-25T21:19:57Z,0,David grossman è una persona molto intelligente molto obiettivo molto moltouna persona intelligente obiettiva sincera ebreo sì ma ebreo nel miglior modo possibile David grossman è una persona molto molto veramente stimabileragione al 1000% al miliardo * 100 al miliardo prr Cento,,0,repubblica,author_2201
Ugz-7DGghuc6dP9qGOR4AaABAg,,yyooDzr0s8I,False,author_2202,2026-05-25T22:03:52Z,2026-05-25T22:03:52Z,8,"92% lo sostiene...basta con sta propaganda. Non fanno entrare medicine a Gaza, i bambini mangaiti dai topi. Vergognarsi é il meno",,0,repubblica,author_2202
Ugwkey9WJHhcRxwZhXV4AaABAg,,yyooDzr0s8I,False,author_1543,2026-05-25T22:20:03Z,2026-05-25T22:20:03Z,10,"Improvvisamente scoprono che è una persona poco carina....bho, ma davvero credono che siamo tutti imbecilli?",,0,repubblica,author_1543
UgyG202o2ORE579cW9d4AaABAg,,yyooDzr0s8I,False,author_2203,2026-05-25T22:37:59Z,2026-05-25T22:38:41Z,5,Anni '70 ..la mia bisnonna abitava nella casa del custode di una sinagoga e ricordo che diceva ..ebrei? ..meglio nulla da cena.,,0,repubblica,author_2203
Ugz5XrLvY0766Ytues94AaABAg.AXDriWPQcz-AXE2h5SMNiW,Ugz5XrLvY0766Ytues94AaABAg,yyooDzr0s8I,True,author_2148,2026-05-26T00:00:00+00:00,,1,"Rispondo a tutti Mossad... Hasbara...extraterrestri... Venitemi a trovare che vi mostro i filmati girati da hamas il 7 ottobre, o cercateli in rete se ne trovate ancora qualcuno. Non dormirete più",Ugz5XrLvY0766Ytues94AaABAg,1,repubblica,author_2148
Ugz5XrLvY0766Ytues94AaABAg.AXDriWPQcz-AXEQREmHW4B,Ugz5XrLvY0766Ytues94AaABAg.AXDriWPQcz-AXE2h5SMNiW,yyooDzr0s8I,True,author_677,2026-05-26T00:00:00+00:00,,1,"@author_2148 Quelli in rete che erano stati pubblicati dall'IDF me li sono visti. Cade male. Di bambini bruciati nei forni e cose simili manco l'ombra. Quello che saltava all'occhio è che le vittime erano in età da servizio militare, come gli ultimi ostaggi rilasciati.",Ugz5XrLvY0766Ytues94AaABAg.AXDriWPQcz-AXE2h5SMNiW,2,repubblica,author_677
Ugz5XrLvY0766Ytues94AaABAg.AXDriWPQcz-AXEMhVNJMkg,Ugz5XrLvY0766Ytues94AaABAg.AXDriWPQcz-AXDuhzRNMHm,yyooDzr0s8I,True,author_2186,2026-05-26T00:00:00+00:00,,0,"@author_517 La parte sbagliata della storia sono i tagliagole palestinesi.. Se non avessero tentato di sterminare gli ebrei, prima con la Shoah e poi aggredendo israele appena fondato, arabi e palestinesi non sarebbero stati bombardati..",Ugz5XrLvY0766Ytues94AaABAg.AXDriWPQcz-AXDuhzRNMHm,2,repubblica,author_2186
Ugz5XrLvY0766Ytues94AaABAg.AXDriWPQcz-AXEMVcumUxB,Ugz5XrLvY0766Ytues94AaABAg.AXDriWPQcz-AXDtApm_BL4,yyooDzr0s8I,True,author_2186,2026-05-26T00:00:00+00:00,,0,Suprematismo occidentale? 😂 Non è suprematismo. È semplicemente la realtà. Civiltà Vs barbarie palestinese,Ugz5XrLvY0766Ytues94AaABAg.AXDriWPQcz-AXDtApm_BL4,2,repubblica,author_2186
Ugz5XrLvY0766Ytues94AaABAg.AXDriWPQcz-AXEQzFPzz6U,Ugz5XrLvY0766Ytues94AaABAg.AXDriWPQcz-AXEQREmHW4B,yyooDzr0s8I,True,author_2148,2026-05-26T00:00:00+00:00,,0,@author_677 Balle,Ugz5XrLvY0766Ytues94AaABAg.AXDriWPQcz-AXEQREmHW4B,3,repubblica,author_2148
Ugz5XrLvY0766Ytues94AaABAg.AXDriWPQcz-AXESeK5V-On,Ugz5XrLvY0766Ytues94AaABAg.AXDriWPQcz-AXEQREmHW4B,yyooDzr0s8I,True,author_677,2026-05-26T00:00:00+00:00,,1,"@author_2148 Balle? Bambini con la testa mozzata e bruciati vivi nei forni non se ne ha notizia. È stato smentito anche da Hareetz oltre che dalle agenzie internazionali. Ci sono ""fondati motivi"" di ritenere che si siano perpetrati stupri ma non vi è la certezza. Per il resto gli omicidi fatti sono comunque da ritenersi un crimine contro l'umanità (morti civili) per cui è corretto procedere contro gli autori. Altrettanto bisogna fare nei confronti degli Israeliani con l'aggravante de genocidio. Cosa mi dice dei 6000 morti civili palestinesi nei 10 anni prima del 7 ottobre. Quelli non valgono? Cosa mi dice dei coloni armati di tutto punto, difesi dall'IDF, che si impadroniscono dei terreni e delle case dei palestinesi. I palestinesi hanno diritto di ribellarsi con la forza.",Ugz5XrLvY0766Ytues94AaABAg.AXDriWPQcz-AXEQREmHW4B,3,repubblica,author_677
Ugz5XrLvY0766Ytues94AaABAg.AXDriWPQcz-AXEVImhcKUP,Ugz5XrLvY0766Ytues94AaABAg.AXDriWPQcz-AXEQREmHW4B,yyooDzr0s8I,True,author_2148,2026-05-26T00:00:00+00:00,,0,"@author_677 Certo, di fatto e’ in corso una guerra",Ugz5XrLvY0766Ytues94AaABAg.AXDriWPQcz-AXEQREmHW4B,3,repubblica,author_2148
Ugz5XrLvY0766Ytues94AaABAg.AXDriWPQcz-AXENbyOmbnK,Ugz5XrLvY0766Ytues94AaABAg.AXDriWPQcz-AXEMOBLdSFm,yyooDzr0s8I,True,author_2186,2026-05-26T00:00:00+00:00,,0,"@author_677 È uno stato riconosciuto dall'ONU e buona parte del pianeta. Ma non dagli arabi e dal mondo islamico, che ha sempre cercato di eliminarlo. Quindi rientra perfettamente nel concetto di autodeterminazione di un popolo. E conseguentemente questo legittimerebbe la lotta armata.",Ugz5XrLvY0766Ytues94AaABAg.AXDriWPQcz-AXEMOBLdSFm,3,repubblica,author_2186
Ugz5XrLvY0766Ytues94AaABAg.AXDriWPQcz-AXEMoqW3Hk-,Ugz5XrLvY0766Ytues94AaABAg.AXDriWPQcz-AXEMOBLdSFm,yyooDzr0s8I,True,author_677,2026-05-26T00:00:00+00:00,,1,@author_2186 Israele è uno stato riconosciuto. Non dica belinate.,Ugz5XrLvY0766Ytues94AaABAg.AXDriWPQcz-AXEMOBLdSFm,3,repubblica,author_677
Ugz5XrLvY0766Ytues94AaABAg.AXDriWPQcz-AXEMOBLdSFm,Ugz5XrLvY0766Ytues94AaABAg.AXDriWPQcz-AXDtApm_BL4,yyooDzr0s8I,True,author_2186,2026-05-26T00:00:00+00:00,,0,@author_677 Infatti il popolo israeliano si è difeso e autodeterminato con la lotta armata Tutto torna. 😂,Ugz5XrLvY0766Ytues94AaABAg.AXDriWPQcz-AXDtApm_BL4,2,repubblica,author_2186
Ugz5XrLvY0766Ytues94AaABAg.AXDriWPQcz-AXEDXQlusfl,Ugz5XrLvY0766Ytues94AaABAg.AXDriWPQcz-AXE2h5SMNiW,yyooDzr0s8I,True,author_2204,2026-05-26T00:00:00+00:00,,1,@author_2148 te li ha passati l'aipac? 😅,Ugz5XrLvY0766Ytues94AaABAg.AXDriWPQcz-AXE2h5SMNiW,2,repubblica,author_2204
Ugz5XrLvY0766Ytues94AaABAg.AXDriWPQcz-AXEZtPVpNWP,Ugz5XrLvY0766Ytues94AaABAg.AXDriWPQcz-AXEQREmHW4B,yyooDzr0s8I,True,author_677,2026-05-26T00:00:00+00:00,,1,@author_2148 e spera,Ugz5XrLvY0766Ytues94AaABAg.AXDriWPQcz-AXEQREmHW4B,3,repubblica,author_677
Ugz5XrLvY0766Ytues94AaABAg.AXDriWPQcz-AXEZDcG9zIf,Ugz5XrLvY0766Ytues94AaABAg.AXDriWPQcz-AXEQREmHW4B,yyooDzr0s8I,True,author_2148,2026-05-26T00:00:00+00:00,,0,@author_677 l’aspetto,Ugz5XrLvY0766Ytues94AaABAg.AXDriWPQcz-AXEQREmHW4B,3,repubblica,author_2148
Ugz5XrLvY0766Ytues94AaABAg.AXDriWPQcz-AXEYRce4qlT,Ugz5XrLvY0766Ytues94AaABAg.AXDriWPQcz-AXEQREmHW4B,yyooDzr0s8I,True,author_677,2026-05-26T00:00:00+00:00,,1,"@author_2148 Stiamo parlando di crimini accertati e lei divaga con una frase che non spiega nulla. Mi dica dove trovare le immagini delle teste di bambini mozzate o di bambini bruciati nei forni. Se ha le prove bene, altrimenti taccia e smetta di scrivere sciocchezze, che i comunisti furono quelli che spinsero per la creazione di Israele e furono i primi a fornire di armi pesanti gli israeliani che altrimenti nel '48 sarebbero stati sconfitti. Dopo l'addio vada a documentarsi.",Ugz5XrLvY0766Ytues94AaABAg.AXDriWPQcz-AXEQREmHW4B,3,repubblica,author_677
Ugz5XrLvY0766Ytues94AaABAg.AXDriWPQcz-AXEXTXUYZjG,Ugz5XrLvY0766Ytues94AaABAg.AXDriWPQcz-AXEQREmHW4B,yyooDzr0s8I,True,author_2148,2026-05-26T00:00:00+00:00,,0,@author_677 e le sue convinzioni neanche Addio,Ugz5XrLvY0766Ytues94AaABAg.AXDriWPQcz-AXEQREmHW4B,3,repubblica,author_2148
Ugz5XrLvY0766Ytues94AaABAg.AXDriWPQcz-AXEW6sWf62_,Ugz5XrLvY0766Ytues94AaABAg.AXDriWPQcz-AXEQREmHW4B,yyooDzr0s8I,True,author_677,2026-05-26T00:00:00+00:00,,1,@author_2148 La sua risposta non è pertinente,Ugz5XrLvY0766Ytues94AaABAg.AXDriWPQcz-AXEQREmHW4B,3,repubblica,author_677
Ugz5XrLvY0766Ytues94AaABAg.AXDriWPQcz-AXEQ4ynSOc9,Ugz5XrLvY0766Ytues94AaABAg.AXDriWPQcz-AXEMOBLdSFm,yyooDzr0s8I,True,author_677,2026-05-26T00:00:00+00:00,,1,"@author_2186 Doppio carpiato con avvitamento. Egitto (confinante), Giordania (confinante) EAU, Bahrein e Marocco lo riconoscono. Se ci si rifà al diritto internazionale Israele esiste e questo è il quanto. Se invece ci si appella a altre questioni sul tavolo allora bisogna analizzarle tutte e quindi bisognerebbe vedere perché quei paesi arabi non lo riconoscono. Vuole stare nel primo campo o nel secondo?",Ugz5XrLvY0766Ytues94AaABAg.AXDriWPQcz-AXEMOBLdSFm,3,repubblica,author_677
UgxPyt1BB1wjOtjJUJ14AaABAg.AXDsJMll1yeAXEWmIqp71J,UgxPyt1BB1wjOtjJUJ14AaABAg.AXDsJMll1yeAXEL8efgVUo,yyooDzr0s8I,True,author_2150,2026-05-26T00:00:00+00:00,,3,@author_2186 ripugnante,UgxPyt1BB1wjOtjJUJ14AaABAg.AXDsJMll1yeAXEL8efgVUo,2,repubblica,author_2150
Ugz5XrLvY0766Ytues94AaABAg.AXDriWPQcz-AXDvbVEQsSR,Ugz5XrLvY0766Ytues94AaABAg,yyooDzr0s8I,True,author_2150,2026-05-26T00:00:00+00:00,,3,Hasbara è un mostro che fabbrica realtà parallele,Ugz5XrLvY0766Ytues94AaABAg,1,repubblica,author_2150
Ugz5XrLvY0766Ytues94AaABAg.AXDriWPQcz-AXDv1MXjsgI,Ugz5XrLvY0766Ytues94AaABAg,yyooDzr0s8I,True,author_2204,2026-05-26T00:00:00+00:00,,4,"I comunisti ce li avete in testa...cit Il 7 Ottobre il mossad ha compiuto un attentato per legittimare una carneficina, quindi?",Ugz5XrLvY0766Ytues94AaABAg,1,repubblica,author_2204
Ugz39cNi1zy3A9cuW594AaABAg,,yyooDzr0s8I,False,author_24,2026-05-26T01:40:25Z,2026-05-26T01:40:25Z,0,"Vuole un dialogo con gli islamici, in Italia vogliono l'integrazione con i musulmani 😂😂😂😂😂😂",,0,repubblica,author_24
UgwIrto3zQNck-JFIOh4AaABAg,,yyooDzr0s8I,False,author_2205,2026-05-26T02:21:58Z,2026-05-26T02:21:58Z,2,Ipocrisia e propaganda,,0,repubblica,author_2205
UgylnyltgQg27ikd6ul4AaABAg.AXDupi_QM_8AXFk72qfnTG,UgylnyltgQg27ikd6ul4AaABAg,yyooDzr0s8I,True,author_2205,2026-05-26T02:23:27Z,2026-05-26T02:23:27Z,0,Perché? C'è un genocidio in Spagna? 🤡🤡🤡,UgylnyltgQg27ikd6ul4AaABAg,1,repubblica,author_2205
UgyZ6Fdk672Vqzx29cB4AaABAg,,yyooDzr0s8I,False,author_2206,2026-05-26T03:58:31Z,2026-05-26T03:58:31Z,3,IL PROBLEMA È ISRAELE CHE COMPIE LO STERMINIO DI UN POPOLO PER L’OCCUPAZIONE DELLA SUA TERRA DAL 1948 IN NOME DEL SIONISMO CHE È UN’IDEOLOGIA POLITICA SUPREMATISTA COLONIALISTA. I GOVERNATORI DI ISRAELE ED IL PROPRIO POPOLO DI COLONI SONO TUTTI FIGLI SANI DEL SIONISMO.,,0,repubblica,author_2206
Ugz1TDf2Gm-IIRtnBhl4AaABAg,,yyooDzr0s8I,False,author_2207,2026-05-26T05:06:59Z,2026-05-26T05:06:59Z,1,Criminali e assassini,,0,repubblica,author_2207
Ugyym3OGeY2MPFuH4G94AaABAg.AXEExbHUbGsAXG2awd6ugA,Ugyym3OGeY2MPFuH4G94AaABAg,yyooDzr0s8I,True,author_2207,2026-05-26T05:13:42Z,2026-05-26T05:13:42Z,0,"Come dicono i sfozza ggioggia senza cervello, aspetta e spera",Ugyym3OGeY2MPFuH4G94AaABAg,1,repubblica,author_2207
Ugwmcr4Q6MUNZ7Bpb7Z4AaABAg.AXDwXGK_xtaAXG34S_wN_h,Ugwmcr4Q6MUNZ7Bpb7Z4AaABAg,yyooDzr0s8I,True,author_2207,2026-05-26T05:17:52Z,2026-05-26T05:17:52Z,1,"Perché non provi ad andare , così provi l'effetto che fa , invece di scrivere stronzate",Ugwmcr4Q6MUNZ7Bpb7Z4AaABAg,1,repubblica,author_2207
UgwKqNMhxB7NhDFHbAl4AaABAg,,yyooDzr0s8I,False,author_2208,2026-05-26T06:24:09Z,2026-05-26T06:24:09Z,0,Le sue parole fanno bene al cuore ❤️,,0,repubblica,author_2208
UgyxmD9QKRhRmLVrsgJ4AaABAg.AXDqeg7GcytAXGCrhsEVcO,UgyxmD9QKRhRmLVrsgJ4AaABAg.AXDqeg7GcytAXE0C7v4CJy,yyooDzr0s8I,True,author_2208,2026-05-26T06:43:22Z,2026-05-26T06:43:22Z,1,@author_2173 esatto : io già mi vergogno del fatto che si dica che Vannacci potrebbe avere un peso alle prossime elezioni. È la dimostrazione di quanto sappiamo essere brutti anche noi italiani,UgyxmD9QKRhRmLVrsgJ4AaABAg.AXDqeg7GcytAXE0C7v4CJy,2,repubblica,author_2208
UgzFJqn7LhhYuW36T3l4AaABAg.AXEtV5ixKVxAXGD-tLAoRm,UgzFJqn7LhhYuW36T3l4AaABAg,yyooDzr0s8I,True,author_2208,2026-05-26T06:44:37Z,2026-05-26T06:44:37Z,1,"Dovrebbero incarcerarli entrambi, per sempre",UgzFJqn7LhhYuW36T3l4AaABAg,1,repubblica,author_2208
Ugy5Q1NBjaXC88TPLHR4AaABAg.AXDvkAir4aMAXGDLrXB8La,Ugy5Q1NBjaXC88TPLHR4AaABAg,yyooDzr0s8I,True,author_2208,2026-05-26T06:47:37Z,2026-05-26T06:47:37Z,0,"No, questo no. Dovremmo essere grati delle sue parole: non sono molti ad opporsi a ciò che sta accadendo, quelli che lo fanno sono perle rare in tutto questo marciume.",Ugy5Q1NBjaXC88TPLHR4AaABAg,1,repubblica,author_2208
UgyZ6Fdk672Vqzx29cB4AaABAg.AXFv-NhITucAXGDk0t_ulM,UgyZ6Fdk672Vqzx29cB4AaABAg,yyooDzr0s8I,True,author_2208,2026-05-26T06:51:03Z,2026-05-26T06:51:03Z,0,"Il problema sono anche tutti quelli che tollerano perché usufruiscono in vari modi di questo sistema: USA, UE....mezzo mondo in pratica",UgyZ6Fdk672Vqzx29cB4AaABAg,1,repubblica,author_2208
UgwAFCYxpE6u_AUXVxJ4AaABAg.AXDyoqr-P_vAXGECjvHTaO,UgwAFCYxpE6u_AUXVxJ4AaABAg,yyooDzr0s8I,True,author_2208,2026-05-26T06:55:07Z,2026-05-26T06:55:07Z,0,Tecnicamente sarà anche vero: gli israeliani stanno bene e non vogliono neanche sapere cosa succede nel cortile di casa loro. Comunque ti capisco: avrei fatto la stessa cosa.,UgwAFCYxpE6u_AUXVxJ4AaABAg,1,repubblica,author_2208
UgyhfA-rvODydFrj2614AaABAg.AXDstpN72qdAXGEXiOwWdJ,UgyhfA-rvODydFrj2614AaABAg.AXDstpN72qdAXELU6VblcL,yyooDzr0s8I,True,author_2208,2026-05-26T06:57:58Z,2026-05-26T06:57:58Z,0,@author_2186 stai sempre sui commenti e non hai ancora capito che siamo tutti indignati tranne te e pochi altri come te. Almeno questo dovresti riconoscerlo.,UgyhfA-rvODydFrj2614AaABAg.AXDstpN72qdAXELU6VblcL,2,repubblica,author_2208
UgyUMo7cABLtoOVvomJ4AaABAg.AXEPlh9oH5uAXGErbebRoA,UgyUMo7cABLtoOVvomJ4AaABAg,yyooDzr0s8I,True,author_2208,2026-05-26T07:00:50Z,2026-05-26T07:00:50Z,0,È comunque una calamità e non dimenticarti che noi europei siamo in gran parte conniventi,UgyUMo7cABLtoOVvomJ4AaABAg,1,repubblica,author_2208
Ugyym3OGeY2MPFuH4G94AaABAg.AXEExbHUbGsAXGGN0mfg9S,Ugyym3OGeY2MPFuH4G94AaABAg,yyooDzr0s8I,True,author_2208,2026-05-26T07:13:59Z,2026-05-26T07:13:59Z,0,"I governi che oggi stanno trascinando il mondo in una guerra mondiale e sono attori o complici di un genocidio sono praticamente tutti di destra, oggi come 90 anni fa. Si dovrebbe vergognare di ciò che ha scritto.",Ugyym3OGeY2MPFuH4G94AaABAg,1,repubblica,author_2208
Ugz39cNi1zy3A9cuW594AaABAg.AXFfBtrIqMaAXGGiOXIRBR,Ugz39cNi1zy3A9cuW594AaABAg,yyooDzr0s8I,True,author_2208,2026-05-26T07:17:03Z,2026-05-26T07:17:34Z,2,"L'integrazione è la giusta via ovunque e se fatta bene non è sinonimo di sopraffazione, forse lei non conosce la differenza, ma potrebbe informarsi",Ugz39cNi1zy3A9cuW594AaABAg,1,repubblica,author_2208
Ugzv15C2ju1Fs9YCk5J4AaABAg.AXETG3ITu4sAXGGuoFwlN-,Ugzv15C2ju1Fs9YCk5J4AaABAg,yyooDzr0s8I,True,author_2208,2026-05-26T07:18:44Z,2026-05-26T07:18:44Z,0,"Anche noi siamo una democrazia: io non voglio affatto questo governo, ma purtroppo me lo devo tenere",Ugzv15C2ju1Fs9YCk5J4AaABAg,1,repubblica,author_2208
UgyvyNELWZBS1KZpLVF4AaABAg,,yyooDzr0s8I,False,author_2209,2026-05-26T07:20:37Z,2026-05-26T07:20:37Z,1,"Bellissimo discorso ,intanto però IL GENOCIDIO CONTINUA 🤬",,0,repubblica,author_2209
Ugwmcr4Q6MUNZ7Bpb7Z4AaABAg.AXDwXGK_xtaAXGH9mfzVh2,Ugwmcr4Q6MUNZ7Bpb7Z4AaABAg,yyooDzr0s8I,True,author_2208,2026-05-26T07:20:55Z,2026-05-26T07:20:55Z,0,"Le foto non le hai viste? Ce ne sono a decine, o vuoi che vengano a farteli vedere a casa?",Ugwmcr4Q6MUNZ7Bpb7Z4AaABAg,1,repubblica,author_2208
UgyIQG3otst5LzMJjf14AaABAg.AXDzSHESksKAXGHNCz7nQS,UgyIQG3otst5LzMJjf14AaABAg.AXDzSHESksKAXEM1zDcxLN,yyooDzr0s8I,True,author_2208,2026-05-26T07:22:45Z,2026-05-26T07:22:45Z,0,@user adesso hanno cambiato alleati. Direi che stanno sempre con il più forte.,UgyIQG3otst5LzMJjf14AaABAg.AXDzSHESksKAXEM1zDcxLN,2,repubblica,author_2208
Ugyym3OGeY2MPFuH4G94AaABAg.AXEExbHUbGsAXGHNSQhaNs,Ugyym3OGeY2MPFuH4G94AaABAg,yyooDzr0s8I,True,author_2183,2026-05-26T07:22:47Z,2026-05-26T07:22:47Z,0,"@author_2208 Il partito democratico italiano è praticamente schierato dalla parte dei terroristi. Tanto è vero che stanno cercando di far passare una legge per limitare la libertà di espressione riguardo i terroristi israeliani. Siete solo chiacchiere oramai, altro che vergognarsi. Avete dimostrato, sostenendo i terroristi, che siete peggio della peggio feccia sionista. Verrete cancellati presto o tardi. Non ci sarà mai pace sulla terra rubata, mai.",Ugyym3OGeY2MPFuH4G94AaABAg.AXEExbHUbGsAXGGN0mfg9S,2,repubblica,author_2183
UgybN8UYT0M8olPrnpZ4AaABAg.AXDyq28-V6AAXGH_2MYidI,UgybN8UYT0M8olPrnpZ4AaABAg,yyooDzr0s8I,True,author_2208,2026-05-26T07:24:30Z,2026-05-26T07:24:30Z,0,"Guarda che lo dicono pure, mica si vergognano",UgybN8UYT0M8olPrnpZ4AaABAg,1,repubblica,author_2208
UgyIQG3otst5LzMJjf14AaABAg.AXDzSHESksKAXGHb93INdn,UgyIQG3otst5LzMJjf14AaABAg,yyooDzr0s8I,True,author_2209,2026-05-26T07:24:48Z,2026-05-26T07:24:48Z,0,👍👍👍👍👍👍👍,UgyIQG3otst5LzMJjf14AaABAg,1,repubblica,author_2209
UgxoqfIHBjYZbSS-fIV4AaABAg,,yyooDzr0s8I,False,author_2210,2026-05-26T08:06:25Z,2026-05-26T08:06:25Z,1,Grossman è un gigante di cultura ed umanità ma deve capire che Ben in Israele ha un forte consenso,,0,repubblica,author_2210
UgxLqc1Wmq9oKTLIK_J4AaABAg,,yyooDzr0s8I,False,author_2211,2026-05-26T08:30:57Z,2026-05-26T08:30:57Z,0,"CI MANCAVI SOLO TU, GROSSMAN...TI METTI A FARE IL COLLABORAZIONISTA, ADESSO? SAI BENISSIMO DI CHE PASTA SONO GLI ISLAMO PALESTINESI! È UNA VERGOGNA CHE TU VADA A CERTE TRASMISSIONI",,0,repubblica,author_2211
Ugz39cNi1zy3A9cuW594AaABAg.AXFfBtrIqMaAXGPDkqpC_9,Ugz39cNi1zy3A9cuW594AaABAg,yyooDzr0s8I,True,author_2212,2026-05-26T08:31:22Z,2026-05-26T08:31:22Z,1,Non si capisce la battuta e tantomeno le risate... Che minchia ridi?,Ugz39cNi1zy3A9cuW594AaABAg,1,repubblica,author_2212
UgyvIrPsS9gukRMyLRZ4AaABAg,,yyooDzr0s8I,False,author_2213,2026-05-26T08:52:46Z,2026-05-26T08:52:46Z,1,"Quante cavolate, se Bengvir avesse meno appoggi, riderebbe meno",,0,repubblica,author_2213
