comment_id,parent_comment_id,video_id,is_reply,author,published_at,updated_at,like_count,text,inferred_parent_id,depth,newspaper,author_anon,label
UgxYjo0j3qEa3rHxrxR4AaABAg,,an8s4xbh9UU,False,author_6646,2026-05-20T18:52:42Z,2026-05-20T18:52:42Z,2,Ma non ci erano già stati? Ah no era Spielberg😂,,0,ilmessaggero,author_6646,0
UgyDWUa0ZqiUQZupR3x4AaABAg,,an8s4xbh9UU,False,author_1614,2026-05-20T19:54:16Z,2026-05-20T19:54:16Z,2,Gli americani sulla Luna non hanno mai messo piede tutto un bleef americani pagliacci che 😂😂,,0,ilmessaggero,author_1614,1
UgxYjo0j3qEa3rHxrxR4AaABAg.AX23ZEkeEJjAX2DRh4lzZs,UgxYjo0j3qEa3rHxrxR4AaABAg,an8s4xbh9UU,True,author_6647,2026-05-20T20:19:03Z,2026-05-20T20:19:03Z,0,No era Kubrik,UgxYjo0j3qEa3rHxrxR4AaABAg,1,ilmessaggero,author_6647,0
UgwQ1kYSXHvurv0aapB4AaABAg,,an8s4xbh9UU,False,author_6648,2026-05-21T07:04:02Z,2026-05-21T07:04:02Z,0,Alla fine qualcuno ci andrà per davvero.,,0,ilmessaggero,author_6648,0
UgwkGZLEEQtWgf3I9ap4AaABAg,,an8s4xbh9UU,False,author_6576,2026-05-21T18:22:04Z,2026-05-21T18:22:04Z,0,Sarebbe bellissimo lo smacco agli yenkees😂😂😂😂 Go... Go... China,,0,ilmessaggero,author_6576,1
