comment_id,parent_comment_id,video_id,is_reply,author,published_at,updated_at,like_count,text,inferred_parent_id,depth,newspaper,author_anon,label
UgwLDriWkrVqZHqRDvt4AaABAg,,IFgbOLDf1TU,False,author_5772,2026-05-23T13:52:52Z,2026-05-23T13:52:52Z,3,Vada a cantare a Mosca.,,0,ilmessaggero,author_5772,1
UgzXq_OTsXmRNb3ukrJ4AaABAg,,IFgbOLDf1TU,False,author_4964,2026-05-23T13:54:42Z,2026-05-23T13:54:42Z,0,Sono tutti gelosi...,,0,ilmessaggero,author_4964,0
UgzsaF6b3dR_yYs8e8h4AaABAg,,IFgbOLDf1TU,False,author_5773,2026-05-23T13:55:15Z,2026-05-23T13:55:15Z,0,Mafioso di mer.....,,0,ilmessaggero,author_5773,1
UgwrYIXSxhOgh3ceHdF4AaABAg,,IFgbOLDf1TU,False,author_129,2026-05-23T13:57:48Z,2026-05-23T13:57:48Z,4,"E basta... Quando uno fa il suo tempo, se deve anna' a ripone, come se dice a roma.... Grande onore e grande rispetto, ma non ha più voce e sostegno diaframmatico.",,0,ilmessaggero,author_129,1
UgxBcrXy2aXcrrWSyZR4AaABAg,,IFgbOLDf1TU,False,author_1661,2026-05-23T13:59:22Z,2026-05-23T13:59:22Z,1,La salute a 83 anni....,,0,ilmessaggero,author_1661,0
UgwjZVSLENacEEBxDBJ4AaABAg,,IFgbOLDf1TU,False,author_5335,2026-05-23T14:06:13Z,2026-05-23T14:06:13Z,2,Spera in un miracolo😂😂😂😂,,0,ilmessaggero,author_5335,1
Ugz5gOA8ssnBa81kN4B4AaABAg,,IFgbOLDf1TU,False,author_4685,2026-05-23T14:07:20Z,2026-05-23T14:07:43Z,0,"Albano, senza togliere nulla agli altri, la tua voce però è di una potenza pazzesca forse metteresti in ombra qualcuno.",,0,ilmessaggero,author_4685,0
Ugyhsmr_iopvg-P2LdJ4AaABAg,,IFgbOLDf1TU,False,author_5774,2026-05-23T14:08:44Z,2026-05-23T14:08:44Z,0,"Albano , goditi la pensione e non rompere più 😢😢😢😢😢😢😢😢",,0,ilmessaggero,author_5774,0
Ugz4QgneYZxJhPK-OWN4AaABAg,,IFgbOLDf1TU,False,author_535,2026-05-23T14:30:37Z,2026-05-23T14:30:37Z,1,🙏❤️💐🌹auguri,,0,ilmessaggero,author_535,0
Ugz5gOA8ssnBa81kN4B4AaABAg.AX9HHlVXpHeAX9LXXx3Zag,Ugz5gOA8ssnBa81kN4B4AaABAg,IFgbOLDf1TU,True,author_590,2026-05-23T14:44:26Z,2026-05-23T14:44:26Z,0,"Per la voce si, indubbiamente, ma i gusti musicali ed il pubblico sono cambiati, va accettato.   Amadeus non doveva promettere, Conti non lo ha illuso.",Ugz5gOA8ssnBa81kN4B4AaABAg,1,ilmessaggero,author_590,0
Ugxp60esdF3cJyb8dg14AaABAg,,IFgbOLDf1TU,False,author_3420,2026-05-23T15:38:49Z,2026-05-23T15:38:49Z,0,"Un vecchio proverbio dice "" quando il corpo si frustra l'anima si aggiusta""",,0,ilmessaggero,author_3420,0
UgyIjt7euJWSCZpM4BR4AaABAg,,IFgbOLDf1TU,False,author_5252,2026-05-23T16:44:53Z,2026-05-23T16:44:53Z,0,Brutta cosa la demenza senile😅😅,,0,ilmessaggero,author_5252,1
UgzQ886Sm9X7DUAAJK54AaABAg,,IFgbOLDf1TU,False,author_5775,2026-05-23T16:55:44Z,2026-05-23T16:55:44Z,2,"Grande Albano, sei sempre nei nostri cuori ❤❤❤❤",,0,ilmessaggero,author_5775,0
UgzDlYhJg-r-jSIYpdx4AaABAg,,IFgbOLDf1TU,False,author_5776,2026-05-23T18:09:51Z,2026-05-23T18:09:51Z,0,Tanti auguri Albano 🎉🎉🎉,,0,ilmessaggero,author_5776,0
Ugy58sBUXq_4CHWBS1R4AaABAg,,IFgbOLDf1TU,False,author_5766,2026-05-23T19:55:02Z,2026-05-23T19:55:02Z,0,La lecciso fa la sua parte,,0,ilmessaggero,author_5766,1
UgyFY4SwZUbWdKGg9S94AaABAg,,IFgbOLDf1TU,False,author_5777,2026-05-24T09:58:33Z,2026-05-24T09:58:33Z,0,"Auguri,  Albano....❤❤❤",,0,ilmessaggero,author_5777,0
Ugwf_GCTvhe0RT6c9jN4AaABAg,,IFgbOLDf1TU,False,author_5778,2026-05-24T12:07:30Z,2026-05-24T12:07:30Z,0,83 accontentati 😂😂😂,,0,ilmessaggero,author_5778,1
UgxgXkEdL9pM2clRmBl4AaABAg,,IFgbOLDf1TU,False,author_4863,2026-05-24T12:54:30Z,2026-05-24T12:54:30Z,0,Bravo e semplice ho fatto una foto alla caracciolo dove si facevano le visite gratuite ci sono persone che fanno tanto rimanendo se stessi complimenti Albano,,0,ilmessaggero,author_4863,0
Ugy6eTKGK-9bQJCA3UF4AaABAg,,IFgbOLDf1TU,False,author_5779,2026-05-24T16:26:51Z,2026-05-24T16:26:51Z,0,Non hai ancora capito che hai stufato,,0,ilmessaggero,author_5779,1
UgydAwh75nsAxpOyiPt4AaABAg,,IFgbOLDf1TU,False,author_5780,2026-05-24T19:28:50Z,2026-05-24T19:28:50Z,0,"chiedilo alla Madonna di Lourdes, se ti da una spintarella per tornare a Sanremo.🤔",,0,ilmessaggero,author_5780,1
Ugz5gOA8ssnBa81kN4B4AaABAg.AX9HHlVXpHeAXDYi2Gf9Uz,Ugz5gOA8ssnBa81kN4B4AaABAg,IFgbOLDf1TU,True,author_5781,2026-05-25T05:56:34Z,2026-05-25T05:56:34Z,0,"La sua spiritualità e  la sua religione si riducono ad un pellegrinaggio  a Lourdes per  chiedere la salute per sé ? Si accontenti di tutto quello che ha avuto  (e direi troppo !!!)  Si guardi intorno e rifletta su tutti quei malati che soffrono da anni , sulle guerre che causano morti e mutilazioni , su quelli che vivono di stenti  e   egli seva per capire quanto siano  assurde le sue  pretese egoistiche , la sua religione cristiana di basso livello , l' astio che lui cova nel cuore contro tutti quelli che non lo accontentano nei suoi desideri , e sono un ostacolo perché il mondo vada come lui vuole .    Il palco gli ha dato la gloria in gioventù come cantante , ora che è vecchio non lo usi per fare sermoni ,non gli si addicono e il pubblico non li apprezza detti da lui . .",Ugz5gOA8ssnBa81kN4B4AaABAg,1,ilmessaggero,author_5781,1
Ugwg2k8cLwAQvvlGgGh4AaABAg,,IFgbOLDf1TU,False,author_324,2026-05-25T09:37:47Z,2026-05-25T09:37:47Z,0,"Notizia irrilevante: chi se ne importa? Vada a festeggiare dal suo amico criminale putin e cola` rimanga. È anche blasfemo nominando Lourdes, atteso che è, come anzidetto, amico e quindi complice del criminale putin. Questo strillone che si appella alla Madonna è come salvini ai comizi con il Rosario in mano: lercio, immondo, trucido, da mettere alla gogna.",,0,ilmessaggero,author_324,1
UgwQT5JotN_AzqliMCh4AaABAg,,IFgbOLDf1TU,False,author_5782,2026-05-25T18:02:33Z,2026-05-25T18:02:33Z,0,E basta Albano ancora miracoli .Dai posto ai poveri,,0,ilmessaggero,author_5782,1
UgxBcrXy2aXcrrWSyZR4AaABAg.AX9GNQkAIeOAXGsrTiwQJl,UgxBcrXy2aXcrrWSyZR4AaABAg,IFgbOLDf1TU,True,author_5783,2026-05-26T12:59:04Z,2026-05-26T12:59:04Z,0,Ne abbiamo le scatole piene,UgxBcrXy2aXcrrWSyZR4AaABAg,1,ilmessaggero,author_5783,1
UgxBcrXy2aXcrrWSyZR4AaABAg.AX9GNQkAIeOAXGtkoxAIy7,UgxBcrXy2aXcrrWSyZR4AaABAg.AX9GNQkAIeOAXGsrTiwQJl,IFgbOLDf1TU,True,author_1661,2026-05-26T13:06:54Z,2026-05-26T13:06:54Z,0,​author_7052,UgxBcrXy2aXcrrWSyZR4AaABAg.AX9GNQkAIeOAXGsrTiwQJl,2,ilmessaggero,author_1661,0
