comment_id,parent_comment_id,video_id,is_reply,author,published_at,updated_at,like_count,text,inferred_parent_id,depth,newspaper,author_anon,label
UgwKLuuRpdPQYWFGmI14AaABAg,,Rm-8FjCgI0k,False,author_4276,2026-05-21T08:51:51Z,2026-05-21T08:51:51Z,3,Spero che siano 20anni effettivi,,0,ilmessaggero,author_4276,1
Ugy-o0dnwwf7A5VGiZl4AaABAg,,Rm-8FjCgI0k,False,author_3905,2026-05-21T09:04:18Z,2026-05-21T09:04:18Z,0,Ma non c erano altri criminali presenti e partecipi a quella vile e vigliacca aggressione?? Loro galera no? 20 anni effettifi devo essere!!!,,0,ilmessaggero,author_3905,1
UgzzabNcQN-v_9q_e7Z4AaABAg,,Rm-8FjCgI0k,False,author_6571,2026-05-21T09:07:02Z,2026-05-21T09:07:02Z,0,"L’abbraccio  falso  dell’aggressione?Per la mor del cielo ognuno che ha subito un’aggressione decide quello che è giusto fare x se!! Da cittadino arrabbiato per il danno permanente subito da questo ragazzo non condivido!!

È vergognoso che questa gentaglia violenta arrivi nel nostra nazione a delinquere?

Chi subisce il torto per la legge italiana è quello che paga il prezzo più alto!!
20 anni sono davvero pochissimi tenendo presente che se gli va male farà 5/6 di galera.
Per me le leggi proteggono chi causa il torto e non chi lo subisce.e il mio pensiero personale.",,0,ilmessaggero,author_6571,1
UgxpIHp-mkjGVatkiJp4AaABAg,,Rm-8FjCgI0k,False,author_6585,2026-05-21T10:07:22Z,2026-05-21T10:07:22Z,7,A gente così  20 anni sono anche pochi,,0,ilmessaggero,author_6585,1
UgwWnM12Zc9ylOpfIxd4AaABAg,,Rm-8FjCgI0k,False,author_6585,2026-05-21T10:08:01Z,2026-05-21T10:08:01Z,0,A gente così  20 anni sono anche pochi,,0,ilmessaggero,author_6585,1
UgzzabNcQN-v_9q_e7Z4AaABAg.AX3aKSWAv2cAX3hvibDLNY,UgzzabNcQN-v_9q_e7Z4AaABAg,Rm-8FjCgI0k,True,author_5312,2026-05-21T10:13:24Z,2026-05-21T10:13:24Z,0,"L'accoltellatore condannato a 20 anni, è italiano!",UgzzabNcQN-v_9q_e7Z4AaABAg,1,ilmessaggero,author_5312,1
Ugx6pp5Rn8GMiXgRMaF4AaABAg,,Rm-8FjCgI0k,False,author_6586,2026-05-21T10:13:25Z,2026-05-21T10:13:58Z,3,"Mhaa! Una volta tanto che c'è una condanna quasi seria, anche se a uno soltanto degli aggressori, ci si mette pure la vittima. Ma dove siamo arrivati? Ma davvero qualcuno può credere che si possa andare avanti così? Mala tempora currunt!",,0,ilmessaggero,author_6586,0
Ugw1wpC5DgraDTzhe_B4AaABAg,,Rm-8FjCgI0k,False,author_6587,2026-05-21T12:20:30Z,2026-05-21T12:20:30Z,0,Sono pure pochi,,0,ilmessaggero,author_6587,1
UgznUWy8i05iA_25V8N4AaABAg,,Rm-8FjCgI0k,False,author_1752,2026-05-21T12:25:22Z,2026-05-21T12:25:22Z,0,20 anni e dopo sedia elettrica e voilà,,0,ilmessaggero,author_1752,1
UgwPYsNLDv3Dt9QA-jR4AaABAg,,Rm-8FjCgI0k,False,author_5086,2026-05-21T14:09:54Z,2026-05-21T14:09:54Z,0,"Lo ha perdonato, è vivo x miracolo penso che questo ragazzo non ha rispetto x se stesso.",,0,ilmessaggero,author_5086,1
UgxXtKRuO0JgcKVz-jV4AaABAg,,Rm-8FjCgI0k,False,author_6588,2026-05-21T16:16:35Z,2026-05-21T16:16:35Z,0,"SPERO CHE QUALCUNO FACCIA A QYESTI DELINQUENTI QYELLO CHE HANNO FATTO A DAVIDE!  VI AUGURO TUTTO IL MA DELLA VITA QUANDO USCIRETE DALLA GALERA!,MALEDETTI!",,0,ilmessaggero,author_6588,1
UgxXtKRuO0JgcKVz-jV4AaABAg.AX4MUh5kvbJAX4MleM_afK,UgxXtKRuO0JgcKVz-jV4AaABAg,Rm-8FjCgI0k,True,author_6588,2026-05-21T16:19:02Z,2026-05-21T16:19:02Z,0,NATURALMENTE SEMPRE LORO QUESTI MALEDETTI STRANIERI SOLO QUI  A  ROVINARE LA VITA A NOI E AI NOSTRI FIGLI!GRAZIE MELONI A FAR SBARCARE YUTTA WUESTA M...A,UgxXtKRuO0JgcKVz-jV4AaABAg,1,ilmessaggero,author_6588,1
Ugyf1tor-ycC8X1dxsZ4AaABAg,,Rm-8FjCgI0k,False,author_6589,2026-05-21T16:48:04Z,2026-05-21T16:48:04Z,4,Non so cosa vuole dimostrare con st'abbraccio!!!Lo rendono invalido e Lui le perdona e le abbraccia???????? Ma per favore!!!!! Che mondo!!!! Se faranno tutti come Lui i malviventi andranno a nozza!!!!! Bel esempio!!!!!!,,0,ilmessaggero,author_6589,1
UgyOZroc0O2Z9OrJZwp4AaABAg,,Rm-8FjCgI0k,False,author_6590,2026-05-21T18:43:56Z,2026-05-21T18:43:56Z,0,"Fai capire, ti hanno rovinato per la vita, speravano di averti ammazzato e tu che fai?!  Gli stringi la mano.. il messaggio che è passato è che gli italiani sono dei poveri idioti senza palle ne cervello.   bravo COGLIONE !!!!",,0,ilmessaggero,author_6590,1
Ugy2Es_b-vWZ2Ha5cIl4AaABAg,,Rm-8FjCgI0k,False,author_6591,2026-05-21T19:50:03Z,2026-05-21T19:50:03Z,1,"Non so se riuscirei ad  abbracciare ,tanto di cappello 😮❤",,0,ilmessaggero,author_6591,0
UgxFukckJb6hEk9M-7h4AaABAg,,Rm-8FjCgI0k,False,author_6592,2026-05-21T20:53:26Z,2026-05-21T20:53:26Z,0,La vittima è stata grata per il fatto di avere avuto giustizia e ha perdonato!,,0,ilmessaggero,author_6592,0
UgzXioDXZ5TN4ZKoMPF4AaABAg,,Rm-8FjCgI0k,False,author_1044,2026-05-22T00:00:16Z,2026-05-22T00:00:16Z,0,Li abbraccia ???????? Doveva staccargliele le braccia..,,0,ilmessaggero,author_1044,1
UgzPYz7p0FR8Fln1GjV4AaABAg,,Rm-8FjCgI0k,False,author_6593,2026-05-22T05:21:09Z,2026-05-22T05:21:09Z,0,"Meglio di niente, mi auguro che li sconta tutti, mi raccomando.",,0,ilmessaggero,author_6593,0
UgzezyqIUpMV3MhgbRF4AaABAg,,Rm-8FjCgI0k,False,author_6594,2026-05-23T05:20:21Z,2026-05-23T05:20:21Z,0,Pena capitale per i responsabili,,0,ilmessaggero,author_6594,1
UgwNEyD4N4HS58_k8_x4AaABAg,,Rm-8FjCgI0k,False,author_6595,2026-05-23T19:00:45Z,2026-05-23T19:00:45Z,0,Dovete buttare via le chiavi…… la colpa?.. sapete benissimo……….,,0,ilmessaggero,author_6595,1
UgzdQNbYxMNO25SU0nh4AaABAg,,Rm-8FjCgI0k,False,author_2531,2026-05-24T13:42:14Z,2026-05-24T13:42:14Z,0,L'immigrazione uccide non scordatelo,,0,ilmessaggero,author_2531,1
UgzHEIYFo0p_zWapm-54AaABAg,,Rm-8FjCgI0k,False,author_120,2026-05-24T14:34:37Z,2026-05-24T14:34:37Z,0,w il duce,,0,ilmessaggero,author_120,1
UgwGahHtfotX4ov3gAV4AaABAg,,Rm-8FjCgI0k,False,author_5256,2026-05-25T07:03:14Z,2026-05-25T07:03:14Z,0,"Questa è giustizia.......
E pensare che il governo Meloni vuole togliersi la magistratura da torno....",,0,ilmessaggero,author_5256,0
