comment_id,parent_comment_id,video_id,is_reply,author,published_at,updated_at,like_count,text,inferred_parent_id,depth,newspaper,author_anon,label
UgyPZQYx8OGF_e57_tV4AaABAg,,-m4722GVbM0,False,author_6771,2026-05-16T10:59:17Z,2026-05-16T10:59:17Z,0,Ai pensionati che non arrivano a fine mese  niente? O ci deve pensare Landini il venerdì?,,0,il_gazzettino,author_6771,1
UgxVeGPkR-Ih0jgobM94AaABAg,,-m4722GVbM0,False,author_6772,2026-05-16T11:43:07Z,2026-05-16T11:44:46Z,1,"Questi fanno le donazioni coi soldi con cui dovrebbero pagare le tasse, quindi in un modo o in un altro sarebbero dovuti uscire, così si fanno un pò di pubblicità gratis. Se invece li prendono dal loro patrimonio personale di cui ne dubito allora è diverso.",,0,il_gazzettino,author_6772,1
UgxVeGPkR-Ih0jgobM94AaABAg.AWs-DNSfTkwAWtHdCtCf1t,UgxVeGPkR-Ih0jgobM94AaABAg,-m4722GVbM0,True,author_3411,2026-05-16T23:43:18Z,2026-05-16T23:43:18Z,0,Mammmmma mia,UgxVeGPkR-Ih0jgobM94AaABAg,1,il_gazzettino,author_3411,0
UgyPZQYx8OGF_e57_tV4AaABAg.AWrvCRXOYchAWv0RfxonJs,UgyPZQYx8OGF_e57_tV4AaABAg,-m4722GVbM0,True,author_52,2026-05-17T15:51:32Z,2026-05-17T15:51:32Z,0,"Che centrano 8 pensionati,questi due sono degli imprenditori che hanno fatto un regalo,un bonus au suoi dipendenti,che cavolo centrano i pensionati. Mi spieghi,o parli perché hai la bocca?",UgyPZQYx8OGF_e57_tV4AaABAg,1,il_gazzettino,author_52,1
UgxVeGPkR-Ih0jgobM94AaABAg.AWs-DNSfTkwAWv0e1vl2_m,UgxVeGPkR-Ih0jgobM94AaABAg,-m4722GVbM0,True,author_52,2026-05-17T15:53:21Z,2026-05-17T15:53:21Z,0,Idiota sono soldi che loro hanno come utile i due signori li conosco personalmente avendo lavorato come fornitore per una delle sue aziende. Sciacquarsi la bocca prima di parlare,UgxVeGPkR-Ih0jgobM94AaABAg,1,il_gazzettino,author_52,1
UgxVeGPkR-Ih0jgobM94AaABAg.AWs-DNSfTkwAWv4cM6Gsui,UgxVeGPkR-Ih0jgobM94AaABAg,-m4722GVbM0,True,author_6772,2026-05-17T16:28:04Z,2026-05-17T16:29:01Z,0,​​author_52 Sugli utili ci sono da pagare imposte diminuendo gli utili loro pagano meno imposte e ci fanno pure una bella figura.,UgxVeGPkR-Ih0jgobM94AaABAg.AWs-DNSfTkwAWv0e1vl2_m,2,il_gazzettino,author_6772,0
