comment_id,parent_comment_id,video_id,is_reply,author,published_at,updated_at,like_count,text,inferred_parent_id,depth,newspaper,author_anon,label
UgweZt9SsB7oSzDFrV14AaABAg,,vEEeGqOXG4g,False,author_1367,2026-05-15T16:45:07Z,2026-05-15T16:45:07Z,1,La collega era il padre?,,0,corriere_della_sera,author_1367,0
UgwVuaPkMZoEL7FhF4l4AaABAg,,vEEeGqOXG4g,False,author_4269,2026-05-15T16:46:49Z,2026-05-15T16:46:49Z,0,Dalle dimensioni della bara della bimba credo che sia morta anche la madre,,0,corriere_della_sera,author_4269,1
Ugz0XfIUNHUF8fZW_x54AaABAg,,vEEeGqOXG4g,False,author_4270,2026-05-15T16:55:03Z,2026-05-15T16:55:03Z,8,"La crisi aguzza l'ingegno 😂😂
Scherzi a parte questa AI è devastante, giorni fa hanno telefonato ai miei genitori anziani usando la mia voce che chissà dove caspita l'hanno campionata (forse in una telefonata di quelle commerciali) per dirgli di fare un bonifico ad un azienda se no venivo arrestato 😅 e un altra volta con il numero mascherato da 112 dicendo che la mia auto nella notte era stata usata per una rapina e bla bla bla
Francamente il problema lo vedo un pò sottovalutato dalle istituzioni.",,0,corriere_della_sera,author_4270,0
UgyeM6yAvusD6jVLF994AaABAg,,vEEeGqOXG4g,False,author_3527,2026-05-15T17:22:55Z,2026-05-15T17:22:55Z,1,Che schifo,,0,corriere_della_sera,author_3527,1
UgzVCuUcJUTAwwT6DIJ4AaABAg,,vEEeGqOXG4g,False,author_1204,2026-05-15T19:34:09Z,2026-05-15T19:34:09Z,0,Il morto di fame....,,0,corriere_della_sera,author_1204,1
UgxUirj6-2uZtah3-xR4AaABAg,,vEEeGqOXG4g,False,author_4271,2026-05-16T15:25:50Z,2026-05-16T15:25:50Z,0,"Certa gente non ha proprio reputazione. È sfacciatamente disonesta. Dico a queste persone: ""Vergognatevi di esistere""😡",,0,corriere_della_sera,author_4271,1
Ugz0XfIUNHUF8fZW_x54AaABAg.AWpz7F4O6FMAWsOy4avHc3,Ugz0XfIUNHUF8fZW_x54AaABAg,vEEeGqOXG4g,True,author_4271,2026-05-16T15:28:05Z,2026-05-16T15:28:05Z,1,Stranamente le richieste sono sempre e solo soldi.,Ugz0XfIUNHUF8fZW_x54AaABAg,1,corriere_della_sera,author_4271,0
UgweZt9SsB7oSzDFrV14AaABAg.AWpxzEgYMdbAWuCTz5Dmqu,UgweZt9SsB7oSzDFrV14AaABAg,vEEeGqOXG4g,True,author_3856,2026-05-17T08:17:27Z,2026-05-17T08:17:27Z,0,"Non penso, sicuramente la collega è di buon cuore e sapeva che avrebbe sganciato i soldi. Meschino, miserabile, accattone.",UgweZt9SsB7oSzDFrV14AaABAg,1,corriere_della_sera,author_3856,1
