comment_id,parent_comment_id,video_id,is_reply,author,published_at,updated_at,like_count,text,inferred_parent_id,depth,newspaper,author_anon
UgxszsCnH9sk4Y0FGF94AaABAg,,co7cT93lKDQ,False,author_6823,2026-05-13T17:08:21Z,2026-05-13T17:08:21Z,16,Rimandiamoli tutti a casa sua!!!!,,0,il_gazzettino,author_6823
Ugzkss8UMDutp9jfg854AaABAg,,co7cT93lKDQ,False,author_6833,2026-05-13T17:08:57Z,2026-05-13T17:08:57Z,16,Rimandatelo subito a casa sua non vogliono essere aiutati c'è la guerra là non me né FREGO .,,0,il_gazzettino,author_6833
Ugwz0yuk3N_Sn3LGdnZ4AaABAg,,co7cT93lKDQ,False,author_6824,2026-05-13T17:24:21Z,2026-05-13T17:24:21Z,2,"Sono Risorse ,lavorano in proprio",,0,il_gazzettino,author_6824
UgxHpyVjJpvXn3A1ScZ4AaABAg,,co7cT93lKDQ,False,author_6834,2026-05-13T17:31:18Z,2026-05-13T17:31:18Z,5,Secondo la legge è sufficiente la denuncia. Questo perché non succede a loro,,0,il_gazzettino,author_6834
UgzXssiq0sLq5VAg3zd4AaABAg,,co7cT93lKDQ,False,author_1742,2026-05-13T17:41:53Z,2026-05-13T17:41:53Z,0,Ma fategli fare la fame non meritano niente tornassero a casa loro tacci loro 😡😡😡😡,,0,il_gazzettino,author_1742
UgzIW3zrDFJGG60XZi94AaABAg,,co7cT93lKDQ,False,author_6835,2026-05-13T18:08:51Z,2026-05-13T18:08:51Z,0,I rimpatri di tutti no ve?,,0,il_gazzettino,author_6835
UgxVNrfN9czfTMoCF4N4AaABAg,,co7cT93lKDQ,False,author_6836,2026-05-13T18:30:28Z,2026-05-13T18:30:28Z,27,"Vengono a casa nostra e pisciano sulle nostre chiese, sulle nostre statue, sulle nostre colonne, si comportano come se fossero palme dei loro villaggi e nessuno osa dire loro la differenza. Forse ce la stiamo scordando anche noi... O. Fallaci",,0,il_gazzettino,author_6836
UgwORsJroiTjIyMfQMZ4AaABAg,,co7cT93lKDQ,False,author_1724,2026-05-13T18:52:15Z,2026-05-13T18:52:15Z,0,Prossimo giro cianuro.. oltre la beffa il danno... è ora di finirla,,0,il_gazzettino,author_1724
UgwaTKmqFpd2EboX2v14AaABAg,,co7cT93lKDQ,False,author_6837,2026-05-13T19:08:01Z,2026-05-13T19:08:01Z,6,Rimandatelo a casa con il taglierino proprio lì.....,,0,il_gazzettino,author_6837
Ugwz0yuk3N_Sn3LGdnZ4AaABAg.AWkst6MQxG3AWl5FqBtWgf,Ugwz0yuk3N_Sn3LGdnZ4AaABAg,co7cT93lKDQ,True,author_718,2026-05-13T19:21:12Z,2026-05-13T19:21:12Z,0,Te sei una risorsa! Stasera aumenta il prezzo quando vendi le chiappe.,Ugwz0yuk3N_Sn3LGdnZ4AaABAg,1,il_gazzettino,author_718
Ugzj4_N7FxyvqmjDDqF4AaABAg,,co7cT93lKDQ,False,author_1655,2026-05-13T19:31:18Z,2026-05-13T19:31:18Z,3,Remigrazione Stop Oppure a breve ci sarà la goccia che farà traboccare il vaso e dopo la guerra civile,,0,il_gazzettino,author_1655
UgxjqK7p6Gf9mcpSYfp4AaABAg,,co7cT93lKDQ,False,author_6838,2026-05-13T19:53:07Z,2026-05-13T19:53:07Z,0,Fuori dall'Italia,,0,il_gazzettino,author_6838
UgzO8kAjARRe-HDVJqp4AaABAg,,co7cT93lKDQ,False,author_4156,2026-05-13T20:42:49Z,2026-05-13T20:42:49Z,1,Rispedirlo a casa sua.,,0,il_gazzettino,author_4156
UgyZCi-ae2_W541dxYp4AaABAg,,co7cT93lKDQ,False,author_709,2026-05-13T20:51:25Z,2026-05-13T20:51:25Z,5,"In spagna si stanno già divertendo con i nuovi laureati, ingenieri e dottori che pagheranno le loro pensioni 😂😂.",,0,il_gazzettino,author_709
UgxrHC-caAjJaw6AyzJ4AaABAg,,co7cT93lKDQ,False,author_534,2026-05-13T21:18:39Z,2026-05-13T21:18:39Z,0,Si lavano la coscienza con due piatti di brodo,,0,il_gazzettino,author_534
UgxMzn7l9CaF4cNvRQF4AaABAg,,co7cT93lKDQ,False,author_6839,2026-05-13T22:40:53Z,2026-05-13T22:40:53Z,1,Remigration,,0,il_gazzettino,author_6839
UgzxPAQ5u9kh07Eww9t4AaABAg,,co7cT93lKDQ,False,author_1898,2026-05-14T02:43:07Z,2026-05-14T02:43:07Z,7,"...ma accompagnatelo a mangiare a casa di Zuppi, della Elly, di Frattoianni, Bonelli, Sala, Ilaria Salis e la Silvia Salis, Gratteri, Boldrini.....",,0,il_gazzettino,author_1898
UgzDxLxj3q2gcapheeR4AaABAg,,co7cT93lKDQ,False,author_6840,2026-05-14T03:31:14Z,2026-05-14T03:31:14Z,0,tanto verra trovata la solita scusante.....saluti da Luca da Genova,,0,il_gazzettino,author_6840
UgyZCi-ae2_W541dxYp4AaABAg.AWlF_b3Rox_AWlyPLBgRMa,UgyZCi-ae2_W541dxYp4AaABAg,co7cT93lKDQ,True,author_6840,2026-05-14T03:31:50Z,2026-05-14T03:31:50Z,0,è vero....eppure c'è chi elogia sanchez 😂😂😂😂saluti da Luca da Genova,UgyZCi-ae2_W541dxYp4AaABAg,1,il_gazzettino,author_6840
UgwP-1FkRZwSi0Cn_ud4AaABAg,,co7cT93lKDQ,False,author_6841,2026-05-14T05:54:54Z,2026-05-14T05:54:54Z,0,Però perché chiudere caritas? Adesso i poveri disgraziati non potranno mangiare sino a lunedì o potersi lavare. È solo propaganda l'aiuto che danno gli uomini della chiesa,,0,il_gazzettino,author_6841
UgyAy19CGvH4FDbKQBZ4AaABAg,,co7cT93lKDQ,False,author_6842,2026-05-14T06:53:38Z,2026-05-14T06:53:38Z,0,ancora li tenete qua rimandateli al loro paese,,0,il_gazzettino,author_6842
UgzlXlV7adMnwsxSfsB4AaABAg,,co7cT93lKDQ,False,author_6843,2026-05-14T11:29:24Z,2026-05-14T11:29:24Z,0,"Non tutti per fortuna ma gran parte di questi schifosi non chiedono aiuto, lo pretendono e se non lo ottengono ti aggrediscono, basta con questo finto buonismo, siamo Cristiani ed il principio è l'umiltà, cosa che non conoscono.",,0,il_gazzettino,author_6843
UgysFlehj0-4ECOvPCR4AaABAg,,co7cT93lKDQ,False,author_4709,2026-05-14T11:37:15Z,2026-05-14T11:37:15Z,0,Ma li vogliamo cacciare? Chi li vuole li tenga a casa loro,,0,il_gazzettino,author_4709
UgwtuNGjv6E6SYDpp6d4AaABAg,,co7cT93lKDQ,False,author_25,2026-05-14T11:48:43Z,2026-05-14T11:48:43Z,0,Sono quelli che la Chiesa vuole integrare teneteveli stretti,,0,il_gazzettino,author_25
Ugw5E9LYknQNuBq_qd14AaABAg,,co7cT93lKDQ,False,author_4078,2026-05-14T12:33:18Z,2026-05-14T12:33:18Z,1,Sempre.loro lacaritas fa di tutto per venire incontro ai loro problemi eun operatore viene aggredito enon e la prima volta,,0,il_gazzettino,author_4078
Ugyc-Zq0ZNEOgewcjfR4AaABAg,,co7cT93lKDQ,False,author_3397,2026-05-14T12:33:48Z,2026-05-14T12:33:48Z,0,"Comunque è stato incriminato, ma dopo è stato liberato ovviamente... Finché trattiamo così gli invasori sarà sempre peggio, grazie alla sinistra antitaliana che li vogliono come serbatoi di voti per il resto non gli interessa nulla.",,0,il_gazzettino,author_3397
UgxMVNWtv7Yl2-Vt4mF4AaABAg,,co7cT93lKDQ,False,author_1511,2026-05-14T13:48:46Z,2026-05-14T13:48:46Z,0,Nulla da mangiare a chi é straniero,,0,il_gazzettino,author_1511
Ugx_W2K6K2gYFz1c6WN4AaABAg,,co7cT93lKDQ,False,author_6844,2026-05-14T13:54:56Z,2026-05-14T13:54:56Z,0,Por culpa de un cretino ...sufriran otras personas el hambre😢,,0,il_gazzettino,author_6844
Ugw8UpfqKp5LLvAe6894AaABAg,,co7cT93lKDQ,False,author_6845,2026-05-14T14:16:06Z,2026-05-14T14:16:06Z,2,"Bastardo.....povero ragazzo dal cuore d'oro, un volontario e qualcuno da Rispettare e Onorare❤",,0,il_gazzettino,author_6845
UgxZ3GNFrbJ-5-McyCN4AaABAg,,co7cT93lKDQ,False,author_4689,2026-05-14T16:16:31Z,2026-05-14T16:16:31Z,0,Portatelo in un angolo nascosto e girategli le ginocchia a rovescio come i gatti vedi come si calma,,0,il_gazzettino,author_4689
UgyG40kySyE2XLTm4h14AaABAg,,co7cT93lKDQ,False,author_6846,2026-05-14T21:36:31Z,2026-05-14T21:36:31Z,0,Quando inizia la guerra di liberazione? Hanno rotto i peperoni!,,0,il_gazzettino,author_6846
UgzymPN2o2EwtTg9xlF4AaABAg,,co7cT93lKDQ,False,author_6717,2026-05-17T18:17:17Z,2026-05-17T18:17:17Z,1,"Cosa deve succedere ancora di peggio dell'attentato di Modena, per far capire che, una immigrazione selvaggia porta solo a questo?",,0,il_gazzettino,author_6717
