comment_id,parent_comment_id,video_id,is_reply,author,published_at,updated_at,like_count,text,inferred_parent_id,depth,newspaper,author_anon,label
UgyRwXe1dUXIJMV-ZW14AaABAg.AXC26uHxLYYAXDI8aXEnQL,UgyRwXe1dUXIJMV-ZW14AaABAg,XMNmGh69aTI,True,author_3005,2026-05-25T03:31:47Z,2026-05-25T03:31:47Z,5,"Putin è il criminale, idioti!🇺🇦🇺🇦🇺🇦",UgyRwXe1dUXIJMV-ZW14AaABAg,1,repubblica,author_3005,1
UgwxkoP2KsCYZstl7Cl4AaABAg,,XMNmGh69aTI,False,author_3006,2026-05-25T05:00:04Z,2026-05-25T05:00:04Z,0,"I nazzi nato han ucciso deliberatamente ragazzi innocenti, le industrie europee producono tutte armi per questi nazzisti.
Quelle bombe non servono ad attaccare servono a difendersi dalla Nato",,0,repubblica,author_3006,1
UgwUa4QTFrcWWn_LEUR4AaABAg,,XMNmGh69aTI,False,author_3007,2026-05-25T05:25:01Z,2026-05-26T16:57:50Z,0,Menomale che la Russia sta perdendo....,,0,repubblica,author_3007,0
UgzDqt9wlsS5uv2lmjx4AaABAg.AXBNCqQTw0iAXDVuQW1MSW,UgzDqt9wlsS5uv2lmjx4AaABAg,XMNmGh69aTI,True,author_3008,2026-05-25T05:32:02Z,2026-05-25T05:32:02Z,2,Si ci stiamo cagando 😢sotto.... alla fine il tuo compare putin... finirà a testa in giù,UgzDqt9wlsS5uv2lmjx4AaABAg,1,repubblica,author_3008,1
Ugw4VvLLs1GlnSziNnl4AaABAg.AXBqdPI-gIyAXDVzjCqPFz,Ugw4VvLLs1GlnSziNnl4AaABAg,XMNmGh69aTI,True,author_3008,2026-05-25T05:32:46Z,2026-05-25T05:32:46Z,0,TACI MERDA ZECCAROSSA COMMUMERRDA DELL'UMANITÀ,Ugw4VvLLs1GlnSziNnl4AaABAg,1,repubblica,author_3008,1
UgyRwXe1dUXIJMV-ZW14AaABAg.AXC26uHxLYYAXDXv0us7Kv,UgyRwXe1dUXIJMV-ZW14AaABAg.AXC26uHxLYYAXDI8aXEnQL,XMNmGh69aTI,True,author_2963,2026-05-25T05:49:36Z,2026-05-25T05:49:36Z,0,author_7666 vedo brava gente in tutti io !,UgyRwXe1dUXIJMV-ZW14AaABAg.AXC26uHxLYYAXDI8aXEnQL,2,repubblica,author_2963,0
UgxQPSpr5kINY9ua6Lh4AaABAg.AXBMoPA6bL7AXD_7dccaYs,UgxQPSpr5kINY9ua6Lh4AaABAg,XMNmGh69aTI,True,author_1343,2026-05-25T06:08:56Z,2026-05-25T06:08:56Z,1,I politici europei sono il risultato dei popoli europei,UgxQPSpr5kINY9ua6Lh4AaABAg,1,repubblica,author_1343,0
Ugzh79LMmclOVkAcNCF4AaABAg,,XMNmGh69aTI,False,author_1360,2026-05-25T06:14:09Z,2026-05-25T06:14:09Z,0,"Oltre le armi abbiamo mandato anche i vigili del fuoco tedeschi?
Siete sicuri che sia Kiev?
Mah!?!",,0,repubblica,author_1360,1
UgxK4ts3Sl-h83RrLm54AaABAg,,XMNmGh69aTI,False,author_3009,2026-05-25T06:14:21Z,2026-05-25T06:14:21Z,0,"Non si venga a riprendere la favoletta che i russi sono cattivi...
Non si fa il tifo per la morte di nessuno,ma ad ogni azione...una reazione.",,0,repubblica,author_3009,0
UgxMm300h6AH8TkLNkF4AaABAg,,XMNmGh69aTI,False,author_3010,2026-05-25T06:21:44Z,2026-05-25T06:21:44Z,0,Non era questo.,,0,repubblica,author_3010,0
Ugw4VvLLs1GlnSziNnl4AaABAg.AXBqdPI-gIyAXDbIz7iPy2,Ugw4VvLLs1GlnSziNnl4AaABAg,XMNmGh69aTI,True,author_3010,2026-05-25T06:27:57Z,2026-05-25T06:27:57Z,0,C,Ugw4VvLLs1GlnSziNnl4AaABAg,1,repubblica,author_3010,0
UgxQPSpr5kINY9ua6Lh4AaABAg.AXBMoPA6bL7AXDbJ0eAq1_,UgxQPSpr5kINY9ua6Lh4AaABAg.AXBMoPA6bL7AXD_7dccaYs,XMNmGh69aTI,True,author_2963,2026-05-25T06:27:58Z,2026-05-25T06:27:58Z,3,author_7667 il risultato della “corruzione” !,UgxQPSpr5kINY9ua6Lh4AaABAg.AXBMoPA6bL7AXD_7dccaYs,2,repubblica,author_2963,1
UgyG0IERNBJuxrCmga94AaABAg,,XMNmGh69aTI,False,author_3011,2026-05-25T07:00:48Z,2026-05-25T07:00:48Z,0,I nazisti ucraini devono ringraziare santo Putin che ancora non li ha polverizzati. Hitler si scontro' con i russi e le prese. Oggi ci riprovano i nazisti sotto il nome di volenterosi,,0,repubblica,author_3011,1
UgzGsl10K5SJYwPJYsp4AaABAg,,XMNmGh69aTI,False,author_3010,2026-05-25T07:17:41Z,2026-05-25T07:17:41Z,1,A quelli che pensano che dipende dal Ucraina fate un riassunto di coscienza. Fatte scifo.,,0,repubblica,author_3010,1
Ugz0-LOTvefCiVNeTjF4AaABAg,,XMNmGh69aTI,False,author_3012,2026-05-25T08:18:16Z,2026-05-25T08:18:16Z,0,"631 commenti contro Kiev & Company. Quindi 99,9% di plebiscito. Tra qualche settimana ci sarà una azione militare di Mosca impressionante. Preparatevi perché sarà molto dura da digerire in Europa. Molte aziende che producono droni al cocainomane verranno bloccate in maniera legittima.",,0,repubblica,author_3012,1
Ugy58am_Gw09gyMHn6V4AaABAg,,XMNmGh69aTI,False,author_3013,2026-05-25T08:24:18Z,2026-05-25T08:24:18Z,0,"Perché non riportate l’attacco di droni fatti da Kiev in dombas ad una scuola di bambini e dive sono stati uccisi una quindicina di bimbi e feriti 70? Questa è la risposta russa al vile attacco , intorno alla scuola non esistevano obiettivi strategici e, sul posto ,sono stati ritrovati frammenti di droni italiani (ci sono i video ) informazione più che imbarazzante per noi italiani",,0,repubblica,author_3013,1
UgwMepSmgwVRjxDpfih4AaABAg,,XMNmGh69aTI,False,author_3014,2026-05-25T08:28:01Z,2026-05-25T08:28:01Z,0,"Abbaiare davanti alla porta dell’orso russo porta solo a brutte cose, con intelligenza si poteva risollevare l’Europa senza fare harakiri con green 110 e riarmo , intanto le lobby si sfregano le mani",,0,repubblica,author_3014,1
UgzYfaWsL4hEbr_JQWZ4AaABAg.AXBRvO4l2KYAXDpCHQBcrE,UgzYfaWsL4hEbr_JQWZ4AaABAg,XMNmGh69aTI,True,author_3014,2026-05-25T08:29:23Z,2026-05-25T08:29:23Z,2,Draghi la nostra rovina totale e certi intellettuali come mieli lo adulano ancora,UgzYfaWsL4hEbr_JQWZ4AaABAg,1,repubblica,author_3014,1
Ugx0SvB1gRLubHVFDrV4AaABAg,,XMNmGh69aTI,False,author_3015,2026-05-25T08:40:31Z,2026-05-25T08:40:31Z,0,A jà ljublju USSR! fanculo l' ucraina delle banche e degli əbrei,,0,repubblica,author_3015,1
UgyTZ0o1_KJ6CLxB-I14AaABAg,,XMNmGh69aTI,False,author_3016,2026-05-25T08:55:27Z,2026-05-25T08:55:27Z,0,"""Progettato per attacchi nucleari contro le capitali europee""
Fonte? 😂 giornalaisti, raccoglierò tutte le firme del mio albero genealogico per farvi togliere i fondi statali... venduti! Disinformazione allo stato puro",,0,repubblica,author_3016,1
UgzD__OqmeSM5Ol-UuN4AaABAg,,XMNmGh69aTI,False,author_390,2026-05-25T09:14:22Z,2026-05-25T09:14:22Z,0,"L' Oreshnik sarebbe stato progettato per l'attacco alle capitali Europee ?!?!....ma và !?!?
Spiegatemi una cosa...ma come mai, da un lato Washington appena eletto Trump, ha riaperto subito il dialogo con l'amico Putin con la destra mentre, sotto al tavolo, con la sinistra, impone ai media Europei, la narrazione del terrorismo psicologico per fomentare l'odio e la convinzione di essere al centro dei pensieri bagnati della Russia ???",,0,repubblica,author_390,0
Ugy4BQ_go2jU0TUF8I54AaABAg,,XMNmGh69aTI,False,author_3017,2026-05-25T09:23:03Z,2026-05-25T09:23:03Z,1,"Quanti filorussi de merda nei commenti... Fate pena avete scelto il male del resto siete vittime di propaganda russa, che fa di tutto x farvi credere a ciò che vuole.. Aooooooo svejaaaaaa, la Russia se non c'era Ucraina ve magna x colazione agli europei, e voi a dire anche che è colpa del Ucraina... Ma siamo scherzando!?",,0,repubblica,author_3017,1
UgxrVBPUvpJYUS_ooYV4AaABAg,,XMNmGh69aTI,False,author_2168,2026-05-25T09:32:20Z,2026-05-25T09:32:20Z,0,Ma questa guerra è voluta dall'occidente di merda servo del potere occulto e del sistema finanziario o da Putin? Da chi si nutre di sangue umano o dall'imperialismo russo? Prima o poi ci sarà la resa dei conti e pagheranno tutti coloro che hanno portato lutti in entrambe le regioni. Gli innocenti pagano x i peccatori.,,0,repubblica,author_2168,1
UgzDqt9wlsS5uv2lmjx4AaABAg.AXBNCqQTw0iAXDyFesyTne,UgzDqt9wlsS5uv2lmjx4AaABAg.AXBNCqQTw0iAXDVuQW1MSW,XMNmGh69aTI,True,author_3018,2026-05-25T09:48:29Z,2026-05-25T09:48:29Z,1,author_3008😂😂😂😂,UgzDqt9wlsS5uv2lmjx4AaABAg.AXBNCqQTw0iAXDVuQW1MSW,2,repubblica,author_3018,0
UgzDqt9wlsS5uv2lmjx4AaABAg.AXBNCqQTw0iAXDyGHF-z-q,UgzDqt9wlsS5uv2lmjx4AaABAg.AXBNCqQTw0iAXDHzk9thSf,XMNmGh69aTI,True,author_3018,2026-05-25T09:48:34Z,2026-05-25T09:48:34Z,1,author_3005😂😂😂😂,UgzDqt9wlsS5uv2lmjx4AaABAg.AXBNCqQTw0iAXDHzk9thSf,2,repubblica,author_3018,0
UgzDqt9wlsS5uv2lmjx4AaABAg.AXBNCqQTw0iAXE-EF26v8o,UgzDqt9wlsS5uv2lmjx4AaABAg,XMNmGh69aTI,True,author_3019,2026-05-25T10:05:46Z,2026-05-25T10:05:46Z,0,"​author_7668 abbi pazienza,  da una frase come quella dove lo leggi che è pro putin? Io ho pensato la stessa cosa quando l ucraina ha bombardato l'fsb,  la risposta russa sarà inevitabile, è una semplice considerazione, adesso vuoi dire anche a me che sono pro putin perché sono giunto ad una conclusione ovvia? 
Ma porco d.. mangiate pane e merda a mattino o siete nati così idioti che uno non può esprimere una semplice opinione che deve essere attaccato subito?",UgzDqt9wlsS5uv2lmjx4AaABAg.AXBNCqQTw0iAXDVuQW1MSW,2,repubblica,author_3019,1
UgxQPSpr5kINY9ua6Lh4AaABAg.AXBMoPA6bL7AXE001G7nez,UgxQPSpr5kINY9ua6Lh4AaABAg.AXBMoPA6bL7AXDbJ0eAq1_,XMNmGh69aTI,True,author_1343,2026-05-25T10:12:33Z,2026-05-25T10:12:33Z,0,​author_2963 il popolo é corrotto! Nessun re va in guerra da solo!,UgxQPSpr5kINY9ua6Lh4AaABAg.AXBMoPA6bL7AXDbJ0eAq1_,3,repubblica,author_1343,0
Ugx6AsIiUUONBNlRRkt4AaABAg,,XMNmGh69aTI,False,author_3020,2026-05-25T10:24:44Z,2026-05-25T10:24:44Z,0,Come al solito. Ci sono morti da piangere e morti da ignorare. Che schifo!,,0,repubblica,author_3020,1
UgzVGzhBXYJfOZE6trN4AaABAg.AXBd7CqhffBAXE3JGOupt7,UgzVGzhBXYJfOZE6trN4AaABAg.AXBd7CqhffBAXBe6CoO5U-,XMNmGh69aTI,True,author_2894,2026-05-25T10:41:24Z,2026-05-25T10:41:24Z,0,"author_2888🫠
Vero anche l’ak47 spara fino a 1000 metri e vedi un po’ lo hanno progettato per controllare ed eventualmente invadere il confine EUROPEO 
I carri russi fanno 600 km con un pieno….serbatoio progettato per la circolazione urbana e statale media europea ! 
I sommergibili nucleari, tra l’altro come afferma lo stesso RUTTO, arrivano fino in Norvegia poi da lì posso attaccare l’UE esattamente come da progetto….

😂😂😂😂😂😂😂

Ma cosa avete nel cervello 

Le armi si sviluppano a 360 gradi poi l’impiego è usato ove c’è la minaccia ! 

Sottolineare “per colpire le città europee” è PROPAGANDA TERRORISTICA ANTI RUSSA !!!!!!!!!!!!!",UgzVGzhBXYJfOZE6trN4AaABAg.AXBd7CqhffBAXBe6CoO5U-,2,repubblica,author_2894,1
UgyrI8Sa54yzcZH-P5Z4AaABAg,,XMNmGh69aTI,False,author_3021,2026-05-25T11:32:14Z,2026-05-25T11:32:14Z,0,Spero che ne prenda uno in testa il🤡 zecchenski!!!!,,0,repubblica,author_3021,1
UgwsRN5oEhMhUFzvxjN4AaABAg,,XMNmGh69aTI,False,author_130,2026-05-25T11:53:41Z,2026-05-25T11:53:41Z,0,"Mi sa che poco prima , nella notte,vi sia stato un attacco ad un collegio dove dormivano i ragazzini...certo che il male è l'unico volto della guerra da che parte la si guardi sempre schifo fa",,0,repubblica,author_130,1
UgyvyvK3bVHZGwr-TRZ4AaABAg.AXBRnfeSgSoAXEC78na_lr,UgyvyvK3bVHZGwr-TRZ4AaABAg,XMNmGh69aTI,True,author_3022,2026-05-25T11:58:24Z,2026-05-25T11:58:24Z,1,Verità scomoda,UgyvyvK3bVHZGwr-TRZ4AaABAg,1,repubblica,author_3022,0
Ugy67b47D-TESa_GoJx4AaABAg,,XMNmGh69aTI,False,author_3023,2026-05-25T12:45:36Z,2026-05-25T12:45:36Z,0,Finche daranno armi a un pagliaccio.....questo e .,,0,repubblica,author_3023,1
UgzTgPJW56Hgvw_ctlV4AaABAg,,XMNmGh69aTI,False,author_3024,2026-05-25T12:53:21Z,2026-05-25T12:53:21Z,0,"Il tossico si ingrassa, politici UE si ingrassano, noi cacciamo i soldi e la povera gente muore.",,0,repubblica,author_3024,1
UgxjSNfF9AX5FyN9BCR4AaABAg,,XMNmGh69aTI,False,author_3025,2026-05-25T12:55:58Z,2026-05-25T12:55:58Z,0,Sfacciati comunisti sanguinari e incapaci  l' operazione speciale non doveva durare 3 mesi ? 4 anni invece,,0,repubblica,author_3025,1
UgzYoV5myGw6fx9TJEV4AaABAg.AXBkwkyzM7pAXEL27ptncJ,UgzYoV5myGw6fx9TJEV4AaABAg,XMNmGh69aTI,True,author_3026,2026-05-25T13:16:21Z,2026-05-25T13:16:21Z,0,Se ci mettono draghi a trattare tutte quelle bombe ce le meritiamo...,UgzYoV5myGw6fx9TJEV4AaABAg,1,repubblica,author_3026,1
UgwWUef5eRHWcbbL1OV4AaABAg.AXBKl0tcRYaAXEL_QAq84Y,UgwWUef5eRHWcbbL1OV4AaABAg.AXBKl0tcRYaAXBWp9VkPoi,XMNmGh69aTI,True,author_3026,2026-05-25T13:21:02Z,2026-05-25T13:21:02Z,1,"​author_2850 bene così, si venderanno anche quei 4 missili per altri cessi d'oro. E gli europei pagano, contentissimi di farsi fregare.",UgwWUef5eRHWcbbL1OV4AaABAg.AXBKl0tcRYaAXBWp9VkPoi,2,repubblica,author_3026,1
UgwzpVE3T15lSHAQafJ4AaABAg.AXBSwQTTIxWAXEMO3w_w_m,UgwzpVE3T15lSHAQafJ4AaABAg,XMNmGh69aTI,True,author_3026,2026-05-25T13:28:05Z,2026-05-25T13:28:05Z,0,Con gli ultimi 90 miliardi di euro li ricomprano subito.,UgwzpVE3T15lSHAQafJ4AaABAg,1,repubblica,author_3026,0
UgzGsl10K5SJYwPJYsp4AaABAg.AXDh-AN4NguAXEMuNpQ7rS,UgzGsl10K5SJYwPJYsp4AaABAg,XMNmGh69aTI,True,author_3026,2026-05-25T13:32:38Z,2026-05-25T13:32:38Z,0,"Il tuo italiano fa anche schifo, ci sei abituato.",UgzGsl10K5SJYwPJYsp4AaABAg,1,repubblica,author_3026,1
UgzK3AJh7_3NBsiN-JN4AaABAg,,XMNmGh69aTI,False,author_3027,2026-05-25T13:58:27Z,2026-05-25T13:58:27Z,0,"La Repubblica dovrebbe anche dire che  in precedenza, gli ucraini avevano colpito con droni con componenti di provenienza italiana, un dormitorio di studenti adolescenti in territorio russo, causando la morte di una trentina di ragazzi e numerosi feriti.",,0,repubblica,author_3027,1
UgyOvq7CZGl8fKbwJtZ4AaABAg,,XMNmGh69aTI,False,author_3028,2026-05-25T13:59:21Z,2026-05-25T13:59:21Z,0,Hanno ordinato al drogato di provocare più ritorsioni possibili dalla Russia attraverso il contributo dei deficienti baltici per arrivare al bombardamento fra qualche giorno di Parigi Berlino e Londra!!! Auguri,,0,repubblica,author_3028,1
Ugzw1eUIK2Lenmh5VbN4AaABAg,,XMNmGh69aTI,False,author_3029,2026-05-25T14:11:41Z,2026-05-25T14:11:41Z,0,Poveri Ucretini!,,0,repubblica,author_3029,0
Ugw6qs8nKBZm1vlQGYR4AaABAg,,XMNmGh69aTI,False,author_3030,2026-05-25T15:31:53Z,2026-05-25T15:31:53Z,1,"Bisogna disertare in massa..uno solo non può decidere il destino di milioni..se non succede prima o poi siamo destinati all estinzione...il pianeta può fare a meno di noi..siamo solo parassiti.. nascerà altra vita..diversa
.",,0,repubblica,author_3030,1
UgzIR7CmcV5NkTfBJUt4AaABAg,,XMNmGh69aTI,False,author_3031,2026-05-25T16:55:17Z,2026-05-25T16:55:17Z,0,A brigante si risponde con brigante e mezzo....ben fatto,,0,repubblica,author_3031,1
UgxNFvNVGk-gP-KkD3R4AaABAg,,XMNmGh69aTI,False,author_3032,2026-05-25T17:08:52Z,2026-05-25T17:08:52Z,0,Spero si capisca che portare la guerra in Russia è la fine per l'Ucraina e se insistiamo anche per noi,,0,repubblica,author_3032,1
UgwaM8G0PDcvaf8nKql4AaABAg,,XMNmGh69aTI,False,author_3033,2026-05-25T19:21:46Z,2026-05-25T19:21:46Z,0,"Oreshnik progettato per aprirvi come una cozza..il bello è che gli attacchi effettuati fin'ora con questo sistema missilistico sono stati effettuati con la sola inerzia del missile aenza alcuna testata esplosiva ahaha😂😂
Precisazione devastante",,0,repubblica,author_3033,1
Ugx5Fb5nJUwZcjxuMD94AaABAg,,XMNmGh69aTI,False,author_3034,2026-05-25T21:13:49Z,2026-05-25T21:13:49Z,0,Un missile è un missile scrivere progettato per attacchi alle capitali europee e subdola propaganda per mettere in allarme i cittadini.,,0,repubblica,author_3034,0
UgzYfaWsL4hEbr_JQWZ4AaABAg.AXBRvO4l2KYAXFBzfEQoKV,UgzYfaWsL4hEbr_JQWZ4AaABAg,XMNmGh69aTI,True,author_83,2026-05-25T21:16:28Z,2026-05-25T21:16:28Z,0,author_3014 beh sara' bellissimo verderlo maneggiato da Putin,UgzYfaWsL4hEbr_JQWZ4AaABAg.AXBRvO4l2KYAXDpCHQBcrE,2,repubblica,author_83,1
UgzpAS2OyAaFb_zS4C14AaABAg.AXBI6qGTHkIAXCazodqlwY,UgzpAS2OyAaFb_zS4C14AaABAg.AXBI6qGTHkIAXBcw8ao25n,XMNmGh69aTI,True,author_2899,2026-05-26T00:00:00+00:00,,0,"​ author_2869 sono d' accordo, ma mi sa che volevi taggare il filorusso",UgzpAS2OyAaFb_zS4C14AaABAg.AXBI6qGTHkIAXBoAXPzUTS,4,repubblica,author_2899,1
UgymxTD9eSGTXvpCVPB4AaABAg.AXBJA-cJ7ZqAXEJWLNDE5P,UgymxTD9eSGTXvpCVPB4AaABAg.AXBJA-cJ7ZqAXBUXTUjGM8,XMNmGh69aTI,True,author_3035,2026-05-26T00:00:00+00:00,,1,"author_2834 Purtroppo no, se la Russia dovesse fermarsi l'occidente andrà avanti con il programma del 2021 di installare missili Usa sul confine e poi una volta annullata la loro deterrenza nucleare gli faremmo fare la fine che abbiamo fatto fare a Iraq, Libia, Siria, Palestina, Cisgiordania, Laos ecc.... capisco che da noi non venga raccontato il terrore che seminiamo nel mondo e crediamo di essere i giusti, ma gli altri 7 miliardi di persone fuori dall'occidente non dimenticano il nostro terrorismo. La cosa peggiore non sono gli ignoranti che spesso non sanno nemmeno di esserlo, ma gli ipocriti, quelli sono davvero imbarazzanti. Lasciamo in pace ucraini, russi, cinesi, africani, asiatici, sud americani e groenlandesi, iniziamo a farci gli affari nostri.",UgymxTD9eSGTXvpCVPB4AaABAg.AXBJA-cJ7ZqAXBUXTUjGM8,2,repubblica,author_3035,1
Ugz7NqL4bmeMNFHalaB4AaABAg.AXBLB5UE7A6AXCBoOrmH-O,Ugz7NqL4bmeMNFHalaB4AaABAg.AXBLB5UE7A6AXBTOe1DOpr,XMNmGh69aTI,True,author_2152,2026-05-26T00:00:00+00:00,,4,​ author_2909   Arruolati volontario nell'esercito ucraino a combattere i russi sul campo e levati dalle balle,Ugz7NqL4bmeMNFHalaB4AaABAg.AXBLB5UE7A6AXBgrJtYC4X,4,repubblica,author_2152,1
Ugz7NqL4bmeMNFHalaB4AaABAg.AXBLB5UE7A6AXCKQ6AD64Y,Ugz7NqL4bmeMNFHalaB4AaABAg,XMNmGh69aTI,True,author_3036,2026-05-26T00:00:00+00:00,,5,È ancora poco e la miserabile KK accusa di terrorismo la risposta di Mosca alla strage nella scuola🤮,Ugz7NqL4bmeMNFHalaB4AaABAg,1,repubblica,author_3036,1
UgzalgU12DCInxHye1B4AaABAg.AXBOlovzGjAAXDavdLjjlw,UgzalgU12DCInxHye1B4AaABAg.AXBOlovzGjAAXBqgUuU9ba,XMNmGh69aTI,True,author_3010,2026-05-26T00:00:00+00:00,,1, author_2987  parla una italiana.,UgzalgU12DCInxHye1B4AaABAg.AXBOlovzGjAAXBqgUuU9ba,3,repubblica,author_3010,1
Ugyj3D9tbZm-Ka7nX214AaABAg.AXBHRZoj62tAXELDBpKXtg,Ugyj3D9tbZm-Ka7nX214AaABAg.AXBHRZoj62tAXBIreVxj4x,XMNmGh69aTI,True,author_3026,2026-05-26T00:00:00+00:00,,0,"​ author_2766  imparare un po' di italiani prima di scrivere, no?",Ugyj3D9tbZm-Ka7nX214AaABAg.AXBHRZoj62tAXBIreVxj4x,2,repubblica,author_3026,1
Ugz7NqL4bmeMNFHalaB4AaABAg.AXBLB5UE7A6AXE6eZiR1Kt,Ugz7NqL4bmeMNFHalaB4AaABAg,XMNmGh69aTI,True,author_3037,2026-05-26T00:00:00+00:00,,0,21 morti🥲,Ugz7NqL4bmeMNFHalaB4AaABAg,1,repubblica,author_3037,0
UgxE9YBLlSDZXYYlAA14AaABAg.AXBKndp1uJoAXCEj5-VdKU,UgxE9YBLlSDZXYYlAA14AaABAg.AXBKndp1uJoAXBNvBpuH0o,XMNmGh69aTI,True,author_182,2026-05-26T00:00:00+00:00,,0,"​ author_104   Come fa a succedere vicino a casa mia, se la Russia non ha più  munizioni, combatte a con le pale a dorso di mulo. Tu dovresti saperlo essendo sei sui campi geopolitici da anni a fare l'inviata di guerra pro🇺🇦.",UgxE9YBLlSDZXYYlAA14AaABAg.AXBKndp1uJoAXBhEtKsUlR,4,repubblica,author_182,1
Ugz7NqL4bmeMNFHalaB4AaABAg.AXBLB5UE7A6AXC9PjXTTPG,Ugz7NqL4bmeMNFHalaB4AaABAg.AXBLB5UE7A6AXBeCGzkKRP,XMNmGh69aTI,True,author_2900,2026-05-26T00:00:00+00:00,,0,"​​ author_2955 hai detto giusto a metà...sono dei maledetti...e lo saranno per sempre,dei maledetti guerrafondai. Ma stavolta non la faranno franca...perderà la guerra l' assassino putinovic e la Russia finalmente morirà per il bene dell' umanità. Inoltre non è vero che non c' era difesa aerea, perché la maggior parte dei droni e missili sono stati abbattuti. Non quei ipersonici",Ugz7NqL4bmeMNFHalaB4AaABAg.AXBLB5UE7A6AXC35TTako5,4,repubblica,author_2900,1
UgzalgU12DCInxHye1B4AaABAg.AXBOlovzGjAAXCJEUGvoet,UgzalgU12DCInxHye1B4AaABAg.AXBOlovzGjAAXBmfH-nNr4,XMNmGh69aTI,True,author_2987,2026-05-26T00:00:00+00:00,,2,"​ author_2859 Il vostro paese è corrotto. I nostri soldi finiscono nelle mani dei vostri ""patrioti""che si comprano i cessi d'oro. Lei continua a combattere qui? 😃😃😃",UgzalgU12DCInxHye1B4AaABAg.AXBOlovzGjAAXC1ADwo8JB,4,repubblica,author_2987,1
UgzalgU12DCInxHye1B4AaABAg.AXBOlovzGjAAXCKdK9OgV3,UgzalgU12DCInxHye1B4AaABAg,XMNmGh69aTI,True,author_2974,2026-05-26T00:00:00+00:00,,1,☝👏👏👏👏👏,UgzalgU12DCInxHye1B4AaABAg,1,repubblica,author_2974,0
UgzalgU12DCInxHye1B4AaABAg.AXBOlovzGjAAXC94yCT2DI,UgzalgU12DCInxHye1B4AaABAg.AXBOlovzGjAAXBmfH-nNr4,XMNmGh69aTI,True,author_2925,2026-05-26T00:00:00+00:00,,3,"​ author_2959 Non so se le è arrivata la mia risposta. Non scrivo la seconda volta, non ho tempo da perdere con gli idioti e impari a rispettare le persone.",UgzalgU12DCInxHye1B4AaABAg.AXBOlovzGjAAXC5YjA4418,4,repubblica,author_2925,1
UgzalgU12DCInxHye1B4AaABAg.AXBOlovzGjAAXCEszXVWsj,UgzalgU12DCInxHye1B4AaABAg.AXBOlovzGjAAXBahkVKmBU,XMNmGh69aTI,True,author_2859,2026-05-26T00:00:00+00:00,,2,"​ author_2917 No.. no lo è, capisco benissimo la sua rabbia. Purtroppo viviamo in una giungla dove vince e decide il più forte. Non è bello per nessuno",UgzalgU12DCInxHye1B4AaABAg.AXBOlovzGjAAXC3bWUnsIs,5,repubblica,author_2859,0
Ugz7NqL4bmeMNFHalaB4AaABAg.AXBLB5UE7A6AXEKpNYhN4N,Ugz7NqL4bmeMNFHalaB4AaABAg.AXBLB5UE7A6AXBeCGzkKRP,XMNmGh69aTI,True,author_3026,2026-05-26T00:00:00+00:00,,0,"​ author_2900 
Chiedi a napoleone e hitler come si vince una guerra con la Russia. 
O non sai chi sono?",Ugz7NqL4bmeMNFHalaB4AaABAg.AXBLB5UE7A6AXBeCGzkKRP,3,repubblica,author_3026,1
UgzalgU12DCInxHye1B4AaABAg.AXBOlovzGjAAXCFnn7Z2L0,UgzalgU12DCInxHye1B4AaABAg.AXBOlovzGjAAXBmfH-nNr4,XMNmGh69aTI,True,author_2859,2026-05-26T00:00:00+00:00,,0,​ author_2925 😂😂😂ha dimenticato quelle di Soloviov e metà parlamento russo. Comunque ora che ha raccontato un po' di se la capisco. Non arriveremo mai a un punto d'incontro perché siamo nemici. Lei ha la sua verità e io la mia quindi è inutile continuare. Buona fortuna 😉,UgzalgU12DCInxHye1B4AaABAg.AXBOlovzGjAAXC5P8yJrUV,4,repubblica,author_2859,0
UgzalgU12DCInxHye1B4AaABAg.AXBOlovzGjAAXEBkGnO4gM,UgzalgU12DCInxHye1B4AaABAg.AXBOlovzGjAAXBqgUuU9ba,XMNmGh69aTI,True,author_3010,2026-05-26T00:00:00+00:00,,0, author_2987 certo   Penso ha senso,UgzalgU12DCInxHye1B4AaABAg.AXBOlovzGjAAXBqgUuU9ba,3,repubblica,author_3010,0
UgwhGGznuEz7pE8kNqd4AaABAg.AXBUc7gUZQDAXCjWXVNWmX,UgwhGGznuEz7pE8kNqd4AaABAg.AXBUc7gUZQDAXBb9lDwvzl,XMNmGh69aTI,True,author_2844,2026-05-26T00:00:00+00:00,,0,"​ author_2857 Fate sentire la vostra voce quando Kiev verrà rasa al suolo,
 perche Zelensky vuole questo.",UgwhGGznuEz7pE8kNqd4AaABAg.AXBUc7gUZQDAXBzeipf0dt,4,repubblica,author_2844,1
UgyRwXe1dUXIJMV-ZW14AaABAg.AXC26uHxLYYAXDb4ltYKGm,UgyRwXe1dUXIJMV-ZW14AaABAg,XMNmGh69aTI,True,author_3010,2026-05-26T00:00:00+00:00,,0,Sei il genio. Da dove scrivi? Da rehab,UgyRwXe1dUXIJMV-ZW14AaABAg,1,repubblica,author_3010,0
UgxMhiuDa9vLumtnWz94AaABAg.AXBPHMg_AMmAXCCFKpYHsk,UgxMhiuDa9vLumtnWz94AaABAg.AXBPHMg_AMmAXC3165h8oe,XMNmGh69aTI,True,author_2999,2026-05-26T00:00:00+00:00,,2," author_2849   il bias non è riferito alle persone ma al metodo di  indagine statistica. le ho anche fatto un esempio molto chiaro. Se lo rilegga, non mi va di ripetermi. Non mi attribuisca frasi che non ho mai scritto. Comunque il punto è proprio questo: in Ucraina c'è una parte di ucraini che non vogliono essere ucraini. La risposta del governo ucraino è stata umiliarli, emarginarli, e fare violenze su di loro.",UgxMhiuDa9vLumtnWz94AaABAg.AXBPHMg_AMmAXC3165h8oe,3,repubblica,author_2999,0
UgxMhiuDa9vLumtnWz94AaABAg.AXBPHMg_AMmAXCBNNMpJud,UgxMhiuDa9vLumtnWz94AaABAg.AXBPHMg_AMmAXC3165h8oe,XMNmGh69aTI,True,author_2849,2026-05-26T00:00:00+00:00,,3,"​ author_2999 Non ti irrispettoso definire ""bias"" il punto di vista di persone che in quelle terre ci abitano o ci hanno abitato? Io contesto il concetto di ""guerra fratricida"", se non nella misura in cui tutte le guerre in qualche modo lo sono.
Il referendum del Donbass è un'altra storia, lì sono per buona parte russi e quasi tutti russofoni. È giusto che possano autodeterminarsi, ma non tramite l'invasione militare di un paese straniero. Il punto della questione è tutto qui.",UgxMhiuDa9vLumtnWz94AaABAg.AXBPHMg_AMmAXC3165h8oe,3,repubblica,author_2849,0
UgxQPSpr5kINY9ua6Lh4AaABAg.AXBMoPA6bL7AXEDIproOPs,UgxQPSpr5kINY9ua6Lh4AaABAg.AXBMoPA6bL7AXD_7dccaYs,XMNmGh69aTI,True,author_3038,2026-05-26T00:00:00+00:00,,0,​ author_1343 è vero ogni popolo ha il governo che si merita,UgxQPSpr5kINY9ua6Lh4AaABAg.AXBMoPA6bL7AXD_7dccaYs,2,repubblica,author_3038,0
UgzDqt9wlsS5uv2lmjx4AaABAg.AXBNCqQTw0iAXEKPUNGAVN,UgzDqt9wlsS5uv2lmjx4AaABAg.AXBNCqQTw0iAXDHzk9thSf,XMNmGh69aTI,True,author_3026,2026-05-26T00:00:00+00:00,,2,"​ author_3005  distruttiva per l'economia europea. 
A meno che non si mettano a tirare sulla Russia cessi d'oro. Allora si che la guerra cambierebbe.",UgzDqt9wlsS5uv2lmjx4AaABAg.AXBNCqQTw0iAXDHzk9thSf,2,repubblica,author_3026,1
UgxMhiuDa9vLumtnWz94AaABAg.AXBPHMg_AMmAXC9qFj4K6o,UgxMhiuDa9vLumtnWz94AaABAg.AXBPHMg_AMmAXC3165h8oe,XMNmGh69aTI,True,author_2999,2026-05-26T00:00:00+00:00,,2," author_2849  la conoscenza di ""diversi ucraini"" è tendenzialmente irrilevante. Potrebbero tranquillamente essere tutte conoscenze affette dallo stesso bias. Ricordo che conobbi ""diversi iraniani"" che vivevano a Milano e frequentavano l'accademia delle belle arti. Ovviamente erano tutti contro la teocrazia. Erano tutti affetti dallo stesso bias per il fatto di trovarsi tutti in Italia, di essere appartenenti a famiglie progre e probabilmente di disporre di molta pecunia. Per fare indagini serie bisogna attenersi ai fatti. E i fatti parlano chiaro: diversi territori ucraini fecero un referendum, stravinto, per staccarsi dall'Ucraina ed essere indipendenti. Quindi almeno quelle regioni vogliono essere indipendenti dal regime di Kyev.",UgxMhiuDa9vLumtnWz94AaABAg.AXBPHMg_AMmAXC3165h8oe,3,repubblica,author_2999,1
UgyQos3_icYGKCeoz7Z4AaABAg.AXBInLS4mQzAXC8WO2bMz9,UgyQos3_icYGKCeoz7Z4AaABAg.AXBInLS4mQzAXC6PLuG-Zm,XMNmGh69aTI,True,author_2962,2026-05-26T00:00:00+00:00,,1, author_3000 🤣🤣🤣,UgyQos3_icYGKCeoz7Z4AaABAg.AXBInLS4mQzAXC6PLuG-Zm,3,repubblica,author_2962,0
UgzDqt9wlsS5uv2lmjx4AaABAg.AXBNCqQTw0iAXEK44w05kf,UgzDqt9wlsS5uv2lmjx4AaABAg.AXBNCqQTw0iAXDyGHF-z-q,XMNmGh69aTI,True,author_2849,2026-05-26T00:00:00+00:00,,0,"​ author_3018 Che risate, ragazzi! C'è gente che muore sotto le bombe!",UgzDqt9wlsS5uv2lmjx4AaABAg.AXBNCqQTw0iAXDyGHF-z-q,3,repubblica,author_2849,1
