comment_id,parent_comment_id,video_id,is_reply,author,published_at,updated_at,like_count,text,inferred_parent_id,depth,newspaper,author_anon,label
UgzSRRXoKl_wGrlU41t4AaABAg,,XMNmGh69aTI,False,author_2969,2026-05-24T17:15:38Z,2026-05-24T17:15:38Z,1,"Questi dell'Ucraina sono tutti corrotti e delinquenti terroristi maledetti, la colpa c'è là l'Europa ché manda i vostri soldi bastardi",,0,repubblica,author_2969,1
Ugw0paZvEKLllmdK0vZ4AaABAg,,XMNmGh69aTI,False,author_2970,2026-05-24T17:19:25Z,2026-05-24T17:19:25Z,1,"Ух красота, Зеленский сначала детей убил в общежитии, а теперь  прячься народ, ебать он умный , сам дел натворил, его предупреждали, он всё равно за свое, спровоцировал, получи теперь, щас еще сильнее ответ будет, вы заебали просто уже",,0,repubblica,author_2970,1
UgzuhmVpwK5JLjYrVXp4AaABAg,,XMNmGh69aTI,False,author_936,2026-05-24T17:29:27Z,2026-05-24T17:29:27Z,0,Il tappo  che non si stacca dalle bottiglie di plastica ci salverà,,0,repubblica,author_936,0
Ugzxnkw_ve8rkSQTI854AaABAg,,XMNmGh69aTI,False,author_2971,2026-05-24T17:41:04Z,2026-05-24T17:41:04Z,8,Non hanno ancora colpito il palazzo giusto....,,0,repubblica,author_2971,1
UgwLgAbITcgc9QkqC2J4AaABAg.AXC6VmR_YGaAXCF5wfrqh9,UgwLgAbITcgc9QkqC2J4AaABAg.AXC6VmR_YGaAXC7-3sX6B0,XMNmGh69aTI,True,author_2960,2026-05-24T17:45:58Z,2026-05-24T17:45:58Z,0,author_2961 allora dai provaci tu 😂 parti in guerra 🤡,UgwLgAbITcgc9QkqC2J4AaABAg.AXC6VmR_YGaAXC7-3sX6B0,2,repubblica,author_2960,1
UgwLgAbITcgc9QkqC2J4AaABAg.AXC6VmR_YGaAXCGF6PGwEH,UgwLgAbITcgc9QkqC2J4AaABAg.AXC6VmR_YGaAXCF5wfrqh9,XMNmGh69aTI,True,author_2961,2026-05-24T17:55:57Z,2026-05-24T17:55:57Z,0,author_2960 Per poi incontrare i troll ruzzi ? 🤡,UgwLgAbITcgc9QkqC2J4AaABAg.AXC6VmR_YGaAXCF5wfrqh9,3,repubblica,author_2961,0
UgwsNxJ__KGwN7CP-bB4AaABAg.AXBM1BLDJ-qAXCHPKls51X,UgwsNxJ__KGwN7CP-bB4AaABAg.AXBM1BLDJ-qAXBW9LbUWzD,XMNmGh69aTI,True,author_2789,2026-05-24T18:06:05Z,2026-05-24T18:06:05Z,4,"​author_2847 è sicuramente colpa delle auto sempre più tappate...non delle centinaia di fabbriche, hai ragione 😂😂😂😂",UgwsNxJ__KGwN7CP-bB4AaABAg.AXBM1BLDJ-qAXBW9LbUWzD,2,repubblica,author_2789,0
UgyNrXPSRLFvNTtRapJ4AaABAg,,XMNmGh69aTI,False,author_2972,2026-05-24T18:09:22Z,2026-05-24T18:09:22Z,0,Lo scemo di sniffolo gioca col fuoco!!!!,,0,repubblica,author_2972,1
UgyjONIRk8kzBEwj9ex4AaABAg.AXBQlq2ipt5AXCIEqbMQan,UgyjONIRk8kzBEwj9ex4AaABAg,XMNmGh69aTI,True,author_2956,2026-05-24T18:13:23Z,2026-05-24T18:13:23Z,1,Sono dei parassiti. Da me c'è uno di sti cessi che spende più di 200€ al giorno in gratta&vinci e birre.... 🇷🇺🇷🇺🇷🇺🇷🇺🇷🇺,UgyjONIRk8kzBEwj9ex4AaABAg,1,repubblica,author_2956,1
UgwcoriH69j-f7LeKKV4AaABAg,,XMNmGh69aTI,False,author_2973,2026-05-24T18:27:54Z,2026-05-24T18:27:54Z,0,Su Bruxelles a casa di Ursula no ?,,0,repubblica,author_2973,1
UgyRwXe1dUXIJMV-ZW14AaABAg.AXC26uHxLYYAXCKSODIvxt,UgyRwXe1dUXIJMV-ZW14AaABAg,XMNmGh69aTI,True,author_2974,2026-05-24T18:32:43Z,2026-05-24T18:32:43Z,0,👏👏👏👏👏,UgyRwXe1dUXIJMV-ZW14AaABAg,1,repubblica,author_2974,1
UgyQCmPeCyhilcPXaB14AaABAg,,XMNmGh69aTI,False,author_2975,2026-05-24T18:32:58Z,2026-05-24T18:32:58Z,0,...anche un missilino giocattolo  ucraino sulla sede di repubblica..così capiscono subito,,0,repubblica,author_2975,1
UgwsNxJ__KGwN7CP-bB4AaABAg.AXBM1BLDJ-qAXCKdDS-KY4,UgwsNxJ__KGwN7CP-bB4AaABAg.AXBM1BLDJ-qAXCHPKls51X,XMNmGh69aTI,True,author_2847,2026-05-24T18:34:20Z,2026-05-24T18:34:20Z,0,"author_2789 secondo uno studio recente (che sicuramente non conosci) il problema principale sono gli allevamenti intensivi. La differenza sta che le macchine portano inquinamento in tutto il tragitto che fanno,pneumatici che rilasciano sostanze tossiche, e l'odore di smog te lo ritrovi ovunque nella stade e centri abitati piu stretti. Io mi fiderei di più di chi fa ricerche e lo fa di lavoro.",UgwsNxJ__KGwN7CP-bB4AaABAg.AXBM1BLDJ-qAXCHPKls51X,3,repubblica,author_2847,0
UgyqIHOcYVucKw3qZQ54AaABAg.AXBQEk3VBhJAXCKy5HbFNe,UgyqIHOcYVucKw3qZQ54AaABAg,XMNmGh69aTI,True,author_2974,2026-05-24T18:37:11Z,2026-05-24T18:37:11Z,0,☝👏👏👏👏👏,UgyqIHOcYVucKw3qZQ54AaABAg,1,repubblica,author_2974,1
UgzlML8sj2B_FKjxGZl4AaABAg.AXBMsXVZqpnAXCNncA-LHb,UgzlML8sj2B_FKjxGZl4AaABAg,XMNmGh69aTI,True,author_2796,2026-05-24T19:01:58Z,2026-05-24T19:01:58Z,0,​author_7662 barese?,UgzlML8sj2B_FKjxGZl4AaABAg.AXBMsXVZqpnAXBZDNakFuk,2,repubblica,author_2796,0
UgzavdPpBeeExSa7fF94AaABAg,,XMNmGh69aTI,False,author_2976,2026-05-24T19:13:22Z,2026-05-24T19:13:22Z,0,"Серьёзно?😂 тратить орешники и другие дорогие ракеты на жилые районы?😂  хохлики с дронов по 50к рупий целые нпз уничтожают.
Хоть бы по военному объекту стрельнули бы. Или я чего-то не понимаю",,0,repubblica,author_2976,1
UgwLgAbITcgc9QkqC2J4AaABAg.AXC6VmR_YGaAXCQOAcGhu5,UgwLgAbITcgc9QkqC2J4AaABAg.AXC6VmR_YGaAXCF5wfrqh9,XMNmGh69aTI,True,author_2960,2026-05-24T19:24:34Z,2026-05-24T19:24:34Z,0,"author_2961 se nutri tutto questo odio dovresti essere assetato di sangue no? 
Haha sei solo uno che appoggia una guerra perché non sei tu che la combatte. 🤡",UgwLgAbITcgc9QkqC2J4AaABAg.AXC6VmR_YGaAXCGF6PGwEH,4,repubblica,author_2960,1
Ugw045M1bJGN30je9hB4AaABAg,,XMNmGh69aTI,False,author_709,2026-05-24T19:36:38Z,2026-05-24T19:36:38Z,0,"Tranquilli , deve essere rasa al suolo per fare Kiev city a nostre spese. Si risparmia sulla demolizione.ottimo !",,0,repubblica,author_709,1
Ugwi1kH0-1-HRJ2uSAV4AaABAg,,XMNmGh69aTI,False,author_2977,2026-05-24T20:06:47Z,2026-05-24T20:06:47Z,0,Rusia este o țară teroristă cu toți jegoșii ei de orci,,0,repubblica,author_2977,1
UgxNBNaQ-cth_kO_Xlh4AaABAg,,XMNmGh69aTI,False,author_2977,2026-05-24T20:08:03Z,2026-05-24T20:08:03Z,0,Reacția Ucrainei va fii devastatoare pentru ORCiA,,0,repubblica,author_2977,1
UgzzPs8j4CTOnzYrKSl4AaABAg,,XMNmGh69aTI,False,author_2977,2026-05-24T20:08:49Z,2026-05-24T20:08:49Z,0,Orcii vor simți și ei ce înseamnă războiul pornit de Orkul lor șef,,0,repubblica,author_2977,1
Ugz1G3RENO4rCGEQ8Sh4AaABAg,,XMNmGh69aTI,False,author_2977,2026-05-24T20:09:17Z,2026-05-24T20:09:17Z,0,O nație de retarzi poci neanderthalieni,,0,repubblica,author_2977,1
Ugxqrsitj10TQZDKzLV4AaABAg,,XMNmGh69aTI,False,author_2978,2026-05-24T20:30:48Z,2026-05-24T20:30:48Z,0,😂 ma avete letto la didascalia esilarante 😂,,0,repubblica,author_2978,0
UgzbCx0eHSMZlIPXzpt4AaABAg,,XMNmGh69aTI,False,author_2979,2026-05-24T21:08:10Z,2026-05-24T21:08:10Z,0,Giornalanza e ignoranza.,,0,repubblica,author_2979,0
Ugx-BeEQpynQiHo6F454AaABAg,,XMNmGh69aTI,False,author_2980,2026-05-24T21:14:32Z,2026-05-24T21:14:32Z,0,Украина террористическое государство. Ответ за детей убитых,,0,repubblica,author_2980,1
Ugz5E3ecSUpHxKFIxAp4AaABAg,,XMNmGh69aTI,False,author_2981,2026-05-24T21:37:10Z,2026-05-24T21:37:10Z,0,E quindi la strage di innocenti di Zelensky …a caspita è vero è stata fatta con i nostri soldi quindi non vale 🤬🤬🤬🤬,,0,repubblica,author_2981,1
UgzTBsElH49kWDI1SrJ4AaABAg,,XMNmGh69aTI,False,author_2982,2026-05-24T22:18:20Z,2026-05-24T22:18:20Z,0,"La si è provocata, provocata e provocata. Mi dispiace per il popolo ucraino...Sarebbe ora che i pochi potenti europei la finissero. Dicono che comandino anche la stampa italiana. Che sia vero?",,0,repubblica,author_2982,1
UgwMkG2E7Cl36OSOUd14AaABAg,,XMNmGh69aTI,False,author_2983,2026-05-24T22:30:06Z,2026-05-24T22:30:20Z,0,"Guardate come scrivono i titoli
Il modo in qui fanno intuire le cose 
""Il missile progettato per colpire le capitali europee""",,0,repubblica,author_2983,1
Ugyy17rQBeGuMWfP87F4AaABAg,,XMNmGh69aTI,False,author_2984,2026-05-24T23:02:14Z,2026-05-24T23:07:36Z,0,"Si tratta di ritorsione, nel senso che ad ogni azione corrisponde una reazione. E questo lo sapevano bene. Missili con possibile testata nucleare progettati per colpire le capitali europee? Come se le nazioni occidentali non avessero armi nucleari in grado di colpire la Russia. Una differenza però, la Russia non le ha mai usate.",,0,repubblica,author_2984,0
UgxpRJjcmoGEAqy0D214AaABAg,,XMNmGh69aTI,False,author_24,2026-05-24T23:11:53Z,2026-05-24T23:11:53Z,0,Troppo poco vogliamo la bomba nucleare 😂😂😂,,0,repubblica,author_24,1
UgxJ8LBQ8RPQlg65sJJ4AaABAg,,XMNmGh69aTI,False,author_2985,2026-05-24T23:39:01Z,2026-05-24T23:39:01Z,0,"Ed è solo un assaggio di ciò che potrebbe accadere, che i nazi-cloptocrati di Kiev lo sappiano",,0,repubblica,author_2985,1
UgzalgU12DCInxHye1B4AaABAg.AXBOlovzGjAAXBmfH-nNr4,UgzalgU12DCInxHye1B4AaABAg.AXBOlovzGjAAXBZ2poUemk,XMNmGh69aTI,True,author_2925,2026-05-25T00:00:00+00:00,,5,"​ author_2859 perché non è in prima linea a combattere, anziché stare in  Uccidente a fare l'esperta di geopolitica??",UgzalgU12DCInxHye1B4AaABAg.AXBOlovzGjAAXBZ2poUemk,2,repubblica,author_2925,1
UgzalgU12DCInxHye1B4AaABAg.AXBOlovzGjAAXC3bWUnsIs,UgzalgU12DCInxHye1B4AaABAg.AXBOlovzGjAAXBahkVKmBU,XMNmGh69aTI,True,author_2917,2026-05-25T00:00:00+00:00,,3," author_2859 e chi li elegge quelle che comandono in ue?? nessuno, chi gli da il diritto di decidere, è un parlamento autoeletto quello, però decide per 400 milioni di persone bello vero??",UgzalgU12DCInxHye1B4AaABAg.AXBOlovzGjAAXBg56j3YL0,4,repubblica,author_2917,1
UgxE9YBLlSDZXYYlAA14AaABAg.AXBKndp1uJoAXBikGSZR2U,UgxE9YBLlSDZXYYlAA14AaABAg.AXBKndp1uJoAXBNvBpuH0o,XMNmGh69aTI,True,author_2986,2026-05-25T00:00:00+00:00,,1,​ author_104 Forse ti è sfuggito di suggerire al megalomane Americano di giudicare il massacro di donne e bambini di origine Russa in territorio ucraino. Non dimenticare di rammentare ai guerrafondai Europei le malefatte del cocainomane.,UgxE9YBLlSDZXYYlAA14AaABAg.AXBKndp1uJoAXBNvBpuH0o,3,repubblica,author_2986,1
UgxE9YBLlSDZXYYlAA14AaABAg.AXBKndp1uJoAXBhEtKsUlR,UgxE9YBLlSDZXYYlAA14AaABAg.AXBKndp1uJoAXBNvBpuH0o,XMNmGh69aTI,True,author_104,2026-05-25T00:00:00+00:00,,0,"​author_182 già...quindi la Russia ha invaso l' Ucraina per tutti questi ""ottimi"" motivi...originale il tuo punto di vista...e quello di Putin...prova a suggerirlo a Trump, chissà che poi facciano pace...",UgxE9YBLlSDZXYYlAA14AaABAg.AXBKndp1uJoAXBNvBpuH0o,3,repubblica,author_104,0
UgxE9YBLlSDZXYYlAA14AaABAg.AXBKndp1uJoAXBWp_BKR4I,UgxE9YBLlSDZXYYlAA14AaABAg.AXBKndp1uJoAXBNvBpuH0o,XMNmGh69aTI,True,author_182,2026-05-25T00:00:00+00:00,,4,"​ author_104  Nessuno ha obbligato l'Ucraina a seguire la NATO nelle invasioni di Iran e Afghanistan, che tra l'altro sono basate su una grande menzogna. Inoltre, l'Ucraina non appartiene né alla NATO né all'Unione Europea per aver preso tale cammino. Senza dimenticare che da anni l'Ucraina vota a favore dell'embargo contro Cuba.",UgxE9YBLlSDZXYYlAA14AaABAg.AXBKndp1uJoAXBNvBpuH0o,3,repubblica,author_182,1
UgxE9YBLlSDZXYYlAA14AaABAg.AXBKndp1uJoAXBVei8rTj2,UgxE9YBLlSDZXYYlAA14AaABAg.AXBKndp1uJoAXBNvBpuH0o,XMNmGh69aTI,True,author_2790,2026-05-25T00:00:00+00:00,,2," author_2986 si lo so, zombie funzionali al sistema",UgxE9YBLlSDZXYYlAA14AaABAg.AXBKndp1uJoAXBNvBpuH0o,3,repubblica,author_2790,1
UgxE9YBLlSDZXYYlAA14AaABAg.AXBKndp1uJoAXBTIi2HxQU,UgxE9YBLlSDZXYYlAA14AaABAg.AXBKndp1uJoAXBNvBpuH0o,XMNmGh69aTI,True,author_2986,2026-05-25T00:00:00+00:00,,2,"​ author_2790 È tempo perso, la propaganda Europea conta su questi personaggi.",UgxE9YBLlSDZXYYlAA14AaABAg.AXBKndp1uJoAXBOIW3jjH_,4,repubblica,author_2986,0
UgxXQVvJmJtbeazK85F4AaABAg.AXBIfPOYSfjAXBZSzdfwZd,UgxXQVvJmJtbeazK85F4AaABAg.AXBIfPOYSfjAXBKmZBQrwq,XMNmGh69aTI,True,author_2857,2026-05-25T00:00:00+00:00,,1," author_2784  appunto, quindi bisogna imporre al criminale del cremlino di smettere",UgxXQVvJmJtbeazK85F4AaABAg.AXBIfPOYSfjAXBKmZBQrwq,3,repubblica,author_2857,0
Ugztv7H--EJ7t8WCAEt4AaABAg.AXBMF_-qUaxAXBXbX60-1L,Ugztv7H--EJ7t8WCAEt4AaABAg,XMNmGh69aTI,True,author_2857,2026-05-25T00:00:00+00:00,,3,chi è che avrebbe seminato fulmini? secondo i vostri 2 neuroni avrebbero dovuto accettare i missili dei naziruzzi e stare muti?,Ugztv7H--EJ7t8WCAEt4AaABAg,1,repubblica,author_2857,1
Ugztv7H--EJ7t8WCAEt4AaABAg.AXBMF_-qUaxAXBh4tCXlN-,Ugztv7H--EJ7t8WCAEt4AaABAg.AXBMF_-qUaxAXBXC6ADhAf,XMNmGh69aTI,True,author_2854,2026-05-25T00:00:00+00:00,,1,​ author_2849 Due ESERCITI Idiota,Ugztv7H--EJ7t8WCAEt4AaABAg.AXBMF_-qUaxAXBXC6ADhAf,3,repubblica,author_2854,1
UgzalgU12DCInxHye1B4AaABAg.AXBOlovzGjAAXC0zTfF8IS,UgzalgU12DCInxHye1B4AaABAg.AXBOlovzGjAAXBqgUuU9ba,XMNmGh69aTI,True,author_2859,2026-05-25T00:00:00+00:00,,0,Qualsiasi cosa? Potrebbe essere più preciso?​ author_2987 ,UgzalgU12DCInxHye1B4AaABAg.AXBOlovzGjAAXBqgUuU9ba,3,repubblica,author_2859,0
Ugztv7H--EJ7t8WCAEt4AaABAg.AXBMF_-qUaxAXBdWiR3ePd,Ugztv7H--EJ7t8WCAEt4AaABAg.AXBMF_-qUaxAXBXC6ADhAf,XMNmGh69aTI,True,author_2849,2026-05-25T00:00:00+00:00,,5,"​ author_2854 Solo per chi ragiona sempre in chiave ideologica, altrimenti sono due cose piuttosto simili.",Ugztv7H--EJ7t8WCAEt4AaABAg.AXBMF_-qUaxAXBXC6ADhAf,3,repubblica,author_2849,0
UgzalgU12DCInxHye1B4AaABAg.AXBOlovzGjAAXBqgUuU9ba,UgzalgU12DCInxHye1B4AaABAg.AXBOlovzGjAAXBZ2poUemk,XMNmGh69aTI,True,author_2987,2026-05-25T00:00:00+00:00,,5,"​ author_2859 Lui si puo dire,cosa devono fare voi ucraini,perche vivete con il nostri soldi ancora. Potete fare qui,in Europa qualsiasi cose. Vergogniati. Siamo stanchi 😡😡😡",UgzalgU12DCInxHye1B4AaABAg.AXBOlovzGjAAXBZ2poUemk,2,repubblica,author_2987,1
Ugztv7H--EJ7t8WCAEt4AaABAg.AXBMF_-qUaxAXBc1fr2FVY,Ugztv7H--EJ7t8WCAEt4AaABAg.AXBMF_-qUaxAXBRNMoyoFr,XMNmGh69aTI,True,author_2882,2026-05-25T00:00:00+00:00,,6,​ author_2829 tempo perso. La differenza è che noi che ragioniamo non abbiamo difficoltà a definire e condannare il genocidio palestinese da parte di un governo nazi-sionista. Loro no. Putin è la vittima. Gente indegna.,Ugztv7H--EJ7t8WCAEt4AaABAg.AXBMF_-qUaxAXBRNMoyoFr,2,repubblica,author_2882,1
Ugztv7H--EJ7t8WCAEt4AaABAg.AXBMF_-qUaxAXBafRj5ecn,Ugztv7H--EJ7t8WCAEt4AaABAg.AXBMF_-qUaxAXBX4j4px8L,XMNmGh69aTI,True,author_2849,2026-05-25T00:00:00+00:00,,6,"​ author_2857 Io non ne sono capace. Se mai gli dovesse capitare di provare un'esperienza simile, vedrai che poi smette di scrivere stronzate dal divano di casa.",Ugztv7H--EJ7t8WCAEt4AaABAg.AXBMF_-qUaxAXBX4j4px8L,3,repubblica,author_2849,1
Ugztv7H--EJ7t8WCAEt4AaABAg.AXBMF_-qUaxAXBXXSfxzHR,Ugztv7H--EJ7t8WCAEt4AaABAg.AXBMF_-qUaxAXBX4j4px8L,XMNmGh69aTI,True,author_2857,2026-05-25T00:00:00+00:00,,1, author_2849  bisognerebbe farglielo capire,Ugztv7H--EJ7t8WCAEt4AaABAg.AXBMF_-qUaxAXBX4j4px8L,3,repubblica,author_2857,1
Ugztv7H--EJ7t8WCAEt4AaABAg.AXBMF_-qUaxAXBX4j4px8L,Ugztv7H--EJ7t8WCAEt4AaABAg.AXBMF_-qUaxAXBRNMoyoFr,XMNmGh69aTI,True,author_2849,2026-05-25T00:00:00+00:00,,11,"​ author_2829 Lascia stare, è gente senza morale. Evidentemente non sanno cosa significhi vivere sotto le bombe.",Ugztv7H--EJ7t8WCAEt4AaABAg.AXBMF_-qUaxAXBRNMoyoFr,2,repubblica,author_2849,1
Ugztv7H--EJ7t8WCAEt4AaABAg.AXBMF_-qUaxAXBbmWj5Srm,Ugztv7H--EJ7t8WCAEt4AaABAg,XMNmGh69aTI,True,author_2882,2026-05-25T00:00:00+00:00,,2,Come dire che se non stavi simpatico a Riina...,Ugztv7H--EJ7t8WCAEt4AaABAg,1,repubblica,author_2882,1
UgzalgU12DCInxHye1B4AaABAg.AXBOlovzGjAAXC5YjA4418,UgzalgU12DCInxHye1B4AaABAg.AXBOlovzGjAAXBmfH-nNr4,XMNmGh69aTI,True,author_2959,2026-05-25T00:00:00+00:00,,2,"​ author_2925   tu, esperto di geopolitica dovresti trovarti un lavoro invece di trollare su ogni canale dedicato.",UgzalgU12DCInxHye1B4AaABAg.AXBOlovzGjAAXBmfH-nNr4,3,repubblica,author_2959,0
UgzalgU12DCInxHye1B4AaABAg.AXBOlovzGjAAXC5P8yJrUV,UgzalgU12DCInxHye1B4AaABAg.AXBOlovzGjAAXBmfH-nNr4,XMNmGh69aTI,True,author_2925,2026-05-25T00:00:00+00:00,,3,"​​ author_2859 Quale? Meglio che si spieghi bene. Io sono Italiano e vivo in Russia, 🇷🇺🇷🇺🙏🙏❤️❤️✌️✌️✌️ e siamo impegnati al volontariato per i Ragazzi al Fronte. Quindi cara mantenuta, la situazione è molto diversa e soprattutto non abbiamo e non siamo mantenuti dalla UE. Dimenticavo non andiamo a comprare le ville sul lago di Como, come qualche sindaco Ucraino. 💩💩💩🇺🇦🇺🇦🇺🇦🤮🤮",UgzalgU12DCInxHye1B4AaABAg.AXBOlovzGjAAXBmfH-nNr4,3,repubblica,author_2925,1
UgzalgU12DCInxHye1B4AaABAg.AXBOlovzGjAAXC1ADwo8JB,UgzalgU12DCInxHye1B4AaABAg.AXBOlovzGjAAXBmfH-nNr4,XMNmGh69aTI,True,author_2859,2026-05-25T00:00:00+00:00,,2,​ author_2925  per lo stesso motivo suo con quella bandiera 🤣,UgzalgU12DCInxHye1B4AaABAg.AXBOlovzGjAAXBmfH-nNr4,3,repubblica,author_2859,1
Ugztv7H--EJ7t8WCAEt4AaABAg.AXBMF_-qUaxAXBXC6ADhAf,Ugztv7H--EJ7t8WCAEt4AaABAg.AXBMF_-qUaxAXBRNMoyoFr,XMNmGh69aTI,True,author_2854,2026-05-25T00:00:00+00:00,,1,​ author_2829 Sono due cose completamente diverse.,Ugztv7H--EJ7t8WCAEt4AaABAg.AXBMF_-qUaxAXBRNMoyoFr,2,repubblica,author_2854,0
Ugztv7H--EJ7t8WCAEt4AaABAg.AXBMF_-qUaxAXBXeEzEtyc,Ugztv7H--EJ7t8WCAEt4AaABAg.AXBMF_-qUaxAXBSf6NEo1z,XMNmGh69aTI,True,author_2857,2026-05-25T00:00:00+00:00,,2, author_1444  perché lo dici tu,Ugztv7H--EJ7t8WCAEt4AaABAg.AXBMF_-qUaxAXBSf6NEo1z,3,repubblica,author_2857,0
Ugy2hx9LH1EPQ_iBRJt4AaABAg.AXBHkQl_HSVAXBgcHQ9K0t,Ugy2hx9LH1EPQ_iBRJt4AaABAg.AXBHkQl_HSVAXBLwBy7OgY,XMNmGh69aTI,True,author_2988,2026-05-25T00:00:00+00:00,,1," author_2998  anche i ragazzi di lugansk erano ucraini , come i civili a l mercayo di donescl un pai di anni fa eppure gli ucraini li hanno colpiti senza problemi",Ugy2hx9LH1EPQ_iBRJt4AaABAg.AXBHkQl_HSVAXBLwBy7OgY,2,repubblica,author_2988,1
UgxE9YBLlSDZXYYlAA14AaABAg.AXBKndp1uJoAXBj4upDf1v,UgxE9YBLlSDZXYYlAA14AaABAg.AXBKndp1uJoAXBNvBpuH0o,XMNmGh69aTI,True,author_104,2026-05-25T00:00:00+00:00,,0,​ author_2986  tutto merito di Putin,UgxE9YBLlSDZXYYlAA14AaABAg.AXBKndp1uJoAXBNvBpuH0o,3,repubblica,author_104,1
UgyQos3_icYGKCeoz7Z4AaABAg.AXBInLS4mQzAXBoPfDz-DW,UgyQos3_icYGKCeoz7Z4AaABAg,XMNmGh69aTI,True,author_2989,2026-05-25T00:00:00+00:00,,11,Hanno attaccato la scuola con i giovani ragazzi!Sono state morti ma il mondo selenio la tv non è anche annunciato questa tragedia ! Vergogna! E poi vogliamo fare convincere che solo i russi cattivi ! Sete peggio !,UgyQos3_icYGKCeoz7Z4AaABAg,1,repubblica,author_2989,1
UgyQos3_icYGKCeoz7Z4AaABAg.AXBInLS4mQzAXBYB8Kf-O1,UgyQos3_icYGKCeoz7Z4AaABAg,XMNmGh69aTI,True,author_2857,2026-05-25T00:00:00+00:00,,9,"hanno fatto bene, si difendono da un criminale peggio di H.",UgyQos3_icYGKCeoz7Z4AaABAg,1,repubblica,author_2857,1
UgyQos3_icYGKCeoz7Z4AaABAg.AXBInLS4mQzAXBZlh2M0gy,UgyQos3_icYGKCeoz7Z4AaABAg.AXBInLS4mQzAXBYB8Kf-O1,XMNmGh69aTI,True,author_2990,2026-05-25T00:00:00+00:00,,18,"​ author_2857 amico degli usa , quelli che han sterminato 18 milioni di indiani , 30 milioni tra coreani e vietnamiti ! Zelensky e' un agente usa !",UgyQos3_icYGKCeoz7Z4AaABAg.AXBInLS4mQzAXBYB8Kf-O1,2,repubblica,author_2990,1
UgyQos3_icYGKCeoz7Z4AaABAg.AXBInLS4mQzAXBiGbOLUkQ,UgyQos3_icYGKCeoz7Z4AaABAg.AXBInLS4mQzAXBZlh2M0gy,XMNmGh69aTI,True,author_2909,2026-05-25T00:00:00+00:00,,6,"​author_7663 quindi? Cioe stai usando dei fatti deprecabili per giustificare altri fatti negativi? Cioè stai dicendo che probabilmente, forse non so c è chi ha fatto peggio allora l invasione russa non è una cosa sbagliata? 🤔🤔 Ah sì potresti anche avere ragione in effetti in matematica meno x meno fa più ... Ma dico io ..prima di scrivere accendere i neuroni?",UgyQos3_icYGKCeoz7Z4AaABAg.AXBInLS4mQzAXBZlh2M0gy,3,repubblica,author_2909,1
UgyQos3_icYGKCeoz7Z4AaABAg.AXBInLS4mQzAXBTLIQ2S_m,UgyQos3_icYGKCeoz7Z4AaABAg.AXBInLS4mQzAXBS2CuOrDo,XMNmGh69aTI,True,author_2767,2026-05-25T00:00:00+00:00,,27, author_2835 dal 2014 nel Dombass l’Ucraina ha iniziato la guerra.,UgyQos3_icYGKCeoz7Z4AaABAg.AXBInLS4mQzAXBS2CuOrDo,2,repubblica,author_2767,0
UgyQos3_icYGKCeoz7Z4AaABAg.AXBInLS4mQzAXBj6oPtL6y,UgyQos3_icYGKCeoz7Z4AaABAg.AXBInLS4mQzAXBTLIQ2S_m,XMNmGh69aTI,True,author_2909,2026-05-25T00:00:00+00:00,,6,​ author_2767 cioè l ucraina ha attaccato la Russia per prima? 🤔Questa non la sapevo ... Io sapevo che il donbass è ucraina? ... Forse parli dei russofoni tanto cari a Putin che li usa per i suoi interessi su quei territori ucraini? ... L altra cosa che non mi spiego come ha fatto la popolazione del donbass ... Contadini e minatori per il 99% ehhh .. a tenere testa all esercito ucraino che sta contenendo l armata rossa? ... Forse perché la vagner era già da anni sul territorio ucraino e ha creato la scusa per l attacco della Russia all ucraina ... Ops la stessa cosa che accade in Moldova? Dove le truppe russe si erano già mobilitate quando pensavano di arrivare ad Odessa in un paio di settimane?,UgyQos3_icYGKCeoz7Z4AaABAg.AXBInLS4mQzAXBTLIQ2S_m,3,repubblica,author_2909,0
UgyQos3_icYGKCeoz7Z4AaABAg.AXBInLS4mQzAXBj7JlPZ_i,UgyQos3_icYGKCeoz7Z4AaABAg.AXBInLS4mQzAXBTLIQ2S_m,XMNmGh69aTI,True,author_2991,2026-05-25T00:00:00+00:00,,5,​​ author_2767  😂😂...credi pure alle favole di putler!!,UgyQos3_icYGKCeoz7Z4AaABAg.AXBInLS4mQzAXBTLIQ2S_m,3,repubblica,author_2991,1
UgyQos3_icYGKCeoz7Z4AaABAg.AXBInLS4mQzAXBuw0qP9Cu,UgyQos3_icYGKCeoz7Z4AaABAg.AXBInLS4mQzAXBTLIQ2S_m,XMNmGh69aTI,True,author_2992,2026-05-25T00:00:00+00:00,,2,​ author_2767  ha iniziato l'Ucraina nel 2014 o la Russia annettendo la Crimea nel suo Anschluss?!,UgyQos3_icYGKCeoz7Z4AaABAg.AXBInLS4mQzAXBTLIQ2S_m,3,repubblica,author_2992,0
UgyQos3_icYGKCeoz7Z4AaABAg.AXBInLS4mQzAXC6NQZVRfJ,UgyQos3_icYGKCeoz7Z4AaABAg.AXBInLS4mQzAXBTLIQ2S_m,XMNmGh69aTI,True,author_2857,2026-05-25T00:00:00+00:00,,0, author_2909  non dimenticare la contemporanea invasione della crimea; chissà che novella hanno queste menti semplici per giustificare anche questo atto criminale,UgyQos3_icYGKCeoz7Z4AaABAg.AXBInLS4mQzAXBTLIQ2S_m,3,repubblica,author_2857,1
UgyQos3_icYGKCeoz7Z4AaABAg.AXBInLS4mQzAXBW0giN3X9,UgyQos3_icYGKCeoz7Z4AaABAg.AXBInLS4mQzAXBT5f1hDv1,XMNmGh69aTI,True,author_2993,2026-05-25T00:00:00+00:00,,7,​ author_1444 esatto👍,UgyQos3_icYGKCeoz7Z4AaABAg.AXBInLS4mQzAXBT5f1hDv1,3,repubblica,author_2993,0
UgzalgU12DCInxHye1B4AaABAg.AXBOlovzGjAAXC0aVg7_-S,UgzalgU12DCInxHye1B4AaABAg.AXBOlovzGjAAXBahkVKmBU,XMNmGh69aTI,True,author_2859,2026-05-25T00:00:00+00:00,,1,​ author_2917 non parlavo di Ucraina impara tu a leggere. Se UE ha deciso di aiutare voi ne fate parte. Poi come ho detto in precedenza liberissimi di scegliere,UgzalgU12DCInxHye1B4AaABAg.AXBOlovzGjAAXBkQJYmm_r,5,repubblica,author_2859,0
UgyQos3_icYGKCeoz7Z4AaABAg.AXBInLS4mQzAXBWXDZL0g9,UgyQos3_icYGKCeoz7Z4AaABAg.AXBInLS4mQzAXBT5f1hDv1,XMNmGh69aTI,True,author_2847,2026-05-25T00:00:00+00:00,,6, author_1444  un po come in palkestina... mica è iniziato il 7 ottobre,UgyQos3_icYGKCeoz7Z4AaABAg.AXBInLS4mQzAXBT5f1hDv1,3,repubblica,author_2847,1
UgyQos3_icYGKCeoz7Z4AaABAg.AXBInLS4mQzAXBdoPS78m1,UgyQos3_icYGKCeoz7Z4AaABAg.AXBInLS4mQzAXBT5f1hDv1,XMNmGh69aTI,True,author_2897,2026-05-25T00:00:00+00:00,,0,​ author_1444 appunto,UgyQos3_icYGKCeoz7Z4AaABAg.AXBInLS4mQzAXBT5f1hDv1,3,repubblica,author_2897,0
UgyQos3_icYGKCeoz7Z4AaABAg.AXBInLS4mQzAXBiVRl0eHz,UgyQos3_icYGKCeoz7Z4AaABAg.AXBInLS4mQzAXBT5f1hDv1,XMNmGh69aTI,True,author_1444,2026-05-25T00:00:00+00:00,,2,"​ author_2996  perché hanno iniziato gli USA a mettere in pericolo l'utilizzo dello storico QG della marina russa a Sebastopoli, cosa che una potenza come la Russia non può permettere. Ad esempio.",UgyQos3_icYGKCeoz7Z4AaABAg.AXBInLS4mQzAXBT5f1hDv1,3,repubblica,author_1444,0
UgxmLiwTwUWzxkb_nzd4AaABAg.AXBI-65sLgtAXBLpPdmsOC,UgxmLiwTwUWzxkb_nzd4AaABAg,XMNmGh69aTI,True,author_2267,2026-05-25T00:00:00+00:00,,4,Nun te scalla' troppo. L'Ucraina si è assunta l'onere di sconfiggere la Russia e di ridurla a cento staterelli. La Russia si è assunta il diritto di impedirglielo. Stop. Nessun genocidio. Non è Gaza . Zelig e Netaboya sono simili e fratelli. Putin è un'altra razza. 😅😅😅,UgxmLiwTwUWzxkb_nzd4AaABAg,1,repubblica,author_2267,1
UgxmLiwTwUWzxkb_nzd4AaABAg.AXBI-65sLgtAXBL1a8Phdf,UgxmLiwTwUWzxkb_nzd4AaABAg,XMNmGh69aTI,True,author_2787,2026-05-25T00:00:00+00:00,,4,Prenditela con zelensky e i corrotti di Bruxelles.,UgxmLiwTwUWzxkb_nzd4AaABAg,1,repubblica,author_2787,1
UgxmLiwTwUWzxkb_nzd4AaABAg.AXBI-65sLgtAXBZjg20b3m,UgxmLiwTwUWzxkb_nzd4AaABAg.AXBI-65sLgtAXBKAoAlX4K,XMNmGh69aTI,True,author_2857,2026-05-25T00:00:00+00:00,,0," author_2995  no, sono fuori quelli che stanno dalla parte di un criminale come H., che sono 25 anni che ha questo comportamento",UgxmLiwTwUWzxkb_nzd4AaABAg.AXBI-65sLgtAXBKAoAlX4K,3,repubblica,author_2857,1
UgxmLiwTwUWzxkb_nzd4AaABAg.AXBI-65sLgtAXBMmeHqruF,UgxmLiwTwUWzxkb_nzd4AaABAg.AXBI-65sLgtAXBKAoAlX4K,XMNmGh69aTI,True,author_2994,2026-05-25T00:00:00+00:00,,3,​ author_216 tu dovresti andare da loro,UgxmLiwTwUWzxkb_nzd4AaABAg.AXBI-65sLgtAXBKAoAlX4K,3,repubblica,author_2994,1
UgxmLiwTwUWzxkb_nzd4AaABAg.AXBI-65sLgtAXBL8VsqxU2,UgxmLiwTwUWzxkb_nzd4AaABAg.AXBI-65sLgtAXBKAoAlX4K,XMNmGh69aTI,True,author_2995,2026-05-25T00:00:00+00:00,,3,​ author_216 ma sei fuori???,UgxmLiwTwUWzxkb_nzd4AaABAg.AXBI-65sLgtAXBKAoAlX4K,3,repubblica,author_2995,1
UgxE9YBLlSDZXYYlAA14AaABAg.AXBKndp1uJoAXC5iHqRSrD,UgxE9YBLlSDZXYYlAA14AaABAg.AXBKndp1uJoAXBNvBpuH0o,XMNmGh69aTI,True,author_182,2026-05-25T00:00:00+00:00,,0,​ author_104  Motra a tutti i tuoi reportage sul campo per sostenere le tue tesi.,UgxE9YBLlSDZXYYlAA14AaABAg.AXBKndp1uJoAXBNvBpuH0o,3,repubblica,author_182,0
UgxE9YBLlSDZXYYlAA14AaABAg.AXBKndp1uJoAXC30mgpZ2A,UgxE9YBLlSDZXYYlAA14AaABAg.AXBKndp1uJoAXBNvBpuH0o,XMNmGh69aTI,True,author_182,2026-05-25T00:00:00+00:00,,2,"​ author_104  Beh... tu, avendo seguito sul campo la diaspora dalla caduta dell'URSS fino allo scoppio della guerra nel 2014, sei molto informata. Io mi accontento del divano.",UgxE9YBLlSDZXYYlAA14AaABAg.AXBKndp1uJoAXBNvBpuH0o,3,repubblica,author_182,0
