comment_id,parent_comment_id,video_id,is_reply,author,published_at,updated_at,like_count,text,inferred_parent_id,depth,newspaper,author_anon,label
UgyIKI1UUqMZhRkAISt4AaABAg,,xPb8SMpBlOs,False,author_199,2026-05-27T11:09:31Z,2026-05-27T11:09:31Z,2,E la data della separazione?😮,,0,repubblica,author_199,0
Ugw42y2-id44YmPU85d4AaABAg,,xPb8SMpBlOs,False,author_27,2026-05-27T11:16:51Z,2026-05-27T11:16:51Z,1,Perché ha scelto lui Io Sono Brutto Uguale😂❤,,0,repubblica,author_27,1
UgyvuRtwaVaDvcNstDV4AaABAg,,xPb8SMpBlOs,False,author_200,2026-05-27T11:43:16Z,2026-05-27T11:43:16Z,4,Dovrà risparmiare sui coperti 😂,,0,repubblica,author_200,1
UgzIzhn82gAKArcQgs14AaABAg,,xPb8SMpBlOs,False,author_201,2026-05-27T16:44:52Z,2026-05-27T16:44:52Z,0,Saranno cazzi suoi?  Chiedo per un amico.,,0,repubblica,author_201,1
UgwSTd5rD5mHWiS1YFF4AaABAg,,xPb8SMpBlOs,False,author_202,2026-05-28T05:03:07Z,2026-05-28T05:03:07Z,1,Le grandi inchieste di Repubblica,,0,repubblica,author_202,0
UgwSTd5rD5mHWiS1YFF4AaABAg.AXLAzEFRwNtAXLZ6K95yaK,UgwSTd5rD5mHWiS1YFF4AaABAg,xPb8SMpBlOs,True,author_203,2026-05-28T08:33:56Z,2026-05-28T08:33:56Z,0,"E da quando un quotidiano dovrebbe occuparsi solo di inchieste? 😌 Mai sentito parlare di CRONACA ROSA❓ 😌 È una delle nozioni di Giornalismo. 😌
Poi se a te interessano solo inchieste e notizie serie è un altro discorso. 😌",UgwSTd5rD5mHWiS1YFF4AaABAg,1,repubblica,author_203,0
UgxEYfYCojsOtGECKAZ4AaABAg,,xPb8SMpBlOs,False,author_203,2026-05-28T08:35:19Z,2026-05-28T08:35:19Z,0,"Azz... 😬 Anch'io, forse, non ci andrei... 😌🖕🏻 Già che non mi vanno particolarmente a genio i matrimoni... 😌",,0,repubblica,author_203,1
UgwSTd5rD5mHWiS1YFF4AaABAg.AXLAzEFRwNtAXL_P8RcpE0,UgwSTd5rD5mHWiS1YFF4AaABAg.AXLAzEFRwNtAXLZ6K95yaK,xPb8SMpBlOs,True,author_202,2026-05-28T08:45:15Z,2026-05-28T08:45:15Z,0,​author_7370 quelli ci sono giornali apposta come chi e novella 2000,UgwSTd5rD5mHWiS1YFF4AaABAg.AXLAzEFRwNtAXLZ6K95yaK,2,repubblica,author_202,1
UgwSTd5rD5mHWiS1YFF4AaABAg.AXLAzEFRwNtAXLakNgTmSc,UgwSTd5rD5mHWiS1YFF4AaABAg.AXLAzEFRwNtAXL_P8RcpE0,xPb8SMpBlOs,True,author_203,2026-05-28T08:57:01Z,2026-05-28T08:57:01Z,0,"​author_202, non solo quelli, anche i quotidiani si occupano di cronaca rosa (ovviamente insieme ad altri generi di notizie). 😌 Poi stiamo parlando di una notizia di gossip ogni cento (faccio per dire) notizie serie, dai... 😅",UgwSTd5rD5mHWiS1YFF4AaABAg.AXLAzEFRwNtAXL_P8RcpE0,3,repubblica,author_203,0
